"item_title","item_link","item_description","item_pub_date","item_guid"
"Antwoorden op Kamervragen over het bericht Acht diplomafraudeurs in zorg voor de rechter, aantal meldingen verdubbeld","https://www.rijksoverheid.nl/documenten/kamerstukken/2023/03/14/antwoorden-op-kamervragen-over-het-bericht-acht-diplomafraudeurs-in-zorg-voor-de-rechter-aantal-meldingen-verdubbeld","Minister Helder (Langdurige Zorg en Sport) geeft antwoord op vragen van de leden Bevers en Van den Hil (beiden VVD) over het bericht ‘Acht diplomafraudeurs in zorg voor de rechter, aantal meldingen verdubbeld’",2023-03-14 15:12:00,"95ceffef-6fd6-4fe1-afd1-bf3c4a341bff"
"Uitstelbrief op Kamervragen over de negatieve gevolgen van de brede SPUK-regeling voor kleinere gemeenten","https://www.rijksoverheid.nl/documenten/kamerstukken/2023/03/14/uitstelbrief-antwoorden-kamervragen-over-de-negatieve-gevolgen-van-de-brede-spuk-regeling-voor-kleinere-gemeenten","Minister Helder (Langdurige Zorg en Sport) meldt dat de antwoorden op de vragen over de negatieve gevolgen van de brede SPUK-regeling voor kleinere gemeenten, later komen dan gebruikelijk. De Tweede Kamerleden Mohandis en De Hoop (beiden PvdA) hebben de vragen gesteld. ",2023-03-14 10:44:00,"19e96e20-4629-407d-869d-e24586d8c246"
"Kamerbrief over verzoek tot verstrekken documenten","https://www.rijksoverheid.nl/documenten/kamerstukken/2023/03/13/kamerbrief-over-verzoek-tot-verstrekken-documenten","Minister Helder (Langdurige Zorg en Sport) ) en minister Kuipers (VWS) sturen de Tweede Kamer een brief over verzoek tot verstrekken documenten. Het gaat om documenten in het kader van openbaarmaking van berichtenverkeer over corona.",2023-03-13 17:25:00,"c8230cbe-a9cd-464d-b0ec-6db04fe3671c"
"Kamerbrief over beschikbaarheid medische producten","https://www.rijksoverheid.nl/documenten/kamerstukken/2023/03/13/kamerbrief-over-beschikbaarheid-medische-producten","Minister Kuipers (VWS) informeert de Tweede Kamer over de beschikbaarheid van medische producten.",2023-03-13 16:45:00,"f8616d25-4c20-46f8-8030-12bcba655d71"
"Kamerbrief voorkomen ongewenste beïnvloeding medisch professionals","https://www.rijksoverheid.nl/documenten/kamerstukken/2023/03/13/kamerbrief-over-voorkomen-van-ongewenste-beinvloeding-van-medisch-professionals-door-bedrijven","Minister Kuipers (VWS) informeert de Tweede Kamer over zijn visie op het voorkomen van ongewenste beïnvloeding van medisch professionals door bedrijven.",2023-03-13 15:26:00,"74c4462a-db9b-494b-8141-5d58e452612f"
"Aanbiedingsbrief bij verkenning verminderen behandelduur in jeugdzorg","https://www.rijksoverheid.nl/documenten/kamerstukken/2023/03/13/kamerbrief-over-aanbieding-rapport-verkenning-naar-het-verminderen-van-de-behandelduur-in-de-jeugdzorg","Staatssecretaris Van Ooijen (VWS) biedt de Tweede Kamer een rapport aan met een verkenning naar het verminderen van de behandelduur in de jeugdzorg. ",2023-03-13 14:47:00,"8d9bddcc-f882-44c4-b999-ccc0c9e36ca9"
"Kamerbrief over reactie op verzoeken over vragen Backpay-kwestie weduwen","https://www.rijksoverheid.nl/documenten/kamerstukken/2023/03/13/kamerbrief-over-reactie-op-verzoeken-inzake-vragen-over-backpay-kwestie-weduwen","Staatssecretaris Van Ooijen (VWS) stuurt de Tweede Kamer zijn reactie op verzoeken van de vaste Tweede Kamercommissie voor Volksgezondheid, Welzijn en Sport (VWS) over Backpay-kwestie voor weduwen.",2023-03-13 14:11:00,"a16ba97a-ebbc-445d-9dfc-8d9bc27b1faf"
"Kamerbrief over donorselectiebeleid MSM (mannen die seks hebben gehad met een andere man)","https://www.rijksoverheid.nl/documenten/kamerstukken/2023/03/13/kamerbrief-over-donorselectiebeleid-mannen-die-seks-hebben-gehad-met-een-andere-man-msm","Minister Kuipers (VWS) informeert de Tweede Kamer over het donorselectiebeleid MSM (mannen die seks hebben gehad met een andere man). ",2023-03-13 13:08:00,"7a13f5d0-ee26-4506-8e0d-eb41cbd6414c"
"Uitstelbrief op Kamervragen over het bericht 'Middel X vaker gebruikt na onthulling werkzame stof'","https://www.rijksoverheid.nl/documenten/kamerstukken/2023/03/13/uitstelbrief-antwoorden-kamervragen-over-het-bericht-middel-x-vaker-gebruikt-na-onthulling-werkzame-stof","Minister Kuipers (VWS) meldt dat de antwoorden op vragen over het bericht ‘Middel X vaker gebruikt na onthulling werkzame stof’ later komen dan gebruikelijk. De Tweede Kamerleden Tielen en Bevers (beiden VVD) hebben de vragen gesteld. ",2023-03-13 11:41:00,"76efe2d3-4cdc-4cc5-b2dd-4661a4b337ff"
"Antwoorden op Kamervragen over moleculaire diagnostiek bij oncologie","https://www.rijksoverheid.nl/documenten/kamerstukken/2023/03/13/antwoorden-op-kamervragen-over-moleculaire-diagnostiek-bij-oncologie","Minister Kuipers (VWS) geeft antwoord op vragen over moleculaire diagnostiek bij oncologi.  De Tweede Kamerleden Van den Berg (CDA) en Den Haan (Fractie Den Haan) hebben de vragen gesteld.",2023-03-13 11:30:00,"7f46bac9-8b1a-40dd-9bba-3fc9c1096097"
"Kamerbrief over verzoek om informatie rondom oversterfte","https://www.rijksoverheid.nl/documenten/kamerstukken/2023/03/13/kamerbrief-over-verzoek-om-informatie-rondom-oversterfte","Minister Kuipers (VWS) stuurt de Tweede Kamer een brief met informatie rondom oversterfte. Dit na een verzoek van de vaste Tweede Kamercommissie voor VWS over dit onderwerp. ",2023-03-13 11:23:00,"c8f1e58a-8b0e-4e37-8130-8bce01585305"
"Antwoorden op Kamervragen over financiële problemen Flevoziekenhuis Almere","https://www.rijksoverheid.nl/documenten/kamerstukken/2023/03/13/antwoorden-op-kamervragen-over-de-financiele-problemen-van-flevoziekenhuis-in-almere","Minister Kuipers (VWS) stuurt zijn antwoorden op vragen over de financiële problemen van het Flevoziekenhuis in Almere. Het Tweede Kamerlid Bushoff (PvdA) had de vragen gesteld. ",2023-03-13 11:20:00,"294c1e56-73a6-4014-abb6-e327d413a0c4"
"Antwoorden op Kamervragen over euthanasiewens bij mensen met psychische aandoening","https://www.rijksoverheid.nl/documenten/kamerstukken/2023/03/13/antwoorden-op-kamervragen-over-een-euthanasiewens-bij-jonge-mensen-met-een-psychische-aandoening","Minister Kuipers (VWS) geeft antwoord op vragen over een euthanasiewens bij (jonge) mensen met een psychische aandoening. Het Tweede Kamerlid Paulusma (D66) heeft deze vragen gesteld.",2023-03-13 11:07:00,"554690ad-b8df-47e6-a050-8f5bf61d6268"
"Kamerbrief over beleidsreactie evaluatie van de Wet verplichte geestelijke gezondheidszorg en de Wet zorg en dwang psychogeriatrische en verstandelijk gehandicapte cliënten","https://www.rijksoverheid.nl/documenten/kamerstukken/2023/03/13/kamerbrief-over-beleidsreactie-wetsevaluatie-van-de-wet-verplichte-geestelijke-gezondheidszorg-wvggz-en-de-wet-zorg-en-dwang-psychogeriatrische-en-verstandelijk-gehandicapte-clienten-wzd","Minister Helder (Langdurige Zorg en Sport) informeert de Tweede Kamer over haar beleidsreactie op de 1e evaluatie van de Wet verplichte geestelijke gezondheidszorg (Wvggz) en de Wet zorg en dwang psychogeriatrische en verstandelijk gehandicapte cliënten (Wzd). De Eerste Kamer heeft eenzelfde brief gekregen. ",2023-03-13 10:47:00,"0f0279f9-921f-4b8a-a017-7c2c83b89412"
"Antwoorden op Kamervragen over het artikel 'Claims Conference reageert op kritiek'","https://www.rijksoverheid.nl/documenten/kamerstukken/2023/03/13/antwoorden-op-kamervragen-over-het-artikel-claims-conference-reageert-op-kritiek","Staatssecretaris Van Ooijen (VWS) geeft antwoord op vragen over het artikel ‘Claims Conference reageert op kritiek’. De Tweede Kamerleden Van den Hil, Ellian en Simons (allen VVD) hebben de vragen gesteld. ",2023-03-13 09:53:00,"09ce40cc-d997-4a50-af9b-04c952c87e49"
"Uitstelbrief antwoorden op Kamervragen over bericht dat meer bevrijdingsfestivals niet door dreigen te gaan","https://www.rijksoverheid.nl/documenten/kamerstukken/2023/03/13/uitstelbrief-antwoorden-kamervragen-over-het-bericht-dat-meer-bevrijdingsfestivals-niet-door-dreigen-te-gaan","Staatssecretaris Van Ooijen (VWS) meldt dat de antwoorden over het bericht dat meer bevrijdingsfestivals niet door dreigen te gaan later komen dan gebruikelijk. Tweede Kamerlid Kwint (SP) heeft de vragen gesteld.",2023-03-13 09:13:00,"54e54dd5-0d6a-40fe-8336-b576bc8e7430"
"Aanbiedingsbrief bij nadere memorie van antwoord bij wetsvoorstel elektronische gegevensuitwisseling in de zorg","https://www.rijksoverheid.nl/documenten/kamerstukken/2023/03/13/kamerbrief-over-regels-inzake-het-elektronisch-delen-en-benaderen-van-gegevens-tussen-zorgverleners-in-aangewezen-gegevensuitwisselingen-wet-elektronische-gegevensuitwisseling-in-de-zorg","Minister Kuipers (VWS) stuurt de Eerste Kamer de nadere memorie van antwoord over het wetsvoorstel Wet elektronische gegevensuitwisseling in de zorg. ",2023-03-13 09:11:00,"74b5b67b-5751-49fe-9cf7-a412eff7c04b"
"Uitstelbrief op Kamervragen over de genderkliniek die homoseksualiteit probeert te genezen","https://www.rijksoverheid.nl/documenten/kamerstukken/2023/03/13/uitstelbrief-antwoorden-kamervragen-over-de-genderkliniek-die-homoseksualiteit-probeert-te-genezen","Staatssecretaris Van Ooijen (VWS) meldt dat de antwoorden op vragen over de genderkliniek die homoseksualiteit probeert te genezen later komen dan gebruikelijk. Het Tweede Kamerlid Pouw-Verweij (JA21) heeft de vragen gesteld. ",2023-03-13 09:04:00,"ed13fc25-e5f9-470c-b5e4-31774131db0f"
"Antwoorden op Kamervragen over overlijdens met diagnose corona","https://www.rijksoverheid.nl/documenten/kamerstukken/2023/03/13/antwoorden-op-kamervragen-over-overlijdens-met-de-diagnose-corona","Minister Kuipers (VWS) geeft antwoord op vragen over overlijdens met de diagnose corona. Het Tweede Kamerlid Van Houwelingen (FvD) heeft deze vragen gesteld.",2023-03-13 08:36:00,"4e0b26bc-1fea-45b1-8817-576395dcdbbd"
"Kamerbrief over beantwoording openstaande vragen uit 1e termijn wetsvoorstel bevorderen samenwerking en rechtmatige zorg","https://www.rijksoverheid.nl/documenten/kamerstukken/2023/03/10/kamerbrief-beantwoording-openstaande-vragen-uit-eerste-termijn-wetsvoorstel-bevorderen-samenwerking-en-rechtmatige-zorg","Minister Helder (Langdurige Zorg en Sport) stuurt de Tweede Kamer de antwoorden op openstaande vragen uit de 1e termijn van de plenaire behandeling van het wetsvoorstel bevorderen samenwerking en rechtmatige zorg. ",2023-03-10 16:38:00,"242502b0-71c5-45ed-9e4a-d9eb20030a39"
"Uitstelbrief Kamervragen klachten over misbruik en mishandeling jeugddorp De Glind","https://www.rijksoverheid.nl/documenten/kamerstukken/2022/10/27/uitstelbrief-antwoorden-kamervragen-over-de-tientallen-klachten-over-misbruik-en-mishandeling-in-jeugddorp-de-glind","Staatssecretaris Van Ooijen (VWS) meldt dat de antwoorden op vragen over de tientallen klachten over misbruik en mishandeling in jeugddorp De Glind later komen dan gebruikelijk. Het Tweede Kamerlid Van Haga (Groep Van Haga) heeft de vragen gesteld.",2022-10-27 11:30:00,"baab205f-2ce1-4265-96de-244d05e8cb51"
"Antwoorden op Kamervragen over vondst van plastic in veevoer, melk en vlees","https://www.rijksoverheid.nl/documenten/kamerstukken/2022/10/26/antwoorden-op-kamervragen-over-de-vondst-van-plastic-in-veevoer-melk-en-vlees","Minister Adema (LNV) geeft antwoord op vragen over de vondst van plastic in veevoer, melk en vlees. De Tweede Kamerleden Vestering en Van Esch (beiden PvdD) hebben de vragen gesteld.",2022-10-26 13:57:00,"590dbd2c-5437-465f-8ce4-4054f4667162"
"Uitstelbrief op Kamervragen over het bericht ‘Buiten het ziekenhuis dreigt een nijpend tekort aan artsen’","https://www.rijksoverheid.nl/documenten/kamerstukken/2022/10/25/uitstelbrief-antwoorden-kamervragen-over-het-bericht-buiten-het-ziekenhuis-dreigt-een-nijpend-tekort-aan-artsen","Minister Kuipers (VWS) meldt dat de antwoorden op vragen over het bericht ‘Buiten het ziekenhuis dreigt een nijpend tekort aan artsen’ later komen dan gebruikelijk. Het Tweede Kamerlid Van den Hil (VVD) heeft de vragen gesteld.",2022-10-25 10:19:00,"3df108a3-88fb-46b7-8f7a-685d4fab0066"
"Aanbiedingsbrief bij Nederlandse mondiale gezondheidsstrategie 2023-2030","https://www.rijksoverheid.nl/documenten/kamerstukken/2022/10/21/kamerbrief-inzake-nederlandse-mondiale-gezondheidsstrategie-2023-2030-samen-zorgen-voor-gezondheid-wereldwijd","Ministers Schreinemacher (Buitenlandse Handel en Ontwikkelingssamenwerking) en Kuipers (VWS) sturen de Tweede Kamer een aanbiedingsbrief over het rapport 'Nederlandse mondiale gezondheidsstrategie 2023 -2030: Samen zorgen voor gezondheid wereldwijd'.",2022-10-22 19:04:00,"346071ad-a67c-46e4-99c4-b7c2fab16e4d"
"Uitstelbrief antwoorden Kamervragen over de uitzending van In het vizier van De Jager over ouderenmishandeling","https://www.rijksoverheid.nl/documenten/kamerstukken/2022/10/21/uitstelbrief-antwoorden-kamervragen-over-de-uitzending-van-in-het-vizier-van-de-jager-over-ouderenmishandeling","Minister Helder (Langdurige Zorg en Sport) meldt dat de vragen van het lid Hijink (SP) over de uitzending van In het vizier van De Jager over ouderenmishandeling later komen dan gebruikelijk.",2022-10-21 15:26:00,"c0ec72dd-c2a1-49ce-aa3a-674e57c56625"
"Antwoorden op Kamervragen over stappen naar betere jeugdhulp","https://www.rijksoverheid.nl/documenten/kamerstukken/2022/10/21/antwoorden-op-kamervragen-over-stappen-naar-betere-jeugdhulp","Staatssecretaris Van Ooijen (VWS) meldt dat hij vragen over stappen naar betere jeugdhulp jeugdhulp niet op tijd kan beantwoorden. De vragen zijn gesteld dor het Tweede Kamerlid Maeijer (PVV). ",2022-10-21 15:12:00,"1367dbaf-323b-40f8-bcb1-cf0748724c02"
"Antwoorden op Kamervragen over het bericht 'NVDI en STAP: samenstelling Alcoholtafel van het Nationaal Preventieakkoord leidt niet tot het gewenste resultaat'","https://www.rijksoverheid.nl/documenten/kamerstukken/2022/10/21/antwoorden-op-kamervragen-over-het-bericht-nvdi-en-stap-samenstelling-alcoholtafel-van-het-nationaal-preventieakkoord-leidt-niet-tot-het-gewenste-resultaat","Staatssecretaris Van Ooijen (VWS) stuurt de Tweede Kamer de antwoorden op vragen over het bericht 'NVDI en STAP: samenstelling Alcoholtafel van het Nationaal Preventieakkoord leidt niet tot het gewenste resultaat'. Het Tweede Kamerlid Van der Laan (D66) heeft de vragen gesteld.",2022-10-21 15:06:00,"0f89260c-e2f1-4fb6-97d0-fd2ff192445b"
"Antwoorden op Kamervragen over de berichten dat het aantal jongeren met suïcidale gedachten ook na corona hoog is en dat er een toename van zelfdodingen onder jongvolwassenen is","https://www.rijksoverheid.nl/documenten/kamerstukken/2022/10/21/antwoorden-op-kamervragen-over-de-berichten-dat-het-aantal-jongeren-met-suicidale-gedachten-ook-na-corona-hoog-is-en-dat-er-een-toename-van-zelfdodingen-onder-jongvolwassenen-is","Staatssecretaris Van Ooijen (VWS) geeft antwoord op vragen over de berichten dat het aantal jongeren met suïcidale gedachten ook na corona hoog is en dat er een toename van zelfdodingen onder jongvolwassenen is. De vragen zijn van het Kamerlid Raemakers (D66).",2022-10-21 14:51:00,"2438a2bb-7b50-4c5e-9ee2-9663c3028c60"
"Antwoorden op Kamervragen over bericht ‘Verpleeghuizen Curaçao in geldnood, ouderen moeten maaltijd delen'","https://www.rijksoverheid.nl/documenten/kamerstukken/2022/10/21/antwoorden-op-kamervragen-over-bericht-verpleeghuizen-curacao-in-geldnood-ouderen-moeten-maaltijd-delen","Staatssecretaris Van Huffelen (Koninkrijksrelaties en Digitalisering) geeft antwoord op vragen over het bericht ‘Verpleeghuizen Curaçao in geldnood, ouderen moeten maaltijd delen’. Het Tweede Kamerlid Bouchallikh (GroenLinks) heeft de vragen gesteld.",2022-10-21 14:51:00,"fabaabbf-b0ed-411e-8a3b-93651c3a982a"
"Uitstelbrief op Kamervragen over de sluiting van de huisartsenpost in Hengelo","https://www.rijksoverheid.nl/documenten/kamerstukken/2022/10/21/uitstelbrief-antwoorden-kamervragen-over-de-sluiting-van-de-huisartsenpost-in-hengelo","Minister Kuipers (VWS) meldt dat de antwoorden op vragen over de sluiting van de huisartsenpost in Hengelo later komen dan gebruikelijk. Het Tweede Kamerlid Hijink (SP) heeft de vragen gesteld.",2022-10-21 14:19:00,"c1716c51-7ee2-49b9-8de5-0a11eafa4ab8"
"Uitstelbrief antwoorden Kamervragen over het toenemende aantal COVID-patiënten in ziekenhuizen","https://www.rijksoverheid.nl/documenten/kamerstukken/2022/10/21/uitstelbrief-antwoorden-kamervragen-over-het-toenemende-aantal-covid-patienten-in-ziekenhuizen","Minister Kuipers (VWS) meldt dat de antwoorden op vragen over het toenemende aantal COVID-patiënten in ziekenhuizen later komen dan gebruikelijk. De vragen zijn gesteld door het Tweede Kamerlid Kuiken (PvdA).",2022-10-21 14:05:00,"276b9662-df90-46f8-8c6f-6872bf0273ba"
"Uitstelbrief antwoorden Kamervragen over Belgische zorgaanbieders die reclame maken in Zeeuws-Vlaanderen","https://www.rijksoverheid.nl/documenten/kamerstukken/2022/10/21/uitstelbrief-antwoorden-kamervragen-over-belgische-zorgaanbieders-die-reclame-maken-in-zeeuws-vlaanderen","Minister Kuipers (VWS) meldt dat de antwoorden op vragen over Belgische zorgaanbieders die reclame maken in Zeeuws-Vlaanderen later komen dan gebruikelijk. De vragen zijn gesteld door het Tweede Kamerlid Van den Berg (CDA).",2022-10-21 14:02:00,"ac7a1fb9-82d7-47c8-a860-506ee83a0856"
"Uitstelbrief antwoorden Kamervragen over mogelijke kabinetssteun bij voorbereiding op volgende pandemie","https://www.rijksoverheid.nl/documenten/kamerstukken/2022/10/21/uitstelbrief-antwoorden-kamervragen-over-het-bericht-wetenschappers-vragen-kabinet-om-steun-bij-voorbereiding-op-volgende-pandemie","Minister Kuipers (VWS) stelt de beantwoording uit van de Kamervragen over het bericht ‘Wetenschappers vragen kabinet om steun bij voorbereiding op volgende pandemie’. De vragen zijn gesteld door het Tweede Kamerlid Tielen (VVD).",2022-10-21 13:51:00,"76ac56c7-ae36-46e6-9c9d-eb5183093b2a"
"Uitstelbrief antwoorden Kamervragen over onderbreking datastroom RIVM vaccinatiecampagnes","https://www.rijksoverheid.nl/documenten/kamerstukken/2022/10/21/uitstelbrief-antwoorden-kamervragen-over-onderbreking-datastroom-rivm-met-betrekking-tot-vaccinatiecampagnes","Minister Kuipers (VWS) meldt dat hij vragen niet op tijd kan beantwoorden. De vragen gaan over de onderbreking van de datastroom bij het Rijksinstituut voor Volksgezondheid en Milieu (RIVM) met betrekking tot vaccinatiecampagnes. Het Tweede Kamerlid Van Haga (Groep-Van Haga) heeft deze vragen gesteld.",2022-10-21 13:44:00,"e70b895e-8b02-4a8a-97b4-65f48ee6bd78"
"Uitstelbrief antwoorden Kamervragen over nieuwe coronagolf, terugkeer influenza en vaccinatiecampagnes","https://www.rijksoverheid.nl/documenten/kamerstukken/2022/10/21/uitstelbrief-antwoorden-kamervragen-over-de-nieuwe-coronagolf-de-terugkeer-van-influenza-en-de-vaccinatiecampagnes","Minister Kuipers (VWS) meldt dat hij vragen niet op tijd kan beantwoorden. De vragen gaan over de nieuwe coronagolf, de terugkeer van influenza en de vaccinatiecampagnes. Het Tweede Kamerlid Van Haga (Groep-Van Haga) heeft de vragen gesteld.",2022-10-21 13:39:00,"22b4df19-4c44-464c-8131-a2a6ecfb013b"
"Uitstelbrief op Kamervragen over het bericht ‘Jo kan al maanden niet de deur uit omdat zijn geleidehond is afgepakt’","https://www.rijksoverheid.nl/documenten/kamerstukken/2022/10/21/uitstelbrief-antwoorden-kamervragen-over-het-bericht-jo-kan-al-maanden-niet-de-deur-uit-omdat-zijn-geleidehond-is-afgepakt","Minister Helder (Langdurige Zorg en Sport) meldt dat de antwoorden op vragen over het bericht ‘Jo kan al maanden niet de deur uit omdat zijn geleidehond is afgepakt’ later komen dan gebruikelijk. Het Tweede Kamerlid Werner (CDA) heeft de vragen gesteld.",2022-10-21 13:30:00,"4f99f377-6be7-43cd-ba93-9b410fc1b9d2"
"Kamerbrief met reactie op artikelen en overzicht wachtlijsten GGZ","https://www.rijksoverheid.nl/documenten/kamerstukken/2022/10/21/kamerbrief-verzoek-aan-de-minister-voor-langdurige-zorg-en-sport-om-een-reactie-op-twee-artikelen-en-een-verzoek-om-een-overzicht-van-wachtlijsten-in-de-ggz","Minister Helder (Langdurige Zorg en Sport) reageert op de artikelen “Dimence groep kiest voor eigen invulling landelijk kwaliteitsstatuut GGZ” en “Zorgvisie over de GGZ”. Ook reageert de minister op een verzoek om een overzicht van wachtlijsten in de GGZ. De Tweede Kamer had hier om verzocht.",2022-10-21 13:22:00,"e7bb4971-cc62-474e-a6d4-386d3a75a9dd"
"Antwoorden op Kamervragen over verzamelbrief ggz en rode draden analyse NZa","https://www.rijksoverheid.nl/documenten/kamerstukken/2022/10/21/kamerbrief-over-verzamelbrief-ggz-en-rode-draden-analyse-nza","Minister Helder (Langdurige Zorg en Sport) geeft antwoord op vragen over de verzamebrief van 7 juli 2022 over ggz en rode draden analyse en verkenning van de Nederlandse Zorgautoriteit (NZa) over (voorgenomen) sluitingen en veranderingen in behandelaanbod. De vragen zijn gesteld door de fracties van VVD, D66, CDA, PvdA en GroenLinks in de Tweede Kamer.",2022-10-21 12:57:00,"9bfb10f1-9b49-4266-84f0-b2040b2177bd"
"Kamerbrief over aanbieding eindrapport wetsevaluatie Wvggz-Wzd","https://www.rijksoverheid.nl/documenten/kamerstukken/2022/10/21/kamerbrief-over-aanbieding-eindrapport-wetsevaluatie-wvggz-wzd","Minister Helder (Langdurige Zorg en Sport) biedt de Tweede Kamer het eindrapport wetsevaluatie Wet verplichte geestelijke gezondheidszorg (Wvggz) en Wet zorg en dwang psychogeriatrische en verstandelijk gehandicapte cliënten (Wzd) aan. Deze stukken zijn ook aan de Eerste Kamer verstuurd.",2022-10-21 12:53:00,"ff436c1e-aa1b-4b08-a5eb-3f97aff60692"
"Kamerbrief over audiobestanden OMT-vergaderingen","https://www.rijksoverheid.nl/documenten/kamerstukken/2022/10/19/kamerbrief-over-audiobestanden-omt-vergaderingen","Minister Kuipers (VWS) informeert de Tweede Kamer over audiobestanden van vergaderingen van het Outbreak Management Team (OMT). Kamerbrief over audiobestanden OMT-vergaderingen (PDF | 3 pagina's | 172 kB)",2022-10-19 19:41:00,"c10a3d2d-bf13-48c0-841d-b5c8773bf002"
"Uitstelbrief antwoorden Kamervragen over het bericht ‘Tientallen klachten van misbruik en mishandeling in Gelders jeugddorp’","https://www.rijksoverheid.nl/documenten/kamerstukken/2022/10/31/uitstelbrief-antwoorden-kamervragen-over-het-bericht-tientallen-klachten-van-misbruik-en-mishandeling-in-gelders-jeugddorp","Staatssecretaris Van Ooijen (VWS) meldt dat de antwoorden op vragen over het bericht ‘Tientallen klachten van misbruik en mishandeling in Gelders jeugddorp’ later komen dan gebruikelijk. De Tweede Kamerleden Richardson, Van den Hil en Verkuijlen (allen VVD) hebben de vragen gesteld.",2022-10-31 09:21:01,"e6c40028-4603-434f-8915-6922f6814cc5"
"Antwoorden op Kamervragen over stappen naar betere jeugdhulp","https://www.rijksoverheid.nl/documenten/kamerstukken/2022/10/21/antwoorden-op-kamervragen-over-stappen-naar-betere-jeugdhulp","Staatssecretaris Van Ooijen (VWS) meldt dat hij vragen over stappen naar betere jeugdhulp jeugdhulp niet op tijd kan beantwoorden. De vragen zijn gesteld dor het Tweede Kamerlid Maeijer (PVV).  Antwoorden op Kamervragen over stappen naar betere jeugdhulp (PDF | 4 pagina's | 182 kB)",2022-10-21 15:12:00,"1367dbaf-323b-40f8-bcb1-cf0748724c02"
"Uitstelbrief antwoorden Kamervragen over het toenemende aantal COVID-patiënten in ziekenhuizen","https://www.rijksoverheid.nl/documenten/kamerstukken/2022/10/21/uitstelbrief-antwoorden-kamervragen-over-het-toenemende-aantal-covid-patienten-in-ziekenhuizen","Minister Kuipers (VWS) meldt dat de antwoorden op vragen over het toenemende aantal COVID-patiënten in ziekenhuizen later komen dan gebruikelijk. De vragen zijn gesteld door het Tweede Kamerlid Kuiken (PvdA).  Uitstelbrief antwoorden Kamervragen over het toenemende aantal COVID-patiënten in ziekenhuizen (PDF | 1 pagina | 69 kB)",2022-10-21 14:05:00,"276b9662-df90-46f8-8c6f-6872bf0273ba"
"Antwoorden op Kamervragen over het bericht dat het onderzoek naar de oorzaken van de oversterfte om oneigenlijke redenen wordt gefrustreerd door het RIVM en de GGD","https://www.rijksoverheid.nl/documenten/kamerstukken/2022/10/31/antwoorden-op-kamervragen-over-het-bericht-dat-het-onderzoek-naar-de-oorzaken-van-de-oversterfte-om-oneigenlijke-redenen-wordt-gefrustreerd-door-het-rivm-en-de-ggd","Minister Kuipers (VWS) geeft antwoord op vragen van het lid Van Meijeren (FvD) over het bericht dat het onderzoek naar de oorzaken van de oversterfte om oneigenlijke redenen wordt gefrustreerd door het RIVM en de GGD",2022-10-31 14:59:00,"90094277-584d-4926-88a8-ae3c059d9302"
"Antwoorden op Kamervragen over openbaargemaakte Wob-verzoeken aangaande corona-communicatie","https://www.rijksoverheid.nl/documenten/kamerstukken/2022/10/31/antwoorden-op-kamervragen-over-openbaargemaakte-wob-verzoeken-aangaande-corona-communicatie","Minister Kuipers (VWS) geeft antwoord op vragen van het lid Van Haga (Groep Van Haga) over openbaargemaakte Wob-verzoeken aangaande corona-communicatie",2022-10-31 14:05:01,"01def17c-f5b2-4514-aec4-9a18d47d6631"
"Antwoorden op Kamervragen over misstanden bij Ambulancezorg Groningen","https://www.rijksoverheid.nl/documenten/kamerstukken/2022/10/31/antwoorden-op-kamervragen-over-misstanden-bij-ambulancezorg-groningen","Minister Kuipers (VWS) geeft antwoord op vragen over misstanden bij Ambulancezorg Groningen. Het Tweede Kamerlid Hijink (SP) heeft deze vragen gesteld.",2022-10-31 13:40:00,"fb2b4b77-771d-4915-9211-f42687a9c07e"
"Kamerbrief met reactie op het boek ‘Een gezonde toekomst’","https://www.rijksoverheid.nl/documenten/kamerstukken/2022/10/31/kamerbrief-over-reactie-op-het-boek-een-gezonde-toekomst","Minister Kuipers (VWS) stuurt de Tweede Kamer een reactie op het boek ‘Een gezonde toekomst’ van Jaap Goudsmit. ",2022-10-31 12:27:00,"70b42008-89e2-40e7-b23f-583762750383"
