"item_title","item_link","item_description","item_pub_date","item_guid"
"Uitstelbrief op Kamervragen over het feit dat GGZ patiënten niet thuis mogen slapen","https://www.rijksoverheid.nl/documenten/kamerstukken/2022/12/14/uitstelbrief-kamervragen-over-het-feit-dat-ggz-patienten-niet-thuis-mogen-slapen","Minister Helder (Langdurige Zorg en Sport) meldt dat de antwoorden op vragen over het feit dat GGZ patiënten niet thuis mogen slapen later komen dan gebruikelijk. Het Tweede Kamerlid Mohandis (PvdA) heeft de vragen gesteld.",2022-12-14 14:48:00,"b6cb91eb-86f0-4318-b290-5233e862f236"
"Uitstelbrief op Kamervragen over Stichting Open Nederland","https://www.rijksoverheid.nl/documenten/kamerstukken/2022/12/14/uitstelbrief-kamervragen-over-inzake-stichting-open-nederland","Minister Kuipers (VWS) meldt dat de antwoorden op vragen over Stichting Open Nederland later komen dan gebruikelijk. Het Tweede Kamerlid Van Haga (Groep Van Haga) heeft de vragen gesteld.",2022-12-14 13:42:00,"774ef626-23e5-4b5f-86c9-a266858781a1"
"Kamerbrief vervuiling vlees grote grazers uiterwaarden","https://www.rijksoverheid.nl/documenten/kamerstukken/2022/12/14/kamerbrief-over-contaminatie-in-het-vlees-van-grote-grazers-in-uiterwaarden","Minister Kuipers (VWS) stuurt de Tweede Kamer een rapport over de risico's van het eten van vlees van grote grazers in de uiterwaarden voor de menselijke gezondheid. Ook geeft de minister een toelichting op de achtergrond van het rapport.",2022-12-14 13:03:00,"faf35b0b-d950-49fc-8377-9b5b0550c499"
"Aanbiedingsbrief bij advies van de Gezondheidsraad ‘Evaluatie en optimalisatie van het bevolkingsonderzoek darmkanker’","https://www.rijksoverheid.nl/documenten/kamerstukken/2022/12/14/kamerbrief-over-aanbieden-gezondheidsraadadvies-evaluatie-en-optimalisatie-van-het-bevolkingsonderzoek-darmkanker","Minister Kuipers (VWS) biedt de Tweede Kamer het Gezondheidsraadadvies: ‘Evaluatie en optimalisatie van het bevolkingsonderzoek darmkanker’ aan.",2022-12-14 12:34:00,"12f42373-0ce1-4cac-93d1-80450fc727f3"
"Kamerbrief 2e kabinetsreactie historisch onderzoek Indonesië","https://www.rijksoverheid.nl/documenten/kamerstukken/2022/12/14/kamerbrief-2e-kabinetsreactie-historisch-onderzoek-indonesie","Minister-president Rutte stuurt de Tweede Kamer de 2e kabinetsreactie op de uitkomsten van het onderzoeksprogramma 'Onafhankelijkheid, Dekolonisatie, Geweld en Oorlog in Indonesië, 1945-1950'.",2022-12-14 11:44:00,"599de35e-209b-439c-83c5-84315244d4a9"
"Kamerbrief Hoofdlijnen Sportakkoord II en vervolgproces","https://www.rijksoverheid.nl/documenten/kamerstukken/2022/12/14/kamerbrief-over-hoofdlijnen-sportakkoord-ii-en-vervolgproces","Minister Helder (Langdurige Zorg en Sport) informeert de Tweede Kamer over het Hoofdlijnen Sportakkoord II en hoe dit verder uitgewerkt gaat worden.",2022-12-14 10:22:00,"5562ab0a-e861-45f9-a103-363c63797807"
"Antwoorden op Kamervragen over inhuur externe arbeid in publieke sectoren","https://www.rijksoverheid.nl/documenten/kamerstukken/2022/12/14/kamerbrief-met-beantwoording-kamervragen-over-de-inhuur-van-externe-arbeid-in-publieke-sectoren","Minister Van Gennip (SZW) geeft antwoord op vragen over de inhuur van externe arbeid in publieke sectoren. De Tweede Kamerleden Maatoug, Westerveld en Ellemeet (allen GroenLinks) hebben de vragen gesteld.",2022-12-15 07:17:00,"15c58e5f-bde6-4229-a8b5-bb3504cec896"
"Kamerbrief over afwegingskader en publieke sturing generieke functies voor elektronische gegevensuitwisseling","https://www.rijksoverheid.nl/documenten/kamerstukken/2022/12/15/kamerbrief-over-afwegingskader-en-stand-van-zaken-publieke-sturing-op-generieke-functies-voor-elektronische-gegevensuitwisseling","Minister Kuipers (VWS) informeert de Tweede Kamer over het afwegingskader en de stand van zaken van de publieke sturing op generieke functies voor elektronische gegevensuitwisseling.",2022-12-15 11:37:00,"3146fc05-43bc-4509-b0d2-28f705fe6b65"
"Kamerbrief over voortgang elektronische gegevensuitwisseling","https://www.rijksoverheid.nl/documenten/kamerstukken/2022/12/15/kamerbrief-over-voortgang-op-elektronische-gegevensuitwisseling","Minister Kuipers (VWS) informeert de Tweede Kamer over de voortgang van elektronische gegevensuitwisseling.",2022-12-15 11:37:00,"158eccda-818c-41c2-9775-c31c8e6a8fa2"
"Kamerbrief over impactanalyses op het commissievoorstel omtrent een European Health Data Space","https://www.rijksoverheid.nl/documenten/kamerstukken/2022/12/15/kamerbrief-over-impactanalyses-op-het-commissievoorstel-omtrent-een-european-health-data-space-en-beantwoording-kamervragen","Minister Kuipers (VWS) stuurt de Tweede Kamer de impactanalyses op het commissievoorstel omtrent een European Health Data Space.",2022-12-15 11:35:00,"69b0b3f6-2166-48c7-8e40-7de615bb99dc"
"Kamerbrief over Vervolg Verzoek over het openbaar maken van chat- en smsberichten","https://www.rijksoverheid.nl/documenten/kamerstukken/2022/12/15/kamerbrief-over-vervolg-verzoek-over-het-openbaar-maken-van-chat-en-smsberichten","Minister Kuipers (VWS) en Minister Helder (Langdurige Zorg en Sport) sturen de Tweede Kamer een brief over Vervolg verzoek over het openbaar maken van chat- en smsberichten",2022-12-15 17:52:00,"a9750b1a-62ad-4e4e-b9c3-446de28f4cd5"
"Kamerbrief over Reactie op RVS advies De Kunst van het Innoveren","https://www.rijksoverheid.nl/documenten/kamerstukken/2022/12/15/kamerbrief-over-reactie-op-rvs-advies-de-kunst-van-het-innoveren","Minister Kuipers (VWS) stuurt de Tweede Kamer een reactie op het RVS advies De Kunst van het Innoveren.",2022-12-15 16:54:00,"64c77380-1ffd-496e-b005-48eb397a03eb"
"Kamerbrief over aanbieding en beleidsreactie wettelijke evaluatie Gezondheidsraad","https://www.rijksoverheid.nl/documenten/kamerstukken/2022/12/15/kamerbrief-over-aanbieding-en-beleidsreactie-wettelijke-evaluatie-gezondheidsraad","Minister Kuipers (VWS) biedt de Eerste en Tweede Kamer  beleidsreactie wettelijke evaluatie Gezondheidsraad aanDe Eerste Kamer heeft eenzelfde brief gekregen",2022-12-15 16:48:03,"dc514063-0029-4e30-a9f5-4956e978807e"
"Kamerbrief over TNO-rapportage dashboard acute zorg","https://www.rijksoverheid.nl/documenten/kamerstukken/2022/12/15/kamerbrief-over-tno-rapportage-dashboard-acute-zorg","Minister Kuipers (VWS) stuurt de Tweede Kamer de TNO-rapportage dashboard acute zorg.",2022-12-15 16:45:01,"c6d65cc6-d8c2-4bb1-a753-75b524c99534"
"Kamerbrief over Manifest jongerendakloosheid","https://www.rijksoverheid.nl/documenten/kamerstukken/2022/12/15/kamerbrief-over-manifest-jongerendakloosheid","Staatssecretaris Van Ooijen (VWS) stuurt de Tweede Kamer een brief over Manifest jongerendakloosheid",2022-12-15 16:33:01,"421f65c4-3e9b-4a0f-86f6-4238123254a2"
"Beantwoording Kamervragen over Hervormingsagenda Jeugd","https://www.rijksoverheid.nl/documenten/kamerstukken/2022/12/16/kamerbrief-eerste-kamer-verslag-inzake-de-vws-begroting-2023","Staatssecretaris Van Ooijen (VWS) stuurt de Eerste Kamer antwoorden op vragen naar aanleiding van de Hervormingsagenda Jeugd. De vragen zijn van de leden van de fracties van GroenLinks en PvdA van de vaste commissie voor Volksgezondheid, Welzijn en Sport (VWS).",2022-12-16 09:07:00,"01ca7654-7b1d-4dbc-a13c-c36d150c13c1"
"Kamerbrief over vervolg verzoek over het openbaar maken van chat- en smsberichten","https://www.rijksoverheid.nl/documenten/kamerstukken/2022/12/15/kamerbrief-over-vervolg-verzoek-over-het-openbaar-maken-van-chat-en-smsberichten","Minister Kuipers (VWS) en Minister Helder (Langdurige Zorg en Sport) sturen de Tweede Kamer een brief over het vervolg op het verzoek over het openbaar maken van chat- en smsberichten over de 'mondkapjesdeal'. ",2022-12-15 17:52:00,"a9750b1a-62ad-4e4e-b9c3-446de28f4cd5"
"Kamerbrief over RVS-advies De Kunst van het Innoveren","https://www.rijksoverheid.nl/documenten/kamerstukken/2022/12/15/kamerbrief-over-reactie-op-rvs-advies-de-kunst-van-het-innoveren","Minister Kuipers (VWS) stuurt de Tweede Kamer een reactie op het advies 'De Kunst van het Innoveren' van de Raad voor Volksgezondheid en Samenleving (RVS).",2022-12-15 16:54:00,"64c77380-1ffd-496e-b005-48eb397a03eb"
"Kamerbrief over wettelijke evaluatie Gezondheidsraad","https://www.rijksoverheid.nl/documenten/kamerstukken/2022/12/15/kamerbrief-over-aanbieding-en-beleidsreactie-wettelijke-evaluatie-gezondheidsraad","Minister Kuipers (VWS) geeft de Tweede Kamer zijn beleidsreactie op de wettelijke evaluatie van de Gezondheidsraad. Een eenluidende brief is naar de Eerste Kamer verstuurd.",2022-12-15 16:48:00,"dc514063-0029-4e30-a9f5-4956e978807e"
"Kamerbrief over TNO-rapportage dashboard acute zorg","https://www.rijksoverheid.nl/documenten/kamerstukken/2022/12/15/kamerbrief-over-tno-rapportage-dashboard-acute-zorg","Minister Kuipers (VWS) stuurt de Tweede Kamer de TNO-rapportage dashboard acute zorg. Ook geeft de minister een toelichting bij de rapportage.",2022-12-15 16:45:00,"c6d65cc6-d8c2-4bb1-a753-75b524c99534"
"Kamerbrief over manifest jongerendakloosheid","https://www.rijksoverheid.nl/documenten/kamerstukken/2022/12/15/kamerbrief-over-manifest-jongerendakloosheid","Staatssecretaris Van Ooijen (VWS) informeert de Tweede Kamer over een manifest van jongerenorganisaties en ervaringsdeskundige jongeren over dakloosheid onder jongeren.",2022-12-15 16:33:00,"421f65c4-3e9b-4a0f-86f6-4238123254a2"
"Voortgangsbrief aanpak voor personen met verward en of onbegrepen gedrag","https://www.rijksoverheid.nl/documenten/kamerstukken/2022/12/15/tk-voortgangsbrief-aanpak-voor-personen-met-verward-en-of-onbegrepen-gedrag","Minister Yeşilgöz-Zegerius (JenV) en minister Helder (Langdurige Zorg en Sport) informeren de Tweede Kamer over de voortgang van de versterking van de samenwerking tussen het zorgdomein, sociaal domein en veiligheidsdomeinen. Zij doen dit in vervolg op de voortgangsbrief van 15 juli 2022. Bij de Kamerbrief zit een beslisnota.",2022-12-15 10:22:00,"317c9fd4-7d81-4b86-bc32-5b3344c679b4"
"Kamerbrief over Verzoek om reactie op motie van de leden Paulusma en Bikker (35925-XVI-50) en het rapport ‘Tolken in de zorg een overzicht van huidige inzet, financiering en knelpunten’","https://www.rijksoverheid.nl/documenten/kamerstukken/2022/12/16/kamerbrief-over-verzoek-om-reactie-op-motie-van-de-leden-paulusma-en-bikker-35925-xvi-50-en-het-rapport-tolken-in-de-zorg-een-overzicht-van-huidige-inzet-financiering-en-knelpunten","Minister Kuipers (VWS) stuurt de Tweede Kamer, mede namens de minister voor Langdurige Zorg en Sport en de staatssecretaris van VWS, zijn reactie op de motie van de leden Paulusma en Bikker (35925-XVI-50) en het rapport ‘Tolken in de zorg: een overzicht van huidige inzet, financiering en knelpunten’.",2022-12-16 16:39:06,"bfb90b8e-e873-4c3a-88c8-c349f7839261"
"Antwoorden op Kamervragen over inzake de adviesbrief van de SER met betrekking tot advies Jeugdzorg met spoed omzetten in tastbaar beleid","https://www.rijksoverheid.nl/documenten/kamerstukken/2022/12/16/antwoorden-op-kamervragen-over-inzake-de-adviesbrief-van-de-ser-met-betrekking-tot-advies-jeugdzorg-met-spoed-omzetten-in-tastbaar-beleid","Minister Kuipers (VWS) stuurt de Tweede Kamer de antwoorden op de vragen van het lid Van Haga (Groep Van Haga) inzake de adviesbrief van de SER met betrekking tot advies Jeugdzorg met spoed omzetten in tastbaar beleid.",2022-12-16 16:30:02,"956dd3f0-e4e1-455d-9705-23b60f26677f"
"Kamerbrief over Veegbrief 2022","https://www.rijksoverheid.nl/documenten/kamerstukken/2022/12/16/kamerbrief-over-veegbrief-2022","Minister Kuipers (VWS) stuurt de Eerste en Tweede Kamer een Veegbrief 2022De Eerste Kamer heeft eenzelfde brief gekregen",2022-12-16 16:30:01,"4efe94c1-3a3b-4438-9deb-a3043a88233d"
"Antwoorden op Kamervragen over het bericht dat een medewerker van vaccinproducent Bilthoven Biologicals besmet is met het poliovirus en dat dit aan het licht kwam door een driewekelijkse rioolcheck bij het Utrecht Science Park","https://www.rijksoverheid.nl/documenten/kamerstukken/2022/12/16/antwoorden-op-kamervragen-over-het-bericht-dat-een-medewerker-van-vaccinproducent-bilthoven-biologicals-besmet-is-met-het-poliovirus-en-dat-dit-aan-het-licht-kwam-door-een-driewekelijkse-rioolcheck-bij-het-utrecht-science-park","Minister Kuipers (VWS) stuurt de Tweede Kamer de antwoorden op vragen van het lid Agema (PVV) over het bericht dat een medewerker van vaccinproducent Bilthoven Biologicals besmet is met het poliovirus en dat dit aan het licht kwam door een driewekelijkse rioolcheck bij het Utrecht Science Park.",2022-12-16 16:23:02,"3cf0440a-2097-4532-833e-245197de04cf"
"Kamerbrief over ontwikkelingen in de bevolkingsonderzoeken naar kanker 2022 en monitors 2021","https://www.rijksoverheid.nl/documenten/kamerstukken/2022/12/16/kamerbrief-over-ontwikkelingen-in-de-bevolkingsonderzoeken-naar-kanker-2022-en-monitors-2021","Minister Kuipers (VWS) informeert de Tweede Kamer over ontwikkelingen in de bevolkingsonderzoeken naar kanker 2022 en monitors 2021",2022-12-16 16:22:02,"94b77450-a33e-4566-a62a-c90d21c1be6e"
"Uitstelbrief antwoorden Kamervragen over de petitie ‘Meer onderzoek naar (onverklaarde) gezondheidsklachten van vrouwen’","https://www.rijksoverheid.nl/documenten/kamerstukken/2022/12/16/uitstelbrief-antwoorden-kamervragen-over-de-petitie-meer-onderzoek-naar-onverklaarde-gezondheidsklachten-van-vrouwen","Minister Kuipers (VWS) meldt dat de antwoorden op vragen van het lid Paulusma (D66) over de petitie ‘Meer onderzoek naar (onverklaarde) gezondheidsklachten van vrouwen’, later komen dan gebruikelijk.",2022-12-16 16:19:04,"d593e28e-a1d3-44a8-a4ee-1b7400ddba35"
"Antwoorden op Kamervragen over campagne herhaalprik","https://www.rijksoverheid.nl/documenten/kamerstukken/2022/12/16/antwoorden-op-kamervragen-over-campagne-verhaalvaccin-slaat-niet-aan-mensen-vinden-dat-ze-genoeg-prikken-hebben-gehad","Minister Kuipers (VWS) geeft antwoord op vragen over het bericht 'Campagne herhaalvaccin slaat niet aan: ""Mensen vinden dat ze genoeg prikken hebben gehad""'. Het Tweede Kamerlid Van Haga (Groep Van Haga) heeft deze vragen gesteld.",2022-12-16 16:15:00,"fd837c07-7f6a-48b2-b8a8-9fe82408c59f"
"Uitstelbrief antwoorden Kamervragen over mijden (mond)zorg door te weinig geld","https://www.rijksoverheid.nl/documenten/kamerstukken/2022/12/16/uitstelbrief-antwoorden-kamervragen-over-het-mijden-van-mondzorg-als-gevolg-van-gebrekkige-financiele-middelen","Minister Kuipers (VWS) meldt dat de antwoorden op vragen over het mijden van (mond)zorg door gebrekkige financiële middelen, later komen dan gebruikelijk.",2022-12-16 16:13:00,"71368555-7ec7-4748-a55a-e0e4b24fbcd4"
"Kamerbrief over 1e tranche Wetswijziging publieke gezondheid","https://www.rijksoverheid.nl/documenten/kamerstukken/2022/12/16/kamerbrief-eerste-tranche-wijziging-wet-publieke-gezondheid","Minister Kuipers (VWS) informeert de Tweede Kamer over de 1e tranche van de Wetswijziging publieke gezondheid.",2022-12-16 16:12:00,"1fda11eb-1d34-4951-94e5-0e3929b4a1ca"
"Antwoorden op Kamervragen over stoppen digitaal jeugddossier","https://www.rijksoverheid.nl/documenten/kamerstukken/2022/12/16/antwoorden-op-kamervragen-over-het-bericht-ggd-trekt-stekker-uit-digitaal-jeugddossier-ondanks-investering-van-miljoenen","Staatssecretaris Van Ooijen (VWS) geeft antwoord op vragen over het bericht 'GGD trekt stekker uit digitaal jeugddossier ondanks investering van miljoenen'. De Tweede Kamerleden Hijink en Leijten (beiden SP) hebben deze vragen gesteld.",2022-12-16 16:11:00,"52490394-ede7-4919-864d-109c70ef9700"
"Antwoorden op Kamervragen over kinderen met post-COVID","https://www.rijksoverheid.nl/documenten/kamerstukken/2022/12/16/antwoorden-op-kamervragen-over-kinderen-met-post-covid","Minister Kuipers (VWS) stuurt zijn antwoorden op vragen over kinderen met post-COVID (aanhoudende klachten langer dan 3 maanden na een besmetting met het coronavirus). De vragen zijn gesteld door het Tweede Kamerlid Kuiken (PvdA). ",2022-12-16 16:10:00,"fcfa273c-ede0-4344-bb4f-656017506b94"
"Antwoorden op Kamervragen over bericht 'RIVM: coronaprik voorkwam minimaal 88.000 ziekenhuisopnames'","https://www.rijksoverheid.nl/documenten/kamerstukken/2022/12/16/antwoorden-op-kamervragen-over-de-berichtgeving-over-het-bericht-rivm-coronaprik-voorkwam-minimaal-88000-ziekenhuisopnames","Minister Kuipers (VWS) geeft antwoord op vragen over het bericht 'RIVM: coronaprik voorkwam minimaal 88.000 ziekenhuisopnames'. Het Tweede Kamerlid Van Haga (Groep-Van Haga) heeft de vragen gesteld.",2022-12-16 16:09:00,"18cb2c48-3589-4726-a20b-2b0f7b9d2135"
"Antwoorden op de Kamervragen over schade aan het immuunsysteem door mRNA-vaccins en de aanhoudende oversterfte","https://www.rijksoverheid.nl/documenten/kamerstukken/2022/12/16/antwoorden-op-de-kamervragen-over-schade-aan-het-immuunsysteem-door-mrna-vaccins-en-de-aanhoudende-oversterfte","Minister Kuipers (VWS) beantwoordt vragen over schade aan het immuunsysteem door mRNA-vaccins en de aanhoudende oversterfte. De vragen zijn van het Kamerlid Van Haga (Groep Van Haga).",2022-12-16 16:07:00,"0b816e0e-32dd-4d7c-aa56-4498cc3d8c41"
"Kamerbrief stand van zaken transgenderzorg","https://www.rijksoverheid.nl/documenten/kamerstukken/2022/12/16/kamerbrief-stand-van-zaken-transgenderzorg","Minister Kuipers (VWS) stuurt de Tweede Kamer Kamer een brief over de stand van zaken in de transgenderzorg. De Eerste Kamer heeft eenzelfde brief gekregen.",2022-12-16 16:07:00,"9d438db9-45d0-4301-9d58-0eb964d32871"
"Kamerbrief over ondersteuning zorgmedewerkers met post-COVID na '1e golf' besmettingen coronavirus","https://www.rijksoverheid.nl/documenten/kamerstukken/2022/12/16/kamerbrief-over-zorgmedewerkers-met-langdurige-post-covid-klachten","Minister Helder (Langdurige Zorg en Sport) meldt de Tweede Kamer hoe het kabinet de ondersteuning wil regelen voor zorgmedewerkers die kampen met post-COVID-klachten door een besmetting met het coronavirus tijdens de zogenoemde '1e golf' van de pandemie in 2020. ",2022-12-16 16:05:00,"c2e0e5f6-1864-447f-b4d2-82bfd45f7d0b"
"Kamerbrief over stand van zaken moties en toezeggingen VWS kerstreces 2022","https://www.rijksoverheid.nl/documenten/kamerstukken/2022/12/16/kamerbrief-over-de-stand-van-zakenbrief-moties-en-toezeggingen-kerstreces-2022","De ministers Kuipers (VWS), Helder (Langdurige Zorg en Sport) en staatssecretaris Van Ooijen (VWS) sturen de Tweede Kamer de stand van zaken van de moties en toezeggingen die zijn gedaan aan de Tweede Kamer.",2022-12-16 16:02:00,"24a8007a-72c0-43e5-86ef-fb39de95aa5f"
"Stand van zaken moties en toezeggingen VWS kerstreces 2022","https://www.rijksoverheid.nl/documenten/kamerstukken/2022/12/16/stand-van-zaken-moties-en-toezeggingen-kerstreces","Stand van zaken van de moties en toezeggingen die door de bewindspersonen van het ministerie van Volksgezondheid, Welzijn en Sport (VWS) zijn gedaan aan de Tweede Kamer.",2022-12-16 16:02:00,"1c7037f7-3511-4e5a-91fa-d1339a6be47d"
"Kamerbrief met stand van zaken beleid prenatale screening","https://www.rijksoverheid.nl/documenten/kamerstukken/2022/12/16/kamerbrief-stand-van-zaken-prenatale-screening","Minister Kuipers (VWS) stuurt de Tweede Kamer een brief met de stand van zaken bij het beleid ten aanzien van prenatale screening. Aan bod komen onder andere de implementatie van de niet-invasieve prenatale test (NIPT) en het structureel echoscopisch onderzoek (SEO) in het 1e en 2e trimester van een zwangerschap (ook bekend als de 13- en 20-wekenecho).",2022-12-16 16:01:00,"2b332531-4b4e-4323-9b8c-7c79315eca46"
"Antwoorden op Kamervragen over vervolgonderzoek oversterfte in Nederland 2020-2022","https://www.rijksoverheid.nl/documenten/kamerstukken/2022/12/16/antwoorden-op-de-kamervragen-over-het-vervolgonderzoek-naar-oversterfte-in-nederland-in-de-periode-2020-2022","Minister Kuipers (VWS) geeft antwoord op vragen over het vervolgonderzoek naar oversterfte in Nederland in de periode 2020-2022. Het Tweede Kamerlid Omtzigt (Omtzigt) heeft deze vragen gesteld.",2022-12-16 16:00:00,"a9a61606-a0bb-4960-b338-8a54b3e6f457"
"Kamerbrief over motie en rapport over tolken in de zorg","https://www.rijksoverheid.nl/documenten/kamerstukken/2022/12/16/kamerbrief-over-verzoek-om-reactie-op-motie-van-de-leden-paulusma-en-bikker-35925-xvi-50-en-het-rapport-tolken-in-de-zorg-een-overzicht-van-huidige-inzet-financiering-en-knelpunten","Minister Kuipers (VWS) stuurt de Tweede kamer zijn reactie op de motie over bekostiging tolken en op het rapport 'Tolken in de zorg: een overzicht van huidige inzet, financiering en knelpunten'.",2022-12-16 16:39:00,"bfb90b8e-e873-4c3a-88c8-c349f7839261"
"Aanbiedingsbrief bij Veegbrief 2022","https://www.rijksoverheid.nl/documenten/kamerstukken/2022/12/16/kamerbrief-over-veegbrief-2022","Minister Kuipers (VWS) stuurt de Eerste en Tweede Kamer een Veegbrief 2022. De Eerste Kamer heeft eenzelfde brief gekregen. ",2022-12-16 16:30:00,"4efe94c1-3a3b-4438-9deb-a3043a88233d"
"Antwoorden op Kamervragen over adviesbrief van de SER over advies Jeugdzorg met spoed omzetten in tastbaar beleid","https://www.rijksoverheid.nl/documenten/kamerstukken/2022/12/16/antwoorden-op-kamervragen-over-inzake-de-adviesbrief-van-de-ser-met-betrekking-tot-advies-jeugdzorg-met-spoed-omzetten-in-tastbaar-beleid","Staatssecretaris Van Ooijen (VWS) geeft antwoord op vragen over de adviesbrief van de Sociaal Economische Raad (SER) over het advies Jeugdzorg met spoed omzetten in tastbaar beleid. Het Tweede Kamerlid Van Haga (Groep Van Haga) heeft de vragen gesteld. ",2022-12-16 16:30:00,"956dd3f0-e4e1-455d-9705-23b60f26677f"
"Antwoorden op Kamervragen over berichtgeving besmetting poliovirus","https://www.rijksoverheid.nl/documenten/kamerstukken/2022/12/16/antwoorden-op-kamervragen-over-het-bericht-dat-een-medewerker-van-vaccinproducent-bilthoven-biologicals-besmet-is-met-het-poliovirus-en-dat-dit-aan-het-licht-kwam-door-een-driewekelijkse-rioolcheck-bij-het-utrecht-science-park","Minister Kuipers (VWS) geeft antwoord op vragen over het bericht dat een medewerker van vaccinproducent Bilthoven Biologicals besmet is met het poliovirus en dat dit aan het licht kwam door een 3-wekelijkse rioolcheck bij het Utrecht Science Park. Het Tweede Kamerlid Agema (PVV) heeft de vragen gesteld.",2022-12-16 16:23:00,"3cf0440a-2097-4532-833e-245197de04cf"
"Kamerbrief over ontwikkelingen in de bevolkingsonderzoeken naar kanker 2022 en monitors 2021","https://www.rijksoverheid.nl/documenten/kamerstukken/2022/12/16/kamerbrief-over-ontwikkelingen-in-de-bevolkingsonderzoeken-naar-kanker-2022-en-monitors-2021","Minister Kuipers (VWS) informeert de Tweede Kamer over ontwikkelingen in de bevolkingsonderzoeken naar kanker 2022 en monitors 2021.",2022-12-16 16:22:00,"94b77450-a33e-4566-a62a-c90d21c1be6e"
"Uitstelbrief op Kamervragen over de petitie ‘Meer onderzoek naar (onverklaarde) gezondheidsklachten van vrouwen’","https://www.rijksoverheid.nl/documenten/kamerstukken/2022/12/16/uitstelbrief-antwoorden-kamervragen-over-de-petitie-meer-onderzoek-naar-onverklaarde-gezondheidsklachten-van-vrouwen","Minister Kuipers (VWS) meldt dat de antwoorden op vragen van het lid Paulusma (D66) over de petitie ‘Meer onderzoek naar (onverklaarde) gezondheidsklachten van vrouwen’, later komen dan gebruikelijk.",2022-12-16 16:19:00,"d593e28e-a1d3-44a8-a4ee-1b7400ddba35"
"Antwoorden op Kamervragen over bericht Minder administratie als oplossing voor personeelstekort","https://www.rijksoverheid.nl/documenten/kamerstukken/2022/12/19/antwoorden-op-kamervragen-over-het-bericht-minder-administratie-als-oplossing-voor-personeelstekort","Minister Helder (Langdurige Zorg en Sport) geeft antwoord op vragen over het bericht 'Minder administratie als oplossing voor personeelstekort'. Het Tweede Kamerlid Agema (PVV) heeft de vragen gesteld.",2022-12-19 15:24:00,"2c598050-da14-4c20-8a70-56dbdae5c8f0"
"Kamerbrief over stand van zaken zorg voor kinderen met een intensieve zorgvraag","https://www.rijksoverheid.nl/documenten/kamerstukken/2022/12/20/kamerbrief-over-stand-van-zaken-zorg-voor-kinderen-met-een-intensieve-zorgvraag","Minister Helder (Langdurige Zorg en Sport) stuurt de Tweede Kamer de stand van zakenbrief over zorg voor kinderen met een intensieve zorgvraag.",2022-12-20 09:57:02,"89c82555-e870-4e2d-8d1b-d8fb72f49451"
"Uitstelbrief antwoorden Kamervragen over uitbreidingsplannen KNVB","https://www.rijksoverheid.nl/documenten/kamerstukken/2022/12/20/uitstelbrief-antwoorden-kamervragen-over-het-artikel-bewoners-zeist-boos-over-uitbreidingsplannen-knvb-heel-bos-moet-er-voor-wijken","Minister Helder (Langdurige Zorg en Sport) meldt dat de antwoorden op vragen over het artikel 'Bewoners Zeist boos over uitbreidingsplannen KNVB: ""Heel bos moet er voor wijken""' later komen dan gebruikelijk.",2022-12-20 09:22:00,"4ccf6028-4c63-4c0c-bfcd-f9e4722db9eb"
"Antwoorden Kamervragen over het bericht over steeds meer meldingen over verwarde personen","https://www.rijksoverheid.nl/documenten/kamerstukken/2022/12/19/antwoorden-kamervragen-over-het-bericht-steeds-meer-meldingen-verwarde-personen-maar-aanpak-moeilijk-door-privacywet-je-weet-niet-met-wie-je-te-maken-hebt","Minister Yeşilgöz-Zegerius (JenV) en minister Helder ( Langdurige Zorg en Sport) geven antwoorden op Kamervragen naar aanleiding van het bericht 'Steeds meer meldingen verwarde personen, maar aanpak moeilijk door privacywet: 'Je weet niet met wie je te maken hebt.'' De Tweede Kamerleden Van den Hil en Michon-Derkzen (beiden VVD) hadden de vragen gesteld.",2022-12-19 19:09:00,"5a567455-6e8b-4c3a-b379-8747fabb94fb"
"Antwoorden op Kamervragen over het Deloitte-onderzoek naar de mondkapjesdeal","https://www.rijksoverheid.nl/documenten/kamerstukken/2022/12/20/antwoorden-op-kamervragen-over-het-deloitte-onderzoek-naar-de-mondkapjesdeal","Minister Helder (Langdurige Zorg en Sport) stuurt de Tweede Kamer de antwoorden op de vragen van het lid Agema (PVV) over het Deloitte-onderzoek naar de mondkapjesdeal.",2022-12-20 14:28:01,"a0b5ce9e-c482-4dd1-9f8a-191f9b53bf70"
