"item_title","item_link","item_description","item_pub_date","item_guid"
"Kamerbrief over monitor effect vervallen verlaagde omzetdrempels zorg","https://www.rijksoverheid.nl/documenten/kamerstukken/2023/01/25/kamerbrief-over-monitor-effect-vervallen-verlaagde-omzetdrempels-zorg","Minister Kuipers (VWS) informeert de Tweede Kamer over de opzet van de monitor naar de effecten van het vervallen van de verlaagde omzetdrempels voor het concentratietoezicht in de zorg. ",2023-01-25 09:59:00,"bfe2bd4a-4273-441c-bd6b-f66437d6dd4f"
"Kamerbrief over ondertekening Integraal Zorgakkoord (IZA) door LHV","https://www.rijksoverheid.nl/documenten/kamerstukken/2023/01/25/kamerbrief-over-ondertekening-integraal-zorgakkoord-door-de-landelijke-huisartsen-vereniging","Minister Kuipers (VWS), minister Helder (Langdurige Zorg en Sport) en staatssecretaris (VWS) Van Ooijen informeren de Tweede Kamer over de ondertekening van het Integraal Zorgakkoord (IZA) door de Landelijke Huisartsen Vereniging (LHV).",2023-01-25 09:33:00,"a9598223-464a-4ba5-8b62-31e980d343d0"
"Kamerbrief over omgang slachtoffers geweld in jeugdhulp","https://www.rijksoverheid.nl/documenten/kamerstukken/2023/01/25/kamerbrief-over-nadere-reactie-mbt-onderzoek-geweld-in-de-jeugdzorg","Staatssecretaris Van Ooijen (VWS) reageert op een mail over hoe instellingen in gesprek gaan met slachtoffers van geweld in de jeugdhulp. De Tweede Kamer heeft om de reactie van de staatssecretaris gevraagd.",2023-01-25 09:26:00,"4c56d377-a403-46b5-8d84-0e6041cb0924"
"Aanbiedingsbrief bij 2e nota van Wijziging van de Jeugdwet","https://www.rijksoverheid.nl/documenten/kamerstukken/2023/01/25/kamerbrief-over-wijziging-van-de-jeugdwet-in-verband-met-het-versterken-van-de-rechtspositie-van-jeugdigen-die-worden-opgenomen-in-een-gesloten-accommodatie","Staatssecretaris Van Ooijen (VWS) biedt de 2e nota van Wijziging van de Jeugdwet in verband met het versterken van de rechtspositie van jeugdigen die worden opgenomen in een gesloten accommodatie (Wet rechtspositie gesloten jeugdhulp) aan.",2023-01-25 08:50:00,"c9d5778e-82e8-48c5-92c7-0ce163726682"
"2e nota van wijziging van de Jeugdwet","https://www.rijksoverheid.nl/documenten/kamerstukken/2023/01/25/nota-van-wijziging-en-toelichting","2e nota van Wijziging van de Jeugdwet in verband met het versterken van de rechtspositie van jeugdigen die worden opgenomen in een gesloten accommodatie (Wet rechtspositie gesloten jeugdhulp) met toelichting. ",2023-01-25 08:50:00,"2f4ee8a4-345f-4474-9e4e-12f78e43fa6f"
"Kamerbrief over inzake verzoek om een jaarplanningsbrief 2023","https://www.rijksoverheid.nl/documenten/kamerstukken/2023/01/25/kamerbrief-over-inzake-verzoek-om-een-jaarplanningsbrief-2023","Minister Kuipers (VWS), minister Helder (Langdurige Zorg en Sport) en staatssecretaris Van Ooijen (VWS) sturen de Tweede Kamer de jaarplanningsbrief 2023.",2023-01-25 15:10:01,"2c8ee0e9-236a-4e97-92c2-fce0c923a4bf"
"Aanbiedingsbrief bij memorie van antwoord Wet elektronische gegevensuitwisseling in de zorg","https://www.rijksoverheid.nl/documenten/kamerstukken/2023/01/25/kamerbrief-regels-inzake-het-elektronisch-delen-en-benaderen-van-gegevens-tussen-zorgverleners-in-aangewezen-gegevensuitwisselingen-wet-elektronische-gegevensuitwisseling-in-de-zorg","Minister Kuipers (VWS) biedt de Eerste Kamer de memorie van antwoord aan bij het wetsvoorstel houdende regels inzake het elektronisch delen en benaderen van gegevens tussen zorgverleners in aangewezen gegevensuitwisselingen (Wet elektronische gegevensuitwisseling in de zorg).",2023-01-25 15:02:00,"94dc9120-2759-417e-aa9a-95709a5b6a08"
"Nadere memorie van antwoord Wet elektronische gegevensuitwisseling in de zorg","https://www.rijksoverheid.nl/documenten/kamerstukken/2023/01/25/nadere-memorie-van-antwoord","Minister Kuipers (VWS) geeft antwoord op vragen over het wetsvoorstel Wet elektronische gegevensuitwisseling in de zorg. Eerste Kamerleden van VVD, GroenLinks, PvdA, D66, PVV, SP en ChristenUnie hebben de vragen gesteld.",2023-01-25 15:02:00,"ab39cef3-2dd4-479e-9510-1a4292f88209"
"Uitstelbrief op Kamervragen over de berichtgeving over de commerciële overname van huisartsenpraktijken","https://www.rijksoverheid.nl/documenten/kamerstukken/2023/01/25/uitstelbrief-antwoorden-kamervragen-over-de-berichtgeving-over-de-commerciele-overname-van-huisartsenpraktijken","Minister Kuipers (VWS) meldt dat de antwoorden op vragen over de berichtgeving over de commerciële overname van huisartsenpraktijken later komen dan gebruikelijk. Het Tweede Kamerlid Van Haga (Groep Van Haga) heeft de vragen gesteld. ",2023-01-25 13:38:00,"068003b3-885e-482b-add1-d21c08c9afbb"
"Uitstelbrief op Kamervragen over het nieuws dat steeds meer huisartsenpraktijken in commerciële handen komen","https://www.rijksoverheid.nl/documenten/kamerstukken/2023/01/25/uitstelbrief-antwoorden-kamervragen-over-het-nieuws-dat-steeds-meer-huisartsenpraktijken-in-commerciele-handen-komen","Minister Kuipers (VWS) meldt dat de antwoorden op vragen over het nieuws dat steeds meer huisartsenpraktijken in commerciële handen komen later komen dan gebruikelijk. Het Tweede Kamerlid  Bushoff (PvdA) heeft deze vragen gesteld.",2023-01-25 13:31:00,"ecfcd610-7d15-4890-a88b-c33df6b6ab0b"
"Uitstelbrief op Kamervragen over commerciële huisartsenpraktijken","https://www.rijksoverheid.nl/documenten/kamerstukken/2023/01/25/uitstelbrief-antwoorden-kamervragen-over-commerciele-huisartsenpraktijken","Minister Kuipers (VWS) meldt dat de antwoorden op vragen over commerciële huisartsenpraktijken later komen dan gebruikelijk. Het Tweede Kamerlid Van den Berg (CDA) heeft de vragen gesteld. ",2023-01-25 13:24:00,"76d1247b-474f-4c9b-a552-328246f6b524"
"Antwoorden op Kamervragen over de wijziging structuur postacademische beroepen psychologische zorg","https://www.rijksoverheid.nl/documenten/kamerstukken/2023/01/25/antwoorden-op-kamervragen-over-de-wijziging-structuur-postacademische-beroepen-psychologische-zorg","Minister Kuipers (VWS) geeft antwoord op vragen over de wijziging structuur postacademische beroepen psychologische zorg. Het Tweede Kamerlid Van Haga (Groep Van Haga) heeft de vragen gesteld. ",2023-01-25 12:26:00,"f460313b-c61e-4872-8e2d-f425f22ba19f"
"Antwoorden op Kamervragen over artikel Bewoners Zeist boos over uitbreidingsplannen KNVB","https://www.rijksoverheid.nl/documenten/kamerstukken/2023/01/25/antwoorden-op-kamervragen-over-het-artikel-bewoners-zeist-boos-over-uitbreidingsplannen-knvb-heel-bos-moet-er-voor-wijken","Minister Helder (Langdurige Zorg en Sport) geeft antwoord op vragen over het artikel 'Bewoners Zeist boos over uitbreidingsplannen KNVB: Heel bos moet er voor wijken'. Het Tweede Kamerlid Heerema (VVD) heeft de vragen gesteld.",2023-01-25 15:29:00,"62bffbb4-035a-4642-88d1-006fbaacd45a"
"Antwoorden op Kamervragen over brief aan vertegenwoordigers Republik Maluku Selatan","https://www.rijksoverheid.nl/documenten/kamerstukken/2023/01/25/antwoorden-op-kamervragen-over-de-brief-aan-de-vertegenwoordigers-van-de-republik-maluku-selatan","Staatssecretaris Van Ooijen (VWS) geeft antwoord op vragen over de brief aan de vertegenwoordigers van de Republik Maluku Selatan. Het Tweede Kamerlid Simons (BIJ1) heeft de vragen gesteld.",2023-01-25 15:24:00,"cd524ccd-ba6e-440c-86a6-a75371e747cb"
"Kamerbrief over verzoek jaarplanningsbrief 2023","https://www.rijksoverheid.nl/documenten/kamerstukken/2023/01/25/kamerbrief-over-inzake-verzoek-om-een-jaarplanningsbrief-2023","Minister Kuipers (VWS), minister Helder (Langdurige Zorg en Sport) en staatssecretaris Van Ooijen (VWS) sturen de Tweede Kamer de jaarplanningsbrief voor het jaar 2023.",2023-01-25 15:10:00,"2c8ee0e9-236a-4e97-92c2-fce0c923a4bf"
"Kamerbrief over schriftelijk overleg inzake regeling wanbetalers","https://www.rijksoverheid.nl/documenten/kamerstukken/2023/01/26/kamerbrief-over-schriftelijk-overleg-inzake-regeling-wanbetalers","Minister Kuipers (VWS) stuurt de Tweede Kamer de antwoorden op de vragen en opmerkingen van de vaste commissie van Volksgezondheid, Welzijn en Sport in het kader van het schriftelijk overleg inzake de Regeling wanbetalers.",2023-01-26 10:41:01,"a84a880f-8305-4d41-bf97-b0741ebf66c1"
"Antwoorden op Kamervragen over het voornemen de afdeling (kinder)hartchirurgie in het UMCG te sluiten","https://www.rijksoverheid.nl/documenten/kamerstukken/2023/01/26/antwoorden-op-kamervragen-over-het-voornemen-de-afdeling-kinderhartchirurgie-in-het-umcg-te-sluiten","Minister Kuipers (VWS) geeft antwoord op vragen over het voornemen de afdeling (kinder)hartchirurgie in het UMCG te sluiten. Het Tweede Kamerlid Van Haga (Groep Van Haga) heeft de vragen gesteld.",2023-01-26 15:10:18,"60953ed3-7e90-4ceb-882d-44b48beac119"
"Antwoorden op vragen over Regeling wanbetalers","https://www.rijksoverheid.nl/documenten/kamerstukken/2023/01/26/kamerbrief-over-schriftelijk-overleg-inzake-regeling-wanbetalers","Minister Kuipers (VWS) geeft antwoord op de vragen en opmerkingen over de Regeling wanbetalers. De vragen zijn gesteld door de vaste commissie van Volksgezondheid, Welzijn en Sport.",2023-01-26 10:41:00,"a84a880f-8305-4d41-bf97-b0741ebf66c1"
"Antwoorden op Kamervragen over het bericht dat van de bijna 22.000 hoogbejaarde wachtenden, 4.734 urgent wachten, wat een stijging van 70% is","https://www.rijksoverheid.nl/documenten/kamerstukken/2023/01/26/antwoorden-op-kamervragen-over-het-bericht-dat-van-de-bijna-22000-hoogbejaarde-wachtenden-4734-urgent-wachten-wat-een-stijging-van-70-is","Minister Helder (Langdurige Zorg en Sport) geeft antwoord op vragen van het lid Agema (PVV) over het bericht dat van de bijna 22.000 hoogbejaarde wachtenden, 4.734 urgent wachten, wat een stijging van 70% is",2023-01-26 16:51:00,"70ae2837-9957-4b87-965f-87ea9057fd62"
"Antwoorden op Kamervragen over farmacokinetiek Comirnaty vaccin","https://www.rijksoverheid.nl/documenten/kamerstukken/2023/01/26/antwoorden-op-kamervragen-over-pharmacokinetics-pfizer-comirnaty","Minister Kuipers (VWS) geeft antwoord op vragen over de farmacokinetiek van het Comirnaty vaccin. Het Tweede Kamerlid Van Haga (Groep Van Haga) heeft deze vragen gesteld.",2023-01-26 16:14:00,"c41efb6d-f044-4e5a-ab89-849d57ba3561"
"Antwoorden op Kamervragen over het voornemen de afdeling (kinder)hartchirurgie in UMCG te sluiten","https://www.rijksoverheid.nl/documenten/kamerstukken/2023/01/26/antwoorden-op-kamervragen-over-het-voornemen-de-afdeling-kinderhartchirurgie-in-het-umcg-te-sluiten","Minister Kuipers (VWS) geeft antwoord op vragen over het voornemen de afdeling (kinder)hartchirurgie in het UMCG te sluiten. Het Tweede Kamerlid Van Haga (Groep Van Haga) heeft de vragen gesteld.",2023-01-26 15:10:00,"60953ed3-7e90-4ceb-882d-44b48beac119"
"Antwoorden op Kamervragen over het bericht dat 4.734 hoogbejaarde ouderen die wachten op een verpleeghuisplek Urgent wachtenden zijn","https://www.rijksoverheid.nl/documenten/kamerstukken/2023/01/26/antwoorden-op-kamervragen-over-het-bericht-dat-van-de-bijna-22000-hoogbejaarde-wachtenden-4734-urgent-wachten-wat-een-stijging-van-70-is","Minister Helder (Langdurige Zorg en Sport) geeft antwoord op vragen over het bericht dat van de bijna 22.000 hoogbejaarde wachtenden, 4.734 urgent wachten, wat een stijging van 70% is. Het Tweede Kamerlid Agema (PVV) heeft de vragen gesteld.",2023-01-26 16:51:00,"70ae2837-9957-4b87-965f-87ea9057fd62"
"Antwoorden Kamervragen over het bericht over het schrijnende tekort aan forensisch artsen","https://www.rijksoverheid.nl/documenten/kamerstukken/2023/01/25/antwoorden-kamervragen-over-het-bericht-het-schrijnende-tekort-aan-forensisch-artsen","Minister Yeşilgöz-Zegerius (JenV) geeft antwoorden op Kamervragen naar aanleiding van de brandbrief 'Grenzen forensische geneeskunde bereikt'  van de 25 GGD’en. De Tweede Kamerleden Van der Werf (D66), Michon-Derkzen (VVD) en Mutluer (PvdA) hadden de vragen gesteld.",2023-01-25 17:43:00,"ca99523e-74e2-4f5c-9586-abe3037b5c01"
"Kamerbrief stand van zaken Toekomstagenda zorg en ondersteuning voor mensen met een beperking","https://www.rijksoverheid.nl/documenten/kamerstukken/2023/01/27/lz-1041536-a","Minister Helder (Langdurige Zorg en Sport) informeert de Tweede Kamer over de stand van zaken van de Toekomstagenda zorg en ondersteuning voor mensen met een beperking.",2023-01-27 15:39:00,"ac515680-ca45-41e0-b2af-497914cdaded"
"Antwoorden op Kamervragen over bericht Covid raast door Peking: uitgestorven straten en volle crematoria","https://www.rijksoverheid.nl/documenten/kamerstukken/2023/01/27/antwoorden-op-kamervragen-over-het-bericht-covid-raast-door-peking-uitgestorven-straten-en-volle-crematoria","Minister Kuipers (VWS) geeft antwoord op vragen over het bericht 'Covid raast door Peking: uitgestorven straten en volle crematoria'. Het Tweede Kamerlid Van den Berg (CDA) heeft de vragen gesteld.",2023-01-27 15:34:00,"55648356-4e6f-479d-8716-76baa8c80b48"
"Antwoorden op Kamervragen over NZa-rapport concentratie kinderhartchirurgie","https://www.rijksoverheid.nl/documenten/kamerstukken/2023/01/27/antwoorden-op-kamervragen-over-het-rapport-van-de-nederlandse-zorgautoriteit-dat-verstrekkende-gevolgen-ziet-van-de-concentratie-van-kinderhartchirurgie","Minister Kuipers (VWS) geeft antwoord op vragen over het rapport van de Nederlandse Zorgautoriteit (NZa) dat verstrekkende gevolgen ziet van de concentratie van kinderhartchirurgie. Het Tweede Kamerlid Agema (PVV) heeft deze vragen gesteld.",2023-01-27 15:31:00,"fb47723f-2fb2-48e0-a752-5862e19e2482"
"Kamerbrief over Werkagenda Toezicht Sociaal Domein 2023-2024","https://www.rijksoverheid.nl/documenten/kamerstukken/2023/01/30/kamerbrief-over-werkagenda-toezicht-sociaal-domein-2023-2024","Staatssecretaris Van Ooijen (VWS) biedt de Tweede Kamer een brief aan over Werkagenda Toezicht Sociaal Domein 2023-2024",2023-01-30 10:57:01,"7574c335-2090-4846-95e4-f9608133cda0"
"Antwoorden op Kamervragen over het rapport Wmo-toezicht 2021","https://www.rijksoverheid.nl/documenten/kamerstukken/2023/01/30/antwoorden-op-kamervragen-over-het-rapport-wmo-toezicht-2021","Staatssecretaris Van Ooijen (VWS) geeft antwoord op vragen over het rapport Wmo-toezicht 2021. Het Tweede Kamerlid Bevers (VVD) heeft de vragen gesteld.",2023-01-30 10:47:00,"284fedb5-7ebb-4b3c-bf2a-64f785713605"
"Kamerbrief over stand van zaken vogelgriep","https://www.rijksoverheid.nl/documenten/kamerstukken/2023/01/27/stand-van-zaken-vogelgriep","Minister Adema (LNV) informeert de Tweede Kamer over recente ontwikkelingen in de vogelgriepsituatie. Hij gaat in op het intensiveringsplan preventie vogelgriep, de epidemiologische situatie in Nederland en Europa, de nieuwe risicobeoordeling door de Deskundigengroep Dierziekten, de voortgang rond vaccinatie en de financiering van de bestrijding van de uitbraken.",2023-01-27 16:49:00,"907d4c33-f056-44b6-97d7-b3cf59dad109"
"Bestrijdingskosten hoogpathogene vogelgriep bij houders met meer dan 250 dieren","https://www.rijksoverheid.nl/documenten/kamerstukken/2023/01/27/bijlage-3-bestrijdingskosten-hpai","Overzicht van de bestrijdingskosten hoogpathogene vogelgriep bij houders met meer dan 250 dieren.",2023-01-27 16:49:00,"f494266b-a61b-41e9-9433-ce751ef245ac"
"Kamerbrief over beleidsprogramma pandemische paraatheid","https://www.rijksoverheid.nl/documenten/kamerstukken/2023/01/30/kamerbrief-over-beleidsprogramma-pandemische-paraatheid","Minister Kuipers (VWS) zendt de Eerste Kamer, mede namens de minister van Landbouw, Natuur en Voedselkwaliteit, de antwoorden op de vragen van de Eerste Kamer leden van de vaste commissies voor Justitie en Veiligheid, voor Volksgezondheid, Welzijn en Sport, en voor Binnenlandse Zaken en de Hoge Colleges van Staat/ Algemene Zaken en Huis van de Koning naar aanleiding van de brief van 4 november 2022 (Kamerstuk 25 295-1964) over het beleidsprogramma pandemische paraatheid.",2023-01-30 15:00:01,"348ef635-4047-46a9-bf16-ec928ffcba5f"
"Antwoorden op Kamervragen over bericht Duizenden ouderen hebben acuut verpleeghuisbed nodig, tekort groeit snel","https://www.rijksoverheid.nl/documenten/kamerstukken/2023/01/30/antwoorden-op-kamervragen-over-het-bericht-duizenden-ouderen-hebben-acuut-verpleeghuisbed-nodig-tekort-groeit-snel","Minister Helder (Langdurige Zorg en Sport) geeft antwoord op vragen over het bericht 'Duizenden ouderen hebben acuut verpleeghuisbed nodig, tekort groeit snel'. Het Tweede Kamerlid Werner (CDA) heeft de vragen gesteld.",2023-01-30 14:50:00,"6010326a-f6d9-47f8-856f-9eb20dd2e158"
"Antwoorden op Kamervragen over berichtgeving drukte in ziekenhuizen door griepepidemie","https://www.rijksoverheid.nl/documenten/kamerstukken/2023/01/30/antwoorden-op-kamervragen-over-de-berichtgeving-over-de-drukte-in-de-ziekenhuizen-als-gevolg-van-de-griepepidemie","Minister Kuipers (VWS) geeft antwoord op vragen over de drukte in de ziekenhuizen door de griepepidemie. Het Tweede Kamerlid Van Haga (Groep-Van Haga) heeft de vragen gesteld.",2023-01-30 14:31:00,"c8f3b5e4-23df-4113-81da-2ce910407034"
"Antwoorden op Kamervragen over 1300 meldingen over onveiligheid van papieren rietjes bij de NVWA","https://www.rijksoverheid.nl/documenten/kamerstukken/2023/01/30/antwoorden-op-kamervragen-over-1300-meldingen-over-onveiligheid-van-papieren-rietjes-bij-de-nvwa","Minister Kuipers (VWS) geeft antwoord op vragen over 1300 meldingen over onveiligheid van papieren rietjes bij de NVWA. Het Tweede Kamerlid Agema (PVV) heeft de vragen gesteld.",2023-01-30 14:28:00,"9dd3eec0-01d2-4eda-b3dc-4d6f3a4fb3da"
"Antwoorden op Kamervragen over Wob-besluit Data Protection Impact Assessment (DPIA)","https://www.rijksoverheid.nl/documenten/kamerstukken/2023/01/30/antwoorden-op-kamervragen-over-het-wob-besluit-data-protection-impact-assessment-dpia","Minister Kuipers (VWS) geeft antwoord op vragen over het Wob-besluit Data Protection Impact Assessment (DPIA). Het Tweede Kamerlid Van Houwelingen (FvD) heeft de vragen gesteld.",2023-01-30 14:23:00,"85b0f8d4-d10a-4e1c-9da8-7003f26f48ff"
"Uitstelbrief op Kamervragen over  bericht dat meningokokkenvaccin ACWY niet vergoed wordt voor mensen met niet-functionerende milt","https://www.rijksoverheid.nl/documenten/kamerstukken/2023/01/30/uitstelbrief-antwoorden-kamervragen-over-het-bericht-dat-meningokokkenvaccin-acwy-nog-steeds-niet-vergoed-wordt-voor-mensen-met-een-niet-functionerende-milt","Minister Kuipers (VWS) meldt dat de antwoorden op vragen over het bericht dat het meningokokkenvaccin ACWY nog steeds niet vergoed wordt voor mensen met een niet-functionerende milt later komen dan gebruikelijk. Het Tweede Kamerlid Hijink (SP) heeft de vragen gesteld.",2023-01-30 12:31:00,"807dc48f-128a-4eb5-b6cd-a7aaae910270"
"Aanbiedingsbrief bij 2 rapporten in kader van Hervormingsagenda Jeugd","https://www.rijksoverheid.nl/documenten/kamerstukken/2023/01/30/kamerbrief-over-aanbieding-rapport-verwey-jonker-en-rapport-aspectu","Staatssecretaris Van Ooijen (VWS) biedt de Tweede Kamer 2 rapporten aan, die zijn opgesteld in het kader van de Hervormingsagenda Jeugd. Dit gaat over jeugdhulp. Het betreft een rapport van het Verweij-Jonkerinstituut over de afbakening van niet-vrij toegankelijke jeugdhulp, en een rapport van bureau Aspectu over gebruik en kosten van voorzieningen uit de Jeugdwet. ",2023-01-30 11:33:00,"d6c70f32-8406-46c6-840b-cd4b375ef59f"
"Kamerbrief over Werkagenda Toezicht Sociaal Domein 2023-2024","https://www.rijksoverheid.nl/documenten/kamerstukken/2023/01/30/kamerbrief-over-werkagenda-toezicht-sociaal-domein-2023-2024","Staatssecretaris Van Ooijen (VWS) biedt de Tweede Kamer een brief aan over de Werkagenda Toezicht Sociaal Domein 2023-2024.",2023-01-30 10:57:00,"7574c335-2090-4846-95e4-f9608133cda0"
"Antwoorden op Kamervragen over beleidsprogramma pandemische paraatheid","https://www.rijksoverheid.nl/documenten/kamerstukken/2023/01/30/kamerbrief-over-beleidsprogramma-pandemische-paraatheid","Minister Kuipers (VWS) stuurt zijn antwoorden op vragen over het beleidsprogramma pandemische paraatheid. Dit gaat over voorbereiding op de mogelijke uitbraak van infectieziekten. De vragen zijn gesteld door Eerste Kamerleden van de fracties van PVV en PvdD in de Eerste Kamercommissies voor JenV, VWS, en Binnenlandse Zaken en Hoge Colleges van Staat/Algemene Zaken en Huis van de Koning (BiZa/AZ).",2023-01-30 15:00:00,"348ef635-4047-46a9-bf16-ec928ffcba5f"
"Antwoorden Kamervragen over Leidraad omgang met wilde vogels en vogelgriep","https://www.rijksoverheid.nl/documenten/kamerstukken/2023/01/31/beantwoording-vragen-schriftelijk-overleg-inzake-de-leidraad-omgang-met-wilde-vogels-met-vogelgriep-en-andere-vogelgrieponderwerpen","Minister Adema (LNV) geeft antwoord op vragen over de Kamerbrief 'Leidraad omgang met wilde vogels met vogelgriep en andere vogelgrieponderwerpen' van 30 november 2022. De vragen zijn gesteld tijdens het Schriftelijk Overleg.",2023-01-31 14:46:00,"81d9a761-f697-4042-a3c9-9aa24cd609c2"
"Antwoorden op Kamervragen over kabinetsreactie op uitkomst overleg over maatregelen voor reizigers China","https://www.rijksoverheid.nl/documenten/kamerstukken/2023/01/31/antwoorden-op-kamervragen-over-de-kabinetsreactie-terugkoppeling-ipcr-en-vervolgproces-ingezonden-op-10-januari-2023","Minister Kuipers (VWS) geeft antwoord op vragen over de Kamerbrief uitkomst overleg over maatregelen voor reizigers uit China. Het Tweede Kamerlid Tielen (VVD) heeft de vragen gesteld.",2023-01-31 13:17:00,"06940310-f1e2-4ed1-a2fb-1e5fcaeaa19d"
"Antwoorden op Kamervragen over testverplichting reizigers uit China","https://www.rijksoverheid.nl/documenten/kamerstukken/2023/01/31/kamerbrief-over-vragen-nav-de-besluitvorming-van-het-kabinet-omtrent-de-epidemiologische-situatie-in-china","Minister Kuipers (VWS) geeft antwoord op vragen over de verplichting voor reizigers uit China om een negatief testresultaat te laten zien. De PvdD-fractie in de Eerste Kamer heeft deze vragen gesteld.",2023-01-31 13:14:00,"1c253e5d-4ef5-4c13-981b-a9c33ba0286b"
"Kamerbrief over Schriftelijk Overleg rapport ‘onderzoek Backpay-regeling weduwen’","https://www.rijksoverheid.nl/documenten/kamerstukken/2023/01/31/kamerbrief-over-schriftelijk-overleg-so-inzake-rapport-onderzoek-backpay-weduwen","Staatssecretaris Van Ooijen (VWS) informeert de Tweede Kamer over het Schriftelijk Overleg (SO) over het rapport ‘onderzoek Backpay-regeling weduwen’.",2023-01-31 12:50:00,"2c41f4c5-24e2-4f26-8c9e-1b1094eb0d7e"
"Antwoorden op Kamervragen over het bericht in Trouw over het gebrek aan landelijk overzicht van de wachttijden in de jeugdzorg","https://www.rijksoverheid.nl/documenten/kamerstukken/2023/01/31/antwoorden-op-kamervragen-over-het-bericht-in-trouw-over-het-gebrek-aan-landelijk-overzicht-van-de-wachttijden-in-de-jeugdzorg","Staatssecretaris Van Ooijen (VWS) geeft antwoord op vragen over het bericht in Trouw over het gebrek aan landelijk overzicht van de wachttijden in de jeugdzorg. Het Tweede Kamerlid Raemakers (D66) heeft de vragen gesteld.",2023-01-31 12:40:00,"cff6faa3-72ae-49bd-97ec-57ccfe68bb1d"
"Antwoorden op Kamervragen over de geluidsopnamen van OMT-vergaderingen die per abuis niet zijn vernietigd","https://www.rijksoverheid.nl/documenten/kamerstukken/2023/01/31/antwoorden-op-kamervragen-over-de-geluidsopnamen-van-omt-vergaderingen-die-per-abuis-niet-zijn-vernietigd","Minister Kuipers (VWS) geeft antwoord op vragen over  de geluidsopnamen van OMT-vergaderingen die per abuis niet zijn vernietigd. Het Tweede Kamerlid Van Haga (Groep Van Haga) heeft de vragen gesteld",2023-01-31 17:02:01,"c37b3e26-e273-4614-9285-905b3e7cf422"
"Kamerbrief over beantwoording inbreng schriftelijk overleg over beschikbaarheid opnames OMT-vergaderingen","https://www.rijksoverheid.nl/documenten/kamerstukken/2023/01/31/kamerbrief-over-beantwoording-inbreng-schriftelijk-overleg-over-beschikbaarheid-opnames-omt-vergaderingen","Minister Kuipers (VWS) stuurt de Tweede Kamer de beantwoording op de inbreng van het schriftelijk overleg over de reactie op het verzoek van het lid Omtzigt, gedaan tijdens de Regeling van Werkzaamheden van 20 oktober 2022, over het niet informeren van de Kamer over de beschikbaarheid van opnames van Outbreak Management Team (OMT)- vergaderingen.",2023-01-31 17:00:01,"ba753c29-f79b-408a-b819-d835482b4aa4"
"Kamerbrief over monitoring energieprijzen en sport","https://www.rijksoverheid.nl/documenten/kamerstukken/2023/01/31/kamerbrief-over-monitoring-energieprijzen-en-sport","Minister Helder (Langdurige Zorg en Sport) stuurt de Tweede Kamer een brief over monitoring energieprijzen en sport.",2023-01-31 16:48:01,"115ffec3-b61a-4511-85d0-cafcd72255fd"
"Kamerbrief over schriftelijk overleg Beleidsprogramma pandemische paraatheid","https://www.rijksoverheid.nl/documenten/kamerstukken/2023/01/31/kamerbrief-over-schriftelijk-overleg-beleidsprogramma-pandemische-paraatheid","Minister Kuipers (VWS) stuurt de Tweede Kamer antwoorden op vragen en opmerkingen over het beleidsprogramma pandemische paraatheid. De vragen zijn van de fracties van de VVD, D66, PVV, CDA, PvdA en GroenLinks, SP, PvdD, ChristenUnie, Groep Van Haga en de BBB.",2023-01-31 16:13:00,"01a37e5a-e28d-46a0-9cff-e611647545c3"
"Kamerbrief over regeling zorgmedewerkers post-COVID","https://www.rijksoverheid.nl/documenten/kamerstukken/2023/02/01/kamerbrief-over-regeling-zorgmedewerkers-post-covid","Minister Helder (Langdurige Zorg en Sport) stuurt de Tweede Kamer een brief over de voorbereiding voor een regeling voor zorgmedewerkers met langdurige post-COVID klachten.",2023-02-01 09:34:00,"c05bd753-d2f8-46f5-858e-2e0bbc8eb1d9"
