"item_title","item_link","item_description","item_pub_date","item_guid"
"Kamerbrief over Voorhangbrief Stimuleringsregeling innovatie TAZ-WOZO","https://www.rijksoverheid.nl/documenten/kamerstukken/2023/12/05/kamerbrief-over-voorhangbrief-stimuleringsregeling-innovatie-taz-wozo","Kamerbrief over Voorhangbrief Stimuleringsregeling innovatie TAZ-WOZO",2023-12-05 15:08:22,"46395b10-e129-4962-97d4-422f9106dcf3"
"Antwoorden op Kamervragen over deelname Taliban-vertegenwoordiger aan WHO-bijeenkomst in Den Haag","https://www.rijksoverheid.nl/documenten/kamerstukken/2023/12/05/antwoorden-op-kamervragen-over-het-feit-dat-de-minister-van-vws-op-een-foto-stond-met-een-taliban-vertegenwoordiger-in-den-haag","Minister Kuipers (VWS) geeft antwoord op vragen over de deelname van een vertegenwoordiger van de Taliban aan het World Local Production Forum in Den Haag, een bijeenkomst van de Wereldgezondheidsorganisatie (WHO). Het Tweede Kamerlid Van der Plas (BBB) heeft deze vragen gesteld.Antwoorden op Kamervragen over deelname Taliban-vertegenwoordiger aan WHO-bijeenkomst in Den Haag",2023-12-05 13:40:11,"adaae75c-7166-4c87-8e9c-f2038eee4788"
"Kamerbrief stand van zaken medicamenteuze afbreking zwangerschap via huisarts","https://www.rijksoverheid.nl/documenten/kamerstukken/2023/12/04/kamerbrief-over-stand-van-zaken-medicamenteuze-afbreking-van-de-zwangerschap-via-de-huisarts","Minister Kuipers (VWS) informeert de Tweede Kamer over de voortgang van de invoering van de abortuspil via de huisarts. De Eerste Kamer heeft eenzelfde brief ontvangen.Kamerbrief stand van zaken medicamenteuze afbreking zwangerschap via huisarts",2023-12-04 16:05:55,"d6cd749e-5f91-4912-b25d-8cf6c19b2aae"
"Antwoorden op Kamervragen over onderzoeksrapporten transgenderzorg","https://www.rijksoverheid.nl/documenten/kamerstukken/2023/12/04/kamerbrief-over-so-inzake-transgenderzorg","Minister Kuipers (VWS) geeft antwoord op vragen over de Kamerbrief van 9 mei 2023 over 2 onderzoeksrapporten op het gebied van transgenderzorg. De vaste commissie voor Volksgezondheid, Welzijn en Sport in de Tweede Kamer heeft deze vragen gesteld.Antwoorden op Kamervragen over onderzoeksrapporten transgenderzorg",2023-12-04 15:08:05,"b5d30568-db25-4032-a74a-89c6af30df38"
"Kamerbrief met beleidsreactie op rapport over zorg en ondersteuning aan Donny M in het straf zorg en sociaal domein ","https://www.rijksoverheid.nl/documenten/kamerstukken/2023/12/04/tk-beleidsreactie-op-rapport-zorg-en-ondersteuning-aan-donny-m-in-het-straf-zorg-en-sociaal-domein-door-toezicht-sociaal-domein","Minister Weerwind (Rechtsbescherming) geeft zijn beleidsreactie op  het onderzoeksrapport 'Zorg en ondersteuning aan Donny M. in het straf-, zorg- en sociaal domein' van Toezicht Sociaal Domein (TSD). Het rapport gaat over de dader van de vermissing en het latere overlijden van Gino. De Tweede Kamer had het rapport op 8 juni 2023 ontvangen.Kamerbrief met beleidsreactie op rapport over zorg en ondersteuning aan Donny M in het straf zorg en sociaal domein",2023-12-04 13:25:07,"fec2327a-fe8b-4351-bb0c-6bd5811c9962"
"Antwoorden op de vragen van het lid Dijk (SP) over de overname van Tandartspraktijk Kennemerland door een Deens private-equityhuis","https://www.rijksoverheid.nl/documenten/kamerstukken/2023/12/04/antwoorden-op-de-vragen-van-het-lid-dijk-sp-over-de-overname-van-tandartspraktijk-kennemerland-door-een-deens-private-equityhuis","Antwoorden op de vragen van het lid Dijk (SP) over de overname van Tandartspraktijk Kennemerland door een Deens private-equityhuis",2023-12-04 12:33:38,"39306b28-ba63-45e9-a203-eda146a0569b"
"Uitstelbrief op Kamervragen over het niet doorgaan van amateur wielrenwedstrijden","https://www.rijksoverheid.nl/documenten/kamerstukken/2023/12/04/uitstelbrief-antwoorden-kamervragen-over-het-niet-doorgaan-van-amateur-wielrenwedstrijden","Minister Helder (Langdurige Zorg en Sport) meldt dat de antwoorden op vragen over het niet doorgaan van amateur wielrenwedstrijden later komen dan gebruikelijk. De Tweede Kamerleden Van den Brink, Krul en Inge van Dijk (allen CDA) hebben de vragen gesteld. Uitstelbrief op Kamervragen over het niet doorgaan van amateur wielrenwedstrijden",2023-12-04 11:28:24,"b04eab16-6b1d-4723-8958-16927186926e"
"Kamerbrief over ontwerpregeling maximumprijzen geneesmiddelen per 1 april 2024","https://www.rijksoverheid.nl/documenten/kamerstukken/2023/12/04/kamerbrief-over-aanbieding-ontwerpregeling-maximumprijzen-geneesmiddelen-per-1-april-2024","Minister Kuipers (VWS) stuurt de Tweede Kamer de wijziging van de Regeling maximumprijzen geneesmiddelen (Rmg).Kamerbrief over ontwerpregeling maximumprijzen geneesmiddelen per 1 april 2024",2023-12-04 11:12:18,"122039e8-c6ef-4e89-bd15-fda2c88cbe1a"
"Uitstelbrief bij Antwoorden op Kamervragen over de huisartsenzorg in Brunssum","https://www.rijksoverheid.nl/documenten/kamerstukken/2023/12/04/uitstelbrief-antwoorden-kamervragen-over-de-huisartsenzorg-in-brunssum","Minister Kuipers (VWS) meldt dat de antwoorden op vragen over de huisartsenzorg in Brunssum later komen dan gebruikelijk. Het Tweede Kamerlid Dijk (SP) heeft de vragen gesteld.Uitstelbrief bij Antwoorden op Kamervragen over de huisartsenzorg in Brunssum",2023-12-04 11:00:05,"162a88f6-1761-4c5d-8f8b-c5ec938890f7"
"Kamerbrief over Samenwerking Nederland - India","https://www.rijksoverheid.nl/documenten/kamerstukken/2023/12/04/kamerbrief-over-samenwerking-nederland-india","Minister Kuipers (VWS) informeert de Tweede Kamer over zijn werkbezoek aan India en de vervolgstappen.  Kamerbrief over Samenwerking Nederland - India",2023-12-04 10:38:51,"eb7a0d15-8130-4a66-8223-2eff91e70d8d"
"Kamerbrief over bestuurlijke afspraken Uitvoering Wet zorg en dwang","https://www.rijksoverheid.nl/documenten/kamerstukken/2023/12/01/kamerbrief-over-bestuurlijke-afspraken-uitvoering-wet-zorg-en-dwang","Minister Helder (Langdurige Zorg en Sport) stuurt de Tweede Kamer de bestuurlijke afspraken uitvoering Wet zorg en dwang psychogeriatrische en verstandelijk gehandicapte cliënten (Wzd) 2024. De bedoeling van de wet: meer rechtsbescherming en minder onvrijwillige zorg. De Eerste Kamer heeft een afschrift van deze brief gekregen.Kamerbrief over bestuurlijke afspraken Uitvoering Wet zorg en dwang",2023-12-01 16:39:59,"833104ad-a21a-46d5-bcc2-b5611cd85237"
"Antwoorden op Kamervragen over bericht dat Europese voetbalclubs betaalde transfersommen sinds uitbreken oorlog in Oekraïne","https://www.rijksoverheid.nl/documenten/kamerstukken/2023/12/01/beantwoording-vragen-over-door-europese-voetbalclubs-betaalde-transfersommen-sinds-uitbreken-oorlog-in-oekraine","Minister Bruins Slot (BZ) geeft antwoord op schriftelijke vragen over het bericht dat Europese voetbalclubs sinds het uitbreken van de oorlog in Oekraïne zo’n 40 miljoen euro aan transfer– en huursommen aan hun Russische tegenhangers hebben betaald. De Tweede Kamerleden Boswijk en Van den Brink (beiden CDA) hebben de vragen gesteld. Antwoorden op Kamervragen over bericht dat Europese voetbalclubs betaalde transfersommen sinds uitbreken oorlog in Oekraïne",2023-12-01 15:58:49,"f1f82499-5a36-4291-95f9-47dfa2386c19"
"Kamerbrief bij jaarrapportage arbeidsmigranten 2023","https://www.rijksoverheid.nl/documenten/kamerstukken/2023/12/01/kamerbrief-drie-jaar-na-roemer-jaarrapportage-arbeidsmigranten-2023","Minister Van Gennip (SZW) deelt haar reactie op hoofdlijnen op de jaarrapportage arbeidsmigranten 2023 met de Tweede Kamer. De jaarrapportage beschrijft de voortgang van de uitvoering van de aanbevelingen uit 2020 om de positie van arbeidsmigranten in Nederland te verbeteren en misstanden tegen te gaan.Kamerbrief bij jaarrapportage arbeidsmigranten 2023",2023-12-01 13:24:21,"91a63f38-68ee-443d-9ed6-5c057f418f1e"
"Toezeggingen en moties EU-arbeidsmigratie 2023","https://www.rijksoverheid.nl/documenten/kamerstukken/2023/12/01/toezeggingen-en-moties-eu-arbeidsmigratie-2023","Minister Van Gennip (SZW) meldt de Tweede Kamer hoe verschillende toezeggingen en moties rondom het thema EU-arbeidsmigratie zijn opgevolgd.Toezeggingen en moties EU-arbeidsmigratie 2023",2023-12-01 13:08:31,"8d55f3d0-7b86-481d-9d56-e83a10e264ea"
"Kamerbrief over vooruitblik op Volksgezondheid Toekomstverkenning 2024 ‘Opgaven voor volksgezondheid en zorg op weg naar 2050’","https://www.rijksoverheid.nl/documenten/kamerstukken/2023/12/01/vooruitblik-op-volksgezondheid-toekomstverkenning-2024-opgaven-voor-volksgezondheid-en-zorg-op-weg-naar-2050","Minister Kuipers (VWS), minister Helder (Langdurige Zorg en Sport) en staatssecretaris Van Ooijen (VWS) sturen de Tweede Kamer het rapport 'Opgaven voor volksgezondheid en zorg op weg naar 2050 - Vooruitblik Volksgezondheid Toekomstverkenning 2024' van het RIVM. Kamerbrief over vooruitblik op Volksgezondheid Toekomstverkenning 2024 ‘Opgaven voor volksgezondheid en zorg op weg naar 2050’",2023-12-01 12:51:08,"c5cc1b83-6bed-40c1-a7ea-e343cda1f72f"
"Kamerbrief over resultaten Monitor mentale gezondheid en middelengebruik studenten hoger onderwijs 2023","https://www.rijksoverheid.nl/documenten/kamerstukken/2023/11/30/resultaten-monitor-mentale-gezondheid-en-middelengebruik-studenten-hoger-onderwijs-2023","Minister Dijkgraaf (OCW) en staatssecretaris Van Ooijen (VWS) informeren de Tweede Kamer over de resultaten van de 2e meting  van de Monitor mentale gezondheid en middelengebruik studenten hoger onderwijs. Zij sturen de Monitor mee met de Kamerbrief.Kamerbrief over resultaten Monitor mentale gezondheid en middelengebruik studenten hoger onderwijs 2023",2023-11-30 08:16:18,"4e946bf2-ca72-4b33-82ac-4f8da3484c35"
"Antwoorden op Kamervragen over handhaving online verkoopverbod vapes ","https://www.rijksoverheid.nl/documenten/kamerstukken/2023/11/29/antwoorden-op-kamervragen-over-de-handhaving-van-het-online-verkoopverbod-op-vapes","Staatssecretaris Van Ooijen (VWS) geeft antwoord op vragen over de handhaving van het online verkoopverbod op vapes. Het Tweede Kamerlid Mohandis (PvdA) heeft deze vragen gesteld.Antwoorden op Kamervragen over handhaving online verkoopverbod vapes",2023-11-29 17:35:47,"ec65065c-569a-4174-adec-e96aac79dead"
"Kamerbrief einde subsidie niet reanimeren-penning","https://www.rijksoverheid.nl/documenten/kamerstukken/2023/11/29/kamerbrief-over-niet-reanimeren-penning","Minister Kuipers (VWS) meldt de Tweede Kamer dat de subsidie aan Patiëntenfederatie Nederland voor het uitgeven van de niet reanimeren-penning eind 2024 stopt.Kamerbrief einde subsidie niet reanimeren-penning",2023-11-29 16:18:42,"89cf598f-2b2b-49e4-8b39-c0a17a638eaf"
"Kamerbrief voortgang Integraal Zorgakkoord: bekostiging domeinoverstijgende en sectoroverstijgende samenwerking","https://www.rijksoverheid.nl/documenten/kamerstukken/2023/11/29/kamerbrief-over-voortgang-integraal-zorgakkoord-bekostiging-domeinoverstijgende-en-sectoroverstijgende-samenwerking-patientengroepsgebonden-afstemming-van-zorg-voor-specifieke-categorieen-verzekerden","Minister Kuipers (VWS) informeert de Tweede Kamer over de toepassing en manier van implementatie van een nieuwe betaaltitel voor de bekostiging van domeinoverstijgende en sectoroverstijgende afstemming door aanbieders van zorg in de zin van de Zorgverzekeringswet. Deze betaaltitel stelt zorgverzekeraars in staat om samen met gemeenten patiëntengroepsgebonden activiteiten van samenwerkingsverbanden van zorg- en welzijnsaanbieders te bekostigen.Kamerbrief voortgang Integraal Zorgakkoord: bekostiging domeinoverstijgende en sectoroverstijgende samenwerking",2023-11-29 16:12:39,"88aca938-d172-4c1c-81eb-26865314e354"
"Antwoorden op Kamervragen over het uitnodigingsbeleid voor COVID-19-vaccinatie","https://www.rijksoverheid.nl/documenten/kamerstukken/2023/11/29/antwoorden-op-kamervragen-over-het-uitnodigingsbeleid-voor-covid-19-vaccinatie","Minister Kuipers (VWS) geeft antwoord op vragen over het uitnodigingsbeleid voor COVID-19-vaccinatie. De vragen zijn van het Kamerlid Van Haga (Groep Van Haga).Antwoorden op Kamervragen over het uitnodigingsbeleid voor COVID-19-vaccinatie",2023-11-29 16:11:39,"57a4aa98-7f2b-4c23-9e84-d426d2945785"
