"item_title","item_link","item_description","item_pub_date","item_guid"
"Beantwoording Kamervragen over Uitvoeringsregeling Waarschuwingsregister zorgfraude","https://www.rijksoverheid.nl/documenten/kamerstukken/2024/10/09/kamerbrief-inzake-voorhangbrief-uitvoeringsregeling-waarschuwingsregister-zorgfraude","Minister Agema (VWS) beantwoordt vragen over de Uitvoeringsregeling Waarschuwingsregister zorgfraude. De vragen zijn van de vaste commissie voor Volksgezondheid, Welzijn en Sport (VWS) van de Eerste Kamer.Beantwoording Kamervragen over Uitvoeringsregeling Waarschuwingsregister zorgfraude",2024-10-09 11:05:48,"3321efde-8181-4be9-af5d-047f5ea76d87"
"Antwoorden op Kamervragen over het bericht ‘Het OM kan criminaliteit in de zorg niet meer aan: ‘Er wordt jaarlijks voor 10 miljard gefraudeerd’ ","https://www.rijksoverheid.nl/documenten/kamerstukken/2024/10/09/antwoorden-op-kamervragen-over-het-bericht-het-om-kan-criminaliteit-in-de-zorg-niet-meer-aan-er-wordt-jaarlijks-voor-10-miljard-gefraudeerd","Minister Agema (VWS) beantwoordt vragen over het bericht dat het OM de criminaliteit in de zorg niet meer aan kan en er jaarlijks voor 10 miljard wordt gefraudeerd. De vragen zijn van de Kamerleden Dobbe en Van Nispen (beiden SP).Antwoorden op Kamervragen over het bericht ‘Het OM kan criminaliteit in de zorg niet meer aan: ‘Er wordt jaarlijks voor 10 miljard gefraudeerd’",2024-10-09 10:53:03,"d17b264f-a0c0-4ed0-bd34-7b5d797dd7de"
"Antwoorden op Kamervragen over ouderen zonder hulp in zomervakantie","https://www.rijksoverheid.nl/documenten/kamerstukken/2024/10/09/antwoorden-op-kamervragen-over-het-bericht-ouderen-komen-zonder-hulp-te-zitten-in-zomervakantie-zoveel-mogelijk-proberen-zelf-te-doen","Staatssecretaris Maeijer (Langdurige en Maatschappelijke Zorg) geeft antwoord op vragen over het bericht 'Ouderen komen zonder hulp te zitten in zomervakantie: ‘Zoveel mogelijk proberen zelf te doen’'. Het Tweede Kamerlid Dobbe (SP) heeft de vragen gesteld.Antwoorden op Kamervragen over ouderen zonder hulp in zomervakantie",2024-10-09 10:30:13,"785d2501-2d31-41e3-b070-d989fd0dc948"
"Kamerbrief over onderzoek naar collectiviteiten","https://www.rijksoverheid.nl/documenten/kamerstukken/2024/10/09/kamerbrief-over-onderzoek-naar-collectiviteiten","Kamerbrief over onderzoek naar collectiviteiten",2024-10-09 09:22:20,"51061c58-6fd8-42d9-8ee6-79614961df96"
"Antwoorden op Kamervragen over het bericht dat het OM de criminaliteit in de zorg niet meer aan kan en er jaarlijks voor 10 miljard wordt gefraudeerd ","https://www.rijksoverheid.nl/documenten/kamerstukken/2024/10/09/antwoorden-op-kamervragen-over-het-bericht-dat-het-om-de-criminaliteit-in-de-zorg-niet-meer-aan-kan-en-er-jaarlijks-voor-10-miljard-wordt-gefraudeerd","Antwoorden op Kamervragen over het bericht dat het OM de criminaliteit in de zorg niet meer aan kan en er jaarlijks voor 10 miljard wordt gefraudeerd",2024-10-09 08:58:51,"710d6247-af9c-4712-bf5a-d4f9327bb5ae"
"Aanbiedingsbrief bij onderzoeksrapport 'Internationale ontwikkelingen in cannabisbeleid voor recreatief gebruik'","https://www.rijksoverheid.nl/documenten/kamerstukken/2024/10/08/tk-aanbieding-onderzoeksrapport-internationale-ontwikkelingen-in-cannabisbeleid-voor-recreatief-gebruik","Minister Van Weel (JenV) en staatssecretaris Karremans (Jeugd, Preventie en Sport) bieden de Tweede Kamer het onderzoeksrapport 'Internationale ontwikkelingen in cannabisbeleid voor recreatief gebruik' aan.Aanbiedingsbrief bij onderzoeksrapport 'Internationale ontwikkelingen in cannabisbeleid voor recreatief gebruik'",2024-10-08 11:44:16,"5ec0bb3e-121c-4079-9f80-28a8c970eaff"
"Kamerbrief opname RSV in Rijksvaccinatieprogramma","https://www.rijksoverheid.nl/documenten/kamerstukken/2024/10/08/kamerbrief-inzake-immunisatie-tegen-het-respiratoir-syncytieel-virus-rsv","Staatssecretaris Karremans (Jeugd, Preventie en Sport) informeert de Tweede Kamer over het besluit om immunisatie tegen het respiratoir syncytieel virus (RSV) toe te voegen aan het Rijksvaccinatieprogramma.Kamerbrief opname RSV in Rijksvaccinatieprogramma",2024-10-08 09:38:26,"12481616-5fc6-4387-b315-a0b7fbb0716c"
"Antwoorden op Kamervragen over het bericht dat zorgzzp’ers de belastingdienst vrezen","https://www.rijksoverheid.nl/documenten/kamerstukken/2024/10/07/antwoorden-op-kamervragen-over-het-bericht-dat-zorgzzp-ers-de-belastingdienst-vrezen","Minister Agema (VWS) geeft antwoord op vragen over het bericht dat zorgzzp’ers de belastingdienst vrezen. Het Tweede Kamerlid Dijk (SP) heeft de vragen gesteld.Antwoorden op Kamervragen over het bericht dat zorgzzp’ers de belastingdienst vrezen",2024-10-07 14:26:29,"c566d847-4fcb-4b8f-b2bb-5c0ac9f990cf"
"Kamerbrief over houdbaarheidsonderzoek Wmo 2015: deelproduct A2","https://www.rijksoverheid.nl/documenten/kamerstukken/2024/10/07/kamerbrief-over-houdbaarheidsonderzoek-wmo-2015-deelproduct-a2","Staatssecretaris Maeijer (Langdurige en Maatschappelijke Zorg) informeert de Tweede Kamer over de ontwikkelingen van de Wmo in de toekomst.Kamerbrief over houdbaarheidsonderzoek Wmo 2015: deelproduct A2",2024-10-07 13:59:37,"7f8d4a0d-af19-4843-aa76-a080578b52d9"
"Aanbiedingsbrief bij tussentijdse- en eindevaluaties Erasmus+ (2014-2020/ 2021-2027) en het European Solidarity Corps (2018-2020/ 2021-2027)","https://www.rijksoverheid.nl/documenten/kamerstukken/2024/10/07/tussentijdse-evaluatie-erasmus-en-europees-solidariteitsfonds","Minister Bruins (OCW) en staatssecretaris Paul (Funderend Onderwijs en Emancipatie) bieden de Tweede Kamer de twee rapporten aan van de tussentijdse- en eindevaluaties van het Erasmus+ programma (2014-2020/2021-2027) en het European Solidarity Corps (2018-2020/2021-2027). Aanbiedingsbrief bij tussentijdse- en eindevaluaties Erasmus+ (2014-2020/ 2021-2027) en het European Solidarity Corps (2018-2020/ 2021-2027)",2024-10-07 13:43:21,"22cbac6c-2f0d-4957-9c73-b750551e2201"
"Beslisnota bij Aanbiedingsbrief tussentijdse- en eindevaluaties Erasmus+ (2014-2020/ 2021-2027) en het European Solidarity Corps (2018-2020/ 2021-2027)","https://www.rijksoverheid.nl/documenten/kamerstukken/2024/10/07/beslisnota-bij-tussentijdse-evaluatie-erasmus-en-europees-solidariteitsfonds","In een beslisnota staat achtergrondinformatie die bewindspersonen gebruiken bij de besluitvorming over een Kamerstuk.Beslisnota bij Aanbiedingsbrief tussentijdse- en eindevaluaties Erasmus+ (2014-2020/ 2021-2027) en het European Solidarity Corps (2018-2020/ 2021-2027)",2024-10-07 13:43:21,"4a468257-64bf-4f99-be8b-f6615e624123"
"National evaluation of  Erasmus+ in the Netherlands  (2014-2020/ 2021-2027)","https://www.rijksoverheid.nl/documenten/kamerstukken/2024/10/07/bijlage-1-national-evaluation-erasmus","Dit document is enkel in het Engels beschikbaar.National evaluation of  Erasmus+ in the Netherlands  (2014-2020/ 2021-2027)",2024-10-07 13:43:16,"f15d8619-206e-4e97-88fe-b72f5e1b4849"
"National evaluation of the  European Solidarity Corps in the  Netherlands","https://www.rijksoverheid.nl/documenten/kamerstukken/2024/10/07/bijlage-2-national-evaluation-esc","Dit document is enkel in het Engels beschikbaar.National evaluation of the  European Solidarity Corps in the  Netherlands",2024-10-07 13:43:15,"36146253-fa6e-45a3-b8b0-3ad05f02469f"
"Antwoorden op Kamervragen over het bericht dat de kwaliteit van de langdurige zorg voor ouderen thuis volgens de IGJ nog vaak onder de maat is ","https://www.rijksoverheid.nl/documenten/kamerstukken/2024/10/07/antwoorden-op-kamervragen-over-het-bericht-dat-de-kwaliteit-van-de-langdurige-zorg-voor-ouderen-thuis-volgens-de-igj-nog-vaak-onder-de-maat-is","Staatssecretaris Maeijer (Langdurige en Maatschappelijke Zorg) geeft antwoord op vragen over het bericht dat de kwaliteit van de langdurige zorg voor ouderen thuis volgens de IGJ nog vaak onder de maat is. Het Tweede Kamerlid Dobbe (SP) heeft de vragen gesteld.Antwoorden op Kamervragen over het bericht dat de kwaliteit van de langdurige zorg voor ouderen thuis volgens de IGJ nog vaak onder de maat is",2024-10-07 12:58:36,"0c6232e1-7ba6-4c20-bba6-8b96b7347370"
"Antwoorden op Kamervragen over terugkeer gesloten jeugdhulp in Fryslân","https://www.rijksoverheid.nl/documenten/kamerstukken/2024/10/07/antwoorden-op-kamervragen-over-het-bericht-gesloten-jeugdhulp-in-fryslan-komt-terug-vijf-opvangplekken-in-drachten","Staatssecretaris Karremans (Jeugd, Preventie en Sport) geeft antwoord op vragen over het bericht ‘Gesloten jeugdhulp in Fryslân komt terug: vijf opvangplekken in Drachten’. Het Tweede Kamerlid Crijns (PVV) heeft deze vragen gesteld.Antwoorden op Kamervragen over terugkeer gesloten jeugdhulp in Fryslân",2024-10-07 11:45:20,"9704f06b-8dde-4a00-a92f-32a32f1343a4"
"Kamerbrief over meerouderschap en gezag en meerpersoonsgezag","https://www.rijksoverheid.nl/documenten/kamerstukken/2024/10/04/tk-aanbieding-van-het-adviesrapport-van-de-raad-voor-strafrechttoepassing-en-jeugdbescherming-over-meerouderschap-en-gezag-en-meerpersoonsgezag","Staatssecretaris Struycken (Rechtsbescherming)  informeert de Tweede Kamer over rapporten ter voorbereiding van besluitvorming over een wettelijke regeling voor de invoering van meerouderschap en/of meerpersoonsgezag. Kamerbrief over meerouderschap en gezag en meerpersoonsgezag",2024-10-07 10:27:12,"74b790ad-88b2-4309-8a31-06784b8f4a4d"
"Kamerbrief met visie kabinet op dure geneesmiddelen en toelating tot basiszorgverzekering","https://www.rijksoverheid.nl/documenten/kamerstukken/2024/10/04/kamerbrief-inzake-kabinetsvisie-over-dure-geneesmiddelen","Minister Agema (VWS) stuurt de Tweede Kamer namens het kabinet de visie op dure geneesmiddelen. Zij gaat met name in op de zogenoemde 'sluiswerking' bij de toelating van dure medicijnen tot het basispakket van de zorgverzekering. Dit betekent dat de overheid beoordeelt of dure medicijnen hun prijs waard zijn en kunnen worden vergoed. Kamerbrief met visie kabinet op dure geneesmiddelen en toelating tot basiszorgverzekering",2024-10-04 15:04:25,"ee944f3e-6900-460d-a7fe-b882667a7930"
"Uitstelbrief antwoorden Kamervragen over genderzorg voor jeugd","https://www.rijksoverheid.nl/documenten/kamerstukken/2024/10/04/uitstelbrief-op-kamervragen-over-genderzorg-voor-jeugd","Staatssecretaris Karremans (Jeugd, Preventie en Sport) meldt de Tweede Kamer dat de antwoorden op vragen over genderzorg voor jeugd later komen dan gebruikelijk. De Tweede Kamerleden Westerveld en Slagt-Tichelman (beiden GroenLinks-PvdA) hebben de vragen gesteld.Uitstelbrief antwoorden Kamervragen over genderzorg voor jeugd",2024-10-04 12:32:15,"f867170d-5ebf-44dc-bb61-e0accf0e68f5"
"Antwoorden op Kamervragen over vergoeding voor spraakcomputers ","https://www.rijksoverheid.nl/documenten/kamerstukken/2024/10/03/antwoorden-op-kamervragen-over-de-vergoeding-van-spraakcomputers-voor-mensen-die-zonder-hulp-niet-of-moeilijk-kunnen-communiceren","Minister Agema (VWS) geeft antwoord op vragen over de vergoeding van spraakcomputers voor mensen die zonder hulp niet of moeilijk kunnen communiceren. Het Tweede Kamerlid Westerveld (GroenLinks-PvdA) heeft de vragen gesteld.Antwoorden op Kamervragen over vergoeding voor spraakcomputers",2024-10-04 09:22:22,"01687d20-7e02-46b0-94cf-9e0de699f55e"
"Kamerbrief over stand van zaken medische kindzorg","https://www.rijksoverheid.nl/documenten/kamerstukken/2024/10/03/kamerbrief-over-stand-van-zaken-medische-kindzorg","Staatssecretaris Maeijer (Langdurige en Maatschappelijke Zorg) informeert de Tweede Kamer over de stand van zaken op het gebied van de medische kindzorg. Zij gaat ook in op een aantal moties en toezeggingen. Kamerbrief over stand van zaken medische kindzorg",2024-10-04 08:16:53,"9bb5af01-e419-4652-8c9c-bbed6436a473"
