"item_title","item_link","item_description","item_pub_date","item_guid"
"Kamerbrief over Stand van zaken ontwikkeling werkagenda bij de nationale strategie VN-verdrag Handicap 2040","https://www.rijksoverheid.nl/documenten/kamerstukken/2024/12/09/kamerbrief-over-stand-van-zaken-ontwikkeling-werkagenda-bij-de-nationale-strategie-vn-verdrag-handicap-2040","Kamerbrief over Stand van zaken ontwikkeling werkagenda bij de nationale strategie VN-verdrag Handicap 2040",2024-12-09 16:09:56,"efdb90ba-f1b6-44cc-ad00-55ecba63b83c"
"Uitstelbrief op Kamervragen over uitspraak rechtbank Noord-Holland: Pleegzorgorganisatie moet kosten kinderopvang vergoeden aan pleegzorgouders","https://www.rijksoverheid.nl/documenten/kamerstukken/2024/12/09/uitstelbrief-antwoorden-kamervragen-over-uitspraak-rechtbank-noord-holland-pleegzorgorganisatie-moet-kosten-kinderopvang-vergoeden-aan-pleegzorgouders","Staatssecretaris Karremans (Jeugd, Preventie en Sport) meldt dat de antwoorden op vragen over de uitspraak rechtbank Noord-Holland: Pleegzorgorganisatie moet kosten kinderopvang vergoeden aan pleegzorgouders later komen dan gebruikelijk. Het Tweede Kamerlid Rikkers-Oosterkamp (BBB) heeft de vragen gesteld.Uitstelbrief op Kamervragen over uitspraak rechtbank Noord-Holland: Pleegzorgorganisatie moet kosten kinderopvang vergoeden aan pleegzorgouders",2024-12-09 15:58:05,"bb6373d4-a685-4a68-b980-05e90c203ee9"
"Kamerbrief behandeling wetsvoorstel 2e tranche wijziging Wet publieke gezondheid","https://www.rijksoverheid.nl/documenten/kamerstukken/2024/12/09/kamerbrief-over-behandeling-wetsvoorstel-tweede-tranche-wijziging-wet-publieke-gezondheid-kamerstuknr-36483","Minister Agema (VWS) vraagt de Tweede Kamer te wachten met de behandeling van het wetsvoorstel 2e tranche wijziging Wet publieke gezondheid.Kamerbrief behandeling wetsvoorstel 2e tranche wijziging Wet publieke gezondheid",2024-12-09 15:56:35,"90f12e77-52dd-4ef6-9a58-21cd10c1d963"
"Antwoorden op Kamervragen over het bericht 'VN tikt Nederland op de vingers: de postcode van je woonplaats bepaalt hoe goed de zorg is'","https://www.rijksoverheid.nl/documenten/kamerstukken/2024/12/09/antwoorden-op-kamervragen-over-het-bericht-vn-tikt-nederland-op-de-vingers-de-postcode-van-je-woonplaats-bepaalt-hoe-goed-de-zorg-is","Staatssecretaris Maeijer (Langdurige en Maatschappelijke Zorg) geeft antwoord op vragen over het bericht 'VN tikt Nederland op de vingers: de postcode van je woonplaats bepaalt hoe goed de zorg is'. Het Tweede Kamerlid Dobbe (SP) heeft de vragen gesteld.Antwoorden op Kamervragen over het bericht 'VN tikt Nederland op de vingers: de postcode van je woonplaats bepaalt hoe goed de zorg is'",2024-12-09 15:48:05,"d42b6579-f0c4-443b-bcd2-0a9959318a88"
"Kamerbrief met reactie op het rapport van Panteia over het beleid van de collectieve erkenning van de Indische, Molukse, Papoea en Chinees-Indonesische gemeenschappen in Nederland","https://www.rijksoverheid.nl/documenten/kamerstukken/2024/12/09/kamerbrief-over-reactie-op-het-rapport-van-panteia-over-het-beleid-van-de-collectieve-erkenning-van-de-indische-molukse-papoea-en-chinees-indonesische-gemeenschappen-in-nederland","Staatssecretaris Karremans (Jeugd, Preventie en Sport) stuurt de Tweede Kamer zijn reactie op het onderzoeksrapport dat Panteia heeft opgesteld naar aanleiding van de reflectie die zij hebben uitgevoerd naar het beleid van de collectieve erkenning van de Indische, Molukse, Papoea en Chinees-Indonesische gemeenschappen in Nederland.Kamerbrief met reactie op het rapport van Panteia over het beleid van de collectieve erkenning van de Indische, Molukse, Papoea en Chinees-Indonesische gemeenschappen in Nederland",2024-12-09 15:17:18,"73686920-ed01-4217-b0cc-1a359e46236a"
"Kamerbrief over verzoek om een reactie op brief NVM-mondhygiënisten over mondzorg","https://www.rijksoverheid.nl/documenten/kamerstukken/2024/12/09/kamerbrief-over-verzoek-om-een-reactie-op-brief-nvm-mondhygienisten-over-mondzorg","Minister Agema (VWS) stuurt de Tweede Kamer een reactie op een  brief van NVM-mondhygiënisten over mondzorg. De vaste commissie voor Volksgezondheid, Welzijn en Sport had de minister gevraagd om op die brief te reageren.Kamerbrief over verzoek om een reactie op brief NVM-mondhygiënisten over mondzorg",2024-12-09 14:48:33,"c5515470-d4c9-45a9-8675-26debc4ecb5e"
"Antwoorden feitelijke vragen over de onthouding over het WHO-pandemieverdrag en de International Health Regulations ","https://www.rijksoverheid.nl/documenten/kamerstukken/2024/12/09/antwoorden-op-kamervragen-over-de-beantwoording-van-feitelijke-vragen-over-de-onthouding-over-het-who-pandemieverdrag-en-de-international-health-regulations","Minister Agema (VWS) geeft antwoord op feitelijke vragen over de onthouding over het WHO-pandemieverdrag en de International Health Regulations. Het Tweede Kamerlid Rikkers-Oosterkamp (BBB) heeft de vragen gesteld.Antwoorden feitelijke vragen over de onthouding over het WHO-pandemieverdrag en de International Health Regulations",2024-12-09 14:45:31,"badb2c0e-861c-4951-acb5-c04b6c322c84"
"Aanbiedingsbrief bij Zicht op gehoorverlies bij kinderen en jongeren","https://www.rijksoverheid.nl/documenten/kamerstukken/2024/12/09/aanbiedingsbrief-gezondheidsraadadvies-zicht-op-gehoorverlies-bij-kinderen-en-jongeren","Staatssecretaris Karremans (Jeugd, Preventie en Sport) biedt de Tweede Kamer het advies 'Zicht op gehoorverlies bij kinderen en jongeren' van de Gezondheidsraadadvies aan. Dit advies is aangevraagd naar aanleiding van een haalbaarheidsonderzoek van VeiligheidNL over een of meer extra contactmomenten van de Jeugdgezondheidszorg (JGZ) voor screening van het gehoor van kinderen.Aanbiedingsbrief bij Zicht op gehoorverlies bij kinderen en jongeren",2024-12-09 14:20:54,"0060335e-bd9c-4a4c-886c-5dbdd0b90303"
"Aanbiedingsbrief afschrift reactie op brief over inclusie en naleving VN-verdrag Handicap","https://www.rijksoverheid.nl/documenten/kamerstukken/2024/12/06/kamerbrief-over-verzoek-om-reactie-op-kopiebrief-coalitie-voor-inclusie-namens-vn-ambassadeurs-en-meerdere-organisaties-aan-het-ministerie-van-vws-m-b-t-belangen-van-inclusie-en-het-vn-verdrag","Staatssecretaris Maeijer (Langdurige en Maatschappelijke Zorg) stuurt de Tweede Kamer een afschrift van de reactie op een brief namens VN-ambassadeurs van de Coalitie voor Inclusie en andere vertegenwoordigende organisaties voor mensen met een beperking over het belang van inclusie en de naleving van het VN-verdrag Handicap.Aanbiedingsbrief afschrift reactie op brief over inclusie en naleving VN-verdrag Handicap",2024-12-09 11:32:16,"46f146fb-55d4-4cfd-88f4-10ddbe1671ed"
"Antwoorden op Kamervragen over het bericht 'Wachttijden ggz niet goed vastgelegd, zeggen onderzoekers'","https://www.rijksoverheid.nl/documenten/kamerstukken/2024/12/06/antwoorden-op-kamervragen-over-het-bericht-wachttijden-ggz-niet-goed-vastgelegd-zeggen-onderzoekers","Staatssecretaris Karremans (Jeugd, Preventie en Sport) geeft antwoord op vragen over het bericht 'Wachttijden ggz niet goed vastgelegd, zeggen onderzoekers'. De Tweede Kamerleden Van den Hil (VVD) en Bikker (ChristenUnie) hebben de vragen gesteld.Antwoorden op Kamervragen over het bericht 'Wachttijden ggz niet goed vastgelegd, zeggen onderzoekers'",2024-12-09 10:49:11,"95b8cd12-50aa-4de4-ac25-1039c4535bf2"
"Kamerbrief met kabinetsreactie op de vierde evaluatie van de Wet medisch-wetenschappelijk onderzoek met mensen en de evaluatie van de Centrale Commissie Mensgebonden Onderzoek","https://www.rijksoverheid.nl/documenten/kamerstukken/2024/12/06/kamerbrief-over-kabinetsreactie-op-de-vierde-evaluatie-van-de-wet-medisch-wetenschappelijk-onderzoek-met-mensen-en-de-evaluatie-van-de-centrale-commissie-mensgebonden-onderzoek","Minister Agema (VWS) en staatssecretaris Karremans (Jeugd, Preventie en Sport) sturen de Tweede Kamer de kabinetsreactie op de vierde evaluatie van de Wet medisch-wetenschappelijk onderzoek met mensen en de evaluatie van de Centrale Commissie Mensgebonden Onderzoek.Kamerbrief met kabinetsreactie op de vierde evaluatie van de Wet medisch-wetenschappelijk onderzoek met mensen en de evaluatie van de Centrale Commissie Mensgebonden Onderzoek",2024-12-09 10:43:34,"65ee9f31-4620-4913-b18f-60d4b96729eb"
"Kamerbrief over rappel moties en toezeggingen VWS Eerste Kamer","https://www.rijksoverheid.nl/documenten/kamerstukken/2024/12/06/kamerbrief-over-beantwoording-halfjaarlijkse-rappelbrief-najaar-2024","Minister Agema (VWS), staatssecretaris Maeijer (Langdurige en Maatschappelijke Zorg) en staatssecretaris Karremans (Jeugd, Preventie en Sport) sturen de Eerste Kamer de actuele stand van zaken rond moties en toezeggingen.Kamerbrief over rappel moties en toezeggingen VWS Eerste Kamer",2024-12-09 10:24:05,"7c0c0d0a-2e17-4fcd-bd7f-44b80645963a"
"Antwoorden Kamervragen over het bericht over falend lachgasbeleid","https://www.rijksoverheid.nl/documenten/kamerstukken/2024/12/09/beantwoording-kamervragen-lid-kostic-over-het-bericht-steden-klaar-met-falend-lachgasbeleid","Staatssecretaris Jansen (Openbaar Vervoer en Milieu) en staatssecretaris Karremans (Jeugd, Preventie en Sport) geven antwoorden op Kamervragen naar aanleiding van het bericht 'Steden klaar met falend lachgasbeleid: binnen 2 weken actie, anders rechtszaak'. Het Tweede Kamerlid Kostić (PvdD) had de vragen gesteld.Antwoorden Kamervragen over het bericht over falend lachgasbeleid",2024-12-09 09:39:45,"598fe93c-f238-4ca0-b356-d8a614ffd1f8"
"Kamerbrief over moties en beantwoording vragen over afschaffen kilometerregistratie voor Valysvervoer","https://www.rijksoverheid.nl/documenten/kamerstukken/2024/12/06/kamerbrief-naar-aanleiding-van-moties-en-beantwoording-inbreng-so-inzake-het-afschaffen-van-de-kilometerregistratie-voor-het-valysvervoer","Staatssecretaris Maeijer (Langdurige en Maatschappelijke Zorg) reageert op de motie-Agema om de kilometerregistratie en het persoonlijk kilometerbudget van Valys (interregionaal doelgroepenvervoer) af te schaffen en de eis van indicatiestelling af te schaffen. Ook geeft zij antwoord op  vragen uit het schriftelijk overleg (SO) over de reactie op de motie-Agema/Van Dijk over het afschaffen van de kilometerregistratie voor het Valysvervoer.Kamerbrief over moties en beantwoording vragen over afschaffen kilometerregistratie voor Valysvervoer",2024-12-06 17:44:07,"8bf68185-673b-4958-b14b-2d6fd6050f5c"
"Kamerbrief over afschaffing pgb door gemeente Hengelo","https://www.rijksoverheid.nl/documenten/kamerstukken/2024/12/06/kamerbrief-over-verzoek-reactie-op-verzoek-kamercommissie-vws-inzake-brief-afschaffing-van-pgb-door-gemeente-hengelo","Staatssecretaris Maeijer (Langdurige en Maatschappelijke Zorg) informeert de Tweede Kamer over het verzoek om een reactie over de afschaffing van het pgb door de gemeente Hengelo.Kamerbrief over afschaffing pgb door gemeente Hengelo",2024-12-06 16:28:42,"f0e6e0d8-d0e4-41ea-9ffc-a6dc4275e516"
"Antwoorden Kamervragen over bewoners zorginstellingen als slachtoffer van mensenhandel","https://www.rijksoverheid.nl/documenten/kamerstukken/2024/12/05/antwoorden-kamervragen-over-het-bericht-vooral-bewoners-zorginstellingen-slachtoffer-van-mensenhandel-hulpverleners-moeten-makkelijker-kunnen-melden","Minister Van Weel (JenV) en staatssecretaris Maeijer (Langdurige en Maatschappelijke Zorg) geven antwoorden op Kamervragen naar aanleiding van het bericht 'Vooral bewoners zorginstellingen slachtoffer van mensenhandel, hulpverleners moeten makkelijker kunnen melden'. Het Tweede Kamerlid Bikker (ChristenUnie) had de vragen gesteld.Antwoorden Kamervragen over bewoners zorginstellingen als slachtoffer van mensenhandel",2024-12-06 10:07:22,"ad303946-a106-4c5c-bd6b-88a37a1eba40"
"Antwoorden op Kamervragen over het bericht 'Opleiding die huisartsentekort had kunnen oplossen alweer weg uit Zeeland' ","https://www.rijksoverheid.nl/documenten/kamerstukken/2024/12/05/antwoorden-op-kamervragen-over-het-bericht-opleiding-die-huisartsentekort-had-kunnen-oplossen-alweer-weg-uit-zeeland","Minister Agema (VWS) meldt dat de antwoorden op vragen over het bericht 'Opleiding die huisartsentekort had kunnen oplossen alweer weg uit Zeeland'  later komen dan gebruikelijk. De Tweede Kamerleden n Tielen en Van den Hil (beiden VVD) hebben de vragen gesteld. Antwoorden op Kamervragen over het bericht 'Opleiding die huisartsentekort had kunnen oplossen alweer weg uit Zeeland'",2024-12-05 16:56:11,"addee941-2c62-4edc-89c4-d60bc2462133"
" Kamerbrief over verlenging Subsidieregeling Wonen en Zorg","https://www.rijksoverheid.nl/documenten/kamerstukken/2024/12/05/kamerbrief-inzake-verlenging-van-de-subsidieregeling-wonen-en-zorg","Minister Agema (VWS) stuurt de Tweede Kamer een reactie op de evaluatie van de subsidieregeling Wonen en Zorg.   Kamerbrief over verlenging Subsidieregeling Wonen en Zorg",2024-12-05 16:11:27,"7ae7e5aa-cfd3-40e6-b1bd-951be30ecc43"
"Antwoorden op Kamervragen over smartvapes","https://www.rijksoverheid.nl/documenten/kamerstukken/2024/12/05/antwoorden-op-kamervragen-over-smartvapes","Staatssecretaris Karremans (Jeugd, Preventie en Sport) geeft antwoord op vragen over smartvapes. Het Tweede Kamerlid Slagt-Tichelman (GroenLinks-PvdA) heeft de vragen gesteld.Antwoorden op Kamervragen over smartvapes",2024-12-05 15:43:53,"81d5a18e-eec3-4e15-899c-0aa0bd9aebc6"
"Antwoorden op Kamervragen over het artikel 'Aidsfonds maakt zich zorgen over stijging hiv-infecties bij jonge mannen' ","https://www.rijksoverheid.nl/documenten/kamerstukken/2024/12/05/antwoorden-op-kamervragen-over-het-artikel-aidsfonds-maakt-zich-zorgen-over-stijging-hiv-infecties-bij-jonge-mannen","Staatssecretaris Karremans (Jeugd, Preventie en Sport) geeft antwoord op vragen over het artikel 'Aidsfonds maakt zich zorgen over stijging hiv-infecties bij jonge mannen'.  De Tweede Kamerleden Rooderkerk en Paulusma (beiden D66) hebben de vragen gesteld.  Antwoorden op Kamervragen over het artikel 'Aidsfonds maakt zich zorgen over stijging hiv-infecties bij jonge mannen'",2024-12-05 15:38:22,"93817536-aa49-4652-9756-97ddede5987a"
