"item_title","item_link","item_description","item_pub_date","item_guid"
"Antwoorden vragen so over vvoortgangsrapportage Toekomstagenda voor zorg en ondersteuning voor mensen met een beperking","https://www.rijksoverheid.nl/documenten/kamerstukken/2025/07/03/schriftelijk-overleg-so-inzake-so-inbreng-voortgangsrapportage-toekomstagenda-zorg-en-ondersteuning-voor-mensen-met-een-beperking","Staatssecretaris Pouw-Verweij (Langdurige en Maatschappelijke Zorg) geeft antwoord op vragen uit het schriftelijk overleg (so) over de Voortgangsrapportage Toekomstagenda 'Zorg en ondersteuning voor mensen met een beperking'. De vaste Tweede Kamercommissie voor Volksgezondheid, Welzijn en Sport (VWS) had de vragen gesteld.Antwoorden vragen so over vvoortgangsrapportage Toekomstagenda voor zorg en ondersteuning voor mensen met een beperking",2025-08-12 10:51:08,"8922ac1a-7dab-44df-b546-5d357d4b7f92"
"Kamerbrief over resultaten programma WOZO","https://www.rijksoverheid.nl/documenten/kamerstukken/2025/07/02/kamerbrief-over-programma-wonen-ondersteuning-en-zorg-voor-ouderen","Staatssecretaris Pouw-Verweij (Langdurige en Maatschappelijke Zorg) informeert de Tweede Kamer over de bereikte resultaten van het programma Wonen, Ondersteuning en Zorg voor Ouderen (WOZO) sinds 2022 en het vervolg. Vervolgens bespreekt zij de stand van zaken van de Medisch generalistische zorg (MGZ). Tot slot gaat zij in op de domeinoverstijgende activiteiten van de langdurige zorg en de gesprekken met Zorgbuurthuis ’t Hageltje.Kamerbrief over resultaten programma WOZO",2025-08-12 10:36:11,"0ce86af8-4f79-4f39-9276-e2a91e41e753"
"Aanbiedingsbrief bij antwoorden vragen over de ontwerpregeling maximumprijzen geneesmiddelen per 1 oktober 2025","https://www.rijksoverheid.nl/documenten/kamerstukken/2025/07/03/kamerbrief-over-de-ontwerpregeling-maximumprijzen-geneesmiddelen-per-1-oktober-2025","Minister Jansen (VWS) stuurt de Eerste Kamer de antwoorden op vragen over de ontwerpregeling maximumprijzen geneesmiddelen per 1 oktober 2025. De Eerste Kamerfracties van de SP en de BBB hadden de vragen gesteld. Ook stuurt zij het 'Overzicht toegekende artikel 3 lid 2 verzoeken'.Aanbiedingsbrief bij antwoorden vragen over de ontwerpregeling maximumprijzen geneesmiddelen per 1 oktober 2025",2025-08-12 09:55:08,"7123e49c-e584-4ab8-8224-ca567cdffe28"
"Overzicht toegekende artikel 3 lid 2 verzoeken","https://www.rijksoverheid.nl/documenten/kamerstukken/2025/07/03/overzicht-toegekende-artikel-3-lid-2-verzoeken","De lijst bevat een overzicht van toegekende verzoeken over geneesmiddelen.Overzicht toegekende artikel 3 lid 2 verzoeken",2025-08-12 09:55:08,"0da3090b-0b38-427e-978a-24cc94855910"
"Antwoorden vragen over de ontwerpregeling maximumprijzen geneesmiddelen per 1 oktober 2025","https://www.rijksoverheid.nl/documenten/kamerstukken/2025/07/03/beantwoording-vragen-ek-nav-ontwerpregeling-h57-wgp","Minister Jansen (VWS) geeft antwoorden op vragen over de ontwerpregeling maximumprijzen geneesmiddelen per 1 oktober 2025. De Eerste Kamerfracties van de SP en de BBB hadden de vragen gesteld.Antwoorden vragen over de ontwerpregeling maximumprijzen geneesmiddelen per 1 oktober 2025",2025-08-12 09:50:34,"bd43d38d-11e1-4c77-a1c0-85161c5ce1a8"
"Kamerbrief over voortgang Actieplan passende langdurige zorg voor dakloze mensen","https://www.rijksoverheid.nl/documenten/kamerstukken/2025/07/03/voortgang-actieplan-passende-langdurige-zorg-voor-dakloze-mensen","Staatssecretaris Pouw-Verweij (Langdurige en Maatschappelijke Zorg) informeert de Tweede Kamer over de voortgang van het actieplan 'Passende zorg voor dakloze mensen met een Wlz-indicatie'. Wlz staat voor Wet langdurige zorg. Het actieplan is onderdeel van  de werkagenda 'Een betekenisvol leven met een langdurige psychische aandoening'.Kamerbrief over voortgang Actieplan passende langdurige zorg voor dakloze mensen",2025-08-12 09:28:16,"1cde5d11-f50e-4ee5-8a14-78a90abdb90b"
"Kamerbrief met beleidsreactie op advies Gezondheidsraad screening op longkanker","https://www.rijksoverheid.nl/documenten/kamerstukken/2025/07/03/kamerbrief-over-beleidsreactie-op-advies-gezondheidsraad-screening-op-longkanker","Staatssecretaris Tielen (Jeugd, Preventie en Sport) reageert op het advies 'Screening op longkanker' van de Gezondheidsraad over bevolkingsonderzoek van overheidswege naar longkanker. De Tweede Kamer had het advies op 31 maart 2025 ontvangen. Kamerbrief met beleidsreactie op advies Gezondheidsraad screening op longkanker",2025-08-12 09:21:46,"19b88f83-5f88-43a0-9203-df950c83c5eb"
"Antwoorden Kamervragen over de verwachte toename van geslachtsziekten en ongewenste zwangerschappen door bezuinigingen","https://www.rijksoverheid.nl/documenten/kamerstukken/2025/07/03/kamervragen-over-de-verwachte-toename-van-geslachtsziekten-en-ongewenste-zwangerschappen-door-bezuinigingen","Staatssecretaris Karremans (Jeugd, Preventie en Sport) geeft antwoord op Kamervragen naar aanleiding van het artikel 'Straks meer geslachtsziekten en ongewenste zwangerschappen door bezuinigingen'. Het Tweede Kamerlid Paulusma (D66) heeft de vragen gesteld.Antwoorden Kamervragen over de verwachte toename van geslachtsziekten en ongewenste zwangerschappen door bezuinigingen",2025-08-12 07:28:39,"85acc8d0-9f98-4ad5-9f34-7f7de8f70891"
"Antwoord op Kamervragen over bericht ‘Nieuwe behandeling? Alleen nog vergoeden als die klimaat en zorgpersoneel spaart’","https://www.rijksoverheid.nl/documenten/kamerstukken/2025/06/17/antwoorden-op-kamervragen-over-het-bericht-nieuwe-behandeling-alleen-nog-vergoeden-als-die-klimaat-en-zorgpersoneel-spaart","Minister Van Hijum (VWS) beantwoordt vragen over het bericht ‘Nieuwe behandeling? Alleen nog vergoeden als die klimaat en zorgpersoneel spaart’. Het Tweede Kamerlid Claassen (PVV) heeft de vragen gesteld.Antwoord op Kamervragen over bericht ‘Nieuwe behandeling? Alleen nog vergoeden als die klimaat en zorgpersoneel spaart’",2025-08-12 07:10:57,"1ac9be2f-d92a-4217-964e-26c8d1ddd11e"
"Antwoord op Kamervragen over bericht dat ongediplomeerd personeel in dienst is bij zorgverleners","https://www.rijksoverheid.nl/documenten/kamerstukken/2025/06/19/antwoorden-op-de-vragen-van-de-leden-dijk-en-dobbe-beiden-sp-over-het-bericht-dat-ongediplomeerd-personeel-in-dienst-is-bij-zorgverleners","Minister van Hijum (VWS) beantwoordt vragen over het bericht dat ongediplomeerd personeel in dienst is bij zorgverleners. De vragen zijn gesteld door Tweede Kamerleden Jimmy Dijk en Dobbe (beiden SP).Antwoord op Kamervragen over bericht dat ongediplomeerd personeel in dienst is bij zorgverleners",2025-08-12 07:02:30,"20066cb4-8d14-4386-9b57-7c7891df2e48"
"Antwoord op Kamervragen over bericht 'Noodkreet GGZ-instelling de Waag: wachtlijsten plotseling nog langer door aanpassing van beleid'","https://www.rijksoverheid.nl/documenten/kamerstukken/2025/06/18/antwoorden-op-kamervragen-over-het-bericht-noodkreet-ggz-instelling-de-waag-wachtlijsten-plotseling-nog-langer-door-aanpassing-van-beleid","Minister Van Hijum (VWS) geeft antwoord op vragen over het bericht 'Noodkreet GGZ-instelling de Waag: wachtlijsten plotseling nog langer door aanpassing van beleid'. Tweede Kamerlid Westerveld (GroenLinks-PvdA) heeft de vragen gesteld.Antwoord op Kamervragen over bericht 'Noodkreet GGZ-instelling de Waag: wachtlijsten plotseling nog langer door aanpassing van beleid'",2025-08-12 06:34:52,"4e6bc153-4119-4b01-8b6a-14a44cb99ffd"
"Kamerbrief met reactie op aangehouden motie Van Dijck over etikettering levensmiddelen","https://www.rijksoverheid.nl/documenten/kamerstukken/2025/07/03/kamerbrief-over-reactie-op-aangehouden-motie-van-het-lid-van-dijck-36-725-nr-8","Staatssecretaris Tielen (Jeugd, Preventie en Sport) reageert op de aangehouden motie van het Tweede Kamerlid Van Dijck (PVV). De motie verzoekt om de verplichting om de informatie op etiketten voor levensmiddelen in het Nederlands te vermelden, te schrappen.Kamerbrief met reactie op aangehouden motie Van Dijck over etikettering levensmiddelen",2025-08-12 06:15:12,"6f89f9a1-7dc4-4cb1-901d-a49bfb8249cc"
"Kamerbrief over Bereikbaarheidsanalyse SEH en acute verloskunde 2025","https://www.rijksoverheid.nl/documenten/kamerstukken/2025/07/03/bereikbaarheidsanalyse-seh-s-en-acute-verloskunde-2025","Minister Jansen (VWS) stuurt de Tweede Kamer de 'Kennisnotitie Bereikbaarheidsanalyse SEH’s en acute verloskunde 2025'. De notitie bevat het jaarlijkse rapport van het Rijksinstituut voor Volksgezondheid en Milieu (RIVM) over de 'gevoelige ziekenhuizen analyse' van de bereikbaarheid van de spoedeisende hulpafdelingen (SEH's) en locaties met acute verloskunde (AV). De minister gaat in op de bevindingen uit de analyse. Kamerbrief over Bereikbaarheidsanalyse SEH en acute verloskunde 2025",2025-08-12 05:41:48,"4469c15b-9234-4465-81d2-3d6d76891f2e"
"Antwoorden op Kamervragen over schijnveiligheid jongeren op sociale media","https://www.rijksoverheid.nl/documenten/kamerstukken/2025/08/11/antwoorden-op-kamervragen-over-de-schijnveiligheid-van-jongeren-op-sociale-media","Staatssecretaris Van Marum (BZK) geeft antwoord op vragen over de schijnveiligheid van jongeren op sociale media. Het Tweede Kamerlid Kathmann (GroenLinks-PvdA) heeft de vragen gesteld.Antwoorden op Kamervragen over schijnveiligheid jongeren op sociale media",2025-08-11 14:21:59,"200f3851-0999-4a91-9701-2df6eefb164c"
"Kamerbrief over datalek bij laboratorium bevolkingsonderzoek baarmoederhalskanker","https://www.rijksoverheid.nl/documenten/kamerstukken/2025/08/11/kamerbrief-over-datalek-bij-laboratorium-bvo-baarmoederhalskanker","Minister Jansen (VWS) informeert de Tweede Kamer over een hack (computerinbraak) bij een laboratorium dat is betrokken bij het bevolkingsonderzoek naar baarmoederhalskanker.  Kamerbrief over datalek bij laboratorium bevolkingsonderzoek baarmoederhalskanker",2025-08-11 12:08:00,"c5196f31-42a2-49b6-82c2-cb123858767f"
"Kamerbrief Beleidsreactie Nibud onderzoek Meerkosten van het leven met een beperking  ","https://www.rijksoverheid.nl/documenten/kamerstukken/2025/07/11/kamerbrief-over-beleidsreactie-nibud-onderzoek-meerkosten-van-het-leven-met-een-beperking","Staatssecretaris Pouw-Verweij (Langdurige en Maatschappelijke Zorg) stuurt de Tweede Kamer de beleidsreactie op het onderzoek naar meerkosten waar mensen met een beperking mee te maken hebben. Dit rapport van het Nationaal Instituut voor Budgetvoorlichting (Nibud) is in juni 2024 aan de Tweede Kamer aangeboden.Kamerbrief Beleidsreactie Nibud onderzoek Meerkosten van het leven met een beperking",2025-08-11 09:10:20,"608393bb-a9d4-44c7-bc5f-c5c030e909b2"
"Aanbiedingsbrief bij wijziging Besluit afbreking zwangerschap","https://www.rijksoverheid.nl/documenten/kamerstukken/2025/06/03/kamerbrief-inzake-nahangprocedure-inzake-wijziging-van-het-besluit-afbreking-zwangerschap","Minister Agema (VWS) biedt de Tweede Kamer een wijziging aan van het Besluit afbreking zwangerschap. De wijziging betreft de invoering van een vergunningplicht en een meldplicht voor het verrichten van handelingen met het poliovirus. Eenzelfde brief is naar de Eerste Kamer verstuurd.Aanbiedingsbrief bij wijziging Besluit afbreking zwangerschap",2025-08-11 08:43:47,"f44aa0b2-b1f1-4fe8-acae-13c3384590de"
"Kamerbrief over stand van zaken complexe zorg gehandicaptenzorg - juni 2025","https://www.rijksoverheid.nl/documenten/kamerstukken/2025/06/03/kamerbrief-over-vervolg-complexe-zorg-gehandicaptenzorg-juni-2025","Staatssecretaris Maeijer (Langdurige en Maatschappelijke Zorg) informeert de Tweede Kamer over de stand van zaken rondom de complexe zorg voor mensen met een beperking. Ook informeert de staatssecretaris de Kamer over de stappen die zij daarin zet. Ze bouwt hierbij voort op onder meer de voortgangsrapportage van de ‘Toekomstagenda zorg en ondersteuning voor mensen met een beperking’.Kamerbrief over stand van zaken complexe zorg gehandicaptenzorg - juni 2025",2025-08-11 07:57:13,"0489f8ea-723f-4ab1-a778-c23fe1f125f8"
"Antwoorden op Kamervragen over het bericht  over toename huidkanker ","https://www.rijksoverheid.nl/documenten/kamerstukken/2025/07/02/antwoorden-op-kamervragen-over-het-bericht-huidkanker-is-snelst-toenemende-vorm-van-kanker-in-nederland","Staatssecretaris Tielen (Jeugd, Preventie en Sport) geeft antwoorden op Kamervragen naar aanleiding van het bericht 'Huidkanker is snelst toenemende vorm van kanker in Nederland'. Het voormalig Tweede Kamerlid Danielle Jansen (Nieuw Sociaal Contract) had de vragen gesteld.Antwoorden op Kamervragen over het bericht  over toename huidkanker",2025-08-11 07:43:06,"a4650b1f-d1b8-4499-95f6-ad488eb850e9"
"Kamerbrief met reactie op petitie over eenzame opsluiting in de ggz","https://www.rijksoverheid.nl/documenten/kamerstukken/2025/07/02/kamerbrief-over-verzoek-om-reactie-op-petitie-stop-eenzame-opsluiting-in-de-ggz","Staatssecretaris Tielen (Jeugd, Preventie en Sport) reageert op de petitie 'Stop eenzame opsluiting in de ggz' van MIND. De vaste Tweede Kamercommissie voor Volksgezondheid, Welzijn en Sport (VWS) had om een reactie verzocht.Kamerbrief met reactie op petitie over eenzame opsluiting in de ggz",2025-08-11 06:11:35,"d9602403-b0cd-4bc0-a1a4-5ed3a5a4a556"
