"item_title","item_link","item_description","item_pub_date","item_guid"
"Beantwoording vragen over het Advies Deskundigencommissie Jeugd","https://www.rijksoverheid.nl/documenten/kamerstukken/2025/04/11/beantwoording-vragen-schriftelijk-overleg-inzake-het-advies-deskundigencommissie-jeugd","Staatssecretaris Karremans (Jeugd, Preventie en Sport) stuurt de Tweede Kamer zijn reactie op de vragen die gesteld zijn in het Verslag van het schriftelijk overleg over het Advies Deskundigencommissie Jeugd. Beantwoording vragen over het Advies Deskundigencommissie Jeugd",2025-04-15 16:06:02,"7cbd31ed-d2ba-4a28-abac-0ca54023c211"
"Antwoorden op Kamervragen over afhaken vrijwilligers voor carnavalsoptochten door overbodige regels","https://www.rijksoverheid.nl/documenten/kamerstukken/2025/04/11/antwoorden-op-kamervragen-over-overbodige-regels-waardoor-vrijwilligers-voor-carnavalsoptochten-dreigen-af-te-haken","Staatssecretaris Maeijer (Langdurige en Maatschappelijke Zorg) geeft antwoord op vragen over overbodige regels waardoor vrijwilligers voor carnavalsoptochten dreigen af te haken. Het Tweede Kamerlid Van Dijk (CDA) heeft de vragen gesteld.Antwoorden op Kamervragen over afhaken vrijwilligers voor carnavalsoptochten door overbodige regels",2025-04-15 16:02:01,"d8484f20-8ae5-4489-85ce-8a3086e61cc7"
"Antwoorden op Kamervragen over het bericht 'Ruim 100 vrouwen met spiraaltje van Ballerine tóch zwanger, gros klachten niet gemeld bij inspectie'","https://www.rijksoverheid.nl/documenten/kamerstukken/2025/04/11/antwoorden-op-kamervragen-over-het-bericht-ruim-honderd-vrouwen-met-spiraaltje-van-ballerine-toch-zwanger-gros-klachten-niet-gemeld-bij-inspectie","Minister Agema (VWS) beantwoordt vragen over het bericht 'Ruim 100 vrouwen met spiraaltje van Ballerine tóch zwanger, gros klachten niet gemeld bij inspectie'. De vragen zijn van de Kamerleden Slagt-Tichelman en Westerveld (beiden GroenLinks-PvdA).Antwoorden op Kamervragen over het bericht 'Ruim 100 vrouwen met spiraaltje van Ballerine tóch zwanger, gros klachten niet gemeld bij inspectie'",2025-04-11 16:04:22,"10f79c88-951e-4fae-aab8-6114be259ed5"
"Kamerbrief over aankondiging Health Deal Caribisch Nederland","https://www.rijksoverheid.nl/documenten/kamerstukken/2025/04/11/aankondiging-health-deal-caribisch-nederland","Staatssecretaris Karremans (Jeugd, Preventie en Sport) informeert de Tweede Kamer over een ‘Health Deal’op het gebied van jeugdzorg op Bonaire, St. Eustatius en Saba (BES). De brief gaat ook over enkele openstaande moties en toezeggingen naar aanleiding van 2 eerdere debatten.   Kamerbrief over aankondiging Health Deal Caribisch Nederland",2025-04-11 16:03:23,"029335c2-5418-4ea1-abe2-fefe98770f68"
"Kamerbrief over tijdlijn van gebeurtenissen in de casus Co-Med","https://www.rijksoverheid.nl/documenten/kamerstukken/2025/04/11/kamerbrief-over-verzoek-om-volledige-tijdlijn-van-alle-relevante-gebeurtenissen-in-de-casus-co-med","Minister Agema (VWS) informeert de Tweede Kamer met een tijdlijn en een evaluatie over de casus Co-Med.Kamerbrief over tijdlijn van gebeurtenissen in de casus Co-Med",2025-04-11 16:02:21,"103d046a-d5ff-4032-8664-d984d7a8f9f3"
"Antwoorden op Kamervragen over uitvoering aanbevelingen van de Commissie-Van Ark en de Hervormingsagenda Jeugd","https://www.rijksoverheid.nl/documenten/kamerstukken/2025/04/11/antwoorden-op-kamervragen-over-de-uitvoering-van-de-aanbevelingen-van-de-commissie-van-ark-en-de-hervormingsagenda-jeugd","Staatssecretaris Karremans (Jeugd, Preventie en Sport) beantwoordt vragen over de uitvoering van de aanbevelingen van de Commissie-Van Ark en de Hervormingsagenda Jeugd. De vragen zijn van het Kamerlid Bruyning (NSC).Antwoorden op Kamervragen over uitvoering aanbevelingen van de Commissie-Van Ark en de Hervormingsagenda Jeugd",2025-04-11 15:07:16,"41c72925-4e6f-4220-a50a-57282bc13031"
"Kamerbrief t b v  kabinetsvisie op biotechnologie","https://www.rijksoverheid.nl/documenten/kamerstukken/2025/04/11/kamerbrief-t-b-v-kabinetsvisie-op-biotechnologie","Kamerbrief t b v  kabinetsvisie op biotechnologie",2025-04-11 14:42:55,"9dc9f80f-0046-4753-b073-48cd887cbc32"
"Antwoorden op Kamervragen over het bericht ‘Zorgen bij ziekenhuizen over tekorten aan middelen voor chemokuren’ en de WNL-aflevering Stand van Nederland","https://www.rijksoverheid.nl/documenten/kamerstukken/2025/04/11/antwoorden-op-kamervragen-over-het-bericht-zorgen-bij-ziekenhuizen-over-tekorten-aan-middelen-voor-chemokuren-en-de-wnl-aflevering-stand-van-nederland","Antwoorden op Kamervragen over het bericht ‘Zorgen bij ziekenhuizen over tekorten aan middelen voor chemokuren’ en de WNL-aflevering Stand van Nederland",2025-04-11 14:41:43,"c04539f9-5e3f-4b4f-a370-54b022089b1a"
"Kamerbrief over bezuiniging subsidieregeling medisch noodzakelijke zorg aan onverzekerden","https://www.rijksoverheid.nl/documenten/kamerstukken/2025/04/08/kamerbrief-over-so-inbreng-36600-xvi-bezuiniging-subsidieregeling-medisch-noodzakelijke-zorg-aan-onverzekerden","Minister Agema (VWS) beantwoordt vragen over bezuinigingen op de subsidieregeling medisch noodzakelijke zorg  aan onverzekerden. De vragen en opmerkingen zijn naar aanleiding van de Kamerbrief van 18 december 2024. De vaste commissie van Volksgezondheid, Welzijn en Sport heeft de vragen schriftelijk gesteld.  Kamerbrief over bezuiniging subsidieregeling medisch noodzakelijke zorg aan onverzekerden",2025-04-10 11:36:19,"c8b82fc2-0ce3-470f-854f-6189ca943bab"
"Uitstelbrief antwoorden Kamervragen over het bericht over afgelasten NK wielrennen","https://www.rijksoverheid.nl/documenten/kamerstukken/2025/04/09/uitstelbericht-kamervragen-over-het-bericht-lokale-wielrenners-balen-van-afgelast-nk-wielrennen","Minister Van Weel (JenV) stelt de toezending uit van de antwoorden op Kamervragen naar aanleiding van het bericht 'Lokale wielrenners balen van afgelast NK wielrennen'. De Tweede Kamerleden leden Boswijk en Inge van Dijk (beiden CDA) hadden de vragen gesteld.Uitstelbrief antwoorden Kamervragen over het bericht over afgelasten NK wielrennen",2025-04-10 08:17:53,"6d09d085-cdaa-48d0-9910-2ff79d65d478"
"Kamerbrief Actieprogramma mentale gezondheid en ggz deel 1","https://www.rijksoverheid.nl/documenten/kamerstukken/2025/04/09/kamerbrief-over-actieprogramma-mentale-gezondheid-en-ggz","Staatssecretaris Karremans (Jeugd, Preventie en Sport) informeert de Tweede Kamer over het 1e deel van het Actieprogramma mentale gezondheid en ggz. Dit deel richt zich op maatregelen die nodig zijn om de toegankelijkheid van de curatieve ggz voor volwassenen te verbeteren.Kamerbrief Actieprogramma mentale gezondheid en ggz deel 1",2025-04-09 15:03:47,"7774926c-ed1c-4d55-85af-2b9de69ef129"
"Uitstelbrief op Kamervragen over het bericht dat hulp in het huishouden voor nieuwe Wmo-klanten in Den Bosch wordt teruggeschroefd naar eens per twee weken","https://www.rijksoverheid.nl/documenten/kamerstukken/2025/04/09/uitstelbrief-antwoorden-kamervragen-over-het-bericht-dat-hulp-in-het-huishouden-voor-nieuwe-wmo-klanten-in-den-bosch-wordt-teruggeschroefd-naar-eens-per-twee-weken","Staatssecretaris Maeijer (Langdurige en Maatschappelijke Zorg) meldt dat de antwoorden op vragen over het bericht dat hulp in het huishouden voor nieuwe Wmo-klanten in Den Bosch wordt teruggeschroefd naar eens per twee weken later komen dan gebruikelijk. Het Tweede Kamerlid Dobbe (SP) heeft de vragen gesteld.Uitstelbrief op Kamervragen over het bericht dat hulp in het huishouden voor nieuwe Wmo-klanten in Den Bosch wordt teruggeschroefd naar eens per twee weken",2025-04-09 12:21:30,"d46794c3-3ef9-480d-9dc3-3eb185f3f9fc"
"Kamerbrief over Adviescommissie richtlijn passend bewijs preventie en stand van zaken investeringsmodel voor preventie","https://www.rijksoverheid.nl/documenten/kamerstukken/2025/04/08/kamerbrief-over-adviescommissie-richtlijn-passend-bewijs-preventie-en-stand-van-zaken-investeringsmodel-voor-preventie","Staatssecretaris Karremans (Jeugd, Preventie en Sport) informeert de Tweede Kamer over de voortgang van de ontwikkeling van het investeringsmodel voor preventie. Werken met dit investeringsmodel kan de gezondheid van inwoners van Nederland verbeteren, doordat het technisch mogelijk wordt om op gezondheid gerichte maatregelen (preventie), acties en activiteiten te beoordelen op hun gezondheidseffecten en waarbij er ook meer inzicht zal zijn in mogelijke budgettaire gevolgen. Eenzelfde brief is ook aan de Eerste Kamer gestuurd.Kamerbrief over Adviescommissie richtlijn passend bewijs preventie en stand van zaken investeringsmodel voor preventie",2025-04-09 10:37:40,"9cb7f875-8f64-4122-a238-caf3e7152d88"
"Kamerbrief eerste contouren samenhangende preventiestrategie","https://www.rijksoverheid.nl/documenten/kamerstukken/2025/04/08/kamerbrief-over-samenhangende-preventiestrategie-eerste-contouren","Staatssecretaris Karremans (Jeugd, Preventie en Sport) deelt de contouren van zijn aanpak voor het opstellen van een samenhangende effectieve preventiestrategie met de Tweede Kamer.Kamerbrief eerste contouren samenhangende preventiestrategie",2025-04-09 09:52:31,"63126014-4042-4482-a546-f1ba9124a783"
"Antwoorden op Kamervragen over problemen met de persoonlijke gezondheidsomgeving","https://www.rijksoverheid.nl/documenten/kamerstukken/2025/04/08/antwoorden-op-kamervragen-over-problemen-met-de-persoonlijke-gezondheidsomgeving-pgo","Minister Agema (VWS) geeft antwoord op vragen over problemen met de persoonlijke gezondheidsomgeving (PGO). Aanleiding voor de vragen is het bericht ‘Haperend patiëntendossier ontaardt in ruzie in rechtszaak’. Het Tweede Kamerlid Bushoff (GroenLinks-PvdA) heeft de vragen gesteld.Antwoorden op Kamervragen over problemen met de persoonlijke gezondheidsomgeving",2025-04-09 09:43:26,"a0cd536e-f0ba-4878-be80-b3b783cf6aca"
"Antwoorden op Kamervragen over vondelingenkamers","https://www.rijksoverheid.nl/documenten/kamerstukken/2025/04/08/antwoorden-op-de-vragen-van-het-lid-bikker-christenunie-over-het-bericht-geen-baby-s-anoniem-achtergelaten-in-eerste-jaar-vondelingenkamer-nul-is-een-mooi-cijfer","Staatssecretaris Karremans (Jeugd, Preventie en Sport) geeft antwoord op vragen over het bericht “Geen baby's anoniem achtergelaten in eerste jaar vondelingenkamer: ‘Nul is een mooi cijfer’”. Het Tweede Kamerlid Bikker (ChristenUnie) heeft deze vragen gesteld.Antwoorden op Kamervragen over vondelingenkamers",2025-04-09 09:42:27,"e25cf0cf-1229-4fe0-a8c4-3935f0316ef5"
"Aanbiedingsbrief nota naar aanleiding van verslag wetsvoorstel registratieplicht verkooppunten tabak","https://www.rijksoverheid.nl/documenten/kamerstukken/2025/04/08/kamerbrief-voorstel-van-wet-tot-wijziging-van-de-tabaks-en-rookwarenwet-in-verband-met-de-invoering-van-een-registratieplicht-voor-verkooppunten-van-tabaksproducten-en-aanverwante-producten","Staatssecretaris Karremans (Jeugd, Preventie en Sport) stuurt de Eerste Kamer de nota naar aanleiding van het verslag over het voorstel van wet tot wijziging van de Tabaks- en rookwarenwet in verband met de invoering van een registratieplicht voor verkooppunten van tabaksproducten en aanverwante producten.Aanbiedingsbrief nota naar aanleiding van verslag wetsvoorstel registratieplicht verkooppunten tabak",2025-04-09 09:00:47,"ac8873eb-d35b-4efb-a8f9-280fe9756d98"
"Nota naar aanleiding van verslag wetsvoorstel registratieplicht verkooppunten tabak","https://www.rijksoverheid.nl/documenten/kamerstukken/2025/04/08/nota-naar-aanleiding-van-het-verslag-voorstel-van-wet-tot-wijziging-van-de-tabaks-en-rookwarenwet-in-verband-met-de-invoering-van-een-registratieplicht-voor-verkooppunten-van-tabaksproducten-en-aanverwante-producten","Staatssecretaris Karremans (Jeugd, Preventie en Sport) geeft antwoord op vragen over het voorstel van wet tot wijziging van de Tabaks- en rookwarenwet in verband met de invoering van een registratieplicht voor verkooppunten van tabaksproducten en aanverwante producten. De Eerste Kamerfracties van GroenLinks-PvdA, D66, SP, PvdD, BBB, JA21 en PVV hebben deze vragen gesteld.Nota naar aanleiding van verslag wetsvoorstel registratieplicht verkooppunten tabak",2025-04-09 09:00:47,"6a0e5565-629e-43e4-ac6a-1a8454a95ac1"
"Aanbiedingsbrief nota naar aanleiding van verslag wetsvoorstel uitbreiding bekostiging vanuit Fonds langdurige zorg","https://www.rijksoverheid.nl/documenten/kamerstukken/2025/04/08/kamerbrief-over-wijziging-van-de-wet-langdurige-zorg-de-wet-financiering-sociale-verzekeringen-de-wet-marktordening-gezondheidszorg-en-de-algemene-wet-bestuursrecht-in-verband-met-de-uitbreiding-en-verdere-uitwerking-van-de-bekostigingsmogelijkheden-met-middelen-vanuit-het-fonds-langdurige-zorg-kamerstukken-36-486","Staatssecretaris Maeijer (Langdurige en Maatschappelijke Zorg) stuurt de Eerste Kamer de nota naar aanleiding van het verslag over het wetsvoorstel tot wijziging van de Wet langdurige zorg, de Wet financiering sociale verzekeringen, de Wet marktordening gezondheidszorg en de Algemene wet bestuursrecht in verband met de uitbreiding en verdere uitwerking van de bekostigingsmogelijkheden met middelen vanuit het Fonds langdurige zorg.Aanbiedingsbrief nota naar aanleiding van verslag wetsvoorstel uitbreiding bekostiging vanuit Fonds langdurige zorg",2025-04-09 08:37:34,"918e81f5-6a23-4552-b7bf-a6ba6fbe7813"
"Nota naar aanleiding van verslag wetsvoorstel uitbreiding bekostiging vanuit Fonds langdurige zorg","https://www.rijksoverheid.nl/documenten/kamerstukken/2025/04/08/nota-naar-aanleiding-van-het-verslag","Staatssecretaris Maeijer (Langdurige en Maatschappelijke Zorg) geeft antwoord op vragen over het wetsvoorstel tot wijziging van de Wet langdurige zorg, de Wet financiering sociale verzekeringen, de Wet marktordening gezondheidszorg en de Algemene wet bestuursrecht in verband met de uitbreiding en verdere uitwerking van de bekostigingsmogelijkheden met middelen vanuit het Fonds langdurige zorg. De Eerste Kamerfracties van CDA, BBB en ChristenUnie hebben deze vragen gesteld.Nota naar aanleiding van verslag wetsvoorstel uitbreiding bekostiging vanuit Fonds langdurige zorg",2025-04-09 08:37:34,"a25d34fa-6439-4cb9-a57b-e0af495ef338"
