"item_title","item_link","item_description","item_pub_date","item_guid"
"Commissiebrief over Bestuurlijke Afspraken Wet zorg en dwang","https://www.rijksoverheid.nl/documenten/kamerstukken/2024/03/14/kamerbrief-inzake-bestuurlijke-afspraken-wet-zorg-en-dwang","Minister Helder (VWS) informeert de Eerste Kamer over de Bestuurlijke afspraken uitvoering Wet zorg en dwang psychogeriatrische en verstandelijk gehandicapte cliënten (Wzd) 2024.Commissiebrief over Bestuurlijke Afspraken Wet zorg en dwang",2024-03-14 10:32:33,"35dbfecd-d7f2-494b-9c4a-be411c8227be"
"Kamerbrief over aanbieden rapporten transformatie passende zorg medisch specialistische bedrijven","https://www.rijksoverheid.nl/documenten/kamerstukken/2024/03/14/kamerbrief-over-aanbieden-rapporten-transformatie-passende-zorg-medisch-specialistische-bedrijven","Kamerbrief over aanbieden rapporten transformatie passende zorg medisch specialistische bedrijven",2024-03-14 10:04:17,"d18633c8-0876-4bc8-868c-34cb488d53d2"
"Antwoord op aanvullende Kamervraag over KNMG-gedragscode ","https://www.rijksoverheid.nl/documenten/kamerstukken/2024/03/14/antwoorden-op-kamervragen-over-de-knmg-gedragscode","Minister Dijkstra (Medische Zorg) geeft antwoord op een vraag over de gedragscode van de KNMG. Het Tweede Kamerlid Van Houwelingen (FvD) heeft deze vraag gesteld.Antwoord op aanvullende Kamervraag over KNMG-gedragscode",2024-03-14 09:57:02,"f460a16a-8e6a-471a-9fcf-9de240e0a3f1"
"Kamerbrief over voortgang programma Simpel Switchen in Participatieketen","https://www.rijksoverheid.nl/documenten/kamerstukken/2024/03/13/kamerbrief-voortgang-programma-simpel-switchen-in-de-participatieketen","Minister Schouten (Armoedebeleid, Participatie en Pensioenen) informeert de Tweede Kamer over de ontwikkelingen rond het programma Simpel Switchen.Kamerbrief over voortgang programma Simpel Switchen in Participatieketen",2024-03-14 09:42:01,"e456f8e8-d9b0-4992-9a26-bc5e207daa8d"
"Kamerbrief over continuering sluisplaatsing Tecartus","https://www.rijksoverheid.nl/documenten/kamerstukken/2024/03/13/kamerbrief-over-continuering-sluisplaatsing-tecartus","Minister Dijkstra (Medische Zorg) informeert de Tweede Kamer over het geneesmiddel Tecartus (stofnaam: brexucabtagene autoleucel). Het geneesmiddel blijft voorlopig in de sluis staan en blijft daarmee uitgezonderd van het basispakket.Kamerbrief over continuering sluisplaatsing Tecartus",2024-03-13 11:42:17,"94d4880d-68d5-4410-b0c8-95c13cb9148a"
"Aanbiedingsbrief advies bevolkingsonderzoek borstkanker","https://www.rijksoverheid.nl/documenten/kamerstukken/2024/03/12/aanbieding-gr-advies-bevolkingsonderzoek-borstkanker","Minister Dijkstra (Medische Zorg) stuurt de Tweede Kamer een advies van de Gezondheidsraad over het bevolkingsonderzoek naar borstkanker.Aanbiedingsbrief advies bevolkingsonderzoek borstkanker",2024-03-13 10:27:19,"21a1454e-1096-4ae5-87c6-8b338d659084"
"Kamerbrief over PFAS in hobbykip-eieren en PFAS in bepaalde vissoorten","https://www.rijksoverheid.nl/documenten/kamerstukken/2024/03/13/kamerbrief-over-buro-advies-pfas-in-hobbykip-eieren-en-onderzoek-naar-pfas-in-bepaalde-vissoorten","Minister Dijkstra (Medische Zorg) informeert de Tweede Kamer over PFAS in eieren van kippen van particulieren. De NVWA heeft hier onderzoek naar gedaan. Ook gaat deze brief over het PFAS-onderzoek naar bepaalde vissoorten.Kamerbrief over PFAS in hobbykip-eieren en PFAS in bepaalde vissoorten",2024-03-13 10:13:19,"a189a5b9-9e33-48fd-8eda-44c8e8fed79e"
"PFAS-onderzoek naar bepaalde vissoorten","https://www.rijksoverheid.nl/documenten/kamerstukken/2024/03/13/pfas-onderzoek-naar-bepaalde-vissoorten","Brief over het onderzoek naar de gehaltes aan PFAS’s in vis en visserijproducten uit de Westerschelde.  De brief is van Wageningen Food Safety Research, van WUR.PFAS-onderzoek naar bepaalde vissoorten",2024-03-13 10:13:18,"a9f58523-cb92-4062-a174-3f737b480760"
"Uitstelbrief antwoorden Kamervragen over euthanasie bij psychisch lijden","https://www.rijksoverheid.nl/documenten/kamerstukken/2024/03/12/uitstelbrief-bij-kamervragen-over-euthanasie-bij-psychisch-lijden","Minister Dijkstra (Medische Zorg) meldt dat de antwoorden op vragen over euthanasie bij psychisch lijden later komen dan gebruikelijk.Uitstelbrief antwoorden Kamervragen over euthanasie bij psychisch lijden",2024-03-13 09:58:30,"6d90a8f0-f5ca-4330-aac4-54573c7be5af"
"Antwoorden op Kamervragen over casemanagement dementie ","https://www.rijksoverheid.nl/documenten/kamerstukken/2024/03/12/antwoorden-op-kamervragen-over-de-brief-van-stichting-zeeuwse-zorgschakels-aangaande-casemanagement-dementie-die-is-gestuurd-aan-alle-relaties","Minister Helder (VWS) beantwoordt vragen over casemanagement dementie en de brief die Stichting Zeeuwse Zorgschakels hierover gestuurd heeft. De vragen zijn van het Kamerlid Van den Hil (VVD).Antwoorden op Kamervragen over casemanagement dementie",2024-03-13 08:34:20,"2563f50e-d417-456d-a5fe-fed12f1c44ff"
"Uitstelbrief antwoorden Kamervragen over kraamzorg in Twente voor 160 gezinnen","https://www.rijksoverheid.nl/documenten/kamerstukken/2024/03/12/uitstelbrief-antwoorden-kamervragen-over-het-bericht-maartje-kraamzorg-trekt-de-stekker-eruit-kraamzorg-in-twente-moet-hulp-zoeken-voor-160-gezinnen","Minister Dijkstra (Medische Zorg) meldt dat de antwoorden op Kamervragen over het bericht 'Maartje Kraamzorg trekt de stekker eruit, kraamzorg in Twente moet hulp zoeken voor 160 gezinnen' later komen dan gebruikelijk.Uitstelbrief antwoorden Kamervragen over kraamzorg in Twente voor 160 gezinnen",2024-03-12 18:04:46,"fcf273ac-4ffa-4464-9ec7-267306cf0645"
"Commissiebrief over Preventieaanpak leefstijl","https://www.rijksoverheid.nl/documenten/kamerstukken/2024/03/11/commissiebrief-inzake-preventieaanpak-leefstijl","Staatssecretaris Van Ooijen (VWS) stuurt de Tweede Kamer zijn reactie op vragen van de leden van de vaste commissie voor Volksgezondheid, Welzijn en Sport (VWS) over de voortgang van de preventieaanpak leefstijl met focus op overgewicht en voeding.Commissiebrief over Preventieaanpak leefstijl",2024-03-11 12:10:01,"50ddb1fe-e77a-4291-ab42-9e344ccd05ce"
"Antwoorden Kamervragen over het artikel over gendersensitieve aanpak bij gemeenten en Rijksoverheid","https://www.rijksoverheid.nl/documenten/kamerstukken/2024/03/11/beantwoording-kamervragen-lid-paulusma-d66-over-het-artikel-gendersensitieve-aanpak-nog-onvoldoende-aanwezig-in-bestaand-beleid-gemeenten-en-rijksoverheid-aan-zet","Minister Dijkgraaf (OCW) geeft antwoorden op Kamervragen naar aanleiding van het artikel 'Gendersensitieve aanpak nog onvoldoende aanwezig in bestaand beleid, gemeenten en Rijksoverheid aan zet'. Het Tweede Kamerlid Paulusma (D66) had de vragen gesteld.Antwoorden Kamervragen over het artikel over gendersensitieve aanpak bij gemeenten en Rijksoverheid",2024-03-11 11:54:36,"51fef0e6-aa98-4a4c-be26-88440d790d29"
"Aanbiedingsbrief bij jaarbeeld 2023 Inspectie Gezondheidszorg en Jeugd","https://www.rijksoverheid.nl/documenten/kamerstukken/2024/03/11/kamerbrief-over-jaarbeeld-2023-inspectie-gezondheidszorg-en-jeugd","Minister Helder (VWS) biedt de Tweede Kamer het jaarbeeld 2023 van de Inspectie Gezondheidszorg en Jeugd (IGJ) aan.Aanbiedingsbrief bij jaarbeeld 2023 Inspectie Gezondheidszorg en Jeugd",2024-03-11 11:30:01,"e1b14641-8f59-4fd5-8f91-148b36f7677a"
"Uitstelbrief op Kamervragen over het bericht ‘Verzorgingshuis laat stervende patiënt (87) niet meer eten, verpleger kan het niet verkroppen en gaat in de fout’","https://www.rijksoverheid.nl/documenten/kamerstukken/2024/03/11/uitstelbrief-antwoorden-kamervragen-over-het-bericht-verzorgingshuis-laat-stervende-patient-87-niet-meer-eten-verpleger-kan-het-niet-verkroppen-en-gaat-in-de-fout","Minister Helder (VWS) meldt dat de antwoorden op vragen over het bericht ‘Verzorgingshuis laat stervende patiënt (87) niet meer eten, verpleger kan het niet verkroppen en gaat in de fout’ later komen dan gebruikelijk. Het Tweede Kamerlid Diederik van Dijk (SGP) heeft de vragen gesteld. Uitstelbrief op Kamervragen over het bericht ‘Verzorgingshuis laat stervende patiënt (87) niet meer eten, verpleger kan het niet verkroppen en gaat in de fout’",2024-03-11 09:48:57,"41c1887b-a665-48d0-af23-aae82aded358"
"Uitstelbrief antwoorden Kamervragen over bericht ‘Ik bied u mijn oudere handen aan het bed. Maar waarom moet ik dan opnieuw leren rekenen?’","https://www.rijksoverheid.nl/documenten/kamerstukken/2024/03/11/uitstelbrief-bij-kamervragen-over-ik-bied-u-mijn-oudere-handen-aan-het-bed-maar-waarom-moet-ik-dan-opnieuw-leren-rekenen","Minister Helder (VWS) meldt dat de antwoorden op vragen over het bericht ‘Ik bied u mijn oudere handen aan het bed. Maar waarom moet ik dan opnieuw leren rekenen?’ later komen dan gebruikelijk.Uitstelbrief antwoorden Kamervragen over bericht ‘Ik bied u mijn oudere handen aan het bed. Maar waarom moet ik dan opnieuw leren rekenen?’",2024-03-11 09:40:09,"b2fe1609-4c90-42b0-ae64-fbb87fe3bc13"
"Uitstelbrief op Kamervragen over een sociaal veilige werkomgeving voor Rijksambtenaren","https://www.rijksoverheid.nl/documenten/kamerstukken/2024/03/08/uitstelbrief-antwoorden-kamervragen-over-een-sociaal-veilige-werkomgeving-voor-rijksambtenaren","Minister Helder (VWS) meldt dat de antwoorden op vragen over een sociaal veilige werkomgeving voor Rijksambtenaren later komen dan gebruikelijk. De Tweede Kamerleden Chakor (GroenLinks-PvdA) en Palmen (NSC) hebben de vragen gesteld.Uitstelbrief op Kamervragen over een sociaal veilige werkomgeving voor Rijksambtenaren",2024-03-08 14:17:20,"23b57842-fa8e-4b35-9eb5-d38f4cf6b936"
"Kamerbrief reactie op rapport ‘Maatschappelijke acceptatie van vrouwspecifieke aandoeningen’","https://www.rijksoverheid.nl/documenten/kamerstukken/2024/03/07/kamerbrief-commissieverzoek-om-een-reactie-op-het-rapport-maatschappelijke-acceptatie-van-vrouwspecifieke-aandoeningen-van-de-nvog","Minister Dijkstra (Medische Zorg) reageert op het rapport ‘Maatschappelijke acceptatie van vrouwspecifieke aandoeningen’ van de Nederlandse Vereniging voor Obstetrie en Gynaecologie. De Tweede Kamer had om een reactie gevraagd.Kamerbrief reactie op rapport ‘Maatschappelijke acceptatie van vrouwspecifieke aandoeningen’",2024-03-08 08:00:28,"ff318b38-15fd-4320-8148-e1a790bd4400"
"Antwoorden op Kamervragen over stand van zaken medicamenteuze afbreking zwangerschap via huisarts","https://www.rijksoverheid.nl/documenten/kamerstukken/2024/03/07/kamerbrief-reactie-schriftelijk-overleg-inzake-de-kamerbrief-stand-van-zaken-medicamenteuze-afbreking-zwangerschap-via-huisarts","Minister Dijkstra (Medische Zorg) geeft antwoord op vragen over de stand van zaken van de invoering van medicamenteuze afbreking van de zwangerschap via de huisarts. De Tweede Kamerfracties van PVV, GroenLinks-PvdA, VVD, NSC, D66, BBB, SP en ChristenUnie hebben deze vragen gesteld.Antwoorden op Kamervragen over stand van zaken medicamenteuze afbreking zwangerschap via huisarts",2024-03-08 07:28:24,"bfa62c6f-fac2-45da-958f-bef9d995cc59"
"Antwoorden op Kamervragen over de huisvesting van de YMCA-vakantiekampen ","https://www.rijksoverheid.nl/documenten/kamerstukken/2024/03/07/antwoorden-op-kamervragen-over-de-huisvesting-van-de-ymca-vakantiekampen","Staatssecretaris Van Ooijen (VWS) beantwoordt vragen over de huisvestingsproblemen van YMCA-vakantiekampen. De vragen zijn van het Kamerlid Ceder (CU).Antwoorden op Kamervragen over de huisvesting van de YMCA-vakantiekampen",2024-03-07 11:45:19,"f11b4e6c-ece3-47e6-a04b-272c66afe2b0"
