"item_title","item_link","item_description","item_pub_date","item_guid"
"Beleidsreactie advies ‘Digitalisering van de zorg op de BES-eilanden’ ","https://www.rijksoverheid.nl/documenten/kamerstukken/2024/05/29/beleidsreactie-advies-digitalisering-van-de-zorg-op-de-bes-eilanden","Beleidsreactie advies ‘Digitalisering van de zorg op de BES-eilanden’",2024-05-29 14:52:05,"59f3773b-6056-4da3-88fc-54342f9a4c86"
"Kamerbrief over voortgang Professionals voor Maatwerk Multiproblematiek","https://www.rijksoverheid.nl/documenten/kamerstukken/2024/05/29/kamerbrief-voortgang-professionals-voor-maatwerk-multiproblematiek","Minister Schouten (Armoedebeleid, Participatie en Pensioenen) stuurt de Tweede Kamer het onderzoeksrapport van de Professionals voor Maatwerk Multiproblematiek (PMM) over 2023. PMM helpt professionals van gemeenten en landelijke uitvoeringsorganisaties maatwerk te bieden bij vastgelopen multiprobleemsituaties van inwoners.Kamerbrief over voortgang Professionals voor Maatwerk Multiproblematiek",2024-05-29 11:02:00,"00d621b8-ae80-4be6-a81f-1452a214eae4"
"Kamerbrief over aanbieding advies omtrent vervolg ZonMw deelprogramma oversterfte","https://www.rijksoverheid.nl/documenten/kamerstukken/2024/05/28/kamerbrief-over-aanbieding-advies-omtrent-vervolg-zonmw-deelprogramma-oversterfte","Minister Dijkstra (Medische Zorg) stuurt de Tweede Kamer het advies van ZonMw over het vervolg van het deelprogramma oversterfte. Kamerbrief over aanbieding advies omtrent vervolg ZonMw deelprogramma oversterfte",2024-05-29 06:31:36,"626c33b7-e8c2-4018-aee8-0fe7e489949e"
"Antwoorden op Kamervragen over artikel 'Nederland vormt belangrijke spil in illegale handel bedreigde diersoorten'","https://www.rijksoverheid.nl/documenten/kamerstukken/2024/05/28/beantwoording-schriftelijke-vragen-over-het-artikel-nederland-vormt-belangrijke-spil-in-illegale-handel-bedreigde-diersoorten","Minister Van der Wal-Zeggelink (Natuur en Stikstof) geeft antwoord op schriftelijke vragen over het artikel 'Nederland vormt belangrijke spil in illegale handel bedreigde diersoorten'. De Tweede Kamerleden Eerdmans (JA21) en Teunissen (PvdD) hebben de vragen gesteld. Antwoorden op Kamervragen over artikel 'Nederland vormt belangrijke spil in illegale handel bedreigde diersoorten'",2024-05-29 06:18:24,"26b2e9ff-ffe2-4931-9e9d-d8d8d23f7f65"
"Kamerbrief over Jaarbeeld NVWA 2023 en Stand van Toezicht","https://www.rijksoverheid.nl/documenten/kamerstukken/2024/05/28/brief-jaarbeeld-nvwa-2023-en-stand-van-toezicht","Minister Adema (LNV) biedt de Tweede Kamer het Jaarbeeld 2023 van de NVWA aan.Kamerbrief over Jaarbeeld NVWA 2023 en Stand van Toezicht",2024-05-28 14:27:53,"b0b41961-afdd-4c10-9290-50a4f6bb893a"
"Uitstelbrief antwoorden Kamervragen over buitensluiten Buurtzorg","https://www.rijksoverheid.nl/documenten/kamerstukken/2024/05/28/uitstelbrief-antwoorden-kamervragen-over-het-bericht-jos-de-blok-vws-en-nza-hebben-buurtzorg-stelselmatig-buitengesloten","Minister Helder (VWS) meldt dat de antwoorden op vragen over het bericht “Jos de Blok: ‘VWS en NZa hebben Buurtzorg stelselmatig buitengesloten’” later komen dan gebruikelijk. Het Tweede Kamerlid Dobbe (SP) heeft de vragen gesteld.Uitstelbrief antwoorden Kamervragen over buitensluiten Buurtzorg",2024-05-28 09:56:06,"804fc92a-0d3e-44c1-8857-7776f6c62edf"
"Uitstelbrief op Kamervragen over bericht 'Voor miljarden aan zorgfraude gepleegd, maar pakkans nihil: ’En zorgpremies stijgen steeds meer’'","https://www.rijksoverheid.nl/documenten/kamerstukken/2024/05/28/uitstelbrief-antwoorden-kamervragen-over-het-bericht-voor-miljarden-aan-zorgfraude-gepleegd-maar-pakkans-nihil-en-zorgpremies-stijgen-steeds-meer","Minister Helder (VWS) meldt dat de antwoorden op vragen over het bericht 'Voor miljarden aan zorgfraude gepleegd, maar pakkans nihil: ’En zorgpremies stijgen steeds meer’', later komen dan gebruikelijk. Het Tweede Kamerlid Dobbe (SP) heeft de vragen gesteld.Uitstelbrief op Kamervragen over bericht 'Voor miljarden aan zorgfraude gepleegd, maar pakkans nihil: ’En zorgpremies stijgen steeds meer’'",2024-05-28 09:00:59,"e43a6113-60da-42d5-9cd2-6635b704e7b7"
"Kamerbrief over Verbeteragenda Doelgroepenvervoer","https://www.rijksoverheid.nl/documenten/kamerstukken/2024/05/28/kamerbrief-over-verbeteragenda-doelgroepenvervoer","Staatssecretaris Van Ooijen (VWS) informeert de Tweede Kamer over de uitwerking van 5 thema’s van de Verbeteragenda Doelgroepenvervoer. Kamerbrief over Verbeteragenda Doelgroepenvervoer",2024-05-28 08:16:41,"54fc4bdf-ce5b-466d-8b7e-8d4a1df373c0"
"Kamerbrief over stand van zaken vogelgriep","https://www.rijksoverheid.nl/documenten/kamerstukken/2024/05/28/kamerbrief-stand-van-zaken-vogelgriep","Minister Adema (LNV) informeert de Tweede Kamer over de recente activiteiten en resultaten jegens vaccinatie tegen vogelgriep.Kamerbrief over stand van zaken vogelgriep",2024-05-28 08:05:10,"c7dd0fe5-a32a-4070-8362-aa7d35475fe2"
"Antwoorden op Kamervragen over vergoeding medische hulpmiddelen voor volgen onderwijs","https://www.rijksoverheid.nl/documenten/kamerstukken/2024/05/27/antwoorden-op-kamervragen-over-de-vergoeding-van-medische-hulpmiddelen-die-nodig-zijn-om-onderwijs-te-kunnen-volgen","Minister Dijkstra (Medische Zorg) geeft antwoord op vragen over de vergoeding van medische hulpmiddelen die nodig zijn om onderwijs te kunnen volgen. Het Tweede Kamerlid Westerveld (GroenLinks-PvdA) heeft deze vragen gesteld.Antwoorden op Kamervragen over vergoeding medische hulpmiddelen voor volgen onderwijs",2024-05-27 13:42:36,"1bc91c77-b3f5-44dd-9c41-1130542de05f"
"Antwoorden op Kamervragen over verspreiding medische misinformatie op sociale media ","https://www.rijksoverheid.nl/documenten/kamerstukken/2024/05/27/antwoorden-op-kamervragen-over-verspreiding-van-medische-misinformatie-op-sociale-media","Minister Dijkstra (Medische Zorg) en staatssecretaris Van Ooijen (VWS) geven antwoord op vragen over verspreiding van medische misinformatie op sociale media. Het Tweede Kamerlid Paulusma (D66) heeft de vragen gesteld.Antwoorden op Kamervragen over verspreiding medische misinformatie op sociale media",2024-05-27 11:03:36,"538ec37b-c953-4257-a61a-a81597bdd18b"
"Antwoorden op Kamervragen over het onder verscherpt toezicht stellen van de ZIKOS-afdelingen Harreveld en Zetten","https://www.rijksoverheid.nl/documenten/kamerstukken/2024/05/27/antwoorden-op-kamervragen-over-het-onder-verscherpt-toezicht-stellen-van-de-zikos-afdelingen-harreveld-en-zetten","Staatssecretaris Van Ooijen (VWS) geeft antwoord op vragen over het onder verscherpt toezicht stellen van de ZIKOS-afdelingen Harreveld en Zetten. Het Tweede Kamerlid Bruyning (Nieuw Sociaal Contract) heeft de vragen gesteld.Antwoorden op Kamervragen over het onder verscherpt toezicht stellen van de ZIKOS-afdelingen Harreveld en Zetten",2024-05-27 10:18:12,"62a85550-8694-49f8-84cd-68620b154aa8"
"Kamerbrief met verzoek om een reactie op het Inspectierapport over de ZIKOS-afdelingen","https://www.rijksoverheid.nl/documenten/kamerstukken/2024/05/27/kamerbrief-over-verzoek-om-een-reactie-op-het-inspectierapport-over-de-zikos-afdelingen","Staatssecretaris Van Ooijen (VWS) stuurt de Tweede Kamer zijn reactie op het Inspectierapport over de ZIKOS-afdelingen. Dit op verzoek van vaste commissie voor Volksgezondheid, Welzijn en Sport.Kamerbrief met verzoek om een reactie op het Inspectierapport over de ZIKOS-afdelingen",2024-05-27 10:18:07,"b2a4bac6-9a27-42bf-a23f-2573265bcfed"
"Antwoorden op Kamervragen over de ontstane situatie bij de zorglocatie Abel Tasman in Heerhugowaard","https://www.rijksoverheid.nl/documenten/kamerstukken/2024/05/24/antwoorden-op-kamervragen-over-de-ontstane-situatie-bij-de-zorglocatie-abel-tasman-in-heerhugowaard","Minister Helder (VWS) geeft antwoord op vragen over de ontstane situatie bij de zorglocatie Abel Tasman in Heerhugowaard. Het Tweede Kamerlid Dobbe (SP) heeft de vragen gesteld.Antwoorden op Kamervragen over de ontstane situatie bij de zorglocatie Abel Tasman in Heerhugowaard",2024-05-27 08:47:51,"f632e0ad-52ca-4157-8d39-0ec09c38d937"
"Kamerbrief over voorhangbrief aanwijzing prestatie verkennend gesprek","https://www.rijksoverheid.nl/documenten/kamerstukken/2024/05/17/kamerbrief-over-voorhangbrief-aanwijzing-prestatie-verkennend-gesprek","Minister Helder (VWS) informeert de Tweede Kamer, conform artikel 8 van de Wet marktordening gezondheidszorg (Wmg), over de zakelijke inhoud van de aanwijzing die zij van plan is te geven op grond van artikel 7 van de Wmg aan de Nederlandse  Zorgautoriteit (NZa). Ook voldoet minister Helder (VWS) aan de toezegging aan het lid Westerveld (GroenLinks-PvdA) tijdens het commissiedebat ggz/suïcidepreventie van 11 april 2024 om de Tweede Kamer te informeren over de voortgang van het verkennend gesprek waarbij zij in gaat op de bekostiging van het verkennend gesprek en het uitsluiten van het verplicht eigen risico. De Eerste Kamer heeft eenzelfde brief gekregen.Kamerbrief over voorhangbrief aanwijzing prestatie verkennend gesprek",2024-05-27 08:45:15,"c737f0f2-0904-440d-a50e-724039a02409"
"Kamerbrief over wettelijk bezoldigingsmaximum door Stichting Sanquin Bloedvoorziening","https://www.rijksoverheid.nl/documenten/kamerstukken/2024/05/24/kamerbrief-over-commissiebrief-inzake-reactie-m-b-t-overschrijding-van-wettelijk-bezoldigingsmaximum-door-stichting-sanquin-bloedvoorziening","Minister Dijkstra (Medische Zorg) reageert op een brief van de heer K.G. van 11 april 2024. De heer K.G. vraagt aandacht voor de hoge salarissen van de directeuren bij Stichting Sanquin Bloedvoorziening. Deze liggen boven het bezoldigingsmaximum van de Wet normering topinkomens (WNT). Kamerbrief over wettelijk bezoldigingsmaximum door Stichting Sanquin Bloedvoorziening",2024-05-27 06:24:36,"8f234c62-0206-446a-af60-980f96934c5f"
"Antwoorden op Kamervragen over de vergoeding van reconstructieoperaties bij besneden vrouwen","https://www.rijksoverheid.nl/documenten/kamerstukken/2024/05/24/antwoorden-op-kamervragen-over-de-vergoeding-van-reconstructieoperaties-bij-besneden-vrouwen","Minister Dijkstra (Medische Zorg) geeft antwoord op vragen over de vergoeding van reconstructieoperaties bij besneden vrouwen. Het Tweede Kamerlid Dobbe (SP) heeft de vragen gesteld.Antwoorden op Kamervragen over de vergoeding van reconstructieoperaties bij besneden vrouwen",2024-05-24 14:56:24,"02a36f42-bfa5-431c-a929-16ce82ec9c3c"
"Antwoorden op Kamervragen over bericht doden door levensgevaarlijke kruiden","https://www.rijksoverheid.nl/documenten/kamerstukken/2024/05/24/antwoorden-op-kamervragen-over-het-bericht-drie-doden-door-soms-levensgevaarlijke-kruiden-rivm-waarschuwt","Minister Dijkstra (Medische Zorg) stuurt de Tweede Kamer haar antwoorden op schriftelijke vragen over het bericht '3 doden door ""soms levensgevaarlijke kruiden"", RIVM waarschuwt'. De vragen zijn gesteld door het Tweede Kamerlid Tielen (VVD). Antwoorden op Kamervragen over bericht doden door levensgevaarlijke kruiden",2024-05-24 14:54:56,"13a3ce20-667c-43a2-98ec-b9f2cc45bdcd"
"Kamerbrief over expertisecentrum FAST","https://www.rijksoverheid.nl/documenten/kamerstukken/2024/05/24/kamerbrief-over-voortgangsrapportage-expertisecentrum-fast","Minister Dijkstra (Medische Zorg) en minister Adriaansens (EZK) informeren de Tweede Kamer over de voortgang van FAST (Future Affordable Sustainable Therapy development). Dit expertisecentrum richt zich op het ondersteunen en versterken van therapieontwikkeling in Nederland. Kamerbrief over expertisecentrum FAST",2024-05-24 14:43:43,"8d992512-ea32-4bfc-9eab-9e6611adc474"
"Kamerbrief over inzet van Nederland voor de 77e World Health Assembly","https://www.rijksoverheid.nl/documenten/kamerstukken/2024/05/24/inzet-van-nederland-voor-de-77e-world-health-assembly","Minister Dijkstra (Medische Zorg) informeert de Tweede Kamer over de inzet van Nederland bij de 77e World Health Assembly (WHA), de jaarvergadering van de Wereldgezondheidsorganisatie (WHO), te Genève. Kamerbrief over inzet van Nederland voor de 77e World Health Assembly",2024-05-24 14:31:25,"63c48b8a-8616-4a44-9783-3b347b39da1f"
