"item_title","item_link","item_description","item_pub_date","item_guid"
"Uitstelbrief antwoorden Kamervragen over het bericht ‘Valkenburgse raad bezorgd om sluiting Mosaqua’ ","https://www.rijksoverheid.nl/documenten/kamerstukken/2024/04/03/uitstelbrief-antwoorden-kamervragen-over-het-bericht-valkenburgse-raad-bezorgd-om-sluiting-mosaqua","Uitstelbrief antwoorden Kamervragen over het bericht ‘Valkenburgse raad bezorgd om sluiting Mosaqua’",2024-04-03 14:57:43,"5f16897b-749f-46f4-bd1f-a82bb98767ce"
"Uitstelbrief op Kamervragen over het bericht 'Rechter gefrustreerd: klinieken willen verward persoon niet opnemen' ","https://www.rijksoverheid.nl/documenten/kamerstukken/2024/04/03/uitstelbrief-op-kamervragen-over-het-bericht-rechter-gefrustreerd-klinieken-willen-verward-persoon-niet-opnemen","Uitstelbrief op Kamervragen over het bericht 'Rechter gefrustreerd: klinieken willen verward persoon niet opnemen'",2024-04-03 14:55:34,"6d8d44f4-b9e3-4ec1-8b1f-b950aefb994b"
"Antwoorden op Kamervragen over artikel ‘GGz Breburg wil verder met mentale gezondheidscentra, maar het systeem stokt’","https://www.rijksoverheid.nl/documenten/kamerstukken/2024/04/03/antwoorden-op-kamervragen-over-het-artikel-ggz-breburg-wil-verder-met-mentale-gezondheidscentra-maar-het-systeem-stokt","Minister Helder (VWS) beantwoordt vragen over het artikel ‘GGz Breburg wil verder met mentale gezondheidscentra, maar het systeem stokt’. De vragen zijn van het Kamerlid Van den Hil (VVD).Antwoorden op Kamervragen over artikel ‘GGz Breburg wil verder met mentale gezondheidscentra, maar het systeem stokt’",2024-04-03 14:12:51,"7561f3ac-430e-4a2b-9884-c8c9fd391c50"
"Kamerbrief over onderzoek naar de relatie tussen luchtkwaliteit en COVID-19","https://www.rijksoverheid.nl/documenten/kamerstukken/2024/04/03/onderzoek-naar-de-relatie-tussen-luchtkwaliteit-en-covid-19","Staatssecretaris Heijnen (IenW) informeert de Tweede Kamer over de uitkomsten van het onderzoek naar de relatie tussen luchtkwaliteit en COVID-19. Kamerbrief over onderzoek naar de relatie tussen luchtkwaliteit en COVID-19",2024-04-03 13:56:29,"8e57c26b-48a3-49c7-b94d-2d4990828383"
"Kamerbrief over Aanstaand Woo-besluit inkoop persoonlijke beschermingsmiddelen ","https://www.rijksoverheid.nl/documenten/kamerstukken/2024/04/03/kamerbrief-over-aanstaand-woo-besluit-inkoop-persoonlijke-beschermingsmiddelen","Kamerbrief over Aanstaand Woo-besluit inkoop persoonlijke beschermingsmiddelen",2024-04-03 13:34:31,"54efb18a-902b-4e3c-be81-2cab0edca5c4"
"Antwoorden op Kamervragen over stoppen basis-ggz door grote zorgaanbieder ","https://www.rijksoverheid.nl/documenten/kamerstukken/2024/04/03/antwoorden-op-kamervragen-over-het-stoppen-van-basis-geestelijke-gezondheidszorg-door-een-grote-zorgaanbieder","Minister Helder (VWS) geeft antwoord op vragen over het bericht ‘Lentis stopt met basis-ggz: wachtlijsten voor psychische problemen zullen toenemen’. De Tweede Kamerleden Westerveld en Slagt-Tichelman (beiden GroenLinks-PvdA) hebben deze vragen gesteld.Antwoorden op Kamervragen over stoppen basis-ggz door grote zorgaanbieder",2024-04-03 13:22:54,"944005ae-1fe5-4827-8bfd-c64619ff8221"
"Kamerbrief acties vaccinatiegraad Rijksvaccinatieprogramma","https://www.rijksoverheid.nl/documenten/kamerstukken/2024/04/03/kamerbrief-acties-vaccinatiegraad-rijksvaccinatieprogramma","Kamerbrief acties vaccinatiegraad Rijksvaccinatieprogramma",2024-04-03 13:19:56,"ac1ccba7-2837-4b60-b0ce-d46c326df174"
"Antwoorden op Kamervragen over dure gehoorapparaten","https://www.rijksoverheid.nl/documenten/kamerstukken/2024/04/03/antwoorden-op-kamervragen-over-de-uitzending-van-radar-d-d-11-maart-2024-over-te-dure-gehoorapparaten","Minister Dijkstra (Medische Zorg) geeft antwoord op vragen over de uitzending van Radar van 11 maart 2024 over te dure gehoorapparaten. Het Tweede Kamerlid Krul (CDA) heeft de vragen gesteld.Antwoorden op Kamervragen over dure gehoorapparaten",2024-04-03 12:21:19,"a17db527-a766-4498-9461-99b06696fdae"
"Antwoorden op Kamervragen over euthanasie bij psychisch lijden ","https://www.rijksoverheid.nl/documenten/kamerstukken/2024/04/03/antwoorden-op-kamervragen-over-euthanasie-bij-psychisch-lijden","Minister Dijkstra (Medische Zorg) geeft antwoord op vragen over het bericht ‘Je patiënt eindeloos laten lijden, dat is ook een keuze’. Het Tweede Kamerlid Paulusma (D66) heeft de vragen gesteld.Antwoorden op Kamervragen over euthanasie bij psychisch lijden",2024-04-03 12:11:58,"fb44d1fc-f28a-485e-af58-fca9d7c672af"
"Antwoorden op aanvullende Kamervragen over KNMG-gedragscode","https://www.rijksoverheid.nl/documenten/kamerstukken/2024/04/03/antwoorden-op-kamervragen-over-de-knmg-gedragscode","Minister Dijkstra (Medische Zorg) geeft antwoord op vragen over de gedragscode van de KNMG. Het Tweede Kamerlid Van Houwelingen (FvD) heeft de vragen gesteld.Antwoorden op aanvullende Kamervragen over KNMG-gedragscode",2024-04-03 12:10:52,"6c71e85e-7dbe-4978-a45b-754e99c68a7c"
"Uitstelbrief op Kamervragen over berichten ‘Bestuurders UMCG declareren voor ton aan autoritten en 15.000 euro voor trip VS’","https://www.rijksoverheid.nl/documenten/kamerstukken/2024/04/03/uitstelbrief-antwoorden-kamervragen-over-de-berichten-bestuurders-umcg-declareren-voor-ton-aan-autoritten-en-15-000-euro-voor-trip-vs-en-ziekenhuisbestuurders-houden-zich-niet-aan-declaratie-afspraken","Minister Helder (VWS) meldt dat de antwoorden op vragen over de berichten ‘Bestuurders UMCG declareren voor ton aan autoritten en 15.000 euro voor trip VS’ en ‘Ziekenhuisbestuurders houden zich niet aan declaratie-afspraken’, later komen dan gebruikelijk. Het Tweede Kamerlid Dijk (SP) heeft de vragen gesteld. Uitstelbrief op Kamervragen over berichten ‘Bestuurders UMCG declareren voor ton aan autoritten en 15.000 euro voor trip VS’",2024-04-03 10:16:02,"71e481a6-267b-4d29-8ee4-e1fb247fe274"
"Uitstelbrief op Kamervragen over de topsalarissen van zorgbestuurders","https://www.rijksoverheid.nl/documenten/kamerstukken/2024/04/03/uitstelbrief-antwoorden-kamervragen-over-de-topsalarissen-van-zorgbestuurders","Minister Helder (VWS) meldt dat de antwoorden op vragen over de topsalarissen van zorgbestuurders later komen dan gebruikelijk. De Tweede Kamerleden Bushoff, Slagt-Tichelman en Westerveld (allen GroenLinks-PvdA) hebben de vragen gesteld. Uitstelbrief op Kamervragen over de topsalarissen van zorgbestuurders",2024-04-03 10:10:21,"ae30e1b5-bd24-479d-9f0d-9298767127c5"
"Antwoorden op Kamervragen over afwijzen sociale huurwoningen aan woningzoekenden met een verleden als cliënt in de jeugdzorg","https://www.rijksoverheid.nl/documenten/kamerstukken/2024/04/03/antwoorden-op-kamervragen-over-afwijzen-sociale-huurwoningen-aan-woningzoekenden-met-een-verleden-als-client-in-de-jeugdzorg","Minister De Jonge (BZK) geeft antwoord op vragen over het afwijzen van sociale huurwoningen aan woningzoekenden met een verleden als cliënt in de jeugdzorg. Het Tweede Kamerlid Synhaeve (D66) heeft de vragen gesteld. Antwoorden op Kamervragen over afwijzen sociale huurwoningen aan woningzoekenden met een verleden als cliënt in de jeugdzorg",2024-04-03 10:03:46,"af43030e-41c1-492f-88d4-90c38b14240e"
"Uitstelbrief op Kamervragen over miljarden euro’s aan junkfoodadvertenties","https://www.rijksoverheid.nl/documenten/kamerstukken/2024/04/03/uitstelbrief-antwoorden-kamervragen-over-miljarden-euro-s-aan-junkfoodadvertenties","Staatssecretaris Van Ooijen (VWS) meldt dat de antwoorden op vragen over miljarden euro’s aan  junkfoodadvertenties later komen dan gebruikelijk. Het Tweede Kamerlid Slagt-Tichelman (GroenLinks-PvdA) heeft de vragen gesteld. Uitstelbrief op Kamervragen over miljarden euro’s aan junkfoodadvertenties",2024-04-03 09:40:57,"5c24955d-f0be-4e86-b2a7-2c6863a74376"
"Kamerbrief uitvoering moties meerjarige strategie sportverenigingen en publiek eigendom openbare zwembaden","https://www.rijksoverheid.nl/documenten/kamerstukken/2024/04/02/kamerbrief-over-opvolging-moties-meerjarige-strategie-voor-sportverenigingen-en-openbare-zwembaden-in-publieke-handen-houden","Minister Helder (VWS) meldt de Tweede Kamer hoe zij de motie-Mohandis en de motie-Mohandis-Van Nispen wil uitvoeren. De motie-Mohandis vraagt om een meerjarige strategie voor sportverenigingen. De motie-Mohandis-Van Nispen verzoekt de regering samen met gemeenten tot een plan te komen om openbare zwembaden in publieke handen te houden.Kamerbrief uitvoering moties meerjarige strategie sportverenigingen en publiek eigendom openbare zwembaden",2024-04-03 08:53:54,"9f2572c9-9e80-4303-832b-e64db32d747d"
"Kamerbrief zorgbonus Zvw-pgb","https://www.rijksoverheid.nl/documenten/kamerstukken/2024/04/02/kamerbrief-over-zorgbonus-zvw-pgb","Minister Helder (VWS) informeert de Tweede Kamer over de zorgbonus voor zorgverleners die betaald worden met een persoonsgebonden budget vanuit de Zorgverzekeringswet (Zvw-pgb).Kamerbrief zorgbonus Zvw-pgb",2024-04-02 15:28:45,"b3178a5b-446c-4e22-ad6b-2d4e94c80608"
"Kamerbrief over scenario's om de financiering van onderzoek naar dementie te vergroten","https://www.rijksoverheid.nl/documenten/kamerstukken/2024/04/02/kamerbrief-over-scenario-s-om-de-financiering-van-onderzoek-naar-dementie-te-vergroten","Kamerbrief over scenario's om de financiering van onderzoek naar dementie te vergroten",2024-04-02 14:55:43,"a545cafd-234c-4504-82e7-9258e59299b0"
"Antwoorden op Kamervragen over vacaturetekst 'PhD-kandidaat: Vroegtijdig des- en misinformatie identificeren op sociale media' bij RIVM","https://www.rijksoverheid.nl/documenten/kamerstukken/2024/04/02/antwoorden-op-kamervragen-over-de-vacaturetekst-phd-kandidaat-vroegtijdig-des-en-misinformatie-identificeren-op-sociale-media-bij-het-rivm","Minister Helder (VWS) geeft antwoord op vragen over de vacaturetekst 'PhD-kandidaat: Vroegtijdig des- en misinformatie identificeren op sociale media' bij het RIVM. De Tweede Kamerleden Six Dijkstra en Daniëlle Jansen (beiden Nieuw Sociaal Contract) hebben de vragen gesteld. Antwoorden op Kamervragen over vacaturetekst 'PhD-kandidaat: Vroegtijdig des- en misinformatie identificeren op sociale media' bij RIVM",2024-04-02 14:53:56,"030543c0-e827-4436-aa28-e17f484b5b47"
"Kamerbrief over probleemanalyse inrichting financiële functie","https://www.rijksoverheid.nl/documenten/kamerstukken/2024/04/02/kamerbrief-over-probleemanalyse-inrichting-financiele-functie","Minister Helder (VWS) biedt de verkenning aan naar de inrichting van de financiële functie VWS en een probleemanalyse. Verder licht zij toe hoe de vastgestelde maatregelen bijdragen aan het oplossen van de geconstateerde problemen. Kamerbrief over probleemanalyse inrichting financiële functie",2024-04-02 14:32:41,"46f1d59b-8319-4aeb-a3a9-e074aa954522"
"Kamerbrief over regeling voor zorgmedewerkers met langdurige post-COVID klachten","https://www.rijksoverheid.nl/documenten/kamerstukken/2024/04/02/kamerbrief-over-regeling-voor-zorgmedewerkers-met-langdurige-post-covid-klachten","Minister Helder (VWS) informeert de Tweede Kamer over de Regeling voor zorgmedewerkers met langdurige post-COVID klachten. Kamerbrief over regeling voor zorgmedewerkers met langdurige post-COVID klachten",2024-04-02 14:30:32,"6403f663-31e1-4b97-801e-c7f243128dcc"
