"item_title","item_link","item_description","item_pub_date","item_guid"
"Uitstelbrief antwoorden Kamervragen over het bericht ‘Tientallen klachten van misbruik en mishandeling in Gelders jeugddorp’","https://www.rijksoverheid.nl/documenten/kamerstukken/2022/10/31/uitstelbrief-antwoorden-kamervragen-over-het-bericht-tientallen-klachten-van-misbruik-en-mishandeling-in-gelders-jeugddorp","Staatssecretaris Van Ooijen (VWS) meldt dat de antwoorden op vragen over het bericht ‘Tientallen klachten van misbruik en mishandeling in Gelders jeugddorp’ later komen dan gebruikelijk. De Tweede Kamerleden Richardson, Van den Hil en Verkuijlen (allen VVD) hebben de vragen gesteld.",2022-10-31 09:21:01,"e6c40028-4603-434f-8915-6922f6814cc5"
"Uitstelbrief Kamervragen klachten over misbruik en mishandeling jeugddorp De Glind","https://www.rijksoverheid.nl/documenten/kamerstukken/2022/10/27/uitstelbrief-antwoorden-kamervragen-over-de-tientallen-klachten-over-misbruik-en-mishandeling-in-jeugddorp-de-glind","Staatssecretaris Van Ooijen (VWS) meldt dat de antwoorden op vragen over de tientallen klachten over misbruik en mishandeling in jeugddorp De Glind later komen dan gebruikelijk. Het Tweede Kamerlid Van Haga (Groep Van Haga) heeft de vragen gesteld.",2022-10-27 11:30:00,"baab205f-2ce1-4265-96de-244d05e8cb51"
"Antwoorden op Kamervragen over vondst van plastic in veevoer, melk en vlees","https://www.rijksoverheid.nl/documenten/kamerstukken/2022/10/26/antwoorden-op-kamervragen-over-de-vondst-van-plastic-in-veevoer-melk-en-vlees","Minister Adema (LNV) geeft antwoord op vragen over de vondst van plastic in veevoer, melk en vlees. De Tweede Kamerleden Vestering en Van Esch (beiden PvdD) hebben de vragen gesteld.",2022-10-26 13:57:00,"590dbd2c-5437-465f-8ce4-4054f4667162"
"Uitstelbrief op Kamervragen over het bericht ‘Buiten het ziekenhuis dreigt een nijpend tekort aan artsen’","https://www.rijksoverheid.nl/documenten/kamerstukken/2022/10/25/uitstelbrief-antwoorden-kamervragen-over-het-bericht-buiten-het-ziekenhuis-dreigt-een-nijpend-tekort-aan-artsen","Minister Kuipers (VWS) meldt dat de antwoorden op vragen over het bericht ‘Buiten het ziekenhuis dreigt een nijpend tekort aan artsen’ later komen dan gebruikelijk. Het Tweede Kamerlid Van den Hil (VVD) heeft de vragen gesteld.",2022-10-25 10:19:00,"3df108a3-88fb-46b7-8f7a-685d4fab0066"
"Aanbiedingsbrief bij Nederlandse mondiale gezondheidsstrategie 2023-2030","https://www.rijksoverheid.nl/documenten/kamerstukken/2022/10/21/kamerbrief-inzake-nederlandse-mondiale-gezondheidsstrategie-2023-2030-samen-zorgen-voor-gezondheid-wereldwijd","Ministers Schreinemacher (Buitenlandse Handel en Ontwikkelingssamenwerking) en Kuipers (VWS) sturen de Tweede Kamer een aanbiedingsbrief over het rapport 'Nederlandse mondiale gezondheidsstrategie 2023 -2030: Samen zorgen voor gezondheid wereldwijd'.",2022-10-22 19:04:00,"346071ad-a67c-46e4-99c4-b7c2fab16e4d"
"Uitstelbrief antwoorden Kamervragen over de uitzending van In het vizier van De Jager over ouderenmishandeling","https://www.rijksoverheid.nl/documenten/kamerstukken/2022/10/21/uitstelbrief-antwoorden-kamervragen-over-de-uitzending-van-in-het-vizier-van-de-jager-over-ouderenmishandeling","Minister Helder (Langdurige Zorg en Sport) meldt dat de vragen van het lid Hijink (SP) over de uitzending van In het vizier van De Jager over ouderenmishandeling later komen dan gebruikelijk.",2022-10-21 15:26:00,"c0ec72dd-c2a1-49ce-aa3a-674e57c56625"
"Antwoorden op Kamervragen over stappen naar betere jeugdhulp","https://www.rijksoverheid.nl/documenten/kamerstukken/2022/10/21/antwoorden-op-kamervragen-over-stappen-naar-betere-jeugdhulp","Staatssecretaris Van Ooijen (VWS) meldt dat hij vragen over stappen naar betere jeugdhulp jeugdhulp niet op tijd kan beantwoorden. De vragen zijn gesteld dor het Tweede Kamerlid Maeijer (PVV).  Antwoorden op Kamervragen over stappen naar betere jeugdhulp (PDF | 4 pagina's | 182 kB)",2022-10-21 15:12:00,"1367dbaf-323b-40f8-bcb1-cf0748724c02"
"Antwoorden op Kamervragen over het bericht 'NVDI en STAP: samenstelling Alcoholtafel van het Nationaal Preventieakkoord leidt niet tot het gewenste resultaat'","https://www.rijksoverheid.nl/documenten/kamerstukken/2022/10/21/antwoorden-op-kamervragen-over-het-bericht-nvdi-en-stap-samenstelling-alcoholtafel-van-het-nationaal-preventieakkoord-leidt-niet-tot-het-gewenste-resultaat","Staatssecretaris Van Ooijen (VWS) stuurt de Tweede Kamer de antwoorden op vragen over het bericht 'NVDI en STAP: samenstelling Alcoholtafel van het Nationaal Preventieakkoord leidt niet tot het gewenste resultaat'. Het Tweede Kamerlid Van der Laan (D66) heeft de vragen gesteld.",2022-10-21 15:06:00,"0f89260c-e2f1-4fb6-97d0-fd2ff192445b"
"Antwoorden op Kamervragen over de berichten dat het aantal jongeren met suïcidale gedachten ook na corona hoog is en dat er een toename van zelfdodingen onder jongvolwassenen is","https://www.rijksoverheid.nl/documenten/kamerstukken/2022/10/21/antwoorden-op-kamervragen-over-de-berichten-dat-het-aantal-jongeren-met-suicidale-gedachten-ook-na-corona-hoog-is-en-dat-er-een-toename-van-zelfdodingen-onder-jongvolwassenen-is","Staatssecretaris Van Ooijen (VWS) geeft antwoord op vragen over de berichten dat het aantal jongeren met suïcidale gedachten ook na corona hoog is en dat er een toename van zelfdodingen onder jongvolwassenen is. De vragen zijn van het Kamerlid Raemakers (D66).",2022-10-21 14:51:00,"2438a2bb-7b50-4c5e-9ee2-9663c3028c60"
"Antwoorden op Kamervragen over bericht ‘Verpleeghuizen Curaçao in geldnood, ouderen moeten maaltijd delen'","https://www.rijksoverheid.nl/documenten/kamerstukken/2022/10/21/antwoorden-op-kamervragen-over-bericht-verpleeghuizen-curacao-in-geldnood-ouderen-moeten-maaltijd-delen","Staatssecretaris Van Huffelen (Koninkrijksrelaties en Digitalisering) geeft antwoord op vragen over het bericht ‘Verpleeghuizen Curaçao in geldnood, ouderen moeten maaltijd delen’. Het Tweede Kamerlid Bouchallikh (GroenLinks) heeft de vragen gesteld.",2022-10-21 14:51:00,"fabaabbf-b0ed-411e-8a3b-93651c3a982a"
"Uitstelbrief op Kamervragen over de sluiting van de huisartsenpost in Hengelo","https://www.rijksoverheid.nl/documenten/kamerstukken/2022/10/21/uitstelbrief-antwoorden-kamervragen-over-de-sluiting-van-de-huisartsenpost-in-hengelo","Minister Kuipers (VWS) meldt dat de antwoorden op vragen over de sluiting van de huisartsenpost in Hengelo later komen dan gebruikelijk. Het Tweede Kamerlid Hijink (SP) heeft de vragen gesteld.",2022-10-21 14:19:00,"c1716c51-7ee2-49b9-8de5-0a11eafa4ab8"
"Uitstelbrief antwoorden Kamervragen over het toenemende aantal COVID-patiënten in ziekenhuizen","https://www.rijksoverheid.nl/documenten/kamerstukken/2022/10/21/uitstelbrief-antwoorden-kamervragen-over-het-toenemende-aantal-covid-patienten-in-ziekenhuizen","Minister Kuipers (VWS) meldt dat de antwoorden op vragen over het toenemende aantal COVID-patiënten in ziekenhuizen later komen dan gebruikelijk. De vragen zijn gesteld door het Tweede Kamerlid Kuiken (PvdA).  Uitstelbrief antwoorden Kamervragen over het toenemende aantal COVID-patiënten in ziekenhuizen (PDF | 1 pagina | 69 kB)",2022-10-21 14:05:00,"276b9662-df90-46f8-8c6f-6872bf0273ba"
"Uitstelbrief antwoorden Kamervragen over Belgische zorgaanbieders die reclame maken in Zeeuws-Vlaanderen","https://www.rijksoverheid.nl/documenten/kamerstukken/2022/10/21/uitstelbrief-antwoorden-kamervragen-over-belgische-zorgaanbieders-die-reclame-maken-in-zeeuws-vlaanderen","Minister Kuipers (VWS) meldt dat de antwoorden op vragen over Belgische zorgaanbieders die reclame maken in Zeeuws-Vlaanderen later komen dan gebruikelijk. De vragen zijn gesteld door het Tweede Kamerlid Van den Berg (CDA).",2022-10-21 14:02:00,"ac7a1fb9-82d7-47c8-a860-506ee83a0856"
"Uitstelbrief antwoorden Kamervragen over mogelijke kabinetssteun bij voorbereiding op volgende pandemie","https://www.rijksoverheid.nl/documenten/kamerstukken/2022/10/21/uitstelbrief-antwoorden-kamervragen-over-het-bericht-wetenschappers-vragen-kabinet-om-steun-bij-voorbereiding-op-volgende-pandemie","Minister Kuipers (VWS) stelt de beantwoording uit van de Kamervragen over het bericht ‘Wetenschappers vragen kabinet om steun bij voorbereiding op volgende pandemie’. De vragen zijn gesteld door het Tweede Kamerlid Tielen (VVD).",2022-10-21 13:51:00,"76ac56c7-ae36-46e6-9c9d-eb5183093b2a"
"Uitstelbrief antwoorden Kamervragen over onderbreking datastroom RIVM vaccinatiecampagnes","https://www.rijksoverheid.nl/documenten/kamerstukken/2022/10/21/uitstelbrief-antwoorden-kamervragen-over-onderbreking-datastroom-rivm-met-betrekking-tot-vaccinatiecampagnes","Minister Kuipers (VWS) meldt dat hij vragen niet op tijd kan beantwoorden. De vragen gaan over de onderbreking van de datastroom bij het Rijksinstituut voor Volksgezondheid en Milieu (RIVM) met betrekking tot vaccinatiecampagnes. Het Tweede Kamerlid Van Haga (Groep-Van Haga) heeft deze vragen gesteld.",2022-10-21 13:44:00,"e70b895e-8b02-4a8a-97b4-65f48ee6bd78"
"Uitstelbrief antwoorden Kamervragen over nieuwe coronagolf, terugkeer influenza en vaccinatiecampagnes","https://www.rijksoverheid.nl/documenten/kamerstukken/2022/10/21/uitstelbrief-antwoorden-kamervragen-over-de-nieuwe-coronagolf-de-terugkeer-van-influenza-en-de-vaccinatiecampagnes","Minister Kuipers (VWS) meldt dat hij vragen niet op tijd kan beantwoorden. De vragen gaan over de nieuwe coronagolf, de terugkeer van influenza en de vaccinatiecampagnes. Het Tweede Kamerlid Van Haga (Groep-Van Haga) heeft de vragen gesteld.",2022-10-21 13:39:00,"22b4df19-4c44-464c-8131-a2a6ecfb013b"
"Uitstelbrief op Kamervragen over het bericht ‘Jo kan al maanden niet de deur uit omdat zijn geleidehond is afgepakt’","https://www.rijksoverheid.nl/documenten/kamerstukken/2022/10/21/uitstelbrief-antwoorden-kamervragen-over-het-bericht-jo-kan-al-maanden-niet-de-deur-uit-omdat-zijn-geleidehond-is-afgepakt","Minister Helder (Langdurige Zorg en Sport) meldt dat de antwoorden op vragen over het bericht ‘Jo kan al maanden niet de deur uit omdat zijn geleidehond is afgepakt’ later komen dan gebruikelijk. Het Tweede Kamerlid Werner (CDA) heeft de vragen gesteld.",2022-10-21 13:30:00,"4f99f377-6be7-43cd-ba93-9b410fc1b9d2"
"Kamerbrief met reactie op artikelen en overzicht wachtlijsten GGZ","https://www.rijksoverheid.nl/documenten/kamerstukken/2022/10/21/kamerbrief-verzoek-aan-de-minister-voor-langdurige-zorg-en-sport-om-een-reactie-op-twee-artikelen-en-een-verzoek-om-een-overzicht-van-wachtlijsten-in-de-ggz","Minister Helder (Langdurige Zorg en Sport) reageert op de artikelen “Dimence groep kiest voor eigen invulling landelijk kwaliteitsstatuut GGZ” en “Zorgvisie over de GGZ”. Ook reageert de minister op een verzoek om een overzicht van wachtlijsten in de GGZ. De Tweede Kamer had hier om verzocht.",2022-10-21 13:22:00,"e7bb4971-cc62-474e-a6d4-386d3a75a9dd"
"Antwoorden op Kamervragen over verzamelbrief ggz en rode draden analyse NZa","https://www.rijksoverheid.nl/documenten/kamerstukken/2022/10/21/kamerbrief-over-verzamelbrief-ggz-en-rode-draden-analyse-nza","Minister Helder (Langdurige Zorg en Sport) geeft antwoord op vragen over de verzamebrief van 7 juli 2022 over ggz en rode draden analyse en verkenning van de Nederlandse Zorgautoriteit (NZa) over (voorgenomen) sluitingen en veranderingen in behandelaanbod. De vragen zijn gesteld door de fracties van VVD, D66, CDA, PvdA en GroenLinks in de Tweede Kamer.",2022-10-21 12:57:00,"9bfb10f1-9b49-4266-84f0-b2040b2177bd"
"Kamerbrief over aanbieding eindrapport wetsevaluatie Wvggz-Wzd","https://www.rijksoverheid.nl/documenten/kamerstukken/2022/10/21/kamerbrief-over-aanbieding-eindrapport-wetsevaluatie-wvggz-wzd","Minister Helder (Langdurige Zorg en Sport) biedt de Tweede Kamer het eindrapport wetsevaluatie Wet verplichte geestelijke gezondheidszorg (Wvggz) en Wet zorg en dwang psychogeriatrische en verstandelijk gehandicapte cliënten (Wzd) aan. Deze stukken zijn ook aan de Eerste Kamer verstuurd.",2022-10-21 12:53:00,"ff436c1e-aa1b-4b08-a5eb-3f97aff60692"
