"item_title","item_link","item_description","item_pub_date","item_guid"
"Kamerbrief over Stand van zaken geboortezorg ","https://www.rijksoverheid.nl/documenten/kamerstukken/2024/04/22/kamerbrief-over-stand-van-zaken-geboortezorg","Kamerbrief over Stand van zaken geboortezorg",2024-04-22 15:01:32,"157f82f1-eacf-4aa3-95a1-06091c9053ba"
"Kamerbrief over verzoek tranchering eigen risico in medisch-specialistische zorg opnieuw in overweging te nemen","https://www.rijksoverheid.nl/documenten/kamerstukken/2024/04/22/kamerbrief-over-verzoek-tranchering-eigen-risico-in-medisch-specialistische-zorg-opnieuw-in-overweging-te-nemen","Minister Dijkstra (Medische Zorg) stuurt de Tweede Kamer een verzoek om de tranchering eigen risico in medisch-specialistische zorg opnieuw in overweging te nemen en de algemene maatregel van bestuur (AMvB) verder in behandeling te nemen met daarbij het streven dat de maatregel per 1 januari 2025 in werking kan treden. De Eerste Kamer heeft eenzelfde brief gekregen.Kamerbrief over verzoek tranchering eigen risico in medisch-specialistische zorg opnieuw in overweging te nemen",2024-04-22 15:01:01,"87791e96-56d8-4a7b-9666-33547f982614"
"Aanbiedingsbrief bij handreikingen over vertegenwoordiging","https://www.rijksoverheid.nl/documenten/kamerstukken/2024/04/22/kamerbrief-over-aanbieding-handreikingen-over-vertegenwoordiging","Minister Helder (VWS) biedt de Tweede Kamer de handreikingen waarvan één zich specifiek richt op zorgverleners en de ander op cliënten en hun vertegenwoordigers aan.Aanbiedingsbrief bij handreikingen over vertegenwoordiging",2024-04-22 14:44:56,"30da957c-7f79-4383-b1f9-23bebec349ad"
"Kamerbrief over intrekken instellingsbesluit begeleidingscommissie herinrichting academisch zorglandschap","https://www.rijksoverheid.nl/documenten/kamerstukken/2024/04/22/kamerbrief-over-intrekken-instellingsbesluit-begeleidingscommissie-herinrichting-academisch-zorglandschap","Minister Dijkstra (Medische Zorg) informeert de Tweede Kamer over het vervolg en het beëindigen van de begeleidingscommissie herinrichting academisch zorglandschap. Kamerbrief over intrekken instellingsbesluit begeleidingscommissie herinrichting academisch zorglandschap",2024-04-22 14:34:36,"6ba51264-f935-48f1-9f6c-d4cccffcebd6"
"Antwoorden op Kamervragen over RIVM-rapport 'Epidemiological impact and effectiveness of COVID-19 measures'","https://www.rijksoverheid.nl/documenten/kamerstukken/2024/04/22/kamerbrief-over-beantwoording-van-vragen-over-het-rivm-rapport-epidemiological-impact-and-effectiveness-of-covid-19-measures","Minister Dijkstra (Medische Zorg) stuurt de Eerste Kamer haar antwoorden op vragen over een rapport van het Rijksinstituut voor Volksgezondheid en Milieu (RIVM), getiteld 'Epidemiological impact and effectiveness of COVID-19 measures'. Over dit rapport hadden de Eerste Kamerfracties van CDA, SGP en SP vragen gesteld. Antwoorden op Kamervragen over RIVM-rapport 'Epidemiological impact and effectiveness of COVID-19 measures'",2024-04-22 13:41:10,"c8403da7-de4b-4793-bef2-7c0c2e2bb0cf"
"Kamerbrief Sluiskandidaten tweede helft 2024","https://www.rijksoverheid.nl/documenten/kamerstukken/2024/04/22/kamerbrief-sluiskandidaten-tweede-helft-2024","Minister Dijkstra (Medische Zorg) stuurt een afschrift van de publicatie naar de Tweede Kamer van het Zorginstituut Nederland over de behandelingen met geneesmiddelen die op basis van de Horizonscan Geneesmiddelen aangemerkt zijn als kandidaat voor de pakketsluis. In de publicatie staat ook de stand van zaken van eerder aangekondigde sluiskandidaten.Kamerbrief Sluiskandidaten tweede helft 2024",2024-04-22 13:32:31,"88a0abea-074c-4985-8fad-0e1a911934ce"
"Kamerbrief aanbieding ontwerpbesluit risicoverevening 2023-2024","https://www.rijksoverheid.nl/documenten/kamerstukken/2024/04/22/kamerbrief-over-aanbieding-ontwerpbesluit-houdende-wijziging-van-het-besluit-zorgverzekering-i-v-m-risicoverevening-2023-2024","Minister Dijkstra (Medische Zorg) biedt het ontwerpbesluit aan in verband met de invoering van maatregelen voor de vereveningsjaren 2023 en 2024. De Eerste Kamer heeft eenzelfde brief gekregen.Kamerbrief aanbieding ontwerpbesluit risicoverevening 2023-2024",2024-04-22 13:30:34,"26a39367-0515-46d6-9748-a8c2074c84e1"
"Kamerbrief voortgang vervolgtraject excuses slavernijverleden voorjaar 2024","https://www.rijksoverheid.nl/documenten/kamerstukken/2024/04/22/tk-voortgangsbrief-slavernijverleden-voorjaar-2024","Staatssecretaris Van Huffelen (Koninkrijksrelaties en Digitalisering), minister De Jonge (BZK), minister Bruins Slot (BZ), minister Dijkgraaf (OCW), minister Van Gennip (SZW), minister Weerwind (Rechtsbescherming), staatssecretaris Van Ooijen (VWS) en staatssecretaris Gräper-van Koolwijk (OCW) informeren de Tweede Kamer over de voortgang van de opvolging van de excuses voor het slavernijverleden. De Eerste Kamer heeft eenzelfde brief gekregen.Kamerbrief voortgang vervolgtraject excuses slavernijverleden voorjaar 2024",2024-04-22 13:29:29,"0d9b3d5f-c8e1-42f4-9847-98839e12bfd0"
"Kamerbrief over 3-den; aangeboden petitie met betrekking tot ouderenzorg","https://www.rijksoverheid.nl/documenten/kamerstukken/2024/04/22/kamerbrief-inzake-3-den-aangeboden-petitie-met-betrekking-tot-ouderenzorg","Minister Helder (VWS) stuurt de Tweede Kamer haar algemene reactie over de petitie over ouderenzorg en gaat daarna in op de specifieke aanbevelingen in de petitie. Dit op verzoek van de vaste commissie voor Volksgezondheid, Welzijn en Sport.Kamerbrief over 3-den; aangeboden petitie met betrekking tot ouderenzorg",2024-04-22 12:02:53,"4f733592-88a7-40e3-a5b2-eeea0fc3bb02"
"Kamerbrief over Nivel-onderzoek naar vertrouwen in databeschikbaarheid van gezondheidsgegevens voor primair en secundair gebruik","https://www.rijksoverheid.nl/documenten/kamerstukken/2024/04/22/kamerbrief-over-nivel-onderzoek-naar-vertrouwen-in-databeschikbaarheid-van-gezondheidsgegevens-voor-primair-en-secundair-gebruik","Minister Helder (VWS) stuurt de Tweede Kamer de uitkomsten van het Nivel-onderzoek naar vertrouwen in databeschikbaarheid van gezondheidsgegevens voor primair en secundair gebruik.Kamerbrief over Nivel-onderzoek naar vertrouwen in databeschikbaarheid van gezondheidsgegevens voor primair en secundair gebruik",2024-04-22 11:01:12,"e307c27b-264f-4e8c-8e2f-4251fb485d9a"
"Aanbiedingsbrief bij rapport over inclusieve ouderenzorg","https://www.rijksoverheid.nl/documenten/kamerstukken/2024/04/22/kamerbrief-over-aanbieding-rapport-over-inclusieve-ouderenzorg","Minister Helder (VWS) biedt de Tweede Kamer het rapport 'Hoe inclusief is de Nederlandse langdurige zorg voor ouderen met een migratieachtergrond?' aan.Aanbiedingsbrief bij rapport over inclusieve ouderenzorg",2024-04-22 09:01:48,"9693e89f-ddc5-4f69-8e3a-d2754528b008"
"Kamerbrief over moties debat acute zorg","https://www.rijksoverheid.nl/documenten/kamerstukken/2024/04/22/kamerbrief-over-moties-debat-acute-zorg","Minister Dijkstra (Medische Zorg) reageert op de moties die zij heeft ontraden en die de Tweede Kamer heeft aangenomen. Het gaat daarbij over twee moties over het voorkomen van sluitingen van afdelingen van ziekenhuizen en twee moties specifiek over het Zuyderland ziekenhuis.Kamerbrief over moties debat acute zorg",2024-04-22 08:42:29,"4311810e-7c22-423a-a761-9f6066b26a12"
"Uitstelbrief op Kamervragen over verspreiding van medische misinformatie op sociale media","https://www.rijksoverheid.nl/documenten/kamerstukken/2024/04/19/uitstelbrief-op-kamervragen-over-verspreiding-van-medische-misinformatie-op-sociale-media","Minister Dijkstra (Medische Zorg) meldt dat de antwoorden op vragen over verspreiding van medische misinformatie op sociale media later komen dan gebruikelijk. Het Tweede Kamerlid Paulusma (D66) heeft de vragen gesteld.Uitstelbrief op Kamervragen over verspreiding van medische misinformatie op sociale media",2024-04-19 15:02:49,"3351efd2-c2ba-4b6a-955f-368c22ca2e34"
"Antwoorden op Kamervragen over het evenement 'Navigating Nicotine Regulation: Insights from Sweden'","https://www.rijksoverheid.nl/documenten/kamerstukken/2024/04/19/antwoorden-op-kamervragen-over-het-evenement-navigating-nicotine-regulation-insights-from-sweden-26-maart-2024-in-nieuwspoort","Staatssecretaris Van Ooijen (VWS) geeft antwoord op vragen over het evenement 'Navigating Nicotine Regulation: Insights from Sweden'. De Tweede Kamerleden Daniëlle Jansen (NSC) en Krul (CDA) hebben de vragen gesteld.Antwoorden op Kamervragen over het evenement 'Navigating Nicotine Regulation: Insights from Sweden'",2024-04-19 13:13:44,"0fa84bcc-541a-4371-b453-033010bd16f5"
"Antwoorden op aanvullende Eerste Kamervragen over RIVM-advies Wet publieke gezondheid","https://www.rijksoverheid.nl/documenten/kamerstukken/2024/04/18/kamerbrief-over-beantwoording-eerste-kamervragen-m-b-t-advies-rivm","Minister Dijkstra (Medische Zorg) geeft antwoord op vragen over het advies van het RIVM over de Wet publieke gezondheid. De Eerste Kamerfracties van JA21 en PVV hebben deze vragen gesteld.Antwoorden op aanvullende Eerste Kamervragen over RIVM-advies Wet publieke gezondheid",2024-04-18 13:36:31,"b4c9ba59-2a54-4947-b126-aa76d80c6bea"
"Antwoorden op Kamervragen over het bericht 'Coffeeshops Tilburg en Breda mogen meer legale cannabisvoorraad in huis hebben: 'genoeg voor een week''","https://www.rijksoverheid.nl/documenten/kamerstukken/2024/04/18/antwoorden-op-kamervragen-over-het-bericht-coffeeshops-tilburg-en-breda-mogen-meer-legale-cannabisvoorraad-in-huis-hebben-genoeg-voor-een-week","Minister Dijkstra (Medische Zorg) en minister Yeşilgöz-Zegerius (JenV) geven antwoord op vragen over het bericht 'Coffeeshops Tilburg en Breda mogen meer legale cannabisvoorraad in huis hebben: 'genoeg voor een week''. De Tweede Kamerleden Bikker (ChristenUnie), Krul (CDA), Van Dijk (SGP) en Jansen (Nieuw Sociaal Contract) hebben de vragen gesteld.Antwoorden op Kamervragen over het bericht 'Coffeeshops Tilburg en Breda mogen meer legale cannabisvoorraad in huis hebben: 'genoeg voor een week''",2024-04-18 13:07:45,"12385904-b26d-422a-93f7-7b4930c77676"
" Antwoorden Kamervragen over dakloze ouderen zonder verblijfsvergunning in Nederland","https://www.rijksoverheid.nl/documenten/kamerstukken/2024/04/18/antwoorden-kamervragen-over-het-bericht-mostafa-is-ongedocumenteerd-op-leeftijd-en-nergens-welkom-behalve-in-de-pauluskerk-in-rotterdam","Staatssecretaris Van der Burg (JenV) geeft antwoorden op Kamervragen naar aanleiding van het bericht 'Mostafa is ongedocumenteerd, op leeftijd en nergens welkom - behalve in de Pauluskerk in Rotterdam'. Het Tweede Kamerlid Podt (D66) had de vragen gesteld. Antwoorden Kamervragen over dakloze ouderen zonder verblijfsvergunning in Nederland",2024-04-18 12:06:38,"ea507681-5cd5-4d52-930e-5406b907cefe"
"Antwoorden op Kamervragen over de noodkreet van MSD-baas 'Kankerpatiënt eindeloos in wachtkamer voor nieuwe behandelingen'","https://www.rijksoverheid.nl/documenten/kamerstukken/2024/04/18/antwoorden-op-kamervragen-over-de-noodkreet-van-msd-baas-kankerpatient-eindeloos-in-wachtkamer-voor-nieuwe-behandelingen","Minister Dijkstra (Medische Zorg) geeft antwoord op vragen over de noodkreet van MSD-baas 'Kankerpatiënt eindeloos in wachtkamer voor nieuwe behandelingen'. Het Tweede Kamerlid Van der Plas (BBB) heeft de vragen gesteld.Antwoorden op Kamervragen over de noodkreet van MSD-baas 'Kankerpatiënt eindeloos in wachtkamer voor nieuwe behandelingen'",2024-04-18 09:23:51,"156acec5-999e-4c2b-a139-c1d77557d793"
"Kamerbrief reactie op rapport ‘Opkomst van bedrijfsketens in de huisartsenzorg’","https://www.rijksoverheid.nl/documenten/kamerstukken/2024/04/18/kamerbrief-over-verzoek-om-tijdige-toezending-inhoudelijke-reactie-rapport-opkomst-van-bedrijfsketens-in-de-huisartsenzorg","Staatssecretaris Dijkstra (Medische Zorg) en minister Helder (VWS) reageren op het rapport ‘Opkomst van bedrijfsketens in de huisartsenzorg’ van de Nederlandse Zorgautoriteit (NZa) en Inspectie Gezondheidszorg en Jeugd (IGJ).Kamerbrief reactie op rapport ‘Opkomst van bedrijfsketens in de huisartsenzorg’",2024-04-18 09:13:15,"2f0fb7de-848e-473b-b957-73fec071491b"
"Kamerbrief met reactie op motie-Dijk over het aanbesteden van zorg niet meer wettelijk verplicht stellen","https://www.rijksoverheid.nl/documenten/kamerstukken/2024/04/17/kamerbrief-over-motie-dijk-over-het-aanbesteden-van-zorg-niet-meer-wettelijk-verplicht-stellen-29023-nr-464","Minister Helder (VWS) stuurt de Tweede Kamer een reactie op motie-Dijk (SP). Met deze motie wordt de regering verzocht het aanbesteden van zorg niet meer wettelijk verplicht te stellen en de juridische hindernissen weg te nemen voor het oprichten van een gemeentelijke zorgorganisatie of het overgaan op een subsidierelatie.Kamerbrief met reactie op motie-Dijk over het aanbesteden van zorg niet meer wettelijk verplicht stellen",2024-04-18 08:33:14,"ab7586ec-c483-4f1d-9108-3e0189ba53f4"
