"item_title","item_link","item_description","item_pub_date","item_guid"
"Kamerbrief over stimuleren innovatieve geneesmiddelenontwikkeling","https://www.rijksoverheid.nl/documenten/kamerstukken/2023/12/19/kamerbrief-over-stimuleren-innovatieve-geneesmiddelenontwikkeling","Minister Kuipers (VWS) informeert de Tweede Kamer over het stimuleren van innovatieve geneesmiddelenontwikkeling.Kamerbrief over stimuleren innovatieve geneesmiddelenontwikkeling",2023-12-19 10:45:30,"365e2900-607a-4a5c-95e8-971da0fac2ff"
"Aanbiedingsbrief over tweede voortgangsrapportage Aanpak geldzorgen, armoede en schulden","https://www.rijksoverheid.nl/documenten/kamerstukken/2023/12/19/aanbiedingsbrief-over-tweede-voortgangsrapportage-aanpak-geldzorgen-armoede-en-schulden","Minister Schouten (Armoedebeleid, Participatie en Pensioenen) stuurt, mede namens de minister van Binnenlandse Zaken en Koninkrijksrelaties, de minister van Economische Zaken en Klimaat, de minister van Onderwijs, Cultuur en Wetenschap, de minister van Sociale Zaken en Werkgelegenheid, de minister voor Primair en Voortgezet Onderwijs, de minister voor Rechtsbescherming, de minister voor Volkshuisvesting en Ruimtelijke Ordening, de staatssecretaris Fiscaliteit en Belastingdienst, de staatssecretaris Koninkrijksrelaties en Digitalisering, de staatssecretaris Toeslagen en Douane en de staatssecretaris van Volksgezondheid, Welzijn en Sport, de tweede voortgangsrapportage van de aanpak geldzorgen, armoede en schulden. Dit is de aanbiedingsbrief. Een vergelijkbare brief is naar de Eerste Kamer gestuurd.Aanbiedingsbrief over tweede voortgangsrapportage Aanpak geldzorgen, armoede en schulden",2023-12-19 10:40:20,"95b3d74a-a074-42fd-85c4-9e402c6f439d"
"Kamerbrief over Verbeteragenda Doelgroepenvervoer","https://www.rijksoverheid.nl/documenten/kamerstukken/2023/12/18/kamerbrief-over-verbeteragenda-doelgroepenvervoer","Staatssecretaris Van Ooijen (VWS) informeert de Tweede Kamer over de Verbeteragenda Doelgroepenvervoer.Kamerbrief over Verbeteragenda Doelgroepenvervoer",2023-12-18 16:53:06,"6175d6b4-5bf3-401a-ac21-dfb95716f17f"
"Antwoorden op Kamervragen over 2 lopende acties om via crowdfunding geld in te zamelen voor een kankerbehandeling","https://www.rijksoverheid.nl/documenten/kamerstukken/2023/12/18/antwoorden-op-kamervragen-over-over-twee-lopende-acties-om-via-crowdfunding-geld-in-te-zamelen-voor-een-kankerbehandeling","Minister Kuipers (VWS) beantwoordt vragen over 2 lopende acties om via crowdfunding geld in te zamelen voor een kankerbehandeling. De vragen zijn gesteld door het Kamerlid Agema (PVV).Antwoorden op Kamervragen over 2 lopende acties om via crowdfunding geld in te zamelen voor een kankerbehandeling",2023-12-18 16:50:03,"4101107e-f0f8-43b2-ba42-0680d037306b"
"Uitstelbrief op Kamervragen over het bericht ‘Medicijnen van verzekerden bij VGZ volgend jaar mogelijk niet of deels vergoed’","https://www.rijksoverheid.nl/documenten/kamerstukken/2023/12/18/uitstelbrief-op-kamervragen-over-het-bericht-medicijnen-van-verzekerden-bij-vgz-volgend-jaar-mogelijk-niet-of-deels-vergoed","Minister Kuipers (VWS) meldt dat de antwoorden op vragen over het bericht ‘Medicijnen van verzekerden bij VGZ volgend jaar mogelijk niet of deels vergoed’, later komen dan gebruikelijk. De vragen zijn van het Kamerlid Dijk (SP).Uitstelbrief op Kamervragen over het bericht ‘Medicijnen van verzekerden bij VGZ volgend jaar mogelijk niet of deels vergoed’",2023-12-18 16:43:27,"45676c78-5bd8-48a0-923e-115c4c1765c6"
"Kamerbrief over de ontwikkelingen in bevolkingsonderzoeken naar kanker 2023 met de monitors van 2022","https://www.rijksoverheid.nl/documenten/kamerstukken/2023/12/18/kamerbrief-over-de-ontwikkelingen-in-bevolkingsonderzoeken-naar-kanker-2023-met-de-monitors-van-2022","Minister Kuipers (VWS) informeert de Tweede Kamer over de ontwikkelingen in bevolkingsonderzoeken naar kanker 2023 met de monitors van 2022.Kamerbrief over de ontwikkelingen in bevolkingsonderzoeken naar kanker 2023 met de monitors van 2022",2023-12-18 16:00:53,"1b9c02d2-d84d-4955-8972-834292e27385"
" Kamerbrief inzake Voortgang beschikbaarheid medische producten ","https://www.rijksoverheid.nl/documenten/kamerstukken/2023/12/18/kamerbrief-inzake-voortgang-beschikbaarheid-medische-producten","Kamerbrief inzake Voortgang beschikbaarheid medische producten",2023-12-18 15:51:37,"28100c82-64bd-4ff7-9d91-ef784050be3b"
"Kamerbrief over Reactie op de Nederlandse Kanker Agenda","https://www.rijksoverheid.nl/documenten/kamerstukken/2023/12/18/kamerbrief-over-reactie-op-de-nederlandse-kanker-agenda","Kamerbrief over Reactie op de Nederlandse Kanker Agenda",2023-12-18 15:41:20,"cc8e4350-e15c-4816-92b4-98159f22b8d3"
"Kamerbrief over aanbieding Samenvattend rapport uitvoering Wlz 2022-2023","https://www.rijksoverheid.nl/documenten/kamerstukken/2023/12/18/kamerbrief-over-aanbieding-samenvattend-rapport-uitvoering-wlz-2022-2023","De Eerste Kamer heeft eenzelfde brief gekregenKamerbrief over aanbieding Samenvattend rapport uitvoering Wlz 2022-2023",2023-12-18 15:39:07,"ebdb6e3c-cdd5-4536-9d5f-790523651f22"
"Voortgangsbrief uithuisplaatsingen kinderopvangtoeslagaffaire UHP KOT december 2023","https://www.rijksoverheid.nl/documenten/kamerstukken/2023/12/18/tk-voortgangsbrief-uithuisplaatsingen-kinderopvangtoeslagaffaire-uhp-kot-mei-2023","Minister Weerwind (Rechtsbescherming) informeert de Tweede Kamer over de voortgang van de aanpak voor gedupeerde gezinnen van de kinderopvangtoeslagaffaire die te maken hebben (gehad) met uithuisplaatsing (UHP KOT).Voortgangsbrief uithuisplaatsingen kinderopvangtoeslagaffaire UHP KOT december 2023",2023-12-18 15:33:49,"5169d211-4515-4cfb-a332-58c8517be50e"
"Kamerbrief over diverse onderwerpen met betrekking tot COVID-19 virus","https://www.rijksoverheid.nl/documenten/kamerstukken/2023/12/18/kamerbrief-over-diverse-onderwerpen-met-betrekking-tot-het-covid-19-virus","Minsiter Kuipers (VWS) informeert de Tweede Kamer over  de stand van zaken op een aantal COVID-19 gerelateerde onderwerpen. De Eerste Kamer heeft een afschrift van deze brief gekregen.Kamerbrief over diverse onderwerpen met betrekking tot COVID-19 virus",2023-12-18 15:32:39,"167cd01b-7f97-44c2-bb3d-a2cb4774c23c"
"Kamerbrief over Voortgangsbrief Jeugd","https://www.rijksoverheid.nl/documenten/kamerstukken/2023/12/18/kamerbrief-over-voortgangsbrief-jeugd","De Eerste Kamer heeft een afschrift van deze brief gekregenKamerbrief over Voortgangsbrief Jeugd",2023-12-18 15:25:17,"a01e233c-d2d1-4491-9f0c-1c1acb12beb9"
"Antwoorden op Kamervragen over vernietiging van persoonlijke beschermingsmiddelen en medische hulpmiddelen ","https://www.rijksoverheid.nl/documenten/kamerstukken/2023/12/18/antwoorden-op-kamervragen-over-de-vernietiging-van-persoonlijke-beschermingsmiddelen-en-medische-hulpmiddelen-die-zijn-ingekocht-ten-behoeve-van-het-bestrijden-van-de-coronacrisis","Minister Kuipers (VWS) geeft antwoord op vragen over de vernietiging van persoonlijke beschermingsmiddelen en medische hulpmiddelen die zijn ingekocht ten behoeve van het bestrijden van de coronacrisis. De vragen zijn gesteld door het lid Van Haga (Groep Van Haga).Antwoorden op Kamervragen over vernietiging van persoonlijke beschermingsmiddelen en medische hulpmiddelen",2023-12-18 15:18:44,"2394e1c7-fd6a-41bd-b0e7-f577ca12c47b"
"Antwoorden op Kamervragen over het bericht dat spoedeisendehulppersoneel wegloopt door schaalvergroting van ziekenhuizen ","https://www.rijksoverheid.nl/documenten/kamerstukken/2023/12/15/antwoorden-op-kamervragen-over-het-bericht-dat-spoedeisendehulppersoneel-wegloopt-door-schaalvergroting-van-ziekenhuizen","Minister Kuipers (VWS) geeft antwoord op vragen over het bericht dat spoedeisendehulppersoneel wegloopt door schaalvergroting van ziekenhuizen . Het Tweede Kamerlid Agema (PVV) heeft de vragen gesteld.Antwoorden op Kamervragen over het bericht dat spoedeisendehulppersoneel wegloopt door schaalvergroting van ziekenhuizen",2023-12-18 15:04:01,"9a38081f-591a-4a55-aead-8b91fa37208b"
"Uitstelbrief op Kamervragen over het bericht 'Gegevens HoNOS+ vragenlijst niet met terugwerkende kracht verwijderd' en de bijbehorende radio-uitzending over dit onderwerp van Argos op zaterdag 25 november jongstleden ","https://www.rijksoverheid.nl/documenten/kamerstukken/2023/12/18/uitstelbrief-op-kamervragen-over-het-bericht-gegevens-honos-vragenlijst-niet-met-terugwerkende-kracht-verwijderd-en-de-bijbehorende-radio-uitzending-over-dit-onderwerp-van-argos-op-zaterdag-25-november-jongstleden","Uitstelbrief op Kamervragen over het bericht 'Gegevens HoNOS+ vragenlijst niet met terugwerkende kracht verwijderd' en de bijbehorende radio-uitzending over dit onderwerp van Argos op zaterdag 25 november jongstleden",2023-12-18 14:47:56,"c48f7970-5b9e-48c8-b29f-3ed3d3250012"
"Kamerbrief over Meerjarenbeleidsplan IGJ 2024-2027","https://www.rijksoverheid.nl/documenten/kamerstukken/2023/12/18/kamerbrief-over-meerjarenbeleidsplan-igj-2024-2027","Minister Kuipers (VWS) stuurt het nieuwe meerjarenbeleidsplan naar de Tweede Kamer van de Inspectie Gezondheidszorg en Jeugd 2024-2027: Toezicht op de zorg van nu en in de toekomst.Kamerbrief over Meerjarenbeleidsplan IGJ 2024-2027",2023-12-18 14:37:38,"57ac938a-4439-42a3-8c2b-3566d6173ba1"
"Antwoorden op Kamervragen over bericht 1e gegevensuitwisseling onder Wegiz verplicht","https://www.rijksoverheid.nl/documenten/kamerstukken/2023/12/15/antwoorden-op-kamervragen-over-het-bericht-1e-gegevensuitwisseling-onder-wegiz-verplicht-versturen-van-recept-door-huisarts-aan-terhandsteller","Minister Kuipers (VWS) stuurt de Tweede Kamer de antwoorden op vragen over het bericht 1e gegevensuitwisseling onder Wegiz verplicht: Versturen van recept door huisarts aan terhandsteller. Het Tweede Kamerlid Van den Berg (CDA) heeft de vragen gesteld.Antwoorden op Kamervragen over bericht 1e gegevensuitwisseling onder Wegiz verplicht",2023-12-18 14:25:14,"43752ef1-ff30-46db-b170-a385d6728bb4"
"Kamerbrief met overzicht beleidsmatige mutaties na Najaarsnota en 2e suppletoire wet 2023 op begroting VWS","https://www.rijksoverheid.nl/documenten/kamerstukken/2023/12/15/kamerbrief-over-veegbrief-2023","Minister Kuipers (VWS) stuurt de Tweede Kamer  een overzicht van de beleidsmatige mutaties die zijn opgetreden na de Najaarsnota en de bijbehorende 2e suppletoire wet 2023 op de begroting van VWS. De Eerste Kamer heeft eenzelfde brief gekregen. Kamerbrief met overzicht beleidsmatige mutaties na Najaarsnota en 2e suppletoire wet 2023 op begroting VWS",2023-12-18 14:24:07,"549d39d9-6d39-4b1b-a60c-6a26fd2e31c2"
"Kamerbrief over Ontwikkelingen Caribisch Nederland 2023","https://www.rijksoverheid.nl/documenten/kamerstukken/2023/12/18/kamerbrief-over-ontwikkelingen-caribisch-nederland-2023","Staatssecretaris Van Ooijen (VWS) informeert de Tweede Kamer over de stand van zaken van een aantal ontwikkelingen in Caribisch Nederland.Kamerbrief over Ontwikkelingen Caribisch Nederland 2023",2023-12-18 14:05:23,"31bf96a7-6a85-4dca-8afa-f484c31c1c74"
"Kamerbrief over Jaarverslag 2022 PGT Nederland","https://www.rijksoverheid.nl/documenten/kamerstukken/2023/12/18/kamerbrief-over-jaarverslag-2022-pgt-nederland","Minister Kuipers (VWS) stuurt het jaarverslag 2022 van PGT Nederland naar de Tweede Kamer. PGT Nederland is de organisatie die verantwoordelijk is voor het uitvoeren van preïmplantatie genetische testen (PGT)1 in ons land.Kamerbrief over Jaarverslag 2022 PGT Nederland",2023-12-18 13:58:18,"2f8ec19e-62e6-4a1e-9332-ad7fdb98b54d"
