"item_title","item_link","item_description","item_pub_date","item_guid"
"Kamerbrief onderzoeksrapportage naar problematiek kinderen van arbeidsmigranten","https://www.rijksoverheid.nl/documenten/kamerstukken/2024/05/13/kamerbrief-onderzoeksrapportage-naar-problematiek-kinderen-van-arbeidsmigranten","Minister Van Gennip stuurt, mede namens de staatssecretaris van Volksgezondheid, Welzijn en Sport en de minister voor Primair en Voortgezet Onderwijs, het onderzoeksrapport ‘Kwetsbaarheid en veerkracht’ en gaat in op de resultaten en aanbevelingen.Kamerbrief onderzoeksrapportage naar problematiek kinderen van arbeidsmigranten",2024-05-13 16:29:54,"06dc1d29-8153-46a5-9e34-c225ecf44e03"
"Kamerbrief met reactie over de IHR en het pandemieakkoord tijdens de Wereldgezondheidsvergadering","https://www.rijksoverheid.nl/documenten/kamerstukken/2024/05/13/kamerbrief-over-reactie-inzake-de-ihr-en-het-pandemieakkoord-tijdens-de-wereldgezondheidsvergadering","Minister Dijkstra (Medische Zorg) stuurt de Tweede Kamer haar reactie over de IHR en het pandemieakkoord tijdens de Wereldgezondheidsvergadering.Kamerbrief met reactie over de IHR en het pandemieakkoord tijdens de Wereldgezondheidsvergadering",2024-05-13 15:31:47,"d73df986-08c6-43c9-9a71-84d17c044715"
"Kamerbrief over Stand van zaken bloedvoorziening","https://www.rijksoverheid.nl/documenten/kamerstukken/2024/05/13/kamerbrief-over-stand-van-zaken-bloedvoorziening","De Eerste Kamer heeft eenzelfde brief gekregen. Kamerbrief over Stand van zaken bloedvoorziening",2024-05-13 15:01:03,"c82729fa-9552-4261-8e05-3c5ad0fd568b"
"Kamerbrief over verzoek om een brief over de voortgang van de onderhandelingen rondom het medicijn Kaftrio","https://www.rijksoverheid.nl/documenten/kamerstukken/2024/05/13/kamerbrief-over-verzoek-om-een-brief-over-de-voortgang-van-de-onderhandelingen-rondom-het-medicijn-kaftrio","Minister Dijkstra (Medische Zorg) informeert de Tweede Kamer over de voortgang van de prijsonderhandelingen over het medicijn Kaftrio. Dit op verzoek van de vaste commissie van Volksgezondheid, Welzijn en Sport.Kamerbrief over verzoek om een brief over de voortgang van de onderhandelingen rondom het medicijn Kaftrio",2024-05-13 14:57:49,"f851b2ac-164b-4f74-84e5-8f78ee8e7277"
"Kamerbrief over PALLAS-project: stand van zaken medische isotopen en aanbieding basisrapportage nieuwbouwprogramma ","https://www.rijksoverheid.nl/documenten/kamerstukken/2024/05/13/kamerbrief-over-pallas-project-stand-van-zaken-medische-isotopen-en-aanbieding-basisrapportage-nieuwbouwprogramma","Kamerbrief over PALLAS-project: stand van zaken medische isotopen en aanbieding basisrapportage nieuwbouwprogramma",2024-05-13 14:18:50,"6eb822af-1968-4b25-ab11-98f260d12eef"
"Antwoorden op Kamervragen over gezondheidsrisico’s door het nog 10 jaar toelaten van glyfosaat ","https://www.rijksoverheid.nl/documenten/kamerstukken/2024/05/13/antwoorden-op-kamervragen-over-gezondheidsrisico-s-door-het-nog-tien-jaar-toelaten-van-glyfosaat","Minister Dijkstra (Medische Zorg) geeft antwoord op vragen over gezondheidsrisico’s door het nog 10 jaar toelaten van  glyfosaat. De Tweede Kamerleden Ouwehand en Kostić (beiden PvdD) hebben de vragen gesteld. Antwoorden op Kamervragen over gezondheidsrisico’s door het nog 10 jaar toelaten van glyfosaat",2024-05-13 13:28:52,"03d14ddb-7561-41bf-af2e-13b905df978c"
"Antwoorden op Kamervragen over reactie op Brandbrief ""Neem de onafhankelijke wetenschap serieus bij het besluit over glyfosaat van Natuur en Milieu namens 159 onafhankelijke wetenschap""","https://www.rijksoverheid.nl/documenten/kamerstukken/2024/05/13/kamerbrief-over-reactie-op-brandbrief-neem-de-onafhankelijke-wetenschap-serieus-bij-het-besluit-over-glyfosaat-van-natuur-en-milieu-namens-159-onafhankelijke-wetenschap","Minister Dijkstra (Medische Zorg) geeft antwoord op vragen over de reactie op de Brandbrief ""Neem de onafhankelijke wetenschap serieus bij het besluit over glyfosaat van Natuur en Milieu namens 159 onafhankelijke wetenschap"". De vragen zijn gesteld door de Tweede Kamerleden van de fracties PVV, GroenLinks-PvdA, VVD, NSC, D66, BBB, SP en de PvdD.Antwoorden op Kamervragen over reactie op Brandbrief ""Neem de onafhankelijke wetenschap serieus bij het besluit over glyfosaat van Natuur en Milieu namens 159 onafhankelijke wetenschap""",2024-05-13 13:28:41,"2ab08a12-5884-4ef7-afc5-0d3750c99e5b"
"Uitstelbrief op Kamervragen over bericht dat honderden sportclubs niet meer kunnen verduurzamen","https://www.rijksoverheid.nl/documenten/kamerstukken/2024/05/13/uitstelbrief-antwoorden-kamervragen-over-het-bericht-dat-honderden-sportclubs-niet-meer-kunnen-verduurzamen","Minister Helder (VWS) meldt dat de antwoorden op vragen over het bericht dat honderden sportclubs niet meer kunnen  verduurzamen, later komen dan gebruikelijk. De Tweede Kamerleden Inge van Dijk (CDA), Mohandis (GroenLinks-PvdA) en Van  Nispen (SP) hebben de vragen gesteld.  Uitstelbrief op Kamervragen over bericht dat honderden sportclubs niet meer kunnen verduurzamen",2024-05-13 11:19:56,"8a36c96a-13d1-46e6-ba2d-97fc9aab5129"
"Kamerbrief over KNMI'23 klimaatscenario’s en doorwerking in Rijksbeleid","https://www.rijksoverheid.nl/documenten/kamerstukken/2024/05/08/knmi-23-klimaatscenario-s-en-doorwerking-in-rijksbeleid","Minister Harbers (IenW) informeert de Tweede Kamer over de gevolgen van klimaatverandering voor verschillende beleidsterreinen. Hij doet dit naar aanleiding van nieuwe klimaatscenario’s die het Koninklijk Nederlands Meteorologisch Instituut (KNMI) op 9 oktober 2023 heeft gepubliceerd.Kamerbrief over KNMI'23 klimaatscenario’s en doorwerking in Rijksbeleid",2024-05-13 06:50:22,"5d41efc2-d08c-4702-a481-1aedb901e8ee"
"Kamerbrief over gratis maken nummer 113: onderzoeksrapport","https://www.rijksoverheid.nl/documenten/kamerstukken/2024/05/10/kamerbrief-over-gratis-maken-nummer-113-onderzoeksrapport","Staatssecretaris Van Ooijen (VWS) stuurt de Tweede Kamer het rapport ‘Kosteloos bellen naar het nummer 113: Verdieping implementatie’.Kamerbrief over gratis maken nummer 113: onderzoeksrapport",2024-05-10 11:28:38,"954e4672-01cc-4806-b57d-15a736e96506"
"Kamerbrief over afhandeling incident biocide Racumin Foam in veehouderij","https://www.rijksoverheid.nl/documenten/kamerstukken/2024/05/08/53022252-brief-afhandeling-incident-biocide-racumin-foam-in-de-veehouderij","Minister Adema (LNV) informeert de Tweede Kamer over de afhandeling van het incident met de biocide Racumin Foam. Deze biocide wordt gebruikt voor het bestrijden van muizen in de stallen. De werkzame stof coumatetralyl is  een toxische stof die bij te hoge blootstelling kan leiden tot gezondheidseffecten bij mens en dier.Kamerbrief over afhandeling incident biocide Racumin Foam in veehouderij",2024-05-10 08:27:09,"0b4c5c49-f314-4e50-85fb-4fc767b9e1e2"
"Kamerbrief over voortgang Internationale Klimaatstrategie","https://www.rijksoverheid.nl/documenten/kamerstukken/2024/05/08/kamerbrief-inzake-voortgang-internationale-klimaatstrategie","Minister Schreinemacher (Buitenlandse Handel en Ontwikkelingssamenwerking) en minister Jetten (Klimaat en Energie) informeren de Tweede Kamer over de voortgang van de uitvoering van de Internationale Klimaatstrategie (IKS).Kamerbrief over voortgang Internationale Klimaatstrategie",2024-05-10 07:22:38,"49f57efc-6d1c-4108-b9d6-292686e2cb49"
"Aanbiedingsbrief werkagenda en evaluatie Raad voor Volksgezondheid & Samenleving","https://www.rijksoverheid.nl/documenten/kamerstukken/2024/05/08/aanbiedingsbrief-werkagenda-en-evaluatie-rvs","Minister Helder (VWS) stuurt de Tweede Kamer de werkagenda 2024-2028 en de evaluatie over 2019-2023 van de  Raad voor Volksgezondheid & Samenleving. De minister geeft op beide een toelichting. De Eerste Kamer heeft eenzelfde brief gekregen.Aanbiedingsbrief werkagenda en evaluatie Raad voor Volksgezondheid & Samenleving",2024-05-08 13:35:43,"41ae3124-74ca-4564-9039-95e16aea4a62"
"Antwoorden op Kamervragen over tekorten Friese gemeenten voor jeugdzorg ","https://www.rijksoverheid.nl/documenten/kamerstukken/2024/05/08/antwoorden-op-kamervragen-over-het-bericht-dat-friese-gemeenten-miljoenen-tekortkomen-op-jeugdzorg","Staatssecretaris Van Ooijen (VWS) geeft antwoord op vragen over het bericht dat Friese gemeenten miljoenen tekortkomen op jeugdzorg. Het Tweede Kamerlid Dobbe (SP) heeft deze vragen gesteld.Antwoorden op Kamervragen over tekorten Friese gemeenten voor jeugdzorg",2024-05-08 12:59:58,"844e15d3-d5cb-4e66-9743-f18a4256d1c2"
"Kamerbrief voortgang vervolgaanpak vakantieparken","https://www.rijksoverheid.nl/documenten/kamerstukken/2024/05/08/kamerbrief-over-de-voortgang-van-de-vervolgaanpak-vakantieparken","Minister De Jonge (BZK) informeert de Tweede Kamer over de voortgang van de vervolgaanpak van de problemen rond vakantieparken.Kamerbrief voortgang vervolgaanpak vakantieparken",2024-05-08 12:51:27,"d921911b-14c6-4349-b6b0-1dc10007bd3d"
"Kamerbrief analyse monitor stapeling eigen bijdragen","https://www.rijksoverheid.nl/documenten/kamerstukken/2024/05/08/kamerbrief-over-analyse-monitor-stapeling-eigen-bijdragen","Minister Helder (VWS) deelt de analyse van de resultaten van de monitor stapeling eigen bijdragen in de Zorgverzekeringswet (Zvw), de Wet maatschappelijke ondersteuning 2015 (Wmo 2015) en de Wet langdurige zorg (Wlz) met de Tweede Kamer.Kamerbrief analyse monitor stapeling eigen bijdragen",2024-05-08 12:49:42,"9ef55278-58b5-4424-b91f-23473cb2ce7e"
"Uitstelbrief antwoorden Kamervragen over optreden Atletiekunie na mogelijk seksueel grensoverschrijdend gedrag atleet","https://www.rijksoverheid.nl/documenten/kamerstukken/2024/05/08/uitstelbrief-antwoorden-kamervragen-over-het-optreden-van-de-atletiekunie-na-mogelijk-seksueel-grensoverschrijdend-gedrag-van-een-atleet","Minister Helder (VWS) meldt dat de antwoorden op vragen over het optreden van de Atletiekunie na mogelijk seksueel grensoverschrijdend gedrag van een atleet, later komen dan gebruikelijk.Uitstelbrief antwoorden Kamervragen over optreden Atletiekunie na mogelijk seksueel grensoverschrijdend gedrag atleet",2024-05-08 11:56:54,"c5e9dce8-7493-488c-a9a7-a1fa4d6477f5"
"Antwoorden op Kamervragen over blokkeren Twitter-account arts","https://www.rijksoverheid.nl/documenten/kamerstukken/2024/05/07/antwoorden-op-kamervragen-over-over-het-blokkeren-van-een-twitter-account-van-een-arts","Staatssecretaris Van Ooijen (VWS) geeft antwoord op vragen over het blokkeren van een Twitter-account van een arts. Het Tweede Kamerlid Van Houwelingen (FvD) heeft deze vragen gesteld.Antwoorden op Kamervragen over blokkeren Twitter-account arts",2024-05-08 08:19:52,"9562635a-9d85-47c8-8734-158688f40758"
"Antwoorden op Kamervragen over voortgang van kabinetsdoelstellingen","https://www.rijksoverheid.nl/documenten/kamerstukken/2024/05/07/antwoorden-op-kamervragen-over-de-voortgang-van-kabinetsdoelstellingen-zoals-in-deze-vragen-geformuleerd-onder-i-j-r-s-en-t","Staatssecretaris Van Ooijen (VWS) geeft antwoord op vragen over de voortgang van kabinetsdoelstellingen. Deze vragen hebben betrekking op doelstellingen die liggen op het terrein van de staatssecretaris van VWS. De Tweede Kamerleden Van der Lee en Stultiens (beiden GroenLinks-PvdA) hebben de vragen gesteld. Antwoorden op Kamervragen over voortgang van kabinetsdoelstellingen",2024-05-08 07:20:41,"185691aa-d514-4f7e-98d2-adb499e7ed1d"
"Kamerbrief over stand van zaken ggz in de Wet langdurige zorg","https://www.rijksoverheid.nl/documenten/kamerstukken/2024/05/07/kamerbrief-over-stand-van-zaken-ggz-in-de-wet-langdurige-zorg","Minister Helder en staatssecretaris Van Ooijen (beiden VWS) informeren de Tweede Kamer over de uitvoering van de afspraken en de actuele ontwikkelingen inzake passende zorg en ondersteuning voor mensen met een psychische aandoening en een langdurige (intensieve) zorgvraag.Kamerbrief over stand van zaken ggz in de Wet langdurige zorg",2024-05-07 15:15:34,"3ef5c100-edb3-4c48-9203-de1b3c689177"
