"item_title","item_link","item_description","item_pub_date","item_guid"
"Voortgang nieuwe regeling zorgkosten onverzekerden en aanpak onverzekerdheid","https://www.rijksoverheid.nl/documenten/kamerstukken/2025/07/03/voortgang-nieuwe-regeling-zorgkosten-onverzekerden-en-aanpak-onverzekerdheid","Voortgang nieuwe regeling zorgkosten onverzekerden en aanpak onverzekerdheid",2025-07-03 10:58:35,"bf817d75-89af-44a7-8a1e-7e0db3ab394b"
"Kamerbrief inzake Aanbieding Gezondheidsraad advies over de gezondheidsrisico’s rondom geitenhouderijen","https://www.rijksoverheid.nl/documenten/kamerstukken/2025/07/03/kamerbrief-inzake-aanbieding-gezondheidsraad-advies-over-de-gezondheidsrisico-s-rondom-geitenhouderijen","Kamerbrief inzake Aanbieding Gezondheidsraad advies over de gezondheidsrisico’s rondom geitenhouderijen",2025-07-03 10:25:18,"9ecf6e2e-70d4-47b9-a559-60e7f39c6bc8"
"Antwoorden op Kamervragen (VSO) over inzet van Nederland voor de 78e World Health Assembly ","https://www.rijksoverheid.nl/documenten/kamerstukken/2025/06/30/kamerbrief-over-verslag-schriftelijk-overleg-vso-inzake-inzet-van-nederland-voor-de-78e-world-health-assembly-kamerstuk-36-600-xvi-nr-185","Minister Jansen (VWS) geeft op de vragen over de inzet van Nederland voor de 78e World Health Assembly. De vaste commissie voor Volksgezondheid, Welzijn en Sport heeft de vragen gesteld in een verslag van een schriftelijk overleg (VSO) met de minister.Antwoorden op Kamervragen (VSO) over inzet van Nederland voor de 78e World Health Assembly",2025-07-03 10:23:15,"f3843ee6-4080-48e9-bfe9-24fe92cf0088"
"Antwoord op Kamervraag over de ‘NAVO-verplichtingen’ met betrekking tot ‘pandemische paraatheid’ ","https://www.rijksoverheid.nl/documenten/kamerstukken/2025/07/03/antwoord-op-kamervraag-over-de-navo-verplichtingen-met-betrekking-tot-pandemische-paraatheid","Antwoord op Kamervraag over de ‘NAVO-verplichtingen’ met betrekking tot ‘pandemische paraatheid’",2025-07-03 08:42:50,"09e82a37-2582-478f-96d6-ac62ea73bf4e"
"Antwoorden op Kamervragen over het bericht 'Huidkanker is snelst toenemende vorm van kanker in Nederland' ","https://www.rijksoverheid.nl/documenten/kamerstukken/2025/07/02/antwoorden-op-kamervragen-over-het-bericht-huidkanker-is-snelst-toenemende-vorm-van-kanker-in-nederland","Antwoorden op Kamervragen over het bericht 'Huidkanker is snelst toenemende vorm van kanker in Nederland'",2025-07-02 14:59:02,"a4650b1f-d1b8-4499-95f6-ad488eb850e9"
"Kamerbrief over Verzoek om reactie op petitie Stop eenzame opsluiting in de GGZ","https://www.rijksoverheid.nl/documenten/kamerstukken/2025/07/02/kamerbrief-over-verzoek-om-reactie-op-petitie-stop-eenzame-opsluiting-in-de-ggz","Kamerbrief over Verzoek om reactie op petitie Stop eenzame opsluiting in de GGZ",2025-07-02 14:55:45,"d9602403-b0cd-4bc0-a1a4-5ed3a5a4a556"
"Reactie op vraag n.a.v. het ontwerpbesluit Wet integrale suïcidepreventie","https://www.rijksoverheid.nl/documenten/kamerstukken/2025/07/02/reactie-op-vraag-n-a-v-het-ontwerpbesluit-wet-integrale-suicidepreventie","Reactie op vraag n.a.v. het ontwerpbesluit Wet integrale suïcidepreventie",2025-07-02 14:54:42,"fabac2dc-199d-41a3-99a4-dddce585e953"
"Kamerbrief over planning en voortgang Algoritmeregister impactvolle algoritmen","https://www.rijksoverheid.nl/documenten/kamerstukken/2025/07/01/kamerbrief-over-planning-en-voortgang-algoritmeregister-impactvolle-algoritmen-vws","Minister Jansen (VWS) reageert op de motie van Tweede Kamerlid Six Dijkstra (NSC). De motie verzoekt elk departement om een brief te sturen met een plan voor de registratie in het Rijksbrede Algoritmeregister van impactvolle algoritmen.  Kamerbrief over planning en voortgang Algoritmeregister impactvolle algoritmen",2025-07-02 12:36:00,"08b11392-9125-4417-898c-7d730f6aa89c"
"Kamerbrief met verslag 78e World Health Assembly ","https://www.rijksoverheid.nl/documenten/kamerstukken/2025/06/30/kamerbrief-over-verslag-78e-world-health-assembly","Minister Jansen (VWS) stuurt de Tweede Kamer het verslag van de 78e World Health Assembly (WHA). Kamerbrief met verslag 78e World Health Assembly",2025-07-02 11:02:09,"52d28f6f-d6f1-4727-af64-772b9ea3d22a"
"Kamerbrief over Programma Wonen, Ondersteuning en Zorg voor Ouderen","https://www.rijksoverheid.nl/documenten/kamerstukken/2025/07/02/kamerbrief-over-programma-wonen-ondersteuning-en-zorg-voor-ouderen","Kamerbrief over Programma Wonen, Ondersteuning en Zorg voor Ouderen",2025-07-02 08:47:25,"0ce86af8-4f79-4f39-9276-e2a91e41e753"
"Onderzoek oorzaken van de onderschrijding van het budgettair kader wijkverpleging ","https://www.rijksoverheid.nl/documenten/kamerstukken/2025/07/02/onderzoek-oorzaken-van-de-onderschrijding-van-het-budgettair-kader-wijkverpleging","Onderzoek oorzaken van de onderschrijding van het budgettair kader wijkverpleging",2025-07-02 08:45:02,"6562e048-ff68-469b-a2df-b4724ad19e49"
"Kamerbrief over Nationale Strategie Vrouwengezondheid ","https://www.rijksoverheid.nl/documenten/kamerstukken/2025/07/02/kamerbrief-over-nationale-strategie-vrouwengezondheid","Kamerbrief over Nationale Strategie Vrouwengezondheid",2025-07-02 06:11:55,"a09fe164-7c34-446b-be78-3e2879e323b8"
"Kamerbrief over Stand van zakenbrief 2025 Sanquin","https://www.rijksoverheid.nl/documenten/kamerstukken/2025/07/01/kamerbrief-over-stand-van-zakenbrief-2025-sanquin","Kamerbrief over Stand van zakenbrief 2025 Sanquin",2025-07-01 15:02:38,"b76ae224-b362-44e6-a143-344880592cca"
"Kamerbrief over Stand van zaken medische kindzorg","https://www.rijksoverheid.nl/documenten/kamerstukken/2025/07/01/kamerbrief-over-stand-van-zaken-medische-kindzorg","Kamerbrief over Stand van zaken medische kindzorg",2025-07-01 14:24:55,"ae5ae73b-e77f-4ace-971b-8c0dbf31cd44"
"Houdbaarheidsonderzoek Wmo 2015: aanbieden analyses","https://www.rijksoverheid.nl/documenten/kamerstukken/2025/07/01/houdbaarheidsonderzoek-wmo-2015-aanbieden-analyses","Houdbaarheidsonderzoek Wmo 2015: aanbieden analyses",2025-07-01 14:23:43,"4b767e9d-90ce-4f8c-a751-5422cdf25905"
"Kamervragen over wachttijden binnen de Wet maatschappelijke ondersteuning 2015 (Wmo) en de geestelijke gezondheidszorg (ggz)","https://www.rijksoverheid.nl/documenten/kamerstukken/2025/07/01/kamervragen-over-wachttijden-binnen-de-wet-maatschappelijke-ondersteuning-2015-wmo-en-de-geestelijke-gezondheidszorg-ggz","Kamervragen over wachttijden binnen de Wet maatschappelijke ondersteuning 2015 (Wmo) en de geestelijke gezondheidszorg (ggz)",2025-07-01 14:08:35,"a84c983e-cb25-4a53-8612-fb57a46d60ac"
"Uitstelbrief antwoorden Kamervragen over het bericht dat de kraamzorg in Nederland onder druk staat","https://www.rijksoverheid.nl/documenten/kamerstukken/2025/07/01/uitstelbrief-antwoorden-kamervragen-over-het-bericht-dat-de-kraamzorg-in-nederland-onder-druk-staat","Uitstelbrief antwoorden Kamervragen over het bericht dat de kraamzorg in Nederland onder druk staat",2025-07-01 13:08:42,"c690953e-4fdb-45ef-b9ae-3f851fcc8f1f"
"Kamerbrief met betrekking tot besluit start uitvoeringsfase PALLAS-reactor","https://www.rijksoverheid.nl/documenten/kamerstukken/2025/07/01/kamerbrief-met-betrekking-tot-besluit-start-uitvoeringsfase-pallas-reactor","Kamerbrief met betrekking tot besluit start uitvoeringsfase PALLAS-reactor",2025-07-01 13:06:42,"b2de230a-4a5e-4186-9fde-1d16c63cd475"
"Kamerbrief over stand van zaken medische technologie","https://www.rijksoverheid.nl/documenten/kamerstukken/2025/06/30/stand-van-zaken-medische-technologie","Minister Jansen (VWS) informeert de Tweede Kamer opnieuw over de beschikbaarheid van medische hulpmiddelen, maar ook over andere relevante ontwikkelingen, zoals haar voornemen wetgeving door te voeren die zorginstellingen in kritieke situaties verplicht informatie te verstrekken over hun voorraden hulpmiddelen.Kamerbrief over stand van zaken medische technologie",2025-07-01 12:57:44,"56864eb3-210d-41db-9b1b-45546007fd35"
"Aanbiedingsbrief bij rapport 'Het begint met luisteren'","https://www.rijksoverheid.nl/documenten/kamerstukken/2025/06/30/aanbieding-deelrapport-avoz-studie","Staatssecretaris Tielen (Jeugd, Preventie en Sport) biedt de Tweede Kamer het rapport 'Het begint met luisteren' aan.Aanbiedingsbrief bij rapport 'Het begint met luisteren'",2025-07-01 12:36:30,"27f2e268-ab5d-402e-ad33-d3f95db79a56"
