"item_title","item_link","item_description","item_pub_date","item_guid"
"Kamerbrief met beleidsreactie op monitor over Seksueel Geweld tegen kinderen 2020 - 2024","https://www.rijksoverheid.nl/documenten/kamerstukken/2026/04/10/tk-beleidsreactie-monitor-seksueel-geweld-tegen-kinderen-2020-2024","Minister Van Weel (JenV), minister Sterk (n Langdurige Zorg, Jeugd en Sport,) en staatssecretaris Tielen (Onderwijs en Emancipatie) sturen de Tweede Kmer het rapport 'Monitor Seksueel Geweld tegen Kinderen 2020 – 2024' van de Nationaal Rapporteur mensenhandel en seksueel geweld tegen kinderen. Zij geven hun beleidsreactie.Kamerbrief met beleidsreactie op monitor over Seksueel Geweld tegen kinderen 2020 - 2024",2026-04-13 06:07:21,"a46f97a5-34b9-4950-bc43-87097c0187ef"
"Kamerbrief over voortgang antisemitismebestrijding april 2026","https://www.rijksoverheid.nl/documenten/kamerstukken/2026/04/10/tk-antisemitismebestrijding","Minister Van Weel (JenV) en minister Letschert (OCW) informeren de Tweede Kamer over de inzet van het kabinet tegen antisemitisme in Nederland. Zij bespreken de voortgang en actualisatie van de Strategie Bestrijding Antisemitisme 2024–2030. Ook geven zij hun beleidsreactie op het rapport 'Gevangen in Vrijheden' van de Taskforce Bestrijding Antisemitisme. De Tweede Kamer had dit rapport op 2 februari 2026 ontvangen.Kamerbrief over voortgang antisemitismebestrijding april 2026",2026-04-13 05:56:48,"1015e10f-5ceb-4bba-99b9-dfce212b5563"
"Bijlage Overzicht en stand van zaken alle maatregelen Strategie Antisemitisme Bestrijding 2024-2030","https://www.rijksoverheid.nl/documenten/kamerstukken/2026/04/10/tk-bijlage-overzicht-en-stand-van-zaken-alle-maatregelen-strategie-antisemitisme-bestrijding-2024-2030","Bijlage bij de 'Kamerbrief over voortgang antisemitismebestrijding april 2026'. De bijlage geeft een overzicht van de stand van zaken van de maatregelen uit de Strategie Antisemitisme Bestrijding 2024-2030. Het gaat om  de pijlers Beschermen, monitoren en opvolgen, Onderwijs en preventie  en  Herdenken en vieren.Bijlage Overzicht en stand van zaken alle maatregelen Strategie Antisemitisme Bestrijding 2024-2030",2026-04-13 05:56:27,"9ead05d7-8aca-480a-98e5-17bf8e382e8b"
"Kamerbrief over Stand van zaken Villa ExpertCare (II)","https://www.rijksoverheid.nl/documenten/kamerstukken/2026/04/10/kamerbrief-over-stand-van-zaken-villa-expertcare-ii","Kamerbrief over Stand van zaken Villa ExpertCare (II)",2026-04-10 13:30:45,"91ae3631-b1f3-4fc7-8c17-a80f652be060"
" Uitstelbrief op Kamervragen van het lid Krul (CDA) over de uitzending van Pointer over tabaksspeciaalzaken","https://www.rijksoverheid.nl/documenten/kamerstukken/2026/04/10/uitstelbrief-op-kamervragen-van-het-lid-krul-cda-over-de-uitzending-van-pointer-over-tabaksspeciaalzaken","Uitstelbrief op Kamervragen van het lid Krul (CDA) over de uitzending van Pointer over tabaksspeciaalzaken",2026-04-10 13:16:23,"f43e57b8-8d97-4874-950b-1d530760f9ce"
"Beantwoording Kamervragen van het lid Moinat (Groep Markuszower) over de continuïteit van jeugdhulp in Lelystad (2026Z03784)","https://www.rijksoverheid.nl/documenten/kamerstukken/2026/04/10/beantwoording-kamervragen-van-het-lid-moinat-groep-markuszower-over-de-continuiteit-van-jeugdhulp-in-lelystad-2026z03784","Beantwoording Kamervragen van het lid Moinat (Groep Markuszower) over de continuïteit van jeugdhulp in Lelystad (2026Z03784)",2026-04-10 13:04:27,"60ba3ea2-93fe-4c80-acf6-0cfe57e841e1"
"Kamerbrief over Reactie advies ATR-bijschrijfplicht dagleidinggevenden ","https://www.rijksoverheid.nl/documenten/kamerstukken/2026/04/10/kamerbrief-over-reactie-advies-atr-bijschrijfplicht-dagleidinggevenden","Kamerbrief over Reactie advies ATR-bijschrijfplicht dagleidinggevenden",2026-04-10 12:55:34,"b3e69c17-56b2-4aec-ab54-cc0f094f822c"
"Antwoorden op Kamervragen over het onderzoek 'Van Inzicht naar uitvoering' van het Verwey-Jonker Instituut in Opdracht van Het Vergeten Kind","https://www.rijksoverheid.nl/documenten/kamerstukken/2026/04/10/antwoorden-op-kamervragen-over-het-onderzoek-van-inzicht-naar-uitvoering-van-het-verwey-jonker-instituut-in-opdracht-van-het-vergeten-kind","Antwoorden op Kamervragen over het onderzoek 'Van Inzicht naar uitvoering' van het Verwey-Jonker Instituut in Opdracht van Het Vergeten Kind",2026-04-10 12:54:44,"1b42785b-ce96-4608-9a21-2c046d1196c1"
"Kamerbrief inzake Kabinetsreactie Beschikbaarheid in Perspectief, periodieke rapportage beschikbaarheid medische producten 2017 tot en met 2023","https://www.rijksoverheid.nl/documenten/kamerstukken/2026/04/10/kamerbrief-inzake-kabinetsreactie-beschikbaarheid-in-perspectief-periodieke-rapportage-beschikbaarheid-medische-producten-2017-tot-en-met-2023","Kamerbrief inzake Kabinetsreactie Beschikbaarheid in Perspectief, periodieke rapportage beschikbaarheid medische producten 2017 tot en met 2023",2026-04-10 12:54:41,"74c56dc3-a7af-4498-9eed-1f72f1d67664"
"Kamerbrief inzake Onderzoek naar de illegale handel in vapes","https://www.rijksoverheid.nl/documenten/kamerstukken/2026/04/10/kamerbrief-inzake-onderzoek-naar-de-illegale-handel-in-vapes","Kamerbrief inzake Onderzoek naar de illegale handel in vapes",2026-04-10 12:13:09,"e0977e04-238f-4927-817b-434854c7534a"
"Beantwoording Kamervragen van het lid Claassen (Groep Markuszower) over het tekort aan SEH-artsen en het niet volledig opvolgen van het advies van het Capaciteitsorgaan","https://www.rijksoverheid.nl/documenten/kamerstukken/2026/04/10/beantwoording-kamervragen-van-het-lid-claassen-groep-markuszower-over-het-tekort-aan-seh-artsen-en-het-niet-volledig-opvolgen-van-het-advies-van-het-capaciteitsorgaan","Beantwoording Kamervragen van het lid Claassen (Groep Markuszower) over het tekort aan SEH-artsen en het niet volledig opvolgen van het advies van het Capaciteitsorgaan",2026-04-10 07:37:50,"03bea9fb-d73e-4634-9f7a-969f3572235f"
"Beantwoording Kamervragen van het lid Van Meetelen (PVV) over het bericht 'Leiden scherpt de regels voor jeugdhulp aan; Zorg Minder snel doorverwijzen, meer eigen verantwoordelijkheid'","https://www.rijksoverheid.nl/documenten/kamerstukken/2026/04/09/beantwoording-kamervragen-van-het-lid-van-meetelen-pvv-over-het-bericht-leiden-scherpt-de-regels-voor-jeugdhulp-aan-zorg-minder-snel-doorverwijzen-meer-eigen-verantwoordelijkheid","Beantwoording Kamervragen van het lid Van Meetelen (PVV) over het bericht 'Leiden scherpt de regels voor jeugdhulp aan; Zorg Minder snel doorverwijzen, meer eigen verantwoordelijkheid'",2026-04-09 15:00:17,"473afb00-a111-4c8f-a580-112cbc5efddc"
"Antwoorden op Kamervragen over het bericht Ook sportclubs openen jacht op gulle gever ","https://www.rijksoverheid.nl/documenten/kamerstukken/2026/04/09/antwoorden-op-kamervragen-over-het-bericht-ook-sportclubs-openen-jacht-op-gulle-gever","Antwoorden op Kamervragen over het bericht Ook sportclubs openen jacht op gulle gever",2026-04-09 14:39:44,"412f2c9d-ff0c-46bc-ac4c-9b019c2ac46d"
"Kamerbrief met reactie op rapport 'Iedereen bijna ziek: over de keerzijden van diagnose-expansie'","https://www.rijksoverheid.nl/documenten/kamerstukken/2026/04/09/kamerbrief-over-beleidsreactie-op-advies-raad-voor-volksgezondheid-en-samenleving-iedereen-bijna-ziek-over-de-keerzijden-van-diagnose-expansie","Minister Hermans (VWS) stuurt de Tweede Kamer een reactie op het rapport 'Iedereen bijna ziek: over de keerzijden van diagnose-expansie'. Dit rapport is van de Raad voor Volksgezondheid en Samenleving (RVS).Kamerbrief met reactie op rapport 'Iedereen bijna ziek: over de keerzijden van diagnose-expansie'",2026-04-09 14:36:35,"8dc5c8b7-b820-4e25-b3e8-e8bfc8217b76"
"Kamerbrief over uitvoering motie zorgkosten","https://www.rijksoverheid.nl/documenten/kamerstukken/2026/04/08/kamerbrief-over-uitvoering-motie-stoffer-c-s-en-lahlah-c-s","Minister Hermans (VWS), minister Sterk (Langdurige Zorg, Jeugd en Sport), minister Vijlbrief (SZW), minister Aartsen (Werk en Participatie) en staatssecretaris Eerenberg (Financiën) informeren de Tweede Kamer over de uitvoering van verschillende moties over zorgkosten, specifiek voor kwetsbare groepen.Kamerbrief over uitvoering motie zorgkosten",2026-04-09 13:43:59,"b9c90d78-4442-4093-8e02-78b7b0ddecfa"
"Kamerbrief inzake Voortgang Integraal Zorgakkoord (IZA) en Aanvullend Zorg- en Welzijnsakkoord (AZWA)","https://www.rijksoverheid.nl/documenten/kamerstukken/2026/04/09/kamerbrief-inzake-voortgang-integraal-zorgakkoord-iza-en-aanvullend-zorg-en-welzijnsakkoord-azwa","Kamerbrief inzake Voortgang Integraal Zorgakkoord (IZA) en Aanvullend Zorg- en Welzijnsakkoord (AZWA)",2026-04-09 13:11:37,"176227d3-6d9b-4552-a77f-5a51e2eee07d"
"Kamerbrief over inzake Uitvoering motie Van Aelst-den Uijl c.s. over financiering van forensisch medisch onderzoek na seksueel geweld (36.600 XVI, S)","https://www.rijksoverheid.nl/documenten/kamerstukken/2026/04/09/kamerbrief-over-inzake-uitvoering-motie-van-aelst-den-uijl-c-s-over-financiering-van-forensisch-medisch-onderzoek-na-seksueel-geweld-36-600-xvi-s","Kamerbrief over inzake Uitvoering motie Van Aelst-den Uijl c.s. over financiering van forensisch medisch onderzoek na seksueel geweld (36.600 XVI, S)",2026-04-09 13:06:06,"afb609b2-eb72-4376-b04b-ec501cb1408c"
"Kamerbrief over datalek bij laboratorium bevolkingsonderzoek baarmoederhalskanker","https://www.rijksoverheid.nl/documenten/kamerstukken/2025/08/11/kamerbrief-over-datalek-bij-laboratorium-bvo-baarmoederhalskanker","Minister Jansen (VWS) informeert de Tweede Kamer over een hack (computerinbraak) bij een laboratorium dat is betrokken bij het bevolkingsonderzoek naar baarmoederhalskanker. Kamerbrief over datalek bij laboratorium bevolkingsonderzoek baarmoederhalskanker",2026-04-09 12:01:08,"c5196f31-42a2-49b6-82c2-cb123858767f"
"Antwoorden op Kamervragen over bericht 'Gegijzeld tijdens de nachtdienst'","https://www.rijksoverheid.nl/documenten/kamerstukken/2026/04/07/antwoorden-op-kamervragen-over-het-bericht-gegijzeld-tijdens-de-nachtdienst","Minister Hermans (VWS) geeft antwoord op vragen over het bericht 'Gegijzeld tijdens de nachtdienst'. Het Tweede Kamerlid Van Brenk (50PLUS) had de vragen gesteld.Antwoorden op Kamervragen over bericht 'Gegijzeld tijdens de nachtdienst'",2026-04-08 15:25:01,"493ceeb3-1296-4eec-b93d-8f5ca62feca6"
"Antwoorden op Kamervragen over bericht dat failliete ggz-aanbieder mogelijk wordt overgenomen door private equity investeerder","https://www.rijksoverheid.nl/documenten/kamerstukken/2026/04/07/antwoorden-op-kamervragen-van-het-lid-dobbe-over-het-bericht-dat-een-failliete-ggz-aanbieder-mogelijk-wordt-overgenomen-door-een-private-equity-investeerder","Minister Hermans (VWS) geeft antwoord op vragen over het bericht dat een failliete ggz-aanbieder mogelijk wordt overgenomen door een private equity investeerder. Het Tweede Kamerlid Dobbe (SP) had de vragen gesteld.Antwoorden op Kamervragen over bericht dat failliete ggz-aanbieder mogelijk wordt overgenomen door private equity investeerder",2026-04-08 13:50:10,"2c1fa119-98fc-4e4c-b8c8-44434015916b"
