"item_title","item_link","item_description","item_pub_date","item_guid"
"Aanbiedingsbrief Stand van de Uitvoering Dienst Toeslagen 2025","https://www.rijksoverheid.nl/documenten/kamerstukken/2025/09/29/aanbiedingsbrief-stand-van-de-uitvoering-dienst-toeslagen-2025","Staatssecretaris Palmen-Schlangen (Herstel en Toeslagen) stuurt de Tweede Kamer de Stand van de Uitvoering Dienst Toeslagen 2025 en de beleidsreactie hierop.Aanbiedingsbrief Stand van de Uitvoering Dienst Toeslagen 2025",2025-09-29 10:44:22,"9bddabf9-1f1c-4e3d-9878-223b418a320f"
"Kamerbrief aanbieding Ontwerp-Nota Ruimte","https://www.rijksoverheid.nl/documenten/kamerstukken/2025/09/26/aanbiedingsbrief-tk-publicatie-ontwerp-nota-ruimte","Minister Keijzer (VRO) biedt de Tweede Kamer de Ontwerp-Nota Ruimte met bijbehorende stukken aan. De ontwerp-Nota Ruimte is de langetermijnvisie van het Rijk op de ruimtelijke inrichting van Nederland en maakt ruimtelijke keuzes voor 2030 en 2050, met een doorkijk naar 2100.   Vanaf 6 oktober ligt de Ontwerp-Nota Ruimte 10 weken (tot en met 15 december) ter inzage. Iedereen kan reageren op de visie en ruimtelijke keuzes.  Eenzelfde brief is ook aan de Eerste Kamer gezonden.Kamerbrief aanbieding Ontwerp-Nota Ruimte",2025-09-29 10:41:54,"d84e0c86-4ef1-489c-8935-a2397fabea17"
"Kamerbrief over Reactie inzake het bericht ‘Lagere vergoeding zorgverzekeraars leidt tot sluiting hospices’ ","https://www.rijksoverheid.nl/documenten/kamerstukken/2025/09/29/kamerbrief-over-reactie-inzake-het-bericht-lagere-vergoeding-zorgverzekeraars-leidt-tot-sluiting-hospices","Kamerbrief over Reactie inzake het bericht ‘Lagere vergoeding zorgverzekeraars leidt tot sluiting hospices’",2025-09-29 10:27:41,"cbb7b384-5d1b-4ac7-b504-d7a53bd62764"
"Aanbiedingsbrief bij ontwerp-Besluit wijziging Lijst I en II Opiumwet","https://www.rijksoverheid.nl/documenten/kamerstukken/2025/09/19/kamerbrief-over-aanbieding-ontwerpbesluit-houdende-wijziging-van-lijst-i-en-ii-behorende-bij-de-opiumwet-in-verband-met-plaatsing-van-enkele-stoffen-op-deze-lijsten","Staatssecretaris Tielen (Jeugd, Preventie en Sport) biedt de Tweede Kamer het ontwerp-Besluit aan om Lijst I en II bij de Opiumwet te wijzigen. De wijziging is nodig vanwege plaatsing van enkele stoffen op de lijsten. Deze brief is ook naar de Eerste Kamer gestuurd.  Aanbiedingsbrief bij ontwerp-Besluit wijziging Lijst I en II Opiumwet",2025-09-29 10:25:00,"5fd891a4-67d5-4d44-8b46-f18e62291f87"
"Kamerbrief met reactie op motie over glutenscreening in protocollen jgz","https://www.rijksoverheid.nl/documenten/kamerstukken/2025/09/19/kamerbrief-over-reactie-motie-tielen-glutenscreening","Staatssecretaris Tielen (Jeugd, Preventie en Sport) stuurt de Tweede Kamer haar reactie op een motie waarin de regering wordt gevraagd te onderzoeken of glutenscreening (onderzoek bij een vermoeden van coeliakie) kosteneffectief onderdeel te laten uitmaken van de jeugdgezondheidszorgprotocollen (jgz-protocollen). De motie was ingediend door het Tweede Kamerlid Tielen.Kamerbrief met reactie op motie over glutenscreening in protocollen jgz",2025-09-29 09:10:41,"cf48aa0b-ee2e-4640-a109-45455de8c230"
"Kamerbrief aanbieding  rapport NSOB en vervolg coördinatie geweld tegen vrouwen","https://www.rijksoverheid.nl/documenten/kamerstukken/2025/09/26/kamerbrief-over-aanbieding-nsob-en-vervolg-coordinatie-geweld-tegen-vrouwen","Staatssecretaris Pouw-Verweij (Langdurige en Maatschappelijke Zorg) biedt de Tweede Kamer het rapport aan van de Nederlandse School voor Openbaar Bestuur (NSOB) over scenario’s voor landelijke coördinatie van de aanpak van huiselijk geweld en kindermishandeling (inclusief femicide) en geweld tegen vrouwen. Ook gaat zij in op het vervolgtraject om de coördinatie van deze aanpak te versterken.Kamerbrief aanbieding  rapport NSOB en vervolg coördinatie geweld tegen vrouwen",2025-09-26 15:51:08,"807ffb85-7e13-4722-bfaa-7fbb2558d859"
"Kamerbrief over Aanbieding advies ZIN Kortdurende zorg in het tijdelijk verblijf en thuis","https://www.rijksoverheid.nl/documenten/kamerstukken/2025/09/26/kamerbrief-over-aanbieding-advies-zin-kortdurende-zorg-in-het-tijdelijk-verblijf-en-thuis","Kamerbrief over Aanbieding advies ZIN Kortdurende zorg in het tijdelijk verblijf en thuis",2025-09-26 14:47:12,"d4abbf5f-76f7-4630-8661-7a7bf964b489"
"Kamerbrief over Feitelijke vragen inzake Lijst met feitelijke vragen Wijziging van de begrotingsstaten van het Ministerie van VWS (XVI) voor het jaar 2025 (wijziging samenhangende met Miljoenennota) (TK 36820-XVI)","https://www.rijksoverheid.nl/documenten/kamerstukken/2025/09/26/kamerbrief-over-feitelijke-vragen-inzake-lijst-met-feitelijke-vragen-wijziging-van-de-begrotingsstaten-van-het-ministerie-van-vws-xvi-voor-het-jaar-2025-wijziging-samenhangende-met-miljoenennota-tk-36820-xvi","Kamerbrief over Feitelijke vragen inzake Lijst met feitelijke vragen Wijziging van de begrotingsstaten van het Ministerie van VWS (XVI) voor het jaar 2025 (wijziging samenhangende met Miljoenennota) (TK 36820-XVI)",2025-09-26 14:39:28,"9faf7f30-09b3-4406-af51-f09747e108b4"
"Antwoorden op Kamervragen over het bericht dat UEFA geld gaf aan clubs in Rusland maar steun weierde aan Oekraïense clubs","https://www.rijksoverheid.nl/documenten/kamerstukken/2025/09/25/antwoorden-op-de-vragen-van-de-leden-boswijk-en-van-dijk-beiden-cda-en-het-lid-paternotte-d66-over-het-bericht-uefa-gaf-clubs-in-rusland-10-8-miljoen-euro-maar-weigerde-steun-aan-oekraiense-clubs","Staatssecretaris Tielen (Jeugd, Preventie en Sport) geeft antwoord op Kamervragen naar aanleiding van het bericht 'UEFA gaf clubs in Rusland 10,8 miljoen euro, maar weigerde steun aan Oekraïense clubs'. De Tweede Kamerleden Boswijk en Van Dijk (beiden CDA) en Paternotte (D66) hadden de vragen gesteld.Antwoorden op Kamervragen over het bericht dat UEFA geld gaf aan clubs in Rusland maar steun weierde aan Oekraïense clubs",2025-09-26 14:16:00,"598d3f41-d080-4bf0-a40d-94944b03b88f"
"Antwoorden op Kamervragen over het bericht dat atlete Zoë Sedney zich in de steek gelaten voelde door de Atletiekunie na grensoverschrijdend gedrag van een teamgenoot ","https://www.rijksoverheid.nl/documenten/kamerstukken/2025/09/19/antwoorden-op-kamervragen-overhet-bericht-dat-atlete-zoe-sedney-zich-in-de-steek-gelaten-voelde-door-de-atletiekunie-na-grensoverschrijdend-gedrag-van-een-teamgenoot","Staatssecretaris Tielen (Jeugd, Preventie en Sport) geeft antwoord op vragen over bericht dat atlete Zoë Sedney zich in de steek gelaten voelde door de Atletiekunie na grensoverschrijdend gedrag van een teamgenoot. De Tweede Kamerleden Mutluer en Mohandis (beiden GroenLinks–PvdA) hebben de vragen gesteld.Antwoorden op Kamervragen over het bericht dat atlete Zoë Sedney zich in de steek gelaten voelde door de Atletiekunie na grensoverschrijdend gedrag van een teamgenoot",2025-09-25 14:16:41,"1dee325d-58f6-4968-bf1c-5608f34cacb3"
"Antwoorden op Kamervragen (VSO) over effecten van behandelingen en medicatie op vrouwen ","https://www.rijksoverheid.nl/documenten/kamerstukken/2025/09/19/kamerbrief-over-verslag-schriftelijk-overleg-vso-inzake-effecten-van-behandelingen-en-medicatie-op-vrouwen","Staatssecretaris Tielen (Jeugd, Preventie en Sport) geeft antwoord op de vragen over effecten van behandelingen en medicatie op vrouwen. De vaste commissie voor Volksgezondheid, Welzijn en Sport heeft de vragen gesteld in een verslag van een schriftelijk overleg (VSO) met de minister.Antwoorden op Kamervragen (VSO) over effecten van behandelingen en medicatie op vrouwen",2025-09-25 13:55:34,"48656978-5ece-40f2-b7a8-565df698b3fb"
"Kamerbrief met beleidsreactie op advies Gezondheidsraad over Rhesus c en Uitvoeringstoets OCTN2-deficiëntie","https://www.rijksoverheid.nl/documenten/kamerstukken/2025/09/19/kamerbrief-over-beleidsreactie-gezondheidsraadadvies-rhesus-c-en-uitvoeringstoets-octn2-deficientie","Staatssecretaris Tielen (Jeugd, Preventie en Sport) reageert op het advies van de Gezondheidsraad over Rhesus c en Uitvoeringstoets OCTN2-deficiëntie. De Tweede Kamer had het advies op 19 juni 2025 ontvangen.Kamerbrief met beleidsreactie op advies Gezondheidsraad over Rhesus c en Uitvoeringstoets OCTN2-deficiëntie",2025-09-25 13:43:08,"fb9689a5-5511-4606-9455-636e275b2d24"
"Antwoorden op Kamervragen over het gebrek aan verbetering van de positie van mensen met fibromyalgie ","https://www.rijksoverheid.nl/documenten/kamerstukken/2025/09/19/antwoorden-op-kamervragen-over-het-gebrek-aan-verbetering-van-de-positie-van-mensen-met-fibromyalgie","Minister Bruijn (VWS) geeft antwoord op vragen over het gebrek aan verbetering van de positie van mensen met fibromyalgie. Het Tweede Kamerlid Dobbe (SP) heeft de vragen gesteld.Antwoorden op Kamervragen over het gebrek aan verbetering van de positie van mensen met fibromyalgie",2025-09-25 13:19:49,"85e87a08-b9ff-42a0-9b1e-6900f65f292b"
"Antwoorden op Kamervragen over het artikel 'Afname van het aantal zzp’ers in thuiszorg en kinderopvang door strenger optreden tegen schijnzelfstandigheid' ","https://www.rijksoverheid.nl/documenten/kamerstukken/2025/09/19/antwoorden-op-kamervragen-over-het-artikel-afname-van-het-aantal-zzp-ers-in-thuiszorg-en-kinderopvang-door-strenger-optreden-tegen-schijnzelfstandigheid","Minister Bruijn (VWS) geeft antwoord op de vragen over het artikel 'Afname van het aantal zzp’ers in thuiszorg en kinderopvang door strenger optreden tegen schijnzelfstandigheid'. Het Tweede Kamerlid El Abassi (DENK) heeft de vragen gesteld.Antwoorden op Kamervragen over het artikel 'Afname van het aantal zzp’ers in thuiszorg en kinderopvang door strenger optreden tegen schijnzelfstandigheid'",2025-09-25 13:07:06,"234a23bd-5d91-408c-92bf-f2d6165dab0e"
"Kamerbrief bij briefrapport en kennisnotitie van RIVM over laagfrequent geluid in Nederland","https://www.rijksoverheid.nl/documenten/kamerstukken/2025/09/23/aanbieding-briefrapport-en-kennisnotitie-van-rivm-over-laagfrequent-geluid-in-nederland","Staatssecretaris Aartsen (Openbaar Vervoer en Milieu) stuurt de Tweede Kamer 2 rapporten van het Rijksinstituut voor Volksgezondheid en Milieu (RIVM) over laagfrequent geluid (LFG). Dit is geluid met lage tonen. Hij bespreekt daarbij de uitkomsten van de onderzoeken en gaat in op de aanbevelingen.Kamerbrief bij briefrapport en kennisnotitie van RIVM over laagfrequent geluid in Nederland",2025-09-25 05:57:34,"a470fab6-e020-4900-a1ef-daa2b7562cee"
"Kamerbrief over voortgang bestuurlijke afspraken zorg voor aangeboren hartafwijkingen","https://www.rijksoverheid.nl/documenten/kamerstukken/2025/09/19/kamerbrief-over-voortgang-bestuurlijke-afspraken-zorg-voor-aangeboren-hartafwijkingen","Minister Bruijn (VWS) informeert de Tweede Kamer over de voortgang van de uitvoering van de bestuurlijke afspraken over zorg voor aangeboren hartafwijkingen.Kamerbrief over voortgang bestuurlijke afspraken zorg voor aangeboren hartafwijkingen",2025-09-24 15:38:29,"096d468d-7c37-4b01-9a2b-64ee6ba8eff6"
"Antwoorden op Kamervragen over het bericht dat gemeenten zorgondernemers nauwelijks op criminaliteit toetsen","https://www.rijksoverheid.nl/documenten/kamerstukken/2025/09/24/antwoorden-op-kamervragen-over-het-bericht-dat-gemeenten-zorgondernemers-nauwelijks-op-criminaliteit-toetsen","Staatssecretaris Pouw-Verweij (Langdurige en Maatschappelijke Zorg) beantwoordt vragen over het bericht dat gemeenten zorgondernemers nauwelijks op criminaliteit toetsen. De vragen zijn van de Kamerleden Westerveld, Bushoff en Slagt-Tichelman (allen GroenLinks-PvdA).  Antwoorden op Kamervragen over het bericht dat gemeenten zorgondernemers nauwelijks op criminaliteit toetsen",2025-09-24 15:27:58,"0db33593-bab8-405f-bf43-b39295e0fa5b"
"Kamerbrief bevindingen Nederlandse Arbeidsinspectie over kidfluencers","https://www.rijksoverheid.nl/documenten/kamerstukken/2025/09/11/kamerbrief-signaal-kidfluencers-nederlandse-arbeidsinspectie","Staatssecretaris Nobel (Participatie en Integratie) stuurt de Tweede Kamer een signaal van de Nederlandse Arbeidsinspectie waarin wordt aangegeven waar de aanpak van influencing met en door kinderen als maatschappelijke opgave nog versterkt kan worden. De staatssecretaris reageert op de bevindingen van de Arbeidsinspectie.Kamerbrief bevindingen Nederlandse Arbeidsinspectie over kidfluencers",2025-09-24 14:47:18,"4534642f-53ce-4e28-92fc-51695c7fb6e8"
"Signaal kidfluencers","https://www.rijksoverheid.nl/documenten/kamerstukken/2025/09/11/bijlage-1-signaal-kidfluencers","De Nederlandse Arbeidsinspectie beschrijft waar de aanpak van influencing met en door kinderen als maatschappelijke opgave nog versterkt kan worden.Signaal kidfluencers",2025-09-24 14:47:18,"056c8217-b611-4e45-ba55-eff5e55ee10c"
"Antwoorden op Kamervragen over het gebrek aan tolken voor mensen die slechthorend of doof zijn en spraakherkenningshulpmiddelen","https://www.rijksoverheid.nl/documenten/kamerstukken/2025/09/24/antwoorden-op-kamervragen-over-het-gebrek-aan-tolken-voor-mensen-die-slechthorend-of-doof-zijn-en-spraakherkenningshulpmiddelen","Staatssecretaris Pouw-Verweij (Langdurige en Maatschappelijke Zorg) beantwoordt vragen over spraakherkenningshulpmiddelen en het gebrek aan tolken voor mensen die slechthorend of doof zijn. De vragen zijn gesteld door het Kamerlid Westerveld (GroenLinks-PvdA).Antwoorden op Kamervragen over het gebrek aan tolken voor mensen die slechthorend of doof zijn en spraakherkenningshulpmiddelen",2025-09-24 14:44:25,"3d2bb815-2f01-4f83-84b5-c201b24187cb"
