"item_title","item_link","item_description","item_pub_date","item_guid"
"Kamerbrief over 3-den; verzoek om reactie brief gedwongen wisseling medicatie en overbelaste mantelzorg ","https://www.rijksoverheid.nl/documenten/kamerstukken/2026/02/11/kamerbrief-inzake-3-den-verzoek-om-een-reactie-over-gedwongen-wisseling-van-medicatie-en-overbelaste-mantelzorg","Staatssecretaris Pouw-Verweij (Langdurige en Maatschappelijke Zorg) stuurt de Tweede Kamer haar reactie op een schrijven over overbelaste mantelzorgers en het gedwongen wisselen van medicatie. De vaste commissie voor Volksgezondheid, Welzijn en Sport had om de reactie verzocht. Kamerbrief over 3-den; verzoek om reactie brief gedwongen wisseling medicatie en overbelaste mantelzorg",2026-02-11 16:01:27,"5c91d149-e9e8-4bb9-948e-8a6cdd9de88b"
"Kamerbrief over beantwoording openstaande vragen over import van rundvlees uit Brazilië met oestradiol","https://www.rijksoverheid.nl/documenten/kamerstukken/2026/02/11/kamerbrief-over-beantwoording-openstaande-vragen-over-import-van-rundvlees-uit-brazilie-met-oestradiol","Staatssecretaris Tielen (Jeugd, Preventie en Sport) beantwoordt vragen over rundvlees uit Brazilië dat is teruggeroepen in verband met de aanwezigheid van het in de Europese Unie verboden groeihormoon oestradiol. De Vaste Kamercommissie voor Buitenlandse Handel en Ontwikkelingssamenwerking heeft de vragen gesteld. Kamerbrief over beantwoording openstaande vragen over import van rundvlees uit Brazilië met oestradiol",2026-02-11 15:50:50,"91d213b9-5c9f-4d24-a254-a70e34653661"
"Kamerbrief met beleidsreactie op rapport 'Op de rem; voorbij de hypernerveuze samenleving'","https://www.rijksoverheid.nl/documenten/kamerstukken/2026/02/11/kamerbrief-over-beleidsreactie-rapport-op-de-rem-voorbij-de-hypernerveuze-samenleving","Staatssecretaris Tielen (Jeugd, Preventie en Sport) stuurt de Tweede Kamer haar beleidsreactie op het rapport 'Op de rem; voorbij de hypernerveuze samenleving'.Kamerbrief met beleidsreactie op rapport 'Op de rem; voorbij de hypernerveuze samenleving'",2026-02-11 15:37:56,"bc2315af-4913-4754-b0bc-0dbb883d5aca"
"Kamerbrief over stand van zaken prenatale screening","https://www.rijksoverheid.nl/documenten/kamerstukken/2026/02/11/kamerbrief-over-stand-van-zaken-prenatale-screening","Staatssecretaris Tielen (Jeugd, Preventie en Sport) informeert de Tweede Kamer over de stand van zaken bij diverse prenatale screeningsmethoden.Kamerbrief over stand van zaken prenatale screening",2026-02-11 15:28:10,"c054e2cc-09cf-4536-9d2f-aaf15408f526"
"Kamerbrief over knellende wet- en regelgeving voor de multifunctionele landbouw","https://www.rijksoverheid.nl/documenten/kamerstukken/2026/02/10/kamerbrief-knellende-wet-en-regelgeving-voor-de-multifunctionele-landbouw","Minister Wiersma (LVVN) informeert de Tweede Kamer over de uitvoering van de motie van Campen en Grinwis. Deze motie verzoekt de regering om in samenwerking met het ministerie van Volksgezondheid, Welzijn en Sport (VWS) in kaart te brengen hoe knellende wet- en regelgeving voor zorgboeren en andere, soortgelijke multifunctionele landbouwbedrijven weggenomen kan worden.Kamerbrief over knellende wet- en regelgeving voor de multifunctionele landbouw",2026-02-11 15:11:18,"553d10e2-62dd-4bf1-b3db-a4129b1c927e"
"Kamerbrief over geannoteerde agenda informele EU Gezondheidsraad, 25-26 februari 2026 ","https://www.rijksoverheid.nl/documenten/kamerstukken/2026/02/10/kamerbrief-over-geannoteerde-agenda-informele-eu-gezondheidsraad-25-en-26-februari-2026","Minister Bruijn (VWS) biedt de Tweede Kamer de geannoteerde agenda aan van de informele EU Gezondheidsraad van 25-26 februari 2026 in Nicosia, Cyprus. Eenzelfde brief is aan de Eerste Kamer verstuurd. Kamerbrief over geannoteerde agenda informele EU Gezondheidsraad, 25-26 februari 2026",2026-02-11 14:52:35,"2e92decb-664a-4e89-81b8-b31661d07ca4"
"Kamerbrief over voortgang bestuurlijke afspraken zorg voor aangeboren hartafwijkingen","https://www.rijksoverheid.nl/documenten/kamerstukken/2025/12/15/kamerbrief-over-voortgang-bestuurlijke-afspraken-zorg-voor-aangeboren-hartafwijkingen","Minister Bruijn (VWS) informeert de Tweede Kamer over de uitkomst van het gesprek met de Universitair Medische Centra (umc's), de Inspectie Gezondheidszorg en Jeugd (IGJ) en de patiëntenorganisaties over de voortgang van de uitvoering van de bestuurlijke afspraken over zorg voor aangeboren hartafwijkingen.Kamerbrief over voortgang bestuurlijke afspraken zorg voor aangeboren hartafwijkingen",2026-02-11 12:58:07,"d5a796ee-a97d-4a53-8385-8ee1bdb758bc"
"Antwoorden op Kamervragen over de waarschuwing van kapitein-ter-zee en internist Roos Barth over gebrek aan antibiotica in tijden van militair conflict","https://www.rijksoverheid.nl/documenten/kamerstukken/2026/02/11/antwoorden-op-kamervragen-over-de-waarschuwing-van-kapitein-ter-zee-en-internist-roos-barth-over-gebrek-aan-antibiotica-in-tijden-van-militair-conflict","Minister Bruijn (VWS) geeft antwoord op vragen over de waarschuwing van kapitein-ter-zee en internist Roos Barth over gebrek aan antibiotica in tijden van militair conflict. De Tweede Kamerleden Claassen (Markuszower groep) en Maeijer (PVV) hadden de vragen gesteld.Antwoorden op Kamervragen over de waarschuwing van kapitein-ter-zee en internist Roos Barth over gebrek aan antibiotica in tijden van militair conflict",2026-02-11 12:36:56,"40ac873e-9e45-4faf-893c-cc040f9d851d"
"Beantwoording Kamervragen hygiëne- en gezondheidsregels in de horeca","https://www.rijksoverheid.nl/documenten/kamerstukken/2026/02/10/beantwoording-kamervragen-hygiene-en-gezondheidsregels-in-de-horeca","Staatssecretaris Rummenie (LVVN) beantwoordt vragen over toezicht door de Nederlandse Voedsel- en Warenautoriteit (NVWA), de Inspectie Leefomgeving en Transport (ILT), de Gemeentelijke gezondheidsdienst (GGD) en de samenwerking met het  Rijksinstituut voor Volksgezondheid en Milieu (RIVM) op hygiëne- en gezondheidsregels in de horeca. De vragen zijn van het Kamerlid Beckerman (SP).Beantwoording Kamervragen hygiëne- en gezondheidsregels in de horeca",2026-02-11 10:38:34,"c3cd2bd6-11f1-4032-a449-52f31855d9fc"
"Antwoorden op Kamervragen over verbod op maagdelijkheidstests in Zweden","https://www.rijksoverheid.nl/documenten/kamerstukken/2026/02/10/antwoorden-op-kamervragen-over-het-bericht-maagdelijkheidstests-zijn-in-zweden-vanaf-vandaag-officieel-verboden","Staatssecretaris Pouw-Verweij (Langdurige en Maatschappelijke Zorg) geeft antwoord op vragen over het bericht 'Maagdelijkheidstests zijn in Zweden vanaf vandaag officieel verboden'. Het Tweede Kamerlid Becker (VVD) had de vragen gesteld.Antwoorden op Kamervragen over verbod op maagdelijkheidstests in Zweden",2026-02-10 16:23:24,"4d7e2eb0-4956-40c2-a83c-50ae378940e0"
"Antwoorden op Kamervragen over bericht dat tandartsketens ouderen als melkkoe gebruiken","https://www.rijksoverheid.nl/documenten/kamerstukken/2026/02/10/antwoorden-op-kamervragen-over-het-bericht-dat-tandartsketens-ouderen-als-melkkoe-gebruiken","Minister Bruijn (VWS) geeft antwoord op vragen over het bericht dat tandartsketens ouderen als melkkoe gebruiken. Het Tweede Kamerlid Dobbe (SP) had de vragen gesteld.Antwoorden op Kamervragen over bericht dat tandartsketens ouderen als melkkoe gebruiken",2026-02-10 15:50:13,"be5c1234-71ea-49aa-8370-200768bdd82f"
"Kamerbrief met overzicht stand van zaken diverse moties en toezeggingen en andere zaken","https://www.rijksoverheid.nl/documenten/kamerstukken/2025/12/17/kamerbrief-over-overzicht-stand-van-zaken-diverse-moties-en-toezeggingen-en-andere-zaken","Minister Bruijn (VWS), staatssecretaris Pouw-Verweij (Langdurige en Maatschappelijke Zorg) en staatssecretaris Tielen (Jeugd, Preventie en Sport) informeren de Tweede Kamer met een overzicht van de stand van zaken van een aantal diverse moties en toezeggingen. Kamerbrief met overzicht stand van zaken diverse moties en toezeggingen en andere zaken",2026-02-10 15:48:58,"2186b1a2-19b3-4100-a75a-ae9a0a123306"
"Kamerbrief over reactie op brief over mantelzorg voor langdurig ziek kind en recht op ontwikkeling","https://www.rijksoverheid.nl/documenten/kamerstukken/2026/02/10/kamerbrief-inzake-3-den-verzoek-om-reactie-op-brief-over-mantelzorg-voor-langdurig-ziek-kind-en-recht-op-ontwikkeling","Staatssecretaris Pouw-Verweij (Langdurige en Maatschappelijke Zorg) informeert de Tweede Kamer over de opvolging van de brief over de complexiteit van hulp voor een langdurig ziek kind, onderwijs en mantelzorg. Kamerbrief over reactie op brief over mantelzorg voor langdurig ziek kind en recht op ontwikkeling",2026-02-10 15:38:08,"5d24c27d-32c6-4149-a796-401aa4569d93"
"Kamerbrief over motie en reactie op brieven over bestrijdingsmiddelen","https://www.rijksoverheid.nl/documenten/kamerstukken/2026/02/10/kamerbrief-uitvoering-motie-podt-en-bromet-reactie-op-brieven-over-het-omnibus-pakket-food-and-feed-safety","Minister Wiersma (LVVN) informeert de Tweede Kamer over brieven en vragen over bestrijdingsmiddelen. Ook gaat de brief over  hoe zij uitvoering wil geven aan de aangenomen motie van Kamerleden Podt (D66) en Bromet (Groenlinks-PvdA).  Kamerbrief over motie en reactie op brieven over bestrijdingsmiddelen",2026-02-10 15:27:45,"582cd0fe-a937-413f-91a2-58545bb92b72"
"Kamerbrief over motie openbare toiletten","https://www.rijksoverheid.nl/documenten/kamerstukken/2026/02/10/kamerbrief-over-motie-openbare-toiletten","Minister Rijkaart (BZK) stuurt de Tweede Kamer een reactie op de motie Struijs over openbare toiletten. In de ingediende motie wordt de regering opgeroepen om onderzoek te doen naar het uitbreiden van het aantal logisch gesitueerde openbare toiletten in Nederland.Kamerbrief over motie openbare toiletten",2026-02-10 15:18:20,"ff33f1a9-c920-4919-9c19-c61b4f65e84c"
"Antwoorden vragen so over advies NZa deel 2 budgetbekostiging acute verloskunde (AV) ","https://www.rijksoverheid.nl/documenten/kamerstukken/2026/02/09/schriftelijk-overleg-so-inzake-inbreng-advies-nza-deel-2-budgetbekostiging-acute-verloskunde-av-29247-nr-467","Minister Bruijn (VWS) geeft antwoord op de vragen uit het schriftelijk overleg (so) over het tweede deel van het uitvoeringsadvies van de Nederlandse Zorgautoriteit (NZa) over budgetbekostiging voor de acute verloskunde (AV). De vaste Tweede Kamercommissie voor Volksgezondheid, Welzijn en Sport had de vragen gesteld. Antwoorden vragen so over advies NZa deel 2 budgetbekostiging acute verloskunde (AV)",2026-02-10 15:13:54,"66ef76ae-25b0-4ef6-ae05-443caae01686"
"Antwoorden op Kamervragen over doucheverplichtingen voor minderjarigen bij sportverenigingen","https://www.rijksoverheid.nl/documenten/kamerstukken/2026/02/10/antwoorden-op-kamervragen-over-doucheverplichtingen-voor-minderjarigen-bij-sportverenigingen","Staatssecretaris Tielen (Jeugd, Preventie en Sport) geeft antwoord op vragen over doucheverplichtingen voor minderjarigen bij sportverenigingen. Het Tweede Kamerlid Abassi (DENK) had de vragen gesteld.Antwoorden op Kamervragen over doucheverplichtingen voor minderjarigen bij sportverenigingen",2026-02-10 15:13:17,"2c1d75c2-eee3-4655-951f-16916873ac22"
"Voortgangsbrief marktonderzoek paramedische zorg (deel 2)","https://www.rijksoverheid.nl/documenten/kamerstukken/2026/02/09/voortgangsbrief-marktonderzoek-paramedische-zorg-deel-2","Staatssecretaris Pouw-Verweij (Langdurige en Maatschappelijke Zorg) informeert de Tweede Kamer over de eindresultaten van het marktonderzoek paramedische zorg van de Nederlandse Zorgautoriteit (NZa).Voortgangsbrief marktonderzoek paramedische zorg (deel 2)",2026-02-10 14:54:31,"ee9615b0-3376-43ec-9ac7-2a8e4ab5a5f6"
"Antwoorden op Kamervragen over niet uitvoeren motie over wervingscampagne om in de zorg te werken ","https://www.rijksoverheid.nl/documenten/kamerstukken/2026/02/09/antwoorden-op-kamervragen-over-het-niet-uitvoeren-van-de-aangenomen-motie-over-een-campagne-om-mensen-te-werven-om-in-de-zorg-te-werken","Minister Bruijn (VWS) geeft antwoord op vragen over het niet uitvoeren van de aangenomen motie over een campagne om mensen te werven om in de zorg te werken. Het Tweede Kamerlid Dobbe (SP) had de vragen gesteld. Antwoorden op Kamervragen over niet uitvoeren motie over wervingscampagne om in de zorg te werken",2026-02-10 14:21:31,"6bccf046-9b09-407d-99ab-012f229aa94d"
"Kamerbrief over werkconferentie Vrouwengezondheid","https://www.rijksoverheid.nl/documenten/kamerstukken/2026/02/09/kamerbrief-over-naar-een-nationale-werkagenda-vrouwengezondheid","Staatssecretaris Tielen (Jeugd, Preventie en Sport) informeert de Tweede Kamer over de werkconferentie Vrouwengezondheid die op 4 februari 2026 plaatsvond. De werkconferentie heeft nuttige inzichten opgeleverd voor de Nationale Werkagenda Vrouwengezondheid.Kamerbrief over werkconferentie Vrouwengezondheid",2026-02-09 16:32:43,"b6944ef5-40d9-43ed-961d-bcb290ed36ec"
