"item_title","item_link","item_description","item_pub_date","item_guid"
"Kamerbrief over commissieverzoek om reactie op rapport 'Waarom is de oversterfte in Nederland zo hoog?' ","https://www.rijksoverheid.nl/documenten/kamerstukken/2025/04/16/beantwoording-commissieverzoek-3-den-rapport-waarom-is-de-oversterfte-in-nederland-zo-hoog","Staatssecretaris Karremans (Jeugd, Preventie en Sport) stuurt de Tweede Kamer zijn op het rapport 'Waarom is de oversterfte in Nederland zo hoog?'. De vaste commissie voor Volksgezondheid, Welzijn en Sport had hierom verzocht. Kamerbrief over commissieverzoek om reactie op rapport 'Waarom is de oversterfte in Nederland zo hoog?'",2025-04-17 10:29:38,"fcf9ceb8-aaed-4e8c-b6e1-7a731c0954c5"
"Aanbiedingsbrief bij Monitors kindermarketing voedingsproducten en alcoholmarketing en rapport 'Het reguleren van de voedselomgeving op grond van gezondheid'","https://www.rijksoverheid.nl/documenten/kamerstukken/2025/04/16/kamerbrief-over-aanbieding-monitors-kindermarketing-voedingsproducten-en-alcoholmarketing-en-rapport-het-reguleren-van-de-voedselomgeving-op-grond-van-gezondheid","Staatssecretaris Karremans (Jeugd, Preventie en Sport) biedt de Tweede Kamer drie onderzoeken ter ondersteuning van het preventiebeleid op gebied van overgewicht en alcohol aan.Aanbiedingsbrief bij Monitors kindermarketing voedingsproducten en alcoholmarketing en rapport 'Het reguleren van de voedselomgeving op grond van gezondheid'",2025-04-17 10:02:36,"7f6f834b-029e-41d4-961d-d1d8f2dccc5f"
"Kamerbrief over PFAS in particuliere kippeneieren","https://www.rijksoverheid.nl/documenten/kamerstukken/2025/04/15/kamerbrief-over-pfas-in-particuliere-kippeneieren","Staatssecretaris Karremans (Jeugd, Preventie en Sport) informeert de Tweede Kamer over het voedingsadvies voor eieren. Het advies is naar aanleiding van het onderzoek naar poly- en perfluoralkylstoffen (PFAS) in hobbykip- of particuliere eieren. Het onderzoek is van het Rijksinstituut voor Volksgezondheid en Milieu (RIVM).Kamerbrief over PFAS in particuliere kippeneieren",2025-04-17 09:41:08,"437f12c8-ef22-408b-8939-7972a5ae6119"
"Kamerbrief over voortgang Nationaal Actieprogramma Aanpak seksueel grensoverschrijdend gedrag en seksueel geweld april 2025","https://www.rijksoverheid.nl/documenten/kamerstukken/2025/04/15/tweede-voortgangsrapportage-nationaal-actieprogramma-aanpak-seksueel-grensoverschrijdend-gedrag-en-seksueel-geweld","Staatssecretaris Paul (OCW) en staatssecretaris Nobel (Participatie en Integratie) informeren de Tweede Kamer over de voortgang van het Nationaal Actieprogramma Aanpak seksueel grensoverschrijdend gedrag en seksueel geweld (NAP). Zij sturen enkele rapporten mee met de Kamerbrief.  Kamerbrief over voortgang Nationaal Actieprogramma Aanpak seksueel grensoverschrijdend gedrag en seksueel geweld april 2025",2025-04-17 08:43:07,"ff291e13-613d-4e49-911d-f7313b388d66"
"Beantwoording vragen van het lid Paternotte (D66) over steun aan Oekraine","https://www.rijksoverheid.nl/documenten/kamerstukken/2025/04/15/beantwoording-vragen-van-het-lid-paternotte-d66-over-steun-aan-oekraine","Minister Brekelmans (Defensie) en Minister Veldkamp (BZ) beantwoorden vragen aan de Tweede Kamer over steun aan Oekraine. Vragen waren ingezonden door lid Paternotte (D66).Beantwoording vragen van het lid Paternotte (D66) over steun aan Oekraine",2025-04-17 08:38:57,"88b9bef2-7cac-4f39-83fc-80c4b559c2bf"
"Kamerbrief over Voortgang verduurzamen (publieke) zorg en welzijn","https://www.rijksoverheid.nl/documenten/kamerstukken/2025/04/17/kamerbrief-over-voortgang-verduurzamen-publieke-zorg-en-welzijn","Kamerbrief over Voortgang verduurzamen (publieke) zorg en welzijn",2025-04-17 08:35:22,"de768f29-0c33-467d-a324-84e5d686badd"
"Kamerbrief Commissieverzoek om de Kamer voor behandeling Voorjaarsnota te informeren over concrete opties om gordelroosvaccin op te nemen in Rijksvaccinatieprogramma","https://www.rijksoverheid.nl/documenten/kamerstukken/2025/04/16/kamerbrief-commissieverzoek-om-de-kamer-voor-de-behandeling-van-de-voorjaarsnota-te-informeren-over-concrete-opties-om-het-gordelroosvaccin-op-te-nemen-in-het-rijksvaccinatieprogramma","Staatssecretaris Karremans (Jeugd, Preventie en Sport) informeert de Tweede Kamer voor de behandeling van de Voorjaarsnota over de concrete opties om het gordelroosvaccin op te nemen in het Rijksvaccinatieprogramma. De vaste commissie voor Volksgezondheid, Welzijn en Sport had hierom verzocht.Kamerbrief Commissieverzoek om de Kamer voor behandeling Voorjaarsnota te informeren over concrete opties om gordelroosvaccin op te nemen in Rijksvaccinatieprogramma",2025-04-17 06:26:28,"26d63f70-66a2-4ead-a7b1-94ab8f6424b4"
"Kamerbrief over Stevig fundament publieke gezondheid/ reactie op advies ‘Op onze gezondheid’ Raad voor Volksgezondheid & Samenleving (RVS)","https://www.rijksoverheid.nl/documenten/kamerstukken/2025/04/16/kamerbrief-over-stevig-fundament-publieke-gezondheid-reactie-op-advies-op-onze-gezondheid-raad-voor-volksgezondheid-samenleving-rvs","Kamerbrief over Stevig fundament publieke gezondheid/ reactie op advies ‘Op onze gezondheid’ Raad voor Volksgezondheid & Samenleving (RVS)",2025-04-16 15:24:03,"f312e194-1c0a-41ae-9a8d-04239c311ad9"
"Antwoorden op Kamervragen over bezuinigingen op de jeugdzorg","https://www.rijksoverheid.nl/documenten/kamerstukken/2025/04/16/antwoorden-op-kamervragen-over-bezuinigingen-op-de-jeugdzorg","Staatssecretaris Karremans (Jeugd, Preventie en Sport) geeft antwoord op vragen over bezuinigingen op de jeugdzorg. Het Tweede Kamerlid Westerveld (GroenLinks-PvdA) heeft de vragen gesteld.Antwoorden op Kamervragen over bezuinigingen op de jeugdzorg",2025-04-16 15:00:36,"b423f1ec-f12a-4e54-ada8-da45e4bc3be7"
"Kamerbrief agenda OJCS-Raad 12-13 mei 2025","https://www.rijksoverheid.nl/documenten/kamerstukken/2025/04/15/kamerbrief-over-geannoteerde-agenda-ojcs-raad-12-en-13-mei","Staatssecretaris Karremans (Jeugd, Preventie en Sport) informeert de Tweede Kamer over de onderwerpen die op de agenda staan van de Onderwijs-, Jeugd-, Cultuur- en Sportraad (OJCS-Raad) voor de onderdelen Jeugd en Sport op 12 en 13 mei 2025. De Eerste Kamer heeft eenzelfde brief ontvangen.Kamerbrief agenda OJCS-Raad 12-13 mei 2025",2025-04-16 14:11:07,"c7941c90-2513-483f-9d44-0f315d7b7c5f"
"Antwoorden op Kamervragen over vergoeding passende rolstoel","https://www.rijksoverheid.nl/documenten/kamerstukken/2025/04/15/antwoorden-op-de-vragen-van-het-lid-westerveld-groenlinks-pvda-over-het-vergoeden-van-een-passende-rolstoel","Staatssecretaris Maeijer (Langdurige en Maatschappelijke Zorg) geeft antwoord op vragen over het vergoeden van een passende rolstoel. Het Tweede Kamerlid Westerveld (GroenLinks-PvdA) heeft deze vragen gesteld.Antwoorden op Kamervragen over vergoeding passende rolstoel",2025-04-16 13:08:28,"f77f20e9-1991-41ec-91f1-6077726968ab"
"Antwoorden op Kamervragen over pilot vaccinatie vogelgriep","https://www.rijksoverheid.nl/documenten/kamerstukken/2025/04/16/beantwoording-vragen-over-pilot-vaccinatie-vogelgriep","Minister Wiersma (LVVN) geeft antwoord op vragen over het vaccineren van pluimvee tegen vogelgriep. Het Tweede Kamerlid Van Meijeren (FVD) heeft deze vragen gesteld.Antwoorden op Kamervragen over pilot vaccinatie vogelgriep",2025-04-16 12:38:46,"0c8434b3-b87d-44a2-852c-6fc1f5c0a9d8"
"Kamerbrief over vragen over petitie 'Mondzorg terug in het basispakket'","https://www.rijksoverheid.nl/documenten/kamerstukken/2025/04/15/kamerbrief-over-petitie-van-dokters-van-de-wereld-mondzorg-terug-in-het-basispakket","Minister Agema (VWS) reageert op vragen over haar reactie op de petitie 'Mondzorg terug in het basispakket'. De petitie was van Dokters van de Wereld. De vragen en opmerkingen zijn van de vaste commissie van Volksgezondheid, Welzijn en Sport en gesteld in het kader van een schriftelijk overleg.  Kamerbrief over vragen over petitie 'Mondzorg terug in het basispakket'",2025-04-16 11:12:11,"85a5cce6-0483-4e40-a4f0-4e04792e9449"
"Antwoorden op vragen over onafhankelijkheid en transparantie van review op het VGO-III-onderzoek","https://www.rijksoverheid.nl/documenten/kamerstukken/2025/04/15/antwoorden-op-de-vragen-van-de-leden-van-der-plas-en-pierik-beiden-bbb-over-de-onafhankelijkheid-en-transparantie-van-de-review-op-het-vgo-iii-onderzoek","Minister Agema (VWS) en minister Wiersma (LVVN) beantwoorden vragen over de onafhankelijkheid en de transparantie van de review op het VGO-III-onderzoek. Dit onderzoek gaat over veehouderij en de gezondheid van omwonenden bij geitenhouderijen. De vragen zijn van de Kamerleden Van der Plas en Pierik (beiden BBB).   Antwoorden op vragen over onafhankelijkheid en transparantie van review op het VGO-III-onderzoek",2025-04-16 11:06:00,"4cfc75ef-e7cb-4891-8552-35654486ba55"
"Antwoorden op Kamervragen over Europese samenwerking op het gebied van postcovid","https://www.rijksoverheid.nl/documenten/kamerstukken/2025/04/15/antwoorden-op-kamervragen-over-ontwikkelingen-en-europese-samenwerking-op-het-gebied-van-postcovid-mede-n-a-v-het-bericht-postcovidklinieken-boeken-eerste-resultaten","Minister Agema (VWS) beantwoordt vragen over ontwikkelingen op het gebied van postcovid en over Europese samenwerking, zoals beschreven in het artikel ‘postcovidklinieken boeken eerste resultaten’. De vragen zijn van het Kamerlid Tielen (VVD).Antwoorden op Kamervragen over Europese samenwerking op het gebied van postcovid",2025-04-16 10:32:42,"a7c5a3b3-c2f5-4949-8a3f-0f59d0b2b2de"
"Kamerbrief over reactie op bericht alternatieve behandelwijzen","https://www.rijksoverheid.nl/documenten/kamerstukken/2025/04/15/commissiebrief-tweede-kamer-inzake-verzoek-om-reactie-op-brief-alternatieve-behandelwijzen","Minister Agema (VWS) informeert de Tweede Kamer over beleid en regelgeving omtrent alternatieve behandelaren. Daarnaast gaat de brief over een e-mailbericht van de Vereniging tegen de Kwakzalverij over alternatieve behandelwijzen. De vaste commissie voor Volksgezondheid, Welzijn en Sport heeft verzocht om een reactie op die e-mail.Kamerbrief over reactie op bericht alternatieve behandelwijzen",2025-04-16 10:31:56,"be4f6a52-8637-446a-9be3-c8de6d969f11"
"Kamerbrief over beleidsreactie onderzoeksrapport 'Druk op de Keten'","https://www.rijksoverheid.nl/documenten/kamerstukken/2025/04/15/kamerbrief-inzake-beleidsreactie-onderzoeksrapport-druk-op-de-keten","Staatssecretaris Karremans (Jeugd, Preventie en Sport) beantwoordt vragen over de beleidsreactie op het rapport 'Druk op de Keten', over de keten van kinderopvang, onderwijs en zorg bij kinderen in de leeftijdsgroep 0-13 jaar. De vragen en opmerkingen zijn van de vaste commissie van Volksgezondheid, Welzijn en Sport en gesteld in het kader van het schriftelijk overleg. Kamerbrief over beleidsreactie onderzoeksrapport 'Druk op de Keten'",2025-04-16 09:56:56,"cd895c8a-c32b-4d0f-b760-f1a5ce4f67a4"
"Kamerbrief over afbouwen compensatie vervallen ouderentoeslag en afschaffen extra vermogensvrijstelling","https://www.rijksoverheid.nl/documenten/kamerstukken/2025/04/15/kamerbrief-over-so-inzake-het-ontwerpbesluit-houdende-wijziging-van-het-uitvoeringsbesluit-wmo-2015-en-het-besluit-langdurige-zorg-in-verband-met-het-afbouwen-van-de-compensatie-vervallen-ouderentoeslag-en-het-afschaffen","Staatssecretaris Maeijer (Langdurige en Maatschappelijke Zorg) stuurt de Tweede Kamer een reactie op vragen en opmerkingen over een ontwerpbesluit over de langdurige zorg. In dit ontwerpbesluit wordt geregeld dat de compensatie vervallen ouderentoeslag wordt afgebouwd en de extra vermogensvrijstelling wordt afgeschaft. De vragen en opmerkingen zijn van de vaste commissie van Volksgezondheid, Welzijn en Sport en gesteld in het kader van het schriftelijk overleg. Kamerbrief over afbouwen compensatie vervallen ouderentoeslag en afschaffen extra vermogensvrijstelling",2025-04-16 09:42:40,"7402f859-cd72-4e68-91cd-ad2f9686a677"
"Kamerbrief akkoord Raadspositie over voorstel gebruik Nieuwe Genomische Technieken bij plantenveredeling","https://www.rijksoverheid.nl/documenten/kamerstukken/2025/04/11/kamerbrief-akkoord-raadspositie-ngt-dossier-in-de-raad-voor-in-de-lijn","Staatssecretaris Rummenie (LVVN) informeert de Tweede Kamer over de Raadspositie over het wetsvoorstel van de Europese Commissie voor het gebruik van Nieuwe Genomische Technieken in de plantenveredeling. Met de Raadspositie kunnen de onderhandelingen beginnen tussen de Europese Commissie, het Europese Parlement en de Raad.Kamerbrief akkoord Raadspositie over voorstel gebruik Nieuwe Genomische Technieken bij plantenveredeling",2025-04-16 09:30:34,"2ebcfa9a-b074-46ad-a80d-477820a37fde"
"Kamerbrief over IGJ-onderzoek behandelregime ggz-instelling Parnassia","https://www.rijksoverheid.nl/documenten/kamerstukken/2025/04/15/kamerbrief-over-igj-onderzoek-behandelregime-ggz-instelling-parnassia","Staatssecretaris Karremans (Jeugd, Preventie en Sport) stuurt de Tweede Kamer een reactie op het onderzoek van de Inspectie Gezondheidszorg en Jeugd (IGJ) naar het behandelregime bij de afdeling Centrum Intensieve Behandeling (CIB) van ggz-instelling Parnassia.Kamerbrief over IGJ-onderzoek behandelregime ggz-instelling Parnassia",2025-04-16 09:20:52,"2bf04ca8-8bdb-4126-8268-884665886a76"
