"item_title","item_link","item_description","item_pub_date","item_guid"
"Kamerbrief over informatie over Committee for the Prevention of Torture and Inhuman or Degrading Treatment or Punishment ","https://www.rijksoverheid.nl/documenten/kamerstukken/2024/04/02/kamerbrief-over-informatie-over-cpt","Staatssecretaris  Van Ooijen (VWS) informeert de Tweede Kamer over het Committee for the Prevention of Torture and Inhuman or Degrading Treatment or Punishment (CPT) naar aanleiding van de ingediende motie van leden Bruyning en Dobbe over een verzoek aan de CPT om inspectie te houden in de gesloten jeugdhulp in Nederland.  Kamerbrief over informatie over Committee for the Prevention of Torture and Inhuman or Degrading Treatment or Punishment",2024-04-02 11:04:46,"2c5cd769-0c4a-4fba-bcb4-8b64c1bf9dab"
"Kamerbrief over ontwikkelingen verordening tot wijziging van de maximumgehalten aan residuen van thiacloprid","https://www.rijksoverheid.nl/documenten/kamerstukken/2024/04/02/kamerbrief-over-ontwikkelingen-verordening-tot-wijziging-van-de-maximumgehalten-aan-residuen-van-thiacloprid","Kamerbrief over ontwikkelingen verordening tot wijziging van de maximumgehalten aan residuen van thiacloprid",2024-04-02 10:59:44,"0db48316-bd6b-46e7-8ef6-6a14bcabd44f"
"Aanbiedingsbrief nota's bij wetsvoorstel Verzamelwet gegevensverwerking VWS I","https://www.rijksoverheid.nl/documenten/kamerstukken/2024/04/02/kamerbrief-over-voorstel-van-wet-tot-wijziging-van-een-aantal-wetten-op-het-terrein-van-het-ministerie-van-volksgezondheid-welzijn-en-sport-om-de-grondslag-voor-gegevensverwerkingen-te-verstevigen","Minister Helder (VWS) stuurt de Tweede Kamer de nota naar aanleiding van het verslag en een nota van wijziging bij het voorstel van wet tot wijziging van een aantal wetten op het terrein van het ministerie van Volksgezondheid, Welzijn en Sport (VWS) om de grondslag voor gegevensverwerkingen te verstevigen (Verzamelwet gegevensverwerking VWS I).Aanbiedingsbrief nota's bij wetsvoorstel Verzamelwet gegevensverwerking VWS I",2024-04-02 10:35:53,"56a8354a-3dce-40a9-a450-25278cb88e31"
"Kamerbrief over Stand van zaken aangenomen moties naar aanleiding van mondelinge behandeling wijziging Wet donorgegevens kunstmatige bevruchting van 12 april 2023","https://www.rijksoverheid.nl/documenten/kamerstukken/2024/04/02/kamerbrief-over-stand-van-zaken-aangenomen-moties-naar-aanleiding-van-mondelinge-behandeling-wijziging-wet-donorgegevens-kunstmatige-bevruchting-van-12-april-2023","Kamerbrief over Stand van zaken aangenomen moties naar aanleiding van mondelinge behandeling wijziging Wet donorgegevens kunstmatige bevruchting van 12 april 2023",2024-04-02 10:17:33,"fe9f61d7-9fc6-4455-b897-0c351f4b9c91"
"Nota naar aanleiding van verslag wetsvoorstel Verzamelwet gegevensverwerking VWS I","https://www.rijksoverheid.nl/documenten/kamerstukken/2024/04/02/nota-naar-aanleiding-van-het-verslag","Minister Helder (VWS) geeft antwoord op vragen over het voorstel van wet tot wijziging van een aantal wetten op het terrein van het ministerie van Volksgezondheid, Welzijn en Sport (VWS) om de grondslag voor gegevensverwerkingen te verstevigen (Verzamelwet gegevensverwerking VWS I). De Tweede Kamerfracties van GroenLinks-PvdA, NSC, D66, BBB en SP hebben deze vragen gesteld.Nota naar aanleiding van verslag wetsvoorstel Verzamelwet gegevensverwerking VWS I",2024-04-02 10:10:48,"04dc2d1f-a91d-4477-9767-ea20f4ab7b91"
"Nota van wijziging wetsvoorstel Verzamelwet gegevensverwerking VWS I","https://www.rijksoverheid.nl/documenten/kamerstukken/2024/04/02/nota-van-wijziging","Wijziging van het voorstel van wet tot wijziging van een aantal wetten op het terrein van het ministerie van Volksgezondheid, Welzijn en Sport (VWS) om de grondslag voor gegevensverwerkingen te verstevigen (Verzamelwet gegevensverwerking VWS I).Nota van wijziging wetsvoorstel Verzamelwet gegevensverwerking VWS I",2024-04-02 10:10:48,"39367410-0755-4a99-851c-032f3a9e57e3"
"Uitstelbrief antwoorden Kamervragen over subsidieregeling BOSA","https://www.rijksoverheid.nl/documenten/kamerstukken/2024/03/29/uitstelbrief-antwoorden-kamervragen-over-de-subsidieregeling-stimulering-bouw-en-onderhoud-van-sportaccommodaties-bosa","Minister Helder (VWS) meldt dat de antwoorden op vragen over de subsidieregeling Stimulering bouw en onderhoud van sportaccommodaties (BOSA) later komen dan gebruikelijk.Uitstelbrief antwoorden Kamervragen over subsidieregeling BOSA",2024-04-02 09:52:27,"8ce15a81-28bf-413c-b3c4-610fcef65e17"
"Antwoorden op Kamervragen over rapport ‘Eenzaam gesloten’","https://www.rijksoverheid.nl/documenten/kamerstukken/2024/03/26/antwoorden-op-kamervragen-over-het-rapport-eenzaam-gesloten-van-jason-bhugwandass","Staatssecretaris Van Ooijen (VWS) beantwoordt vragen over het rapport ‘Eenzaam gesloten’ van Jason Bhugwandass. De vragen zijn van het Kamerlid Bruyning (NSC).Antwoorden op Kamervragen over rapport ‘Eenzaam gesloten’",2024-04-02 09:10:00,"a11524cb-c52c-4f7b-b18f-95c6b91556b9"
"Antwoorden op Kamervragen over dakloze arbeidsmigranten","https://www.rijksoverheid.nl/documenten/kamerstukken/2024/03/29/beantwoording-kamervragen-over-dakloze-arbeidsmigranten","Minister Van Gennip (SZW) geeft antwoord op vragen over de berichten ‘Steeds meer arbeidsmigranten op straat: 'De opvang moet humaner'’, ‘Een half miljoen arbeidsmigranten: uitbuiting en maatschappelijke onrust’, ‘Veel meer dakloze arbeidsmigranten dan gedacht: zeker 6000’ en ‘Gemeenten blijven dakloze migrant opvang weigeren’. De Tweede Kamerleden Bontenbal, Inge van Dijk (beiden CDA) en Koekkoek (Volt) hebben de vragen gesteld. Antwoorden op Kamervragen over dakloze arbeidsmigranten",2024-04-02 09:09:29,"0a25fd81-ac16-4f9b-ba07-11d4a0087e02"
"Antwoorden op Kamervragen over bericht ‘Ik bied u mijn oudere handen aan het bed. Maar waarom moet ik dan opnieuw leren rekenen?’","https://www.rijksoverheid.nl/documenten/kamerstukken/2024/03/28/antwoorden-op-kamervragen-over-ik-bied-u-mijn-oudere-handen-aan-het-bed-maar-waarom-moet-ik-dan-opnieuw-leren-rekenen","Minister Helder (VWS) geeft antwoord op vragen over het bericht ‘Ik bied u mijn oudere handen aan het bed. Maar waarom moet ik dan opnieuw leren rekenen?’. De Tweede Kamerleden Van den Hil en Tielen (beiden VVD) hebben deze vragen gesteld.Antwoorden op Kamervragen over bericht ‘Ik bied u mijn oudere handen aan het bed. Maar waarom moet ik dan opnieuw leren rekenen?’",2024-04-02 09:05:13,"4d7f8de4-4bb5-435b-9915-4a50b103487f"
"Uitstelbrief op Kamervragen over het bericht over onveilig sportklimaat en machtsmisbruik bij gewichthefbond","https://www.rijksoverheid.nl/documenten/kamerstukken/2024/03/29/uitstelbrief-op-kamervragen-over-het-bericht-onveilig-sportklimaat-en-machtsmisbruik-bij-gewichthefbond","Minister Helder (VWS) stelt de toezending uit van de Kamervragen naar aanleiding van het bericht 'Onveilig sportklimaat en machtsmisbruik bij gewichthefbond'. Het Tweede Kamerlid Van Eijk (VVD) had de vragen gesteld.Uitstelbrief op Kamervragen over het bericht over onveilig sportklimaat en machtsmisbruik bij gewichthefbond",2024-04-02 08:59:51,"a3ab035b-3090-4b8c-a6f7-a33e28060d8c"
"Uitstelbrief op Kamervragen over een via Nederland verspreidde tuberculose-uitbraak bij apen die als proefdier worden gebruikt","https://www.rijksoverheid.nl/documenten/kamerstukken/2024/03/29/uitstelbrief-op-kamervragen-over-een-via-nederland-verspreidde-tuberculose-uitbraak-bij-apen-die-als-proefdier-worden-gebruikt","Minister Helder (VWS) meldt dat de antwoorden op vragen over een via Nederland verspreidde tuberculose-uitbraak bij apen die als proefdier worden gebruikt later komen dan gebruikelijk. Het Tweede Kamerlid Kostić (PvdD) heeft de vragen gesteld.Uitstelbrief op Kamervragen over een via Nederland verspreidde tuberculose-uitbraak bij apen die als proefdier worden gebruikt",2024-03-29 14:31:48,"7006169e-a8af-4ce4-a4a2-80bb01ce2d7d"
"Antwoorden op Kamervragen over npo-radio 1-uitzending van Argos en het bericht ‘Negens en tienen voor artsen die dat niet verdienen’","https://www.rijksoverheid.nl/documenten/kamerstukken/2024/03/29/antwoorden-op-kamervragen-over-npo-radio1-uitzending-van-argos-van-zaterdag-3-februari-jl-en-het-bericht-negens-en-tienen-voor-artsen-die-dat-niet-verdienen","Minister Dijkstra (Medische Zorg) geeft antwoord op vragen over de npo-radio 1-uitzending van Argos van zaterdag 3 februari jl. en het bericht ‘Negens en tienen voor artsen die dat niet verdienen’. Het Tweede Kamerlid Tielen (VVD) heeft de vragen gesteld. Antwoorden op Kamervragen over npo-radio 1-uitzending van Argos en het bericht ‘Negens en tienen voor artsen die dat niet verdienen’",2024-03-29 14:02:00,"f756bfc7-6839-497b-9919-43c8b26cf46a"
"Antwoorden op Kamervragen over een sociaal veilige werkomgeving voor Rijksambtenaren","https://www.rijksoverheid.nl/documenten/kamerstukken/2024/03/29/antwoorden-op-kamervragen-over-een-sociaal-veilige-werkomgeving-voor-rijksambtenaren","Minister Helder (VWS) geeft antwoord op vragen over een sociaal veilige werkomgeving  voor Rijksambtenaren. De Tweede Kamerleden Chakor (GroenLinks-PvdA) en Palmen (Nieuw Sociaal Contract) hebben de vragen gesteld. Antwoorden op Kamervragen over een sociaal veilige werkomgeving voor Rijksambtenaren",2024-03-29 13:59:27,"17018f35-36d5-45bd-8dc5-ee815b137e02"
"Antwoorden op Kamervragen over het bericht ‘Meer meldingen van seksueel grensoverschrijdend gedrag in de zorg’","https://www.rijksoverheid.nl/documenten/kamerstukken/2024/03/29/antwoorden-op-kamervragen-over-het-bericht-meer-meldingen-van-seksueel-grensoverschrijdend-gedrag-in-de-zorg","Minister Helder (VWS) geeft antwoord op vragen over het bericht ‘Meer meldingen van seksueel grensoverschrijdend gedrag in de zorg’. Het Tweede Kamerlid Westerveld (GroenLinks-PvdA) heeft de vragen gesteld. Antwoorden op Kamervragen over het bericht ‘Meer meldingen van seksueel grensoverschrijdend gedrag in de zorg’",2024-03-29 13:57:21,"54c67362-f646-4a1a-9064-e2285364c3a2"
"Antwoorden op Kamervragen over bericht ‘Commerciële huisartsenketens groeien hard, maar controle schiet tekort’","https://www.rijksoverheid.nl/documenten/kamerstukken/2024/03/29/antwoorden-op-kamervragen-over-het-bericht-commerciele-huisartsenketens-groeien-hard-maar-controle-schiet-tekort","Minister Dijkstra (Medische Zorg) geeft antwoord op vragen over het bericht ‘Commerciële huisartsenketens groeien hard, maar controle schiet tekort’. De vragen zijn gesteld door n het lid Dijk (SP).Antwoorden op Kamervragen over bericht ‘Commerciële huisartsenketens groeien hard, maar controle schiet tekort’",2024-03-29 13:53:31,"6d0d29bb-35b7-4128-bae9-975959414920"
"Kamerbrief over Nationale strategie rond de positie van mensen met een beperking ","https://www.rijksoverheid.nl/documenten/kamerstukken/2024/03/29/kamerbrief-over-nationale-strategie-rond-de-positie-van-mensen-met-een-beperking-implementatie-vn-verdrag-handicap","Minister Helder (VWS) geeft antwoord op vragen over de Nationale strategie rond de positie van mensen met een beperking (implementatie VN-verdrag handicap).Kamerbrief over Nationale strategie rond de positie van mensen met een beperking",2024-03-29 13:44:33,"cfb2ce79-c2d9-48cc-a3d9-0b2f48c8c24c"
"Kamerbrief over langdurig klinisch verblijf","https://www.rijksoverheid.nl/documenten/kamerstukken/2024/03/29/kamerbrief-over-langdurig-klinisch-verblijf","Minister Helder (VWS) informeert de Tweede Kamer over langdurig klinisch verblijf voor personen met complexe (gedrags)problematiek, waarbij naast zorg ook een bepaalde mate van beveiliging  beschikbaar moet zijn. Kamerbrief over langdurig klinisch verblijf",2024-03-29 13:34:54,"999634fb-5951-4d8f-b406-dcf4e0728494"
"Antwoorden op Kamervragen over het gebruik van de term ‘ras’ in de gezondheidszorg ","https://www.rijksoverheid.nl/documenten/kamerstukken/2024/03/29/antwoorden-op-kamervragen-over-het-gebruik-van-de-term-ras-in-de-gezondheidszorg","Minister Dijkstra (Medische Zorg) geeft antwoord op vragen over het gebruik van de term ‘ras’ in de gezondheidszorg. De Tweede Kamerleden White en Westerveld (beiden GroenLinks-PvdA) hebben de vragen gesteld.Antwoorden op Kamervragen over het gebruik van de term ‘ras’ in de gezondheidszorg",2024-03-29 11:50:03,"00db8208-8c63-4634-8877-7bccee3624ca"
"Antwoorden op Kamervragen over het online verstrekken van abortuspillen ","https://www.rijksoverheid.nl/documenten/kamerstukken/2024/03/29/antwoorden-op-kamervragen-over-het-online-verstrekken-van-abortuspillen","Minister Dijkstra (Medische Zorg) geeft antwoord op vragen over het online verstrekken van abortuspillen. Het Tweede Kamerlid Van Dijk (SGP) heeft de vragen gesteld. Antwoorden op Kamervragen over het online verstrekken van abortuspillen",2024-03-29 11:44:55,"c79234da-7c61-4248-a70a-aae90a93c304"
