"item_title","item_link","item_description","item_pub_date","item_guid"
"Kamerbrief over toezending adviezen Gezondheidsraad over pneumokokkenvaccinatie","https://www.rijksoverheid.nl/documenten/kamerstukken/2023/06/20/kamerbrief-over-toezending-adviezen-gezondheidsraad-over-pneumokokkenvaccinatie",NA,2023-06-20 11:11:35,"94e22657-944e-4e86-ba25-70cd2508e3b5"
"Aanbiedingsbrief bij antwoorden op Kamervragen over wijziging van de begrotingsstaten van het ministerie VWS 2023","https://www.rijksoverheid.nl/documenten/kamerstukken/2023/06/20/kamerbrief-over-feitelijke-vragen-inzake-wijziging-van-de-begrotingsstaten-van-het-ministerie-van-volksgezondheid-welzijn-en-sport-xvi-voor-het-jaar-2023","Minister Kuipers (VWS), minister Helder (Langdurige Zorg en Sport) en staatssecretaris Van Ooijen (VWS) bieden de Tweede Kamer de antwoorden op vragen over de wijziging van de begrotingsstaten van het ministerie van Volksgezondheid, Welzijn en Sport (XVI) voor het jaar 2023 aan.Aanbiedingsbrief bij antwoorden op Kamervragen over wijziging van de begrotingsstaten van het ministerie VWS 2023",2023-06-20 11:04:58,"e74d7fb7-e28d-48d0-8315-21d69fde3e82"
"Antwoorden op Kamervragen over de Wet publieke gezondheid","https://www.rijksoverheid.nl/documenten/kamerstukken/2023/06/20/antwoorden-op-kamervragen-over-de-wet-publieke-gezondheid","Antwoorden op Kamervragen over de Wet publieke gezondheid",2023-06-20 10:33:59,"8ca55b58-183f-439d-9ad4-48e20c67fbdd"
"Antwoorden op Kamervragen over de beperkte invloed van het bron- en contactonderzoek en de CoronaMelder-app op de bestrijding van de pandemie ","https://www.rijksoverheid.nl/documenten/kamerstukken/2023/06/20/antwoorden-op-kamervragen-over-de-beperkte-invloed-van-het-bron-en-contactonderzoek-en-de-coronamelder-app-op-de-bestrijding-van-de-pandemie","Minister Kuipers (VWS) geeft antwoord op vragen van het lid Van Haga (Groep Van Haga) over de beperkte invloed van het bron- en contactonderzoek en de CoronaMelder-app op de bestrijding van de pandemie Antwoorden op Kamervragen over de beperkte invloed van het bron- en contactonderzoek en de CoronaMelder-app op de bestrijding van de pandemie",2023-06-20 10:27:42,"8f054cec-312a-48a4-93e4-d229d7d9f3c2"
"Kamerbrief over vergunningplicht en meldplicht inzake poliovirus ","https://www.rijksoverheid.nl/documenten/kamerstukken/2023/06/20/kamerbrief-over-nota-naar-aanleiding-van-het-verslag-inzake-wijziging-van-de-wet-publieke-gezondheid-vanwege-de-invoering-van-een-vergunningplicht-en-een-meldplicht-ter-zake-van-het-verrichten-van-handelingen-met-poliovirus-en-enkele-andere-wijzigingen-36334","Minister Kuipers (VWS) informeert de Tweede Kamer over wijzigingen van de Wet publieke gezondheid vanwege de invoering van een vergunningplicht en een meldplicht ter zake van het verrichten van handelingen met poliovirus.Kamerbrief over vergunningplicht en meldplicht inzake poliovirus",2023-06-20 10:18:58,"09a988b8-414a-40ce-ab9e-c011b2366867"
"Kamerbrief over ontwikkelingen bevolkingsonderzoek borstkanker","https://www.rijksoverheid.nl/documenten/kamerstukken/2023/06/20/kamerbrief-over-stand-van-zaken-ontwikkelingen-bevolkingsonderzoek-borstkanker","Minister Kuipers (VWS) stuurt de Tweede Kamer een brief over de stand van zaken van de ontwikkelingen van bevolkingsonderzoek naar borstkanker.Kamerbrief over ontwikkelingen bevolkingsonderzoek borstkanker",2023-06-20 10:02:24,"3b26a75f-1b70-491d-93f7-0d9f205026ec"
"Kamerbrief over Appreciatie moties 15 juni 2023","https://www.rijksoverheid.nl/documenten/kamerstukken/2023/06/20/kamerbrief-over-appreciatie-moties-15-juni","Minister Kuipers (VWS) stuurt de Tweede Kamer een brief over appreciatie (aangepaste) moties over de tweeminutendebatten Bekostiging tolkenvoorzieningen en het rapport Tolken in de zorg, stand van zaken gebruik Corona Opt-in en Ontwikkelingen rondom het coronavirus/pandemische paraatheid die plaatsvonden op 15 juni 2023.Kamerbrief over Appreciatie moties 15 juni 2023",2023-06-20 09:56:57,"9713ac80-4f83-4748-aff5-5135b0a644de"
"Kamerbrief over beantwoording SO inzake Definitief besluit concentratie interventies bij aangeboren hartafwijkingen","https://www.rijksoverheid.nl/documenten/kamerstukken/2023/06/20/kamerbrief-beantwoording-so-inzake-definitief-besluit-concentratie-interventies-bij-aangeboren-hartafwijkingen","Minister Kuipers (VWS) beidt de Tweede Kamer de antwoorden aan uit het Schriftelijk Overleg over het definitief besluit concentratie interventies bij aangeboren hartafwijkingen. Kamerbrief over beantwoording SO inzake Definitief besluit concentratie interventies bij aangeboren hartafwijkingen",2023-06-20 09:42:04,"ba83eae0-6d28-41d6-adbb-c4b28165c6bf"
"Nota van wijziging over vergunningplicht en meldplicht over poliovirus","https://www.rijksoverheid.nl/documenten/kamerstukken/2023/06/20/nota-van-wijziging","Nota van wijziging van de Wet publieke gezondheid vanwege de invoering van een vergunningplicht en een meldplicht ter zake van het verrichten van handelingen met poliovirus en enkele andere wijzigingen.Nota van wijziging over vergunningplicht en meldplicht over poliovirus",2023-06-20 09:33:35,"3961672b-7bcc-489f-8b00-f1d5bda6ed29"
"Nota naar aanleiding van het verslag over vergunningplicht en meldplicht over poliovirus ","https://www.rijksoverheid.nl/documenten/kamerstukken/2023/06/20/nota-naar-aanleiding-van-het-verslag","Nota naar aanleiding van het verslag van de wijziging van Wet publieke gezondheid vanwege de invoering van een vergunningplicht en een meldplicht ter zake van het verrichten van handelingen met poliovirus en enkele andere wijzigingen.Nota naar aanleiding van het verslag over vergunningplicht en meldplicht over poliovirus",2023-06-20 09:33:35,"4bd5fa40-3e63-492f-89fd-56565e56a6a1"
"Kamerbrief over motie over hulpmiddelen thuis laten staan","https://www.rijksoverheid.nl/documenten/kamerstukken/2023/06/19/kamerbrief-over-motie-over-hulpmiddelen-thuis-laten-staan","Minister Helder (Langdurige Zorg en Sport) informeert de Tweede Kamer over de motie van de Kamerleden Westerveld (GroenLinks) en Bikker (ChristenUnie). Deze motie vraagt de regering om met betrokken partijen landelijke afspraken te maken over het behoud van hulpmiddelen thuis voor cliënten die verhuizen naar een instelling en die aangeven thuis te willen logeren. Kamerbrief over motie over hulpmiddelen thuis laten staan",2023-06-20 08:57:53,"70c5ee6d-2d48-47ad-958f-75149ae33726"
"Kamerbrief over verzoek om reactie op code oranje in ziekenhuis Bonaire vanwege onvoldoende budget","https://www.rijksoverheid.nl/documenten/kamerstukken/2023/06/19/kamerbrief-over-verzoek-om-reactie-op-code-oranje-in-ziekenhuis-bonaire-i-v-m-onvoldoende-budget","Staatssecretaris Van Ooijen (VWS) stuurt de Tweede Kamer de kabinetsreactie op het bericht dat in het ziekenhuis in Bonaire code oranje is afgegeven. De vaste Tweede Kamercommissie voor Koninkrijksrelaties had de staatssecretaris om reactie gevraagd.Kamerbrief over verzoek om reactie op code oranje in ziekenhuis Bonaire vanwege onvoldoende budget",2023-06-20 08:19:24,"2085b85d-8fc0-437e-a1a6-3478d31f849e"
"Kamerbrief over verzoek kabinetsreactie op het nieuwsbericht “Code oranje voor zorg Bonaire” van het Antilliaans Dagblad","https://www.rijksoverheid.nl/documenten/kamerstukken/2023/06/19/kamerbrief-over-verzoek-kabinetsreactie-op-het-nieuwsbericht-code-oranje-voor-zorg-bonaire-van-het-antilliaans-dagblad","Staatssecretaris Van Ooijen (VWS) stuurt de Tweede Kamer de kabinetsreactie op het nieuwsbericht “Code oranje voor zorg Bonaire” van het Antilliaans Dagblad van 15 mei 2023. De vaste Tweede Kamercommissie voor Koninkrijksrelaties had de staatssecretaris om een reactie gevraagd. Kamerbrief over verzoek kabinetsreactie op het nieuwsbericht “Code oranje voor zorg Bonaire” van het Antilliaans Dagblad",2023-06-20 08:04:12,"1e242cd6-8a0a-48d0-b9a6-e35100c29e83"
"Antwoorden op Kamervragen over het financieel wanbeheer bij het ministerie van VWS","https://www.rijksoverheid.nl/documenten/kamerstukken/2023/06/19/antwoorden-op-kamervragen-over-het-financieel-wanbeheer-bij-het-ministerie-van-vws","Minister Kuipers (VWS) geeft antwoord op vragen over het financieel wanbeheer bij het ministerie van VWS. Het Tweede Kamerlid Van Haga (Groep Van Haga) heeft de vragen gesteld. Antwoorden op Kamervragen over het financieel wanbeheer bij het ministerie van VWS",2023-06-20 06:51:25,"b9261210-8254-4c67-83aa-6e7f29d9dde8"
"Kamerbrief over deelrapporten onderzoek inkoop persoonlijke beschermingsmiddelen","https://www.rijksoverheid.nl/documenten/kamerstukken/2023/06/19/kamerbrief-over-deelrapporten-onderzoek-inkoop-persoonlijke-beschermingsmiddelen","Minister Helder (Langdurige Zorg en Sport) informeert de Tweede Kamer over deelrapporten onderzoek inkoop persoonlijke beschermingsmiddelenKamerbrief over deelrapporten onderzoek inkoop persoonlijke beschermingsmiddelen",2023-06-19 15:14:55,"92ee8c3d-d135-473b-b916-e3c7c9d3c881"
"Antwoorden op Kamervragen over het artikel 'Het gebrek aan zorg voor psychiatrische patiënten met een verslaving drijft ouders tot wanhoop: ‘Wij zijn gevangen in de zorg voor hem’'","https://www.rijksoverheid.nl/documenten/kamerstukken/2023/06/19/antwoorden-op-kamervragen-over-het-artikel-het-gebrek-aan-zorg-voor-psychiatrische-patienten-met-een-verslaving-drijft-ouders-tot-wanhoop-wij-zijn-gevangen-in-de-zorg-voor-hem","Minister Helder (Langdurige Zorg en Sport) en staatssecretaris Van Ooijen (VWS) geven antwoorden op vragen over het artikel 'Het gebrek aan zorg voor psychiatrische patiënten met een verslaving drijft ouders tot wanhoop: ‘Wij zijn gevangen in de zorg voor hem’'. De Tweede Kamerleden Kat en Raemakers (beiden D66) hebben de vragen gesteld. Antwoorden op Kamervragen over het artikel 'Het gebrek aan zorg voor psychiatrische patiënten met een verslaving drijft ouders tot wanhoop: ‘Wij zijn gevangen in de zorg voor hem’'",2023-06-19 14:13:23,"7e8779a4-46c5-4381-82ea-7fd30b10512c"
"Aanbiedingsbrief nota naar aanleiding van verslag wetsvoorstel toevoeging 11e gemeente aan experiment gesloten coffeeshopketen","https://www.rijksoverheid.nl/documenten/kamerstukken/2023/06/19/kamerbrief-over-voorstel-van-wet-tot-wijziging-van-de-wet-experiment-gesloten-coffeeshopketen-in-verband-met-de-toevoeging-van-een-elfde-gemeente-aan-het-experiment-36279","Minister Kuipers (VWS) en minister Yeşilgöz-Zegerius (JenV) sturen de Tweede Kamer de nota naar aanleiding van het verslag over het voorstel van wet tot wijziging van de Wet experiment gesloten coffeeshopketen in verband met de toevoeging van een 11e gemeente aan het experiment.Aanbiedingsbrief nota naar aanleiding van verslag wetsvoorstel toevoeging 11e gemeente aan experiment gesloten coffeeshopketen",2023-06-19 13:08:00,"551bae5a-3845-4e7c-8190-696a77914e0b"
"Nota naar aanleiding van verslag wetsvoorstel toevoeging 11e gemeente aan experiment gesloten coffeeshopketen","https://www.rijksoverheid.nl/documenten/kamerstukken/2023/06/19/nota-naar-aanleiding-van-het-verslag","Minister Kuipers (VWS) en minister Yeşilgöz-Zegerius (JenV) geven antwoord op vragen over het voorstel van wet tot wijziging van de Wet experiment gesloten coffeeshopketen in verband met de toevoeging van een 11e gemeente aan het experiment. De Tweede Kamerfracties van VVD, D66, SP, ChristenUnie en SGP hebben deze vragen gesteld.Nota naar aanleiding van verslag wetsvoorstel toevoeging 11e gemeente aan experiment gesloten coffeeshopketen",2023-06-19 13:07:59,"40a2ef14-5a4f-4513-831e-73a6c94c1801"
"Kamerbrief over naar een toekomstbestendig stelsel voor de vergoeding van nieuwe dure geneesmiddelen uit het basispakket","https://www.rijksoverheid.nl/documenten/kamerstukken/2023/06/16/kamerbrief-over-naar-een-toekomstbestendig-stelsel-voor-de-vergoeding-van-nieuwe-dure-geneesmiddelen-uit-het-basispakket","Minister Kuipers (VWS) stuurt de Tweede Kamer een brief over Naar een toekomstbestendig stelsel voor de vergoeding van nieuwe dure geneesmiddelen uit het basispakket.Kamerbrief over naar een toekomstbestendig stelsel voor de vergoeding van nieuwe dure geneesmiddelen uit het basispakket",2023-06-19 11:58:09,"a214d1bd-42c1-4b6c-95d3-24c5760e04b5"
"Kamerbrief over samenvattend rapport Zvw 2022 NZa","https://www.rijksoverheid.nl/documenten/kamerstukken/2023/06/19/kamerbrief-over-samenvattend-rapport-zvw-2022-nza","Minister Kuipers (VWS) stuurt het ‘Samenvattend rapport Zorgverzekeringswet 2022’ van de Nederlandse Zorgautoriteit (NZa) naar de Tweede Kamer. Kamerbrief over samenvattend rapport Zvw 2022 NZa",2023-06-19 11:52:31,"7284d12d-1591-48cb-9fe2-b30f891f4ccb"
