"item_title","item_link","item_description","item_pub_date","item_guid"
"Kamerbrief over Kabinetsreactie op advies Gezondheidsraad over een Meetprogramma voor blootstelling aan chemische stoffen","https://www.rijksoverheid.nl/documenten/kamerstukken/2024/11/07/kamerbrief-over-kabinetsreactie-op-advies-gezondheidsraad-over-een-meetprogramma-voor-blootstelling-aan-chemische-stoffen","Kamerbrief over Kabinetsreactie op advies Gezondheidsraad over een Meetprogramma voor blootstelling aan chemische stoffen",2024-11-07 16:23:02,"17714fc7-d79e-4370-94b5-4361d76b1247"
"Antwoorden op Kamervragen over bericht ‘Jorinde van Klinken zwijgt niet langer: ‘Ik heb echt heel serieuze zaken gehoord, ook verkrachtingen’’","https://www.rijksoverheid.nl/documenten/kamerstukken/2024/11/07/antwoorden-op-kamervragen-over-het-bericht-jorinde-van-klinken-zwijgt-niet-langer-ik-heb-echt-heel-serieuze-zaken-gehoord-ook-verkrachtingen","Staatssecretaris Karremans (Jeugd, Preventie en Sport) informeert de Tweede Kamer over over grensoverschrijdend gedrag in de sportwereld.Antwoorden op Kamervragen over bericht ‘Jorinde van Klinken zwijgt niet langer: ‘Ik heb echt heel serieuze zaken gehoord, ook verkrachtingen’’",2024-11-07 16:22:47,"6a1fd546-54fd-457a-90ff-a79d25305bf3"
"Kamerbrief over Continuering van de sluis voor zes geneesmiddelen","https://www.rijksoverheid.nl/documenten/kamerstukken/2024/11/07/kamerbrief-over-continuering-van-de-sluis-voor-zes-geneesmiddelen","Kamerbrief over Continuering van de sluis voor zes geneesmiddelen",2024-11-07 15:55:14,"e9725120-1006-419e-8400-1a362e26036a"
"Uitstelbrief op Kamervragen over de zorgelijke situatie van het ziekenhuislandschap in Friesland","https://www.rijksoverheid.nl/documenten/kamerstukken/2024/11/07/uitstelbrief-antwoorden-kamervragen-over-de-zorgelijke-situatie-van-het-ziekenhuislandschap-in-friesland","Minister Agema (VWS) meldt dat de antwoorden op vragen over de zorgelijke situatie van het ziekenhuislandschap in Friesland later komen dan gebruikelijk. Het Tweede Kamerlid Bushoff (GroenLinks-PvdA) heeft de vragen gesteld.Uitstelbrief op Kamervragen over de zorgelijke situatie van het ziekenhuislandschap in Friesland",2024-11-07 15:51:22,"3674676d-17f1-4897-8c3a-044ff8d6de7c"
"Kamerbrief over ontwikkelingen bevolkingsonderzoeken naar kanker 2024","https://www.rijksoverheid.nl/documenten/kamerstukken/2024/11/07/kamerbrief-over-ontwikkelingen-in-de-bevolkingsonderzoeken-naar-kanker-2024","Staatssecretaris Karremans (Jeugd, Preventie en Sport) informeert de Tweede Kamer over ontwikkelingen in de bevolkingsonderzoeken naar kanker in 2024.Kamerbrief over ontwikkelingen bevolkingsonderzoeken naar kanker 2024",2024-11-07 14:47:05,"46cae505-526b-4c45-97c3-7397e3febe48"
"Kamerbrief over nazending Voortgangsbrief Jeugd","https://www.rijksoverheid.nl/documenten/kamerstukken/2024/11/06/kamerbrief-over-nazending-voortgangsbrief-jeugd","Staatssecretaris Karremans (Jeugd, Preventie en Sport) stuurt de Tweede Kamer alsnog drie bijlagen die per ongeluk niet waren meegestuurd met de Voortgangsbrief Jeugd van 5 november 2024.Kamerbrief over nazending Voortgangsbrief Jeugd",2024-11-07 13:59:15,"6537ec10-f333-40a1-8728-654420a16f6e"
"Antwoorden op Kamervragen over antwoorden op eerdere vragen over het opleggen van budgetplafonds aan Pro Persona door de zorgverzekeraars ","https://www.rijksoverheid.nl/documenten/kamerstukken/2024/11/06/antwoorden-op-kamervragen-over-de-antwoorden-op-eerdere-vragen-over-het-opleggen-van-budgetplafonds-aan-pro-persona-door-de-zorgverzekeraars","Staatssecretaris Karremans (Jeugd, Preventie en Sport) beantwoordt Kamervragen over eerdere vragen over het opleggen van budgetplafonds aan de GGZ-aanbieder Pro Persona door de zorgverzekeraars. De Tweede Kamerleden Dobbe (SP) en Westerveld (PvdA-GroenLinks) hadden de vragen gesteld. Antwoorden op Kamervragen over antwoorden op eerdere vragen over het opleggen van budgetplafonds aan Pro Persona door de zorgverzekeraars",2024-11-07 11:32:18,"d6f7cb45-18c5-4205-b097-7677d8a3257f"
"Antwoorden op Kamervragen over artikel ‘Wat vrouwen niet mogen weten over hun eigen borsten'","https://www.rijksoverheid.nl/documenten/kamerstukken/2024/11/06/antwoorden-op-kamervragen-over-het-artikel-wat-vrouwen-niet-mogen-weten-over-hun-eigen-borsten","Staatssecretaris Karremans (Jeugd, Preventie en Sport) geeft antwoord op vragen over het artikel ‘Wat vrouwen niet mogen weten over hun eigen borsten' De Tweede Kamerleden Tielen (VVD) en Westerveld (PvdA) hebben de vragen gesteld.Antwoorden op Kamervragen over artikel ‘Wat vrouwen niet mogen weten over hun eigen borsten'",2024-11-07 11:11:08,"b4db684f-fff5-4142-99cf-eac22ba27c43"
"Kamerbrief over het inlichten van vrouwen na het bevolkingsonderzoek over borstkanker","https://www.rijksoverheid.nl/documenten/kamerstukken/2024/11/06/kamerbrief-inzake-het-inlichten-van-vrouwen-na-het-bevolkingsonderzoek-over-borstkanker","Staatssecretaris Karremans (Jeugd, Preventie en Sport) geeft antwoord op vragen over vrouwen met zeer dicht borstweefsel in het bevolkingsonderzoek borstkanker. Het Tweede Kamerlid Westerveld (GroenLinks/PvdA) heeft de vragen gesteld.  Kamerbrief over het inlichten van vrouwen na het bevolkingsonderzoek over borstkanker",2024-11-07 10:43:56,"74422dbe-91c1-49f7-8b4d-318d0f2a14ce"
"Antwoorden Kamervragen over het bericht dat er voor het eerst iemand stierf in een zelfdodingsmachine","https://www.rijksoverheid.nl/documenten/kamerstukken/2024/11/05/antwoorden-kamervragen-over-het-bericht-dat-er-voor-het-eerst-iemand-stierf-in-een-zelfdodingsmachine","Minister Van Weel (JenV) geeft antwoorden op Kamervragen naar aanleiding van het bericht '1e persoon ter wereld sterft in 'zelfdodingscapsule' in Zwitserland'. Het Tweede Kamerlid Diederik van Dijk (SGP) had de vragen gesteld.Antwoorden Kamervragen over het bericht dat er voor het eerst iemand stierf in een zelfdodingsmachine",2024-11-07 06:50:02,"7d4b45e5-b7a2-4178-be0d-3c3148750868"
"Kamerbrief over opening post-COVID expertisecentra","https://www.rijksoverheid.nl/documenten/kamerstukken/2024/11/06/kamerbrief-over-opening-post-covid-expertisecentra","Minister Agema (VWS) informeert de Tweede Kamer over de opening van post-COVID expertisecentra. En over de voortgang van het ZonMw programma post-COVID en de middelen die daarvoor worden ingezet.Kamerbrief over opening post-COVID expertisecentra",2024-11-06 17:11:46,"ab86386f-5ded-4613-8e8f-cb545459fc07"
"Kamerbrief over voorhangbrief bekostigingsexperiment tijdelijk verblijf en ambulante grz","https://www.rijksoverheid.nl/documenten/kamerstukken/2024/11/06/kamerbrief-over-voorhangbrief-bekostigingsexperiment-tijdelijk-verblijf-en-ambulante-grz","Staatssecretaris Maeijer (Langdurige en Maatschappelijke Zorg) informeert de Tweede Kamer over de zakelijke inhoud van de aanwijzing die zij van plan is te geven op grond van artikel 7 van die wet aan de Nederlandse Zorgautoriteit (NZa). Met deze aanwijzing wil de staatssecretaris de NZa opdracht geven om met ingang van 1 januari 2026 op grond van artikel 58 van de Wmg in haar regelgeving de mogelijkheid op te nemen van een experiment. Dit experiment is een bekostigingsexperiment voor het tijdelijk verblijf en de ambulante geriatrische revalidatiezorg (grz) op grond van de Zorgverzekeringswet (Zvw). Eenzelfde brief is ook aan de Eerste Kamer gestuurd.Kamerbrief over voorhangbrief bekostigingsexperiment tijdelijk verblijf en ambulante grz",2024-11-06 15:52:19,"c15e8664-49de-419f-9c14-065d4864aa65"
"Aanbiedingsbrief bij IGJ Jaarrapportage Wafz 2023","https://www.rijksoverheid.nl/documenten/kamerstukken/2024/11/06/kamerbrief-over-aanbieding-igj-jaarrapportage-wafz-2023","Staatssecretaris Karremans (Jeugd, Preventie en Sport) biedt de Tweede Kamer de jaarrapportage 2023 van de Wet afbreking zwangerschap aan. Het rapport is van de Inspectie Gezondheidszorg en Jeugd (IGJ). Eenzelfde brief is ook aan de Eerste Kamer gestuurd.Aanbiedingsbrief bij IGJ Jaarrapportage Wafz 2023",2024-11-06 15:21:49,"aab4e430-31f3-43ec-bffb-c30d2f1bbad4"
"Voortgangsbrief Jeugd","https://www.rijksoverheid.nl/documenten/kamerstukken/2024/11/05/kamerbrief-over-voortgangsbrief-jeugd","Staatssecretaris Karremans (Jeugd, Preventie en Sport) en staatssecretaris Struycken (Rechtsbescherming) informeren de Tweede Kamer over de voortgang van verschillende onderwerpen op het gebied van jeugd. Eenzelfde brief is ook aan de Eerste Kamer gestuurd.Voortgangsbrief Jeugd",2024-11-06 13:06:22,"97bf3ffd-43e2-40da-8e4b-bce01548e1df"
"Antwoorden op Kamervragen over de postcovidexpertisecentra die per 1 november jl. zijn geopend, zoals aangekondigd in het bericht van de NOS ‘Eerste expertisecentra long covid openen in november’","https://www.rijksoverheid.nl/documenten/kamerstukken/2024/11/06/antwoorden-op-kamervragen-over-de-postcovidexpertisecentra-die-per-1-november-jl-zijn-geopend-zoals-aangekondigd-in-het-bericht-van-de-nos-eerste-expertisecentra-long-covid-openen-in-november","Antwoorden op Kamervragen over de postcovidexpertisecentra die per 1 november jl. zijn geopend, zoals aangekondigd in het bericht van de NOS ‘Eerste expertisecentra long covid openen in november’",2024-11-06 12:00:34,"ccc898a3-03cf-4293-88d0-d847fb7063af"
"Kamerbrief over lijst kritieke geneesmiddelen","https://www.rijksoverheid.nl/documenten/kamerstukken/2024/11/06/kamerbrief-over-de-nederlandse-lijst-kritieke-geneesmiddelen","Minister Agema (VWS) informeert de Tweede Kamer over de Nederlandse Lijst kritieke geneesmiddelen. Deze lijst  is opgesteld onder leiding van het Landelijk Coördinatiecentrum Geneesmiddelen (LCG) met relevante zorgpartijen.Kamerbrief over lijst kritieke geneesmiddelen",2024-11-06 10:16:47,"cb70b525-8560-4084-aaa6-3eb775e028d6"
"Kamerbrief over verzoek reactie rapport VU Amsterdam over oversterfte en COVID-19 vaccins","https://www.rijksoverheid.nl/documenten/kamerstukken/2024/11/05/kamerbrief-over-commissieverzoek-om-een-reactie-op-het-rapport-van-vu-amsterdam-m-b-t-oversterfte-en-covid-19-vaccins","Staatssecretaris Karremans (Jeugd, Preventie en Sport) stuurt de Tweede Kamer op verzoek een reactie op het rapport van de Vrije Universiteit Amsterdam over oversterfte en COVID-19 vaccins. Het verzoek om een reactie kwam van de vaste commissie voor Volksgezondheid, Welzijn en Sport (VWS).Kamerbrief over verzoek reactie rapport VU Amsterdam over oversterfte en COVID-19 vaccins",2024-11-06 09:44:10,"46574499-c95f-41ae-8fe2-aa9a4dd8d57e"
"Antwoorden op Kamervragen over het bericht ‘Kinderen in bedwang gehouden met pijnprikkels, commissie tegen martelen kijkt mee in Nederland’","https://www.rijksoverheid.nl/documenten/kamerstukken/2024/11/05/antwoorden-op-kamervragen-over-het-bericht-kinderen-in-bedwang-gehouden-met-pijnprikkels-commissie-tegen-martelen-kijkt-mee-in-nederland","Staatssecretaris Karremans (Jeugd, Preventie en Sport) beantwoordt vragen over het bericht ‘Kinderen in bedwang gehouden met pijnprikkels, commissie tegen martelen kijkt mee in Nederland’. De vragen zijn van het Kamerlid Van den Hil (VVD).Antwoorden op Kamervragen over het bericht ‘Kinderen in bedwang gehouden met pijnprikkels, commissie tegen martelen kijkt mee in Nederland’",2024-11-06 08:13:02,"4d298436-e25d-4988-bd5a-b1f56cc9d0d3"
"Antwoorden op Kamervragen over de hoge parkeertarieven bij ziekenhuizen ","https://www.rijksoverheid.nl/documenten/kamerstukken/2024/11/05/antwoorden-op-kamervragen-over-de-hoge-parkeertarieven-bij-ziekenhuizen","Minister Agema (VWS) beantwoordt vragen over de hoge parkeertarieven bij ziekenhuizen. De vragen van de Kamerleden Bushoff en De Hoop (beiden GroenLinks-PvdA).Antwoorden op Kamervragen over de hoge parkeertarieven bij ziekenhuizen",2024-11-06 08:08:35,"0b8f927f-110a-4cba-81a8-8f66900fdcc8"
"Antwoorden op Kamervragen over de compensatieregeling voor zorgmedewerkers met post-COVID","https://www.rijksoverheid.nl/documenten/kamerstukken/2024/11/05/antwoorden-op-kamervragen-over-de-compensatieregeling-voor-zorgmedewerkers-met-post-covid","Minister Agema (VWS) beantwoordt  over de compensatieregeling voor zorgmedewerkers met post-COVID. De vragen zijn van het Kamerlid Bushoff (PvdA).Antwoorden op Kamervragen over de compensatieregeling voor zorgmedewerkers met post-COVID",2024-11-05 16:36:19,"cb349fbc-d25f-4b11-89fc-a8d88d22b535"
