"item_title","item_link","item_description","item_pub_date","item_guid"
"Aanbiedingsbrief bij nota naar aanleiding van het 2e verslag wijziging Opiumwet","https://www.rijksoverheid.nl/documenten/kamerstukken/2024/09/16/kamerbrief-over-voorstel-van-wet-tot-wijziging-van-de-opiumwet-in-verband-met-het-toevoegen-van-een-derde-lijst-met-als-doel-het-tegengaan-van-de-productie-van-en-de-handel-in-nieuwe-psychoactieve-stoffen-en-enkele-andere-wijzigingen-36-159","Staatssecretaris Karremans (Jeugd, Preventie en Sport) stuurt een nota naar aanleiding van het 2e verslag over het voorstel van wet tot wijziging van de Opiumwet naar de Tweede Kamer. Het wetsvoorstel gaat over het toevoegen van een derde lijst met als doel het tegengaan van de productie van en de handel in nieuwe psychoactieve stoffen en enkele andere wijzigingen.Aanbiedingsbrief bij nota naar aanleiding van het 2e verslag wijziging Opiumwet",2024-09-17 06:49:45,"84eed5cc-7b1e-4f62-82a5-6d99514556d4"
"Nota naar aanleiding van het 2e verslag wijziging Opiumwet","https://www.rijksoverheid.nl/documenten/kamerstukken/2024/09/16/nota-naar-aanleiding-van-het-tweede-verslag","Staatssecretaris Karremans (Jeugd, Preventie en Sport) reageert op de vragen van de leden van de Tweede Kamerfracties van GroenLinks-PvdA, D66, Volt, PvdD, JA21 en de PVV in het 2e verslag van de Tweede Kamer over het voorstel van wet tot wijziging van de Opiumwet. Het wetsvoorstel gaat over het toevoegen van een derde lijst met als doel het tegengaan van de productie van en de handel in nieuwe psychoactieve stoffen en enkele andere wijzigingen.Nota naar aanleiding van het 2e verslag wijziging Opiumwet",2024-09-17 06:49:45,"e5af6a0d-ae79-46a7-a577-cdc5a164e29a"
"Kamerbrief over Wijziging Subsidieregeling Veelbelovende Zorg wegens verlenging van de werkingsduur","https://www.rijksoverheid.nl/documenten/kamerstukken/2024/09/16/kamerbrief-over-wijziging-van-de-subsidieregeling-veelbelovende-zorg-in-verband-met-verlenging-van-de-werkingsduur","Minister Agema (VWS) stuurt de Tweede Kamer de Wijziging van de Subsidieregeling Veelbelovende Zorg in verband met verlenging van de werkingsduur. De subsidieregeling kent op dit moment een vervaldatum van 1 februari 2025. De conceptregeling ziet op de verlenging van de werkingsduur van de regeling tot en met 31 december 2025.  De voorlegging geschiedt in het kader van de wettelijk voorgeschreven voorhangprocedure.Kamerbrief over Wijziging Subsidieregeling Veelbelovende Zorg wegens verlenging van de werkingsduur",2024-09-16 16:09:39,"6006c657-2f49-4358-93cf-e45b43ce8bb6"
"Antwoorden op Kamervragen over bericht sponsordeal KNVB met omstreden gokbedrijf","https://www.rijksoverheid.nl/documenten/kamerstukken/2024/09/16/antwoorden-op-kamervragen-over-het-bericht-knvb-sloot-sponsordeal-met-omstreden-gokbedrijf-dat-onderdeel-was-van-chinese-georganiseerde-misdaad","Staatssecretaris Karremans (Jeugd, Preventie en Sport) geeft antwoord op Kamervragen over het bericht ‘KNVB sloot sponsordeal met omstreden gokbedrijf dat onderdeel was van Chinese georganiseerde misdaad’. Het Tweede Kamerlid Bikker (ChristenUnie) heeft de vragen gesteld.Antwoorden op Kamervragen over bericht sponsordeal KNVB met omstreden gokbedrijf",2024-09-16 15:37:39,"cb77148b-a29f-4d8f-939c-3f8b2ef11551"
"Kamerbrief over Spoedwijziging Herzieningsregeling VIPP Babyconnect","https://www.rijksoverheid.nl/documenten/kamerstukken/2024/09/16/kamerbrief-over-spoedwijziging-herzieningsregeling-vipp-babyconnect","Minister Agema (VWS) informeert de Tweede Kamer over haar voornemen om een technische wijziging door te voeren in de conceptherziening van de subsidieregeling van VIPP Babyconnect die tot 18 september 2024 in voorhang in de Tweede Kamer ligt.Kamerbrief over Spoedwijziging Herzieningsregeling VIPP Babyconnect",2024-09-16 15:22:27,"7503c9d8-ce03-4bbc-aebd-2c741f1561be"
"Uitstelbrief antwoorden Kamervragen over vrouwensporten","https://www.rijksoverheid.nl/documenten/kamerstukken/2024/09/16/uitstelbrief-antwoorden-kamervragen-over-vrouwensporten","Uitstelbrief antwoorden Kamervragen over vrouwensporten",2024-09-16 15:11:00,"90d46bcd-729b-44a3-8c37-4555b195960a"
"Aanbiedingsbrief bij antwoorden op vragen schriftelijk overleg (SO) over Uitvoeringsregeling Waarschuwingsregister zorgfraude","https://www.rijksoverheid.nl/documenten/kamerstukken/2024/09/16/beantwoording-schriftelijk-overleg-so-inzake-uitvoeringsregeling-waarschuwingsregister-zorgfraude","Minister Agema (VWS) stuurt de Tweede Kamer de antwoorden op vragen over het voorstel voor de ontwerpregeling, houdende nadere regels ter uitvoering van de Wet bevorderen samenwerking en rechtmatige zorg en het Besluit bevorderen samenwerking en rechtmatige zorg met betrekking tot de uitvoering van artikel 2.1 van de wet en artikel 2.3 van het Besluit (Uitvoeringsregeling Waarschuwingsregister zorgfraude). De vragen zijn gesteld door leden van de VVD-fractie, de NSC-fractie en de BBB-fractie in een verslag van een schriftelijk overleg (VSO) met de minister.Aanbiedingsbrief bij antwoorden op vragen schriftelijk overleg (SO) over Uitvoeringsregeling Waarschuwingsregister zorgfraude",2024-09-16 14:48:07,"252fa840-9e4d-4c05-ae5c-05a23e9ba5fe"
"Kamerbrief inzake Verslag Bezoek Zuyderland-ziekenhuis  ","https://www.rijksoverheid.nl/documenten/kamerstukken/2024/09/16/kamerbrief-inzake-verslag-bezoek-zuyderland-ziekenhuis","Kamerbrief inzake Verslag Bezoek Zuyderland-ziekenhuis",2024-09-16 14:46:43,"cc2b879d-d5d6-4b53-bc40-0c7d2c3a8fc3"
"Aanbiedingsbrief bij antwoorden op vragen schriftelijk overleg (SO) over 'traject transparantie en voorkomen van ongewenste beïnvloeding van medisch professionals door bedrijven'","https://www.rijksoverheid.nl/documenten/kamerstukken/2024/09/16/kamerbrief-over-beantwoording-schriftelijk-overleg-inzake-traject-transparantie-en-voorkomen-van-ongewenste-beinvloeding-van-medisch-professionals-door-bedrijven","Minister Agema (VWS) stuurt de Tweede Kamer de antwoorden op vragen over de Kamerbrief 'Voortgang traject transparantie en voorkomen van ongewenste beïnvloeding van medisch professionals door bedrijven'. De vragen zijn gesteld door leden van de PVV-fractie, de GroenLinks-PvdA-fractie, de VVD-fractie, de NSC-fractie, de D66-fractie, de BBB-fractie en de CDA-fractie in een verslag van een schriftelijk overleg (VSO) met de minister.Aanbiedingsbrief bij antwoorden op vragen schriftelijk overleg (SO) over 'traject transparantie en voorkomen van ongewenste beïnvloeding van medisch professionals door bedrijven'",2024-09-16 14:33:58,"0cb111e5-5c3e-4914-a895-4deb08a54d16"
"Antwoorden op Kamervragen over het bericht '(Oud-)topsporters noemen lagere inkomsten 'ramp voor de clubs': 'Bezuinig niet op sport''","https://www.rijksoverheid.nl/documenten/kamerstukken/2024/09/16/antwoorden-op-kamervragen-over-het-bericht-oud-topsporters-noemen-lagere-inkomsten-ramp-voor-de-clubs-bezuinig-niet-op-sport","Staatssecretaris Karremans (Jeugd, Preventie en Sport) geeft antwoord op vragen over het bericht '(Oud-)topsporters noemen lagere inkomsten 'ramp voor de clubs': 'Bezuinig niet op sport''. De Tweede Kamerleden Inge van Dijk (CDA), Mohandis (GroenLinks-PvdA) en Van Nispen (SP) hebben de vragen gesteld.Antwoorden op Kamervragen over het bericht '(Oud-)topsporters noemen lagere inkomsten 'ramp voor de clubs': 'Bezuinig niet op sport''",2024-09-16 14:23:07,"b9cdfd7a-5fcc-4baa-a44e-fe469baf09b9"
"Afschrift brief staatssecretaris VWS aan gemeente Midden-Drenthe over erkenning Molukse KNIL-militairen","https://www.rijksoverheid.nl/documenten/kamerstukken/2024/09/06/getekende-brief-stasvws","Afschrift van een brief van de staatssecretaris VWS aan de gemeente Midden-Drenthe. De gemeente had de wens uitgesproken van nationale erkenning voor Molukse militairen van het KNIL (Koninklijk Nederlandsch-Indisch Leger).Afschrift brief staatssecretaris VWS aan gemeente Midden-Drenthe over erkenning Molukse KNIL-militairen",2024-09-16 11:29:18,"c3b09dcc-538d-42e7-b9fc-30ceb0e85c68"
"Antwoorden Kamervragen over het vogelgriepvirus dat overspringt van koeien op mensen","https://www.rijksoverheid.nl/documenten/kamerstukken/2024/09/13/beantwoording-kamervragen-over-het-vogelgriepvirus-dat-overspringt-van-koeien-op-mensen","Minister Wiersma (LVVN) geeft antwoorden op Kamervragen naar aanleiding van het bericht 'Vogelgriep uit koeien bindt aan receptor in de menselijke luchtwegen'. De Tweede Kamerleden Bromet en Bushoff (beiden GroenLinks-PvdA) hadden de vragen gesteld.Antwoorden Kamervragen over het vogelgriepvirus dat overspringt van koeien op mensen",2024-09-13 16:50:45,"5e52d682-a376-445e-a909-a4d2babed55b"
"Antwoorden op Kamervragen over vermindering aantal bedden voor psychische noodgevallen in regio Breda-Tilburg","https://www.rijksoverheid.nl/documenten/kamerstukken/2024/09/13/antwoorden-op-kamervragen-over-het-artikel-bedden-voor-psychische-noodgevallen-in-de-regio-breda-en-tilburg-verdwijnen-dit-is-precies-waar-we-al-langer-voor-vreesden","Staatssecretaris Karremans (Jeugd, Preventie en Sport) geeft antwoord op Kamervragen over het artikel 'Bedden voor psychische noodgevallen in de regio Breda en Tilburg verdwijnen: Dit is precies waar we al langer voor vreesden'. Het Tweede Kamerlid Van den Hil (VVD) heeft de vragen gesteld.Antwoorden op Kamervragen over vermindering aantal bedden voor psychische noodgevallen in regio Breda-Tilburg",2024-09-13 14:07:56,"25addd19-4d25-4a96-a3f5-9ea5ab0f3fac"
"Antwoorden op Kamervragen over de normalisering van drugsgebruik onder studenten","https://www.rijksoverheid.nl/documenten/kamerstukken/2024/09/13/antwoorden-op-kamervragen-over-het-artikel-studenten-vinden-drugs-gebruiken-de-normaalste-zaak-van-de-wereld","Staatssecretaris Karremans (Jeugd, Preventie en Sport) geeft antwoord op vragen over het artikel 'Studenten vinden drugs gebruiken de normaalste zaak van de werel'. Het Tweede Kamerlid Jansen (Nieuw Sociaal  Contract)  heeft de vragen gesteld. Antwoorden op Kamervragen over de normalisering van drugsgebruik onder studenten",2024-09-13 14:03:00,"0e270b0a-4d34-4a32-98df-0b9b240937f2"
"Uitstelbrief op Kamervragen over het bericht dat kwart van ouders met lager inkomen kind niet op zwemles doet","https://www.rijksoverheid.nl/documenten/kamerstukken/2024/09/13/uitstelbrief-op-kamervragen-over-het-bericht-kwart-van-ouders-met-lager-inkomen-doet-kind-niet-op-zwemles-oplopende-kosten-vaak-de-reden","Staatssecretaris Karremans (Jeugd, Preventie en Sport) meldt dat de antwoorden op vragen over het bericht 'Kwart van ouders met lager inkomen doet kind niet op zwemles, oplopende kosten vaak de reden' later komen dan gebruikelijk. De Tweede Kamerleden Mohandis (GroenLinks-PvdA) en van Nispen (SP) hebben de vragen gesteld.Uitstelbrief op Kamervragen over het bericht dat kwart van ouders met lager inkomen kind niet op zwemles doet",2024-09-13 13:30:32,"9aef8f1b-f8d0-42ce-b6c9-cd35a346e799"
"Kamerbrief over Besluit intrekken en doorhaling Unieke Zorgverlener Identificatie","https://www.rijksoverheid.nl/documenten/kamerstukken/2024/09/09/kamerbrief-over-ontwerpbesluit-houdende-besluit-houdende-wijziging-van-het-besluit-gebruik-burgerservicenummer-in-de-zorg-en-het-besluit-jeugdwet-met-het-oog-op-de-verbetering-van-de-intrekkings-en-doorhalingsgronden-in-verband-met-de-toegangsmiddelen-het-register-en-de-autorisatielijst","Minister Agema (VWS) stuurt de Tweede Kamer, mede namens Staatssecretaris Karremans (Jeugd, Preventie en Sport ) het ontwerpbesluit houdende wijziging van het Besluit gebruik burgerservicenummer in de zorg en het Besluit Jeugdwet met het oog op de verbetering van de intrekkings- en doorhalingsgronden in verband met de toegangsmiddelen, het register en de autorisatielijst. De Eerste Kamer heeft eenzelfde brief gekregen.  De voorlegging geschiedt ter uitvoering van de voorhangprocedure.  Het betreft enkel een technische wijziging.Kamerbrief over Besluit intrekken en doorhaling Unieke Zorgverlener Identificatie",2024-09-13 13:14:49,"8f364900-f5c6-4974-ba3b-16bf46a48891"
"Kamerbrief over Kabinetsstandpunt gratis maken nummer 113","https://www.rijksoverheid.nl/documenten/kamerstukken/2024/09/12/kamerbrief-over-kabinetsstandpunt-gratis-maken-nummer-113","Staatssecretaris Karremans (Jeugd, Preventie en Sport) reageert op het onderzoeksrapport ‘Kosteloos bellen naar het nummer 113: verdieping implementatie’. Kamerbrief over Kabinetsstandpunt gratis maken nummer 113",2024-09-13 08:51:37,"837c9832-42d0-43ce-8a2c-6c88fe0b8d64"
"Kamerbrief met reactie op motie Dobbe over hulpmiddelen","https://www.rijksoverheid.nl/documenten/kamerstukken/2024/09/10/kamerbrief-over-reactie-inzake-motie-dobbe-een-brede-aanpak-van-de-problemen-met-de-levering-van-hulpmiddelen","Minister Agema (VWS) reageert op de motie van het Tweede Kamerlid Dobbe (SP). De motie ging over een brede aanpak van de problemen met de levering van hulpmiddelen.Kamerbrief met reactie op motie Dobbe over hulpmiddelen",2024-09-12 12:48:22,"08fbfa21-c0b3-4058-b94e-a27fd0ecf855"
"Antwoorden op Kamervragen over het bericht ‘Veel Nederlandse tandartsen gaan binnenkort met pensioen, alleen in Italië studeren er minder nieuwe af’ ","https://www.rijksoverheid.nl/documenten/kamerstukken/2024/09/10/antwoorden-op-kamervragen-over-het-bericht-veel-nederlandse-tandartsen-gaan-binnenkort-met-pensioen-alleen-in-italie-studeren-er-minder-nieuwe-af","Minister Agema (VWS) beantwoordt vragen over het bericht ‘Veel Nederlandse tandartsen gaan binnenkort met pensioen, alleen in Italië studeren er minder nieuwe af’. De vragen zijn van het Kamerlid Dijk (SP).Antwoorden op Kamervragen over het bericht ‘Veel Nederlandse tandartsen gaan binnenkort met pensioen, alleen in Italië studeren er minder nieuwe af’",2024-09-12 12:11:43,"5da9bd39-4413-4402-ad33-381b7dd8e5dd"
"Antwoorden op Kamervragen over het bericht 'Wat nou smaakjesverbod? Nepsigaret met menthol en fruit op de markt  dankzij 'truc' van tabakgigant'","https://www.rijksoverheid.nl/documenten/kamerstukken/2024/09/10/antwoorden-op-kamervragen-over-het-bericht-wat-nou-smaakjesverbod-nepsigaret-met-menthol-en-fruit-op-de-markt-dankzij-truc-van-tabakgigant","Staatssecretaris Karremans (Jeugd, Preventie en Sport) geeft antwoord op vragen over het bericht 'Wat nou smaakjesverbod? Nepsigaret met menthol en fruit op de markt  dankzij 'truc' van tabakgigant'. Het Tweede Kamerlid Jansen (NSC) heeft de vragen gesteld.Antwoorden op Kamervragen over het bericht 'Wat nou smaakjesverbod? Nepsigaret met menthol en fruit op de markt  dankzij 'truc' van tabakgigant'",2024-09-12 09:42:33,"e992d36f-7685-4b4f-91e8-643af1053eee"
