"item_title","item_link","item_description","item_pub_date","item_guid"
"Antwoorden op Kamervragen over bericht ‘Jongeren en hun smartphones een wereldwijde geestelijke giframp’","https://www.rijksoverheid.nl/documenten/kamerstukken/2023/09/11/antwoorden-op-kamervragen-over-het-bericht-jongeren-en-hun-smartphones-een-wereldwijde-geestelijke-giframp","Staatssecretaris Van Ooijen (VWS) geeft antwoord op vragen over het bericht ‘Jongeren en hun smartphones een wereldwijde geestelijke giframp’. Het Tweede Kamerlid Verkuijlen (VVD) heeft deze vragen gesteld.Antwoorden op Kamervragen over bericht ‘Jongeren en hun smartphones een wereldwijde geestelijke giframp’",2023-09-11 15:54:08,"961a2749-e87f-46d5-b481-cd9c784168ad"
"Antwoorden op Kamervragen over recent vrijgegeven e-mails van en naar VWS","https://www.rijksoverheid.nl/documenten/kamerstukken/2023/09/11/antwoorden-op-kamervragen-over-e-mailverkeer-van-en-naar-het-ministerie-van-volksgezondheid-welzijn-en-sport-dat-onlangs-is-vrijgegeven","Staatssecretaris Van Ooijen (VWS) geeft antwoord op vragen over e-mailverkeer van en naar het ministerie van Volksgezondheid, Welzijn en Sport (VWS) dat onlangs is vrijgegeven. Het Tweede Kamerlid Van Houwelingen (FvD) heeft deze vragen gesteld.Antwoorden op Kamervragen over recent vrijgegeven e-mails van en naar VWS",2023-09-11 13:02:07,"d8e44cdb-1a2e-428c-906a-8d31cfdd55a5"
"Antwoorden op Kamervragen over het artikel ‘Internationale boksbond gaat olympische status verliezen om Russische invloeden’ ","https://www.rijksoverheid.nl/documenten/kamerstukken/2023/09/11/antwoorden-op-kamervragen-over-het-artikel-internationale-boksbond-gaat-olympische-status-verliezen-om-russische-invloeden","Minister Helder (Langdurige Zorg en Sport) stuurt de antwoorden op vragen over het artikel ‘Internationale boksbond gaat olympische status verliezen om Russische invloeden’. De Tweede Kamerleden Heerema en Brekelmans (beiden VVD) hebben de vragen gesteld.Antwoorden op Kamervragen over het artikel ‘Internationale boksbond gaat olympische status verliezen om Russische invloeden’",2023-09-11 10:43:05,"fe4cf4b5-639a-40e1-a246-71f059980ba4"
"Antwoorden op Kamervragen over het verkeerd informeren van de Eerste Kamer over de PCR-test tijdens de coronacrisis","https://www.rijksoverheid.nl/documenten/kamerstukken/2023/09/11/antwoorden-op-kamervragen-over-het-verkeerd-informeren-van-de-eerste-kamer-over-de-pcr-test-tijdens-de-coronacrisis","Antwoorden op Kamervragen over het verkeerd informeren van de Eerste Kamer over de PCR-test tijdens de coronacrisis",2023-09-11 09:05:13,"a3064551-72bb-4c6f-9b9f-622cb999980e"
"Antwoorden op Kamervragen over de verlenging van de voorwaardelijke vergoeding van de paramedische herstelzorg na COVID-19","https://www.rijksoverheid.nl/documenten/kamerstukken/2023/09/11/anwtwoorden-op-kamervragen-over-de-verlenging-van-de-voorwaardelijke-vergoeding-van-de-paramedische-herstelzorg-na-covid-19","Minister Kuipers (VWS) geeft antwoord op vragen over de verlenging van de voorwaardelijke vergoeding van de paramedische herstelzorg na COVID-19 (2023Z13863). Het Tweede Kamerlid Dijk (SP) heeft de vragen gesteld.Antwoorden op Kamervragen over de verlenging van de voorwaardelijke vergoeding van de paramedische herstelzorg na COVID-19",2023-09-11 09:01:15,"633fe2c0-b9cb-4781-aa23-c2ed6df57f70"
"Kamerbrief over Bestuurlijke afspraken Zvw-pgb 2024","https://www.rijksoverheid.nl/documenten/kamerstukken/2023/09/08/kamerbrief-over-bestuurlijke-afspraken-zvw-pgb-2024","Kamerbrief over Bestuurlijke afspraken Zvw-pgb 2024",2023-09-08 13:46:03,"623f3650-c468-471d-932a-56b1f759c3a6"
"Uitstelbrief op Kamervragen over bericht dat weer 2 huisartsenpraktijken zijn overgenomen door commerciële keten","https://www.rijksoverheid.nl/documenten/kamerstukken/2023/09/08/uitstelbrief-op-kamervragen-over-het-bericht-dat-er-alweer-twee-huisartsenpraktijken-zijn-overgenomen-door-de-commerciele-keten-co-med","Minister Kuipers (VWS) meldt dat de antwoorden op vragen over het bericht dat er alweer 2 huisartsenpraktijken zijn overgenomen door de commerciële keten Co-Med later komen dan gebruikelijk. Het Tweede Kamerlid Jimmy Dijk (SP) heeft de vragen gesteld. Uitstelbrief op Kamervragen over bericht dat weer 2 huisartsenpraktijken zijn overgenomen door commerciële keten",2023-09-08 12:40:01,"23b4c50c-4209-456b-a4d7-ff92f5f08b72"
"Kamerbrief bij eindevaluatie Actieplan Verbetering Feitenonderzoek Jeugdbeschermingsketen","https://www.rijksoverheid.nl/documenten/kamerstukken/2023/09/07/tk-eindevaluatie-actieplan-verbetering-feitenonderzoek","Minister Weerwind (Rechtsbescherming) stuurt de Tweede Kamer het evaluatierapport over het Actieplan Verbetering Feitenonderzoek in de Jeugdbeschermingsketen. Dit liep van 2018 tot en met 2021. Hij geeft een korte toelichting.",2023-09-07 15:30:00,"4b2ceadc-705e-4a4f-bddc-e3d5f775ebd1"
"Kamerbrief over geannoteerde agenda informele OJCS Raad 18 september 2023","https://www.rijksoverheid.nl/documenten/kamerstukken/2023/09/06/kamerbrief-over-geannoteerde-agenda-informele-ojcs-raad-onderdeel-jeugd-18-september-2023","Staatssecretaris Van Ooijen (VWS) informeert de Tweede Kamer over de informele Onderwijs-, Jeugd-, Cultuur- en Sportraad (OJCS-Raad) op 18 september 2023 in Zaragoza (Spanje). De Eerste Kamer heeft eenzelfde brief gekregen.Kamerbrief over geannoteerde agenda informele OJCS Raad 18 september 2023",2023-09-06 13:15:56,"38b7c75e-3e9a-49e7-8756-df31209a1ccc"
"Antwoorden op Kamervragen over het bericht dat kinderen soms langer dan een jaar wachten op logopedie","https://www.rijksoverheid.nl/documenten/kamerstukken/2023/09/06/antwoorden-op-kamervragen-over-het-bericht-dat-kinderen-soms-langer-dan-een-jaar-wachten-op-logopedie","Antwoorden op Kamervragen over het bericht dat kinderen soms langer dan een jaar wachten op logopedie",2023-09-06 13:11:48,"65cc05c2-b3ac-4b22-b892-fd6f5a6def56"
"Antwoorden op Kamervragen over de verdeling van opleidingsplaatsen over heel Nederland","https://www.rijksoverheid.nl/documenten/kamerstukken/2023/09/06/antwoorden-op-kamervragen-over-de-verdeling-van-opleidingsplaatsen-over-heel-nederland","Minister Kuipers (VWS) geeft antwoord op vragen over de verdeling van opleidingsplaatsen over heel Nederland. Het Tweede Kamerlid Van den Berg (CDA) heeft de vragen gesteld.Antwoorden op Kamervragen over de verdeling van opleidingsplaatsen over heel Nederland",2023-09-06 11:13:03,"001c45ae-7d27-4971-ac1f-223721289437"
"Antwoorden op Kamervragen over eigen bijdrage voor kunstgebit","https://www.rijksoverheid.nl/documenten/kamerstukken/2023/09/06/antwoorden-op-kamervragen-over-de-eigen-bijdrage-voor-een-kunstgebit","Minister Kuipers (VWS) geeft antwoord op vragen over de eigen bijdrage voor een kunstgebit. Het Tweede Kamerlid Agema (PVV) heeft de vragen gesteld.Antwoorden op Kamervragen over eigen bijdrage voor kunstgebit",2023-09-06 10:12:59,"b84d8416-9322-494a-adfe-743da77826ca"
"Antwoorden op Kamervragen over aanpak illegale handel in beschermde plant- en diersoorten","https://www.rijksoverheid.nl/documenten/kamerstukken/2023/09/05/beantwoording-vragen-over-de-aanpak-van-illegale-handel-in-beschermde-plant-en-diersoorten-of-producten-ervan","Minister Van der Wal-Zeggelink (Natuur en Stikstof) geeft antwoord op vragen over de aanpak van illegale handel in beschermde plant- en diersoorten en producten hiervan. De Tweede Kamerleden Van Esch en Wassenberg (beiden PvdD) hebben deze vragen gesteld.Antwoorden op Kamervragen over aanpak illegale handel in beschermde plant- en diersoorten",2023-09-06 09:36:26,"13b41724-80f7-4cb7-8ceb-37e96884d3fd"
"Kamerbrief over aanpassing bestrijding hoogpathogene vogelgriep in pluimveedicht gebied ","https://www.rijksoverheid.nl/documenten/kamerstukken/2023/09/04/aanpassing-beleid-bestrijding-hoogpathogene-vogelgriep-in-pluimveedicht-gebied-en-andere-onderwerpen-diergezondheid","Minister Adema (LNV) informeert de Tweede Kamer over een wijziging in de bestrijding van vogelgriep. De brief gaat ook over de bestrijding van de rundveeziekte Boviene Virus Diarree (BVD), het introductierisico van Afrikaanse varkenspest, het project veterinaire veld en diergeneeskundige handelingen door medewerkers van de dierenambulance. Kamerbrief over aanpassing bestrijding hoogpathogene vogelgriep in pluimveedicht gebied",2023-09-05 09:21:31,"85f190ff-15e8-4e24-9337-890b77aec2e6"
"Antwoorden op Kamervragen over de staat van spoedeisende hulp in Nederland ","https://www.rijksoverheid.nl/documenten/kamerstukken/2023/09/04/antwoorden-op-kamervragen-over-de-staat-van-de-spoedeisende-hulp-in-nederland","Minister Kuipers (VWS) geeft antwoord op vragen over de staat van de spoedeisende hulp in Nederland. Het Tweede Kamerlid Dijk (SP) heeft de vragen gesteld. Antwoorden op Kamervragen over de staat van spoedeisende hulp in Nederland",2023-09-04 12:39:48,"e45b00fb-1d63-4e7c-a486-dfcadce403d0"
"Kamerbrief over regeling zorgmedewerkers met langdurige post-COVID klachten","https://www.rijksoverheid.nl/documenten/kamerstukken/2023/09/01/kamerbrief-over-regeling-zorgmedewerkers-met-langdurige-post-covid-klachten","Kamerbrief over regeling zorgmedewerkers met langdurige post-COVID klachten",2023-09-01 14:09:56,"f62894d3-c310-4b3a-b320-055e205babaa"
"Antwoorden op Kamervragen over de ‘goedkeuring’ van de FDA voor het voorschrijven van Ivermectine als behandeling tegen Covid-19","https://www.rijksoverheid.nl/documenten/kamerstukken/2023/09/01/antwoorden-op-kamervragen-over-de-goedkeuring-van-de-fda-voor-het-voorschrijven-van-ivermectine-als-behandeling-tegen-covid-19","Antwoorden op Kamervragen over de ‘goedkeuring’ van de FDA voor het voorschrijven van Ivermectine als behandeling tegen Covid-19",2023-09-01 14:08:41,"f763479c-478f-44f5-8770-819fb7005c61"
" Nota naar aanleiding van het verslag bij voorstel van wet tot wijziging van een aantal wetten VWS","https://www.rijksoverheid.nl/documenten/kamerstukken/2023/09/01/nota-n-a-v-verslag","Nota naar aanleiding van het verslag bij het voorstel van wet tot wijziging van een aantal wetten op het terrein van het ministerie van VWS. Nota naar aanleiding van het verslag bij voorstel van wet tot wijziging van een aantal wetten VWS",2023-09-01 14:05:33,"ff3e17b5-1127-4dcd-8403-1f39764b454b"
"Kamerbrief over Verzamelwet VWS 2023","https://www.rijksoverheid.nl/documenten/kamerstukken/2023/09/01/kamerbrief-over-verzamelwet-vws-2023","Kamerbrief over Verzamelwet VWS 2023",2023-09-01 14:05:33,"a9cc52cd-5076-4c5c-84a8-a8b4d93c6c04"
"Nota van wijziging bij voorstel van wet tot wijziging van een aantal wetten VWS","https://www.rijksoverheid.nl/documenten/kamerstukken/2023/09/01/nota-van-wijziging-en-toelichting","Nota van wijziging bij het voorstel van wet tot wijziging van een aantal wetten op het terrein van het ministerie van VWS.Nota van wijziging bij voorstel van wet tot wijziging van een aantal wetten VWS",2023-09-01 14:05:33,"6880f144-dd75-4299-bdb1-0c159f2e9f38"
