"item_title","item_link","item_description","item_pub_date","item_guid"
"Kamerbrief laboratoriumanalyses voedselveiligheid en motie-Flach","https://www.rijksoverheid.nl/documenten/kamerstukken/2025/03/03/kamerbrief-over-appreciatie-motie-flach-c-s","Staatssecretaris Karremans (Jeugd, Preventie en Sport) informeert de Tweede Kamer over de achtergrond van de kosten van laboratoriumanalyses bij verplichte toezichtcontroles voor voedselveiligheid. Ook reageert de staatssecretaris op de motie-Flach. Deze motie verzoekt de regering om private laboratoria die voldoen aan de kwaliteitsstandaarden uit de Europese regelgeving de mogelijkheid te geven zich te accrediteren voor het uitvoeren van testen bij de import van vers voedsel.Kamerbrief laboratoriumanalyses voedselveiligheid en motie-Flach",2025-03-03 17:12:47,"82bb86c4-7bd0-4c75-ac37-b3178b460769"
"Antwoorden op Kamervragen over dure importcontroles bij groente en fruit ","https://www.rijksoverheid.nl/documenten/kamerstukken/2025/03/03/antwoorden-op-kamervragen-over-de-dure-importcontroles-bij-groente-en-fruit","Staatssecretaris Karremans (Jeugd, Preventie en Sport) geeft antwoord op vragen over de dure importcontroles bij groente en fruit. De Tweede Kamerleden  Flach (SGP), Van Campen (VVD), Graus (PVV) en Pierik (BBB) hadden de vragen gesteld.Antwoorden op Kamervragen over dure importcontroles bij groente en fruit",2025-03-03 17:06:13,"7f7b75f8-fa16-42a9-aa2a-73f8533ccc57"
"Kamerbrief reactie op notitie over kinderen van ouders met psychische of verslavingsproblemen","https://www.rijksoverheid.nl/documenten/kamerstukken/2025/03/03/commissiebrief-inzake-3-den-verzoek-om-reactie-op-notitie-investeren-in-kinderen-van-ouders-met-psychische-en-of-verslavingsproblemen-koppkov-van-trimbos-instituut","Staatssecretaris Karremans (Jeugd, Preventie en Sport) reageert op de notitie ‘Investeren in Kinderen van Ouders met Psychische en/of Verslavingsproblemen’ van het Trimbos-instituut. De Tweede Kamer had om een reactie gevraagd.Kamerbrief reactie op notitie over kinderen van ouders met psychische of verslavingsproblemen",2025-03-03 16:17:28,"451582cf-1985-4125-86b0-336b619d9742"
"Uitstelbrief op Kamervragen over de ontwikkelingen rondom zelfstandige zorgprofessionals (zzp'ers in de zorg) onder andere zoals beschreven in het artikel van RTL 'In maand tijd ruim 4000 minder zzp'ers, vooral in de zorg'","https://www.rijksoverheid.nl/documenten/kamerstukken/2025/03/03/uitstelbrief-antwoorden-kamervragen-over-de-ontwikkelingen-rondom-zelfstandige-zorgprofessionals-zzp-ers-in-de-zorg-onder-andere-zoals-beschreven-in-het-artikel-van-rtl-in-maand-tijd-ruim-4000-minder-zzp-ers-vooral-in-de-zorg","Minister Agema (VWS) meldt dat de antwoorden op vragen over de ontwikkelingen rondom zelfstandige zorgprofessionals (zzp'ers in de zorg) onder andere zoals beschreven in het artikel van RTL 'In maand tijd ruim 4000 minder zzp'ers, vooral in de zorg' later komen dan gebruikelijk. De Tweede Kamerleden Tielen en Aartsen (beiden VVD) hebben de vragen gesteld.Uitstelbrief op Kamervragen over de ontwikkelingen rondom zelfstandige zorgprofessionals (zzp'ers in de zorg) onder andere zoals beschreven in het artikel van RTL 'In maand tijd ruim 4000 minder zzp'ers, vooral in de zorg'",2025-03-03 15:33:24,"02c8e8c7-f2ba-49f5-993d-86bec1b3ff1e"
"Kamerbrief over toestemmingvoor hoorzitting over het onderzoek naar de pleegzorg van een mishandeld meisje in Vlaardingen","https://www.rijksoverheid.nl/documenten/kamerstukken/2025/03/03/tk-toestemmingsbrief-vkc-volksgezondheid-welzijn-en-sport-over-hoorzitting-over-het-onderzoek-naar-de-pleegzorg-van-een-mishandeld-meisje-in-vlaardingen","Minister Van Weel (JenV) geeft toestemming aan de districtchef van de Eenheid Rotterdam voor deelname aan de hoorzitting met de vaste Tweede Kamercommissie voor Volksgezondheid, Welzijn en Sport (VWS) over het onderzoek naar de pleegzorg van een mishandeld meisje in Vlaardingen. De zitting vindt plaats op 3 maart 2025.Kamerbrief over toestemmingvoor hoorzitting over het onderzoek naar de pleegzorg van een mishandeld meisje in Vlaardingen",2025-03-03 13:21:27,"d5901795-feb2-46d5-8d1c-67fdd445faf6"
"Uitstelbrief antwoorden op Kamervragen over toepassen pijnprikkels in jeugdzorginstellingen","https://www.rijksoverheid.nl/documenten/kamerstukken/2025/03/03/uitstelbrief-antwoorden-kamervragen-over-het-toepassen-pijnprikkels-in-jeugdzorginstellingen","Staatssecretaris Karremans (Jeugd, Preventie en Sport) meldt dat de antwoorden op vragen over het toepassen van pijnprikkels  in jeugdzorginstellingen later komen dan gebruikelijk. Het Tweede Kamerlid Westerveld (GroenLinks-PvdA) heeft de vragen gesteld.Uitstelbrief antwoorden op Kamervragen over toepassen pijnprikkels in jeugdzorginstellingen",2025-03-03 11:30:20,"5546ddd5-0199-4d48-8767-05ce9aa46d8d"
"Kamerbrief over nota n.a.v. 2e verslag begrotingsstaten VWS 2025","https://www.rijksoverheid.nl/documenten/kamerstukken/2025/02/28/kamerbrief-over-nota-naar-aanleiding-van-het-tweede-verslag-begrotingsstaten-vws-2025","Minister Agema (VWS), staatssecretaris Maeijer (Langdurige en Maatschappelijke Zorg) en staatssecretaris Karremans (Jeugd,  Preventie en Sport) sturen de Eerste Kamer de nota naar aanleiding van het tweede verslag over de Begrotingsstaten VWS 2025.Kamerbrief over nota n.a.v. 2e verslag begrotingsstaten VWS 2025",2025-02-28 14:22:59,"140bc550-88c5-4982-a86d-690307547b2f"
"Nota n.a.v. 2e verslag begrotingsstaten VWS 2025","https://www.rijksoverheid.nl/documenten/kamerstukken/2025/02/28/nota-naar-aanleiding-van-het-tweede-verslag-begrotingsstaten-vws-2025","Minister Agema (VWS), staatssecretaris Maeijer (Langdurige en Maatschappelijke Zorg) en staatssecretaris Karremans (Jeugd,  Preventie en Sport) geven antwoord op vragen uit het tweede verslag over de Begrotingsstaten VWS 2025 van de vaste commissie voor Volksgezondheid, Welzijn en Sport uit de Eerste Kamer. Leden van de fracties van de GroenLinks-PvdA, D66, SP, PvdD en Volt hadden vragen gesteld en opmerkingen gemaakt.Nota n.a.v. 2e verslag begrotingsstaten VWS 2025",2025-02-28 14:22:59,"18c32723-892a-48d8-b7bd-98a373cf723d"
"Uitstelbrief antwoorden op Kamervragen over relatie 'koppen' en hersenschade","https://www.rijksoverheid.nl/documenten/kamerstukken/2025/02/28/uitstelbrief-antwoorden-kamervragen-over-het-alarmerende-boek-mijn-hoofd-doet-gek-over-de-relatie-tussen-koppen-en-hersenschade-in-het-nederlandse-voetbal-en-naar-aanleiding-van-het-eenvandaag-item-over-de-schadelijke-effecten-van-koppen","Staatssecretaris Karremans (Jeugd, Preventie en Sport) meldt aan de Tweede Kamer dat hij vragen niet op tijd kan beantwoorden. De vragen gaan over de relatie tussen 'koppen' in het voetbal en hersenschade, en de schadelijke effecten van 'koppen'. Het Tweede Kamerlid Mohandis (GroenLinks-PvdA) had de vragen gesteld.Uitstelbrief antwoorden op Kamervragen over relatie 'koppen' en hersenschade",2025-02-28 14:15:40,"fd424897-4f08-464d-9ffa-bd48ff562e7e"
"Uitstelbrief antwoorden op Kamervragen over dreiging vrouwelijke genitale verminking","https://www.rijksoverheid.nl/documenten/kamerstukken/2025/02/28/uitstelbrief-antwoorden-kamervragen-over-de-dreiging-van-vrouwelijke-genitale-verminking-in-nederland","Staatssecreraris Maeijer (Langdurige en Maatschappelijke Zorg) meldt aan de Tweede Kamer dat zij Kamervragen niet op tijd kan beantwoorden. De vragen gaan over de dreiging in Nederland van vrouwelijke genitale verminking. Het Tweede Kamerlid Dobbe (SP) had de vragen gesteld.  Uitstelbrief antwoorden op Kamervragen over dreiging vrouwelijke genitale verminking",2025-02-28 14:09:50,"ed9ffec0-d112-4a4d-bc93-234365b5eebd"
"Uitstelbrief antwoorden op Kamervragen over abortus vanwege geslacht","https://www.rijksoverheid.nl/documenten/kamerstukken/2025/02/28/uitstelbrief-antwoorden-kamervragen-over-abortus-vanwege-geslacht","Staatssecretaris Karremans (Jeugd, Preventie en Sport) meldt dat de antwoorden op vragen over abortus vanwege geslacht later komen dan gebruikelijk. De Tweede Kamerleden Van Dijk (SGP), Bikker (CU), Krul (CDA) en Van der Plas (BBB) hebben de vragen gesteld.Uitstelbrief antwoorden op Kamervragen over abortus vanwege geslacht",2025-02-28 13:49:56,"bb071a87-d9e9-4588-a902-2329dec48493"
"Uitstelbrief Kamervragen over bericht 'Zorgverzekeraars vinden thuis sterven vaak te duur'","https://www.rijksoverheid.nl/documenten/kamerstukken/2025/02/27/uitstelbrief-op-kamervragen-over-het-bericht-zorgverzekeraars-vinden-thuis-sterven-vaak-te-duur","Staatssecretaris Maeijer (Langdurige en Maatschappelijke Zorg) meldt dat de antwoorden op vragen over het bericht 'Zorgverzekeraars vinden thuis sterven vaak te duur' later komen dan gebruikelijk. Het Tweede Kamerlid Krul (CDA) heeft de vragen gesteld.Uitstelbrief Kamervragen over bericht 'Zorgverzekeraars vinden thuis sterven vaak te duur'",2025-02-27 10:54:13,"21abbc46-25c0-4596-b616-f5b7aaf089fc"
"Uitstelbrief antwoorden Kamervragen over het diversiteits-, gender- en inclusiebeleid binnen diverse uitvoeringsinstanties ","https://www.rijksoverheid.nl/documenten/kamerstukken/2025/02/27/uitstelbrief-antwoorden-kamervragen-over-het-diversiteits-gender-en-inclusiebeleid-binnen-diverse-uitvoeringsinstanties-van-verschillende-departementen","Minister Agema (VWS) stelt de toezending uit van de antwoorden op vragen over het diversiteits-, gender- en inclusiebeleid binnen diverse uitvoeringsinstanties. In dit geval RIVM. De vragen zijn van het Kamerlid Eerdmans (JA21) Uitstelbrief antwoorden Kamervragen over het diversiteits-, gender- en inclusiebeleid binnen diverse uitvoeringsinstanties",2025-02-27 10:52:31,"6b173d91-01a9-46f2-8ccc-443d7eb3f1fd"
"Uitstelbrief op Kamervragen over het bericht 'Diagnose prostaatkanker nu bijna net zo vaak als borstkanker, vorig jaar 15.000 keer'","https://www.rijksoverheid.nl/documenten/kamerstukken/2025/02/25/uitstelbrief-antwoorden-kamervragen-over-het-bericht-diagnose-prostaatkanker-nu-bijna-net-zo-vaak-als-borstkanker-vorig-jaar-15-000-keer","Staatssecretaris Karremans (Jeugd, Preventie en Sport) meldt dat de antwoorden op vragen over het bericht 'Diagnose prostaatkanker nu bijna net zo vaak als borstkanker, vorig jaar 15.000 keer' later komen dan gebruikelijk. Het Tweede Kamerlid Rikkers-Oosterkamp (BBB) heeft de vragen gesteld.Uitstelbrief op Kamervragen over het bericht 'Diagnose prostaatkanker nu bijna net zo vaak als borstkanker, vorig jaar 15.000 keer'",2025-02-25 09:45:38,"4673389c-10cd-42bd-97e2-3ee7c5b7456a"
"Uitstelbrief op Kamervragen over het bericht 'Zorgverzekeraars vinden thuis sterven vaak te duur'","https://www.rijksoverheid.nl/documenten/kamerstukken/2025/02/25/uitstelbrief-antwoorden-kamervragen-over-het-bericht-zorgverzekeraars-vinden-thuis-sterven-vaak-te-duur","Staatssecretaris Maeijer (Langdurige en Maatschappelijke Zorg) meldt dat de antwoorden op vragen over het bericht 'Zorgverzekeraars vinden thuis sterven vaak te duur' later komen dan gebruikelijk. De Tweede Kamerleden Bikker (ChristenUnie), Van Dijk (SGP), Dijk (SP) en Slagt-Tichelman (GroenLinks-PvdA) hebben de vragen gesteld.Uitstelbrief op Kamervragen over het bericht 'Zorgverzekeraars vinden thuis sterven vaak te duur'",2025-02-25 09:41:45,"7fad22fd-621a-42a5-a9f3-be4666765cfa"
"Antwoorden op Kamervragen over ontwerpbesluit Verbetering beschikbaarheid jeugdzorg","https://www.rijksoverheid.nl/documenten/kamerstukken/2025/02/21/kamerbrief-over-reactie-so-voorhang-ontwerpbesluit-verbetering-beschikbaarheid-jeugdzorg-en-reactie-op-brief-bgzj-over-dit-ontwerpbesluit","Staatssecretaris Karremans (Jeugd, Preventie en Sport) geeft antwoord op vragen over het ontwerpbesluit Verbetering beschikbaarheid jeugdzorg. De Tweede Kamerfracties van PVV, GroenLinks-PvdA, VVD, NSC, BBB, SP en SGP hebben deze vragen gesteld.Antwoorden op Kamervragen over ontwerpbesluit Verbetering beschikbaarheid jeugdzorg",2025-02-24 17:53:18,"9ee1f5c0-44c4-44f5-a56f-44ace40e52ec"
"Kamerbrief over voorhang ontwerpbesluit tot wijziging van het Besluit verbetering beschikbaarheid jeugdzorg","https://www.rijksoverheid.nl/documenten/kamerstukken/2025/02/21/kamerbrief-over-voorhang-ontwerpbesluit-verbetering-beschikbaarheid-jeugdzorg","Staatssecretaris Karremans (Jeugd, Preventie en Sport) stuurt de Eerste Kamer het ontwerpbesluit wijziging van het Besluit Jeugdwet teneinde te bevorderen dat jeugdhulp en gecertificeerde instellingen voor de uitvoering van kinderbeschermingsmaatregelen en jeugdreclassering steeds voldoende beschikbaar zijn (Besluit verbetering beschikbaarheid jeugdzorg).Kamerbrief over voorhang ontwerpbesluit tot wijziging van het Besluit verbetering beschikbaarheid jeugdzorg",2025-02-24 16:39:21,"8145669c-b618-463c-a33b-9b80d6e1837b"
"Kamerbrief over motie uitbreiden rook- en vapeverbod naar sportterreinen, speeltuinen, kinderopvanglocaties, dagattracties en openluchtzwembaden ","https://www.rijksoverheid.nl/documenten/kamerstukken/2025/02/21/kamerbrief-over-motie-inzake-het-rook-en-vapeverbod-uitbreiden-naar-sportterreinen-speeltuinen-kinderopvanglocaties-dagattracties-en-openluchtzwembaden","Staatssecretaris Karremans (Jeugd, Preventie en Sport) laat de Tweede Kamer weten dat een uitbreiding van het rook- en vapeverbod naar sportterreinen, speeltuinen, kinderopvanglocaties, dagattracties en openluchtzwembaden pas aan de orde is als er bij de NVWA  financiële middelen beschikbaar zijn voor handhaving van het verbod. In de motie Slagt-Tichelman en Krul was om zo'n verbod gevraagd.Kamerbrief over motie uitbreiden rook- en vapeverbod naar sportterreinen, speeltuinen, kinderopvanglocaties, dagattracties en openluchtzwembaden",2025-02-24 16:11:30,"fc568fbe-0300-4c83-a8e1-c0cfcdd0abdd"
"Kamerbrief over verzoek om reactie op petitie Alzheimer Nederland en Sociaal Werk","https://www.rijksoverheid.nl/documenten/kamerstukken/2025/02/21/kamerbrief-over-verzoek-om-reactie-op-petitie-alzheimer-nederland-en-sociaal-werk","Staatssecretaris Maeijer (Langdurige en Maatschappelijke Zorg) stuurt de Tweede Kamer een reactie op de petitie “vaste stek gezocht voor samenredzaamheid” van Alzheimer Nederland en Sociaal Werk. De vaste commissie voor Volksgezondheid, Welzijn en Sport had op 16 oktober 2024 om een reactie gevraagd.Kamerbrief over verzoek om reactie op petitie Alzheimer Nederland en Sociaal Werk",2025-02-24 15:44:16,"d0f5336e-746d-4db8-8375-e5dfe6c299d2"
"Antwoorden op Kamervragen over het bericht over hoe zorginstellingen diplomafraude bestrijden","https://www.rijksoverheid.nl/documenten/kamerstukken/2025/02/21/antwoorden-op-kamervragen-over-het-bericht-hoe-zorginstellingen-diplomafraude-bestrijden-kwaadwillenden-gaan-ingenieus-te-werk","Minister Agema (VWS) geeft antwoorden op Kamervragen naar aanleiding van het bericht 'Hoe zorginstellingen diplomafraude bestrijden: 'Kwaadwillenden gaan ingenieus te werk''. Het Tweede Kamerlid Tielen (VVD) had de vragen gesteld. Antwoorden op Kamervragen over het bericht over hoe zorginstellingen diplomafraude bestrijden",2025-02-24 15:04:52,"7f6b3df9-ac1e-4527-a0bf-6a3a7c7735a0"
