"item_title","item_link","item_description","item_pub_date","item_guid"
"Antwoorden op Kamervragen over noodkreet van gemeenten over doorontwikkeling verwijsindex februari 2024 ","https://www.rijksoverheid.nl/documenten/kamerstukken/2024/04/09/antwoorden-op-kamervragen-over-noodkreet-van-gemeenten-over-doorontwikkeling-verwijsindex-februari-2024","Antwoorden op Kamervragen over noodkreet van gemeenten over doorontwikkeling verwijsindex februari 2024",2024-04-09 15:08:55,"83acd4a4-5d2b-4093-8e25-64b265f9766e"
"Kamerbrief over advies ‘De opstelling aan de top’","https://www.rijksoverheid.nl/documenten/kamerstukken/2024/04/09/kamerbrief-over-aanbieding-advies-de-opstelling-aan-de-top","Minister Helder (VWS) stuurt de Tweede Kamer het advies van de Nederlandse Sportraad over het toekomstbestendig maken van organisatie en financiering van de topsport in Nederland ‘De opstelling aan de top’.Kamerbrief over advies ‘De opstelling aan de top’",2024-04-09 15:02:05,"ec33a6e2-1e5e-4806-8453-aad0cc4f3099"
"Antwoorden op Kamervragen over de berichten 'Recordaantal meldingen van personen met verward gedrag in 2023' en 'Duizenden kwetsbaren wachten op plek beschermd wonen' ","https://www.rijksoverheid.nl/documenten/kamerstukken/2024/04/09/antwoorden-op-kamervragen-over-de-berichten-recordaantal-meldingen-van-personen-met-verward-gedrag-in-2023-en-duizenden-kwetsbaren-wachten-op-plek-beschermd-wonen","Antwoorden op Kamervragen over de berichten 'Recordaantal meldingen van personen met verward gedrag in 2023' en 'Duizenden kwetsbaren wachten op plek beschermd wonen'",2024-04-09 14:56:40,"85202b36-a115-4e52-a988-7b57ee99b401"
"Kamerbrief met geannoteerde agenda informele EU Gezondheidsraad 23-24 april 2024","https://www.rijksoverheid.nl/documenten/kamerstukken/2024/04/09/kamerbrief-over-geannoteerde-agenda-informele-eu-gezondheidsraad-23-24-april-2024","Minister Dijkstra (Medische Zorg) biedt de Tweede Kamer de geannoteerde agenda voor de informele EU Gezondheidsraad  van 23 en 24 april 2024 en de kwartaalrapportage lopende wetgevingsdossiers op VWS-terrein aan. De Eerste Kamer heeft eenzelfde brief gekregen.Kamerbrief met geannoteerde agenda informele EU Gezondheidsraad 23-24 april 2024",2024-04-09 14:52:32,"55283b61-82b7-4f74-ac60-84031005f52b"
"Antwoorden op Kamervragen over rapport 'Preventie op waarde schatten'","https://www.rijksoverheid.nl/documenten/kamerstukken/2024/04/09/verslag-schriftelijk-overleg-rapport-preventie-op-waarde-schatten","Staatssecretaris Van Ooijen (VWS) stuurt de Tweede Kamer zijn reactie op de vragen over het advies ‘Preventie op waarde schatten’. De vragen zijn van de PVV-fractie,  de GroenLinks-PvdAfractie, de VVD-fractie, de NSC-fractie, de D66-fractie, de BBB-fractie, de CDA-fractie en de PvdD-fractie.Antwoorden op Kamervragen over rapport 'Preventie op waarde schatten'",2024-04-09 14:46:12,"354bd7b2-2cd4-47e2-aeae-be96882042d4"
"Antwoorden op Kamervragen over bericht ‘Verzorgingshuis laat stervende patiënt (87) niet meer eten, verpleger kan het niet verkroppen en gaat in de fout’ ","https://www.rijksoverheid.nl/documenten/kamerstukken/2024/04/09/antwoorden-op-kamervragen-over-het-bericht-verzorgingshuis-laat-stervende-patient-87-niet-meer-eten-verpleger-kan-het-niet-verkroppen-en-gaat-in-de-fout","Minister Helder (VWS) beantwoordt vragen over het bericht ‘Verzorgingshuis laat stervende patiënt (87) niet meer eten, verpleger kan het niet verkroppen en gaat in de fout’. Het Tweede Kamerlid Van Dijk (SGP) heeft de vragen gesteld.Antwoorden op Kamervragen over bericht ‘Verzorgingshuis laat stervende patiënt (87) niet meer eten, verpleger kan het niet verkroppen en gaat in de fout’",2024-04-09 14:35:12,"1ede8754-2297-4fb7-b666-d7531d453792"
"Kamerbrief met verslag formele EU Gezondheidsraad van 30 november 2023","https://www.rijksoverheid.nl/documenten/kamerstukken/2024/04/09/kamerbrief-over-verslag-formele-eu-gezondheidsraad-30-november-2023","Minister Dijkstra (Medische Zorg) stuurt de Tweede Kamer het verslag van de formele EU Gezondheidsraad van 30 november 2023. De Eerste Kamer heeft eenzelfde brief gekregen. Kamerbrief met verslag formele EU Gezondheidsraad van 30 november 2023",2024-04-09 14:07:17,"36c019d5-b3e1-4902-85fc-7391f4bb1ca6"
"Kamerbrief over bestuursafspraak Friese Taal en Cultuur 2024-2028","https://www.rijksoverheid.nl/documenten/kamerstukken/2024/04/08/kamerbrief-over-bestuursafspraak-friese-taal-en-cultuur-2024-2028","Minister De Jonge (BZK) stuurt de Tweede Kamer de Bestuursafspraak Friese taal en cultuur 2024-2028. Kamerbrief over bestuursafspraak Friese Taal en Cultuur 2024-2028",2024-04-09 07:32:37,"a4496afc-baf5-4913-8116-696292a47701"
"Kamerbrief over voortgang traject passende aanspraak fysio- en oefentherapie","https://www.rijksoverheid.nl/documenten/kamerstukken/2024/04/08/kamerbrief-over-voortgang-van-het-traject-naar-een-passende-aanspraak-fysio-en-oefentherapie","Minister Dijkstra (Medische Zorg) informeert de Tweede Kamer over de voortgang van het traject om te komen tot een passende aanspraak op fysio- en oefentherapeutische zorg (PAFOZ-traject). Dit traject heeft als doel te komen tot een advies van het Zorginstituut Nederland (ZN) over een geschikte vormgeving van de aanspraak op eerstelijns fysio- en oefentherapeutische zorg vanuit de basiszorgverzekering, rekening houdend met de principes van passende zorg.  Kamerbrief over voortgang traject passende aanspraak fysio- en oefentherapie",2024-04-09 06:57:00,"2c9fa9d0-53de-4a4b-a599-caf730c33fff"
"Kamerbrief over voortgang traject transparantie en voorkomen van ongewenste beïnvloeding van medisch professionals door bedrijven","https://www.rijksoverheid.nl/documenten/kamerstukken/2024/04/08/kamerbrief-over-voortgang-traject-transparantie-en-voorkomen-van-ongewenste-beinvloeding-van-medisch-professionals-door-bedrijven","Minister Dijkstra (Medische Zorg) informeert de Tweede Kamer over de voortgang van het traject transparantie en voorkomen van ongewenste beïnvloeding van medisch professionals door bedrijven.Kamerbrief over voortgang traject transparantie en voorkomen van ongewenste beïnvloeding van medisch professionals door bedrijven",2024-04-08 15:22:50,"01f7b397-00c2-4743-9c93-348b0f994fba"
"Antwoorden op Kamervragen over perinatale zorg ","https://www.rijksoverheid.nl/documenten/kamerstukken/2024/04/08/antwoorden-op-kamervragen-over-perinatale-zorg","Minister Dijkstra (Medische Zorg) geeft antwoord op vragen over perinatale zorg. De Tweede Kamerleden leden Bikker (ChristenUnie) en Hertzberger (Nieuw Sociaal Contract) hebben de vragen gesteld.Antwoorden op Kamervragen over perinatale zorg",2024-04-08 15:15:59,"ff919450-23ba-449e-a260-6a57d5c22463"
"Uitstelbrief op Kamervragen over het blokkeren van een Twitter account van een arts ","https://www.rijksoverheid.nl/documenten/kamerstukken/2024/04/08/uitstelbrief-antwoorden-kamervragen-over-het-blokkeren-van-een-twitter-account-van-een-arts","Staatssecretaris Van Ooijen meldt dat de antwoorden op vragen over het blokkeren van een Twitter account van een arts later komen dan gebruikelijk. Het Tweede Kamerlid Van Houwelingen (FVD) heeft de vragen gesteld. Uitstelbrief op Kamervragen over het blokkeren van een Twitter account van een arts",2024-04-08 09:26:11,"e8e6f45c-71fb-46e1-ab45-efd60442a55f"
"Kamerbrief met kabinetsreactie deelrapport 'Aanpak coronacrisis Deel 3' van de Onderzoeksraad voor Veiligheid","https://www.rijksoverheid.nl/documenten/kamerstukken/2024/04/05/kamerbrief-over-kabinetsreactie-deelrapport-aanpak-coronacrisis-deel-3-van-de-onderzoeksraad-voor-veiligheid","Minister Dijkstra (Medische Zorg), minister Yeşilgöz-Zegerius (JenV) en minister Helder (VWS) informeren de Tweede Kamer over de kabinetsreactie op het deelrapport ‘Aanpak coronacrisis Deel 3’ van de Onderzoeksraad voor Veiligheid. De Eerste Kamer heeft eenzelfde brief gekregen.Kamerbrief met kabinetsreactie deelrapport 'Aanpak coronacrisis Deel 3' van de Onderzoeksraad voor Veiligheid",2024-04-05 15:05:59,"35a513da-4f47-4c43-b3dd-49e64c9c6e9f"
"Aanbiedingsbrief bij evaluatierapport kwaliteitsstandaard Transgenderzorg-somatisch","https://www.rijksoverheid.nl/documenten/kamerstukken/2024/04/05/kamerbrief-over-aanbieding-evaluatierapport-kwaliteitsstandaard-transgenderzorg-somatisch","Minister Dijkstra (Medische Zorg) biedt de Tweede Kamer de evaluatie van de Kwaliteitsstandaard Transgenderzorg Somatisch, die is begeleid door het Kennisinstituut van de Federatie Medisch Specialisten (KIMS), aan.Aanbiedingsbrief bij evaluatierapport kwaliteitsstandaard Transgenderzorg-somatisch",2024-04-05 15:03:02,"5c0d8aa1-b924-4dc1-a111-04e1c401ab69"
"Kamerbrief over gesprekken verzekeraars borsthersteloperaties","https://www.rijksoverheid.nl/documenten/kamerstukken/2024/04/05/kamerbrief-over-gesprekken-verzekeraars-machtigingen-tertiaire-borsthersteloperaties","Minister Dijkstra (Medische Zorg) informeert de Tweede Kamer over gesprekken met zorgverzekeraars over borstkankerpatiënten die nog steeds foto’s aan verzekeraars moeten sturen.Kamerbrief over gesprekken verzekeraars borsthersteloperaties",2024-04-05 14:02:34,"decdf01f-70dc-429f-9a12-156f02f9bcca"
"Antwoorden op Kamervragen over miljarden euro’s aan junkfoodadvertenties ","https://www.rijksoverheid.nl/documenten/kamerstukken/2024/04/05/antwoorden-op-kamervragen-over-miljarden-euro-s-aan-junkfoodadvertenties","Staatssecretaris Van Ooijen (VWS) geeft antwoord op vragen over miljarden euro’s aan junkfoodadvertenties. Het Tweede Kamerlid Slagt-Tichelman (GroenLinks-PvdA) heeft de vragen gesteld. Antwoorden op Kamervragen over miljarden euro’s aan junkfoodadvertenties",2024-04-05 13:22:35,"e3aebb5f-0b38-4b8c-bf5c-495d082af0e2"
"Antwoorden op Kamervragen over bericht Maartje Kraamzorg trekt de stekker eruit, kraamzorg in Twente moet hulp zoeken voor 160 gezinnen ","https://www.rijksoverheid.nl/documenten/kamerstukken/2024/04/05/antwoorden-op-kamervragen-over-het-bericht-maartje-kraamzorg-trekt-de-stekker-eruit-kraamzorg-in-twente-moet-hulp-zoeken-voor-160-gezinnen","Minister Dijkstra (Medische Zorg) beantwoordt vragen over het bericht 'Maartje Kraamzorg trekt de stekker eruit, kraamzorg in Twente moet hulp zoeken voor 160 gezinnen'. De vragen zijn van het Kamerlid Dobbe (SP).Antwoorden op Kamervragen over bericht Maartje Kraamzorg trekt de stekker eruit, kraamzorg in Twente moet hulp zoeken voor 160 gezinnen",2024-04-05 13:16:18,"63ce032a-5c82-4856-ac44-98a599207f75"
"Kamerbrief stand van zaken gratis maken 113","https://www.rijksoverheid.nl/documenten/kamerstukken/2024/04/04/kamerbrief-inzake-commissie-vws-verzoek-een-stand-van-zakenbrief-over-de-uitvoering-van-de-motie-den-haan-tk-25424-663-over-het-gratis-maken-van-nummer-113","Staatssecretaris Van Ooijen (VWS) deelt de stand van zaken van het gratis maken van het telefoonnummer 113 met de Tweede Kamer.Kamerbrief stand van zaken gratis maken 113",2024-04-04 14:06:17,"6c81b54e-02d6-4b5e-a265-16f59e005adf"
"Kamerbrief over invulling COVID-19-vaccinatie naar aanleiding van geactualiseerd Gezondheidsraad advies","https://www.rijksoverheid.nl/documenten/kamerstukken/2024/04/04/kamerbrief-over-invulling-aanbod-covid-19-vaccinatie-naar-aanleiding-van-geactualiseerd-gezondheidsraad-advies","Minister Dijkstra (Medische Zorg) reageert op het advies van de Gezondheidsraad ‘COVID-19-vaccinatie in 2024'. Zij licht haar besluit toe over de invulling van het COVID-19-vaccinatieaanbod.Kamerbrief over invulling COVID-19-vaccinatie naar aanleiding van geactualiseerd Gezondheidsraad advies",2024-04-04 12:34:18,"85a61eae-78fe-4848-9fbb-f5e240df7ebf"
"Kamerbrief over Jaarverslag 2023 van Regionale Toetsingscommissies Euthanasie ","https://www.rijksoverheid.nl/documenten/kamerstukken/2024/04/04/kamerbrief-over-aanbieding-rte-jaarverslag-2023","Minister Dijkstra (Medische Zorg) stuurt de Tweede Kamer het Jaarverslag 2023 van de Regionale Toetsingscommissies Euthanasie (RTE). In het jaarverslag leggen de commissies verantwoording af over hun wijze van toetsing op grond van de Wet toetsing levensbeëindiging op verzoek en hulp bij zelfdoding. Eenzelfde brief is naar de Eerste Kamer verstuurd.Kamerbrief over Jaarverslag 2023 van Regionale Toetsingscommissies Euthanasie",2024-04-04 12:22:56,"91c05196-4205-47dc-bbe1-8d2136325e86"
