"item_title","item_link","item_description","item_pub_date","item_guid"
"Antwoorden Kamervragen over Leidraad omgang met wilde vogels en vogelgriep","https://www.rijksoverheid.nl/documenten/kamerstukken/2023/01/31/beantwoording-vragen-schriftelijk-overleg-inzake-de-leidraad-omgang-met-wilde-vogels-met-vogelgriep-en-andere-vogelgrieponderwerpen","Minister Adema (LNV) geeft antwoord op vragen over de Kamerbrief 'Leidraad omgang met wilde vogels met vogelgriep en andere vogelgrieponderwerpen' van 30 november 2022. De vragen zijn gesteld tijdens het Schriftelijk Overleg.",2023-01-31 14:46:00,"81d9a761-f697-4042-a3c9-9aa24cd609c2"
"Antwoorden op Kamervragen over kabinetsreactie op uitkomst overleg over maatregelen voor reizigers China","https://www.rijksoverheid.nl/documenten/kamerstukken/2023/01/31/antwoorden-op-kamervragen-over-de-kabinetsreactie-terugkoppeling-ipcr-en-vervolgproces-ingezonden-op-10-januari-2023","Minister Kuipers (VWS) geeft antwoord op vragen over de Kamerbrief uitkomst overleg over maatregelen voor reizigers uit China. Het Tweede Kamerlid Tielen (VVD) heeft de vragen gesteld.",2023-01-31 13:17:00,"06940310-f1e2-4ed1-a2fb-1e5fcaeaa19d"
"Antwoorden op Kamervragen over testverplichting reizigers uit China","https://www.rijksoverheid.nl/documenten/kamerstukken/2023/01/31/kamerbrief-over-vragen-nav-de-besluitvorming-van-het-kabinet-omtrent-de-epidemiologische-situatie-in-china","Minister Kuipers (VWS) geeft antwoord op vragen over de verplichting voor reizigers uit China om een negatief testresultaat te laten zien. De PvdD-fractie in de Eerste Kamer heeft deze vragen gesteld.",2023-01-31 13:14:00,"1c253e5d-4ef5-4c13-981b-a9c33ba0286b"
"Kamerbrief over Schriftelijk Overleg rapport ‘onderzoek Backpay-regeling weduwen’","https://www.rijksoverheid.nl/documenten/kamerstukken/2023/01/31/kamerbrief-over-schriftelijk-overleg-so-inzake-rapport-onderzoek-backpay-weduwen","Staatssecretaris Van Ooijen (VWS) informeert de Tweede Kamer over het Schriftelijk Overleg (SO) over het rapport ‘onderzoek Backpay-regeling weduwen’.",2023-01-31 12:50:00,"2c41f4c5-24e2-4f26-8c9e-1b1094eb0d7e"
"Antwoorden op Kamervragen over het bericht in Trouw over het gebrek aan landelijk overzicht van de wachttijden in de jeugdzorg","https://www.rijksoverheid.nl/documenten/kamerstukken/2023/01/31/antwoorden-op-kamervragen-over-het-bericht-in-trouw-over-het-gebrek-aan-landelijk-overzicht-van-de-wachttijden-in-de-jeugdzorg","Staatssecretaris Van Ooijen (VWS) geeft antwoord op vragen over het bericht in Trouw over het gebrek aan landelijk overzicht van de wachttijden in de jeugdzorg. Het Tweede Kamerlid Raemakers (D66) heeft de vragen gesteld.",2023-01-31 12:40:00,"cff6faa3-72ae-49bd-97ec-57ccfe68bb1d"
"Antwoorden op Kamervragen over beleidsprogramma pandemische paraatheid","https://www.rijksoverheid.nl/documenten/kamerstukken/2023/01/30/kamerbrief-over-beleidsprogramma-pandemische-paraatheid","Minister Kuipers (VWS) stuurt zijn antwoorden op vragen over het beleidsprogramma pandemische paraatheid. Dit gaat over voorbereiding op de mogelijke uitbraak van infectieziekten. De vragen zijn gesteld door Eerste Kamerleden van de fracties van PVV en PvdD in de Eerste Kamercommissies voor JenV, VWS, en Binnenlandse Zaken en Hoge Colleges van Staat/Algemene Zaken en Huis van de Koning (BiZa/AZ).",2023-01-30 15:00:00,"348ef635-4047-46a9-bf16-ec928ffcba5f"
"Antwoorden op Kamervragen over bericht Duizenden ouderen hebben acuut verpleeghuisbed nodig, tekort groeit snel","https://www.rijksoverheid.nl/documenten/kamerstukken/2023/01/30/antwoorden-op-kamervragen-over-het-bericht-duizenden-ouderen-hebben-acuut-verpleeghuisbed-nodig-tekort-groeit-snel","Minister Helder (Langdurige Zorg en Sport) geeft antwoord op vragen over het bericht 'Duizenden ouderen hebben acuut verpleeghuisbed nodig, tekort groeit snel'. Het Tweede Kamerlid Werner (CDA) heeft de vragen gesteld.",2023-01-30 14:50:00,"6010326a-f6d9-47f8-856f-9eb20dd2e158"
"Antwoorden op Kamervragen over berichtgeving drukte in ziekenhuizen door griepepidemie","https://www.rijksoverheid.nl/documenten/kamerstukken/2023/01/30/antwoorden-op-kamervragen-over-de-berichtgeving-over-de-drukte-in-de-ziekenhuizen-als-gevolg-van-de-griepepidemie","Minister Kuipers (VWS) geeft antwoord op vragen over de drukte in de ziekenhuizen door de griepepidemie. Het Tweede Kamerlid Van Haga (Groep-Van Haga) heeft de vragen gesteld.",2023-01-30 14:31:00,"c8f3b5e4-23df-4113-81da-2ce910407034"
"Antwoorden op Kamervragen over 1300 meldingen over onveiligheid van papieren rietjes bij de NVWA","https://www.rijksoverheid.nl/documenten/kamerstukken/2023/01/30/antwoorden-op-kamervragen-over-1300-meldingen-over-onveiligheid-van-papieren-rietjes-bij-de-nvwa","Minister Kuipers (VWS) geeft antwoord op vragen over 1300 meldingen over onveiligheid van papieren rietjes bij de NVWA. Het Tweede Kamerlid Agema (PVV) heeft de vragen gesteld.",2023-01-30 14:28:00,"9dd3eec0-01d2-4eda-b3dc-4d6f3a4fb3da"
"Antwoorden op Kamervragen over Wob-besluit Data Protection Impact Assessment (DPIA)","https://www.rijksoverheid.nl/documenten/kamerstukken/2023/01/30/antwoorden-op-kamervragen-over-het-wob-besluit-data-protection-impact-assessment-dpia","Minister Kuipers (VWS) geeft antwoord op vragen over het Wob-besluit Data Protection Impact Assessment (DPIA). Het Tweede Kamerlid Van Houwelingen (FvD) heeft de vragen gesteld.",2023-01-30 14:23:00,"85b0f8d4-d10a-4e1c-9da8-7003f26f48ff"
"Uitstelbrief op Kamervragen over  bericht dat meningokokkenvaccin ACWY niet vergoed wordt voor mensen met niet-functionerende milt","https://www.rijksoverheid.nl/documenten/kamerstukken/2023/01/30/uitstelbrief-antwoorden-kamervragen-over-het-bericht-dat-meningokokkenvaccin-acwy-nog-steeds-niet-vergoed-wordt-voor-mensen-met-een-niet-functionerende-milt","Minister Kuipers (VWS) meldt dat de antwoorden op vragen over het bericht dat het meningokokkenvaccin ACWY nog steeds niet vergoed wordt voor mensen met een niet-functionerende milt later komen dan gebruikelijk. Het Tweede Kamerlid Hijink (SP) heeft de vragen gesteld.",2023-01-30 12:31:00,"807dc48f-128a-4eb5-b6cd-a7aaae910270"
"Aanbiedingsbrief bij 2 rapporten in kader van Hervormingsagenda Jeugd","https://www.rijksoverheid.nl/documenten/kamerstukken/2023/01/30/kamerbrief-over-aanbieding-rapport-verwey-jonker-en-rapport-aspectu","Staatssecretaris Van Ooijen (VWS) biedt de Tweede Kamer 2 rapporten aan, die zijn opgesteld in het kader van de Hervormingsagenda Jeugd. Dit gaat over jeugdhulp. Het betreft een rapport van het Verweij-Jonkerinstituut over de afbakening van niet-vrij toegankelijke jeugdhulp, en een rapport van bureau Aspectu over gebruik en kosten van voorzieningen uit de Jeugdwet. ",2023-01-30 11:33:00,"d6c70f32-8406-46c6-840b-cd4b375ef59f"
"Kamerbrief over Werkagenda Toezicht Sociaal Domein 2023-2024","https://www.rijksoverheid.nl/documenten/kamerstukken/2023/01/30/kamerbrief-over-werkagenda-toezicht-sociaal-domein-2023-2024","Staatssecretaris Van Ooijen (VWS) biedt de Tweede Kamer een brief aan over de Werkagenda Toezicht Sociaal Domein 2023-2024.",2023-01-30 10:57:00,"7574c335-2090-4846-95e4-f9608133cda0"
"Antwoorden op Kamervragen over het rapport Wmo-toezicht 2021","https://www.rijksoverheid.nl/documenten/kamerstukken/2023/01/30/antwoorden-op-kamervragen-over-het-rapport-wmo-toezicht-2021","Staatssecretaris Van Ooijen (VWS) geeft antwoord op vragen over het rapport Wmo-toezicht 2021. Het Tweede Kamerlid Bevers (VVD) heeft de vragen gesteld.",2023-01-30 10:47:00,"284fedb5-7ebb-4b3c-bf2a-64f785713605"
"Kamerbrief over stand van zaken vogelgriep","https://www.rijksoverheid.nl/documenten/kamerstukken/2023/01/27/stand-van-zaken-vogelgriep","Minister Adema (LNV) informeert de Tweede Kamer over recente ontwikkelingen in de vogelgriepsituatie. Hij gaat in op het intensiveringsplan preventie vogelgriep, de epidemiologische situatie in Nederland en Europa, de nieuwe risicobeoordeling door de Deskundigengroep Dierziekten, de voortgang rond vaccinatie en de financiering van de bestrijding van de uitbraken.",2023-01-27 16:49:00,"907d4c33-f056-44b6-97d7-b3cf59dad109"
"Bestrijdingskosten hoogpathogene vogelgriep bij houders met meer dan 250 dieren","https://www.rijksoverheid.nl/documenten/kamerstukken/2023/01/27/bijlage-3-bestrijdingskosten-hpai","Overzicht van de bestrijdingskosten hoogpathogene vogelgriep bij houders met meer dan 250 dieren.",2023-01-27 16:49:00,"f494266b-a61b-41e9-9433-ce751ef245ac"
"Kamerbrief stand van zaken Toekomstagenda zorg en ondersteuning voor mensen met een beperking","https://www.rijksoverheid.nl/documenten/kamerstukken/2023/01/27/lz-1041536-a","Minister Helder (Langdurige Zorg en Sport) informeert de Tweede Kamer over de stand van zaken van de Toekomstagenda zorg en ondersteuning voor mensen met een beperking.",2023-01-27 15:39:00,"ac515680-ca45-41e0-b2af-497914cdaded"
"Antwoorden op Kamervragen over bericht Covid raast door Peking: uitgestorven straten en volle crematoria","https://www.rijksoverheid.nl/documenten/kamerstukken/2023/01/27/antwoorden-op-kamervragen-over-het-bericht-covid-raast-door-peking-uitgestorven-straten-en-volle-crematoria","Minister Kuipers (VWS) geeft antwoord op vragen over het bericht 'Covid raast door Peking: uitgestorven straten en volle crematoria'. Het Tweede Kamerlid Van den Berg (CDA) heeft de vragen gesteld.",2023-01-27 15:34:00,"55648356-4e6f-479d-8716-76baa8c80b48"
"Antwoorden op Kamervragen over NZa-rapport concentratie kinderhartchirurgie","https://www.rijksoverheid.nl/documenten/kamerstukken/2023/01/27/antwoorden-op-kamervragen-over-het-rapport-van-de-nederlandse-zorgautoriteit-dat-verstrekkende-gevolgen-ziet-van-de-concentratie-van-kinderhartchirurgie","Minister Kuipers (VWS) geeft antwoord op vragen over het rapport van de Nederlandse Zorgautoriteit (NZa) dat verstrekkende gevolgen ziet van de concentratie van kinderhartchirurgie. Het Tweede Kamerlid Agema (PVV) heeft deze vragen gesteld.",2023-01-27 15:31:00,"fb47723f-2fb2-48e0-a752-5862e19e2482"
"Antwoorden op Kamervragen over het bericht dat 4.734 hoogbejaarde ouderen die wachten op een verpleeghuisplek Urgent wachtenden zijn","https://www.rijksoverheid.nl/documenten/kamerstukken/2023/01/26/antwoorden-op-kamervragen-over-het-bericht-dat-van-de-bijna-22000-hoogbejaarde-wachtenden-4734-urgent-wachten-wat-een-stijging-van-70-is","Minister Helder (Langdurige Zorg en Sport) geeft antwoord op vragen over het bericht dat van de bijna 22.000 hoogbejaarde wachtenden, 4.734 urgent wachten, wat een stijging van 70% is. Het Tweede Kamerlid Agema (PVV) heeft de vragen gesteld.",2023-01-26 16:51:00,"70ae2837-9957-4b87-965f-87ea9057fd62"
