"item_title","item_link","item_description","item_pub_date","item_guid"
"Kamerbrief Beleidsreactie Nibud onderzoek Meerkosten van het leven met een beperking  ","https://www.rijksoverheid.nl/documenten/kamerstukken/2025/07/11/kamerbrief-over-beleidsreactie-nibud-onderzoek-meerkosten-van-het-leven-met-een-beperking","Staatssecretaris Pouw-Verweij (Langdurige en Maatschappelijke Zorg) stuurt de Tweede Kamer de beleidsreactie op het onderzoek naar meerkosten waar mensen met een beperking mee te maken hebben. Dit rapport van het Nationaal Instituut voor Budgetvoorlichting (Nibud) is in juni 2024 aan de Tweede Kamer aangeboden.Kamerbrief Beleidsreactie Nibud onderzoek Meerkosten van het leven met een beperking",2025-08-04 08:28:17,"608393bb-a9d4-44c7-bc5f-c5c030e909b2"
"Kamerbrief over tegemoetkoming voor mensen met een chronische ziekte en of beperking","https://www.rijksoverheid.nl/documenten/kamerstukken/2025/07/11/kamerbrief-over-tegemoetkoming-voor-mensen-met-een-chronische-ziekte-en-of-beperking","Minister Jansen (VWS) en staatssecretaris Van Oostenbruggen (Fiscaliteit, Belastingdienst en Douane) sturen de Tweede Kamer de kabinetsreactie over de fiscale regeling voor aftrek en tegemoetkoming specifieke zorgkosten middelen voor mensen met een chronische ziekte en/of beperking, en of dit minder complex kan. Kamerbrief over tegemoetkoming voor mensen met een chronische ziekte en of beperking",2025-08-01 13:07:26,"6244fa57-bb90-4955-b65b-b6f227c6f735"
"Uitstelbrief antwoorden Kamervragen over erkenning van foltering in gesloten jeugdzorg, bescherming van kritische rechters en herbezinning op het ketenpartnerschap binnen de jeugdsector","https://www.rijksoverheid.nl/documenten/kamerstukken/2025/08/01/uitstelbrief-antwoorden-kamervragen-over-erkenning-van-foltering-in-gesloten-jeugdzorg-bescherming-van-kritische-rechters-en-herbezinning-op-het-ketenpartnerschap-binnen-de-jeugdsector","Staatssecretaris Tielen (Jeugd, Preventie en Sport) meldt de Tweede Kamer dat de antwoorden op vragen over erkenning van  foltering in gesloten jeugdzorg, bescherming van kritische rechters en herbezinning op het ketenpartnerschap binnen de jeugdsector, niet binnen de gebruikelijke termijn worden beantwoord. De vragen zijn van het Kamerlid Bruyning (Nieuw Sociaal Contract). Uitstelbrief antwoorden Kamervragen over erkenning van foltering in gesloten jeugdzorg, bescherming van kritische rechters en herbezinning op het ketenpartnerschap binnen de jeugdsector",2025-08-01 12:31:21,"c753b432-eb3a-42d3-a839-e371f40df249"
"Uitstelbrief antwoorden Kamervragen over bericht '1 op de 5 horecazaken en supermarkten lapt tabaksverbod aan laars'","https://www.rijksoverheid.nl/documenten/kamerstukken/2025/08/01/uitstelbrief-antwoorden-kamervragen-over-het-bericht-een-op-de-vijf-horecazaken-en-supermarkten-lapt-tabaksverbod-aan-laars-vapes-en-sigaretten-liggen-in-achterkamertje-in-holle-bank","Staatssecretaris Tielen (Jeugd, Preventie en Sport) meldt de Tweede Kamer dat de antwoorden op vragen over het bericht '1 op de 5 horecazaken en supermarkten lapt tabaksverbod aan laars: ’Vapes en sigaretten liggen in achterkamertje in holle bank'', niet binnen de gebruikelijke termijn worden beantwoord. De vragen zijn van het Kamerlid Hertzberger (Nieuw Sociaal Contract).'Uitstelbrief antwoorden Kamervragen over bericht '1 op de 5 horecazaken en supermarkten lapt tabaksverbod aan laars'",2025-08-01 12:27:30,"5e82d0e8-6b6f-4d33-99bc-63dea7cd0053"
"Uitstelbrief antwoorden Kamervragen over enkele aspecten van de embryo-wetswijzigingen","https://www.rijksoverheid.nl/documenten/kamerstukken/2025/08/01/uitstelbrief-antwoorden-kamervragen-over-enkele-aspecten-van-de-embryo-wetswijzigingen","Staatssecretaris Tielen (Jeugd, Preventie en Sport) meldt de Tweede Kamer dat de antwoorden op vragen over enkele aspecten  van de embryo-wetswijzigingen, niet binnen de gebruikelijke termijn worden beantwoord. De vragen zijn van het Kamerlid Hertzberger (Nieuw Sociaal Contract).Uitstelbrief antwoorden Kamervragen over enkele aspecten van de embryo-wetswijzigingen",2025-08-01 12:23:21,"3e293611-ce19-4a92-875a-9da00134f7de"
"Uitstelbrief antwoorden Kamervragen over artikel over opsluiten van jongeren in de gesloten jeugdzorg ","https://www.rijksoverheid.nl/documenten/kamerstukken/2025/08/01/uitstelbrief-antwoorden-kamervragen-over-het-artikel-trouw-waarin-de-staatssecretaris-het-opsluiten-van-jongeren-in-de-gesloten-jeugdzorg-weer-mogelijk-wil-maken","Staatssecretaris Tielen (Jeugd, Preventie en Sport) meldt de Tweede Kamer dat de antwoorden op vragen over het artikel   over dat de staatssecretaris het opsluiten van jongeren in de gesloten jeugdzorg weer mogelijk wil maken, niet binnen de gebruikelijke termijn worden beantwoord. De vragen zijn van het Kamerlid Bruyning (Nieuw Sociaal Contract).Uitstelbrief antwoorden Kamervragen over artikel over opsluiten van jongeren in de gesloten jeugdzorg",2025-08-01 12:20:08,"e97df197-3c26-4082-8868-c60c00991a44"
"Aanbiedingsbrief bij advies AcICT over programma Doorontwikkeling Praeventis (RIVM)","https://www.rijksoverheid.nl/documenten/kamerstukken/2025/07/07/kamerbrief-over-aanbieding-acict-advies-programma-doorontwikkeling-praeventis-rivm","Staatssecretaris Tielen (Jeugd, Preventie en Sport) biedt de Tweede Kamer het advies aan van het Adviescollege ICT-toetsing (AcICT) over het programma Doorontwikkeling Praeventis van het Rijksinstituut voor Volksgezondheid en Milieu (RIVM). De Eerste Kamer heeft eenzelfde brief gekregen.Aanbiedingsbrief bij advies AcICT over programma Doorontwikkeling Praeventis (RIVM)",2025-08-01 07:59:07,"27636f07-cb71-488b-a628-7063f1d050da"
"Kamerbrief over uitvoering motie over benoemingen raad van toezicht zorginstellingen op bindende voordracht cliëntenraad","https://www.rijksoverheid.nl/documenten/kamerstukken/2025/07/07/kamerbrief-over-plan-van-aanpak-aangenomen-motie-inzake-benoemingen-in-de-raad-van-toezicht-van-zorginstellingen-op-bindende-voordracht-van-de-clientenraad","Minister Jansen (VWS) informeert de Tweede Kamer over uitvoering van de motie over het wettelijk regelen dat in zorginstellingen met een Raad van Toezicht minimaal 1/3 en maximaal de helft van de commissarissen wordt benoemd op bindende voordracht van de cliëntenraad.Kamerbrief over uitvoering motie over benoemingen raad van toezicht zorginstellingen op bindende voordracht cliëntenraad",2025-07-31 08:32:04,"c1576a3b-9971-4e4d-ae52-af065474db43"
"Kamerbrief met reactie op motie over gevolgen afschaffen stagefonds","https://www.rijksoverheid.nl/documenten/kamerstukken/2025/07/07/kamerbrief-over-reactie-motie-paulusma-en-dijk-over-gevolgen-afschaffen-stagefonds","Minister Jansen (VWS) reageert op de motie over het in kaart brengen van de gevolgen van het afschaffen van het Stagefonds voor de zorg en het onderzoeken op welke wijze het aantal stageplekken in de zorg daadwerkelijk vergroot kan worden en het in kaart brengen van effectieve instrumenten hiervoor. De Tweede Kamerleden Paulusma (D66) en Jimmy Dijk (SP) hebben de motie ingediend.Kamerbrief met reactie op motie over gevolgen afschaffen stagefonds",2025-07-31 08:24:32,"95590f8b-3246-4ad1-8563-92d2128f67bb"
"Kamerbrief over brief over participatieproces sprintsessies VN-agenda Handicap","https://www.rijksoverheid.nl/documenten/kamerstukken/2025/07/11/kamerbrief-inzake-reactie-op-brief-lbvso-inzake-participatieproces-sprintsessies-vn-agenda-handicap","Staatssecretaris Pouw-Verweij (Langdurige en Maatschappelijke Zorg) stuurt de Tweede Kamer een reactie op de brief van de vertegenwoordigende organisatie LBVSO over het participatieproces van de sprintsessies VN-verdrag Handicap. De werkagenda VN-verdrag Handicap is een uitwerking van de nationale strategie VN-verdrag Handicap. De doelstellingen uit de strategie moeten in 2040 bereikt zijn. Kamerbrief over brief over participatieproces sprintsessies VN-agenda Handicap",2025-07-30 16:06:51,"0f5f241b-7e0e-4ec4-ae8b-01a7dc95248e"
"Kamerbrief kabinetsreactie op rapport 'Sociale en Culturele Ontwikkelingen 2025'","https://www.rijksoverheid.nl/documenten/kamerstukken/2025/07/11/kamerbrief-kabinetsreactie-op-rapport-sociale-en-culturele-ontwikkelingen-2025","Minister Uitermark (BZK), minister Jansen (VWS), minister Van Hijum (SZW) en staatssecretaris Tielen (Jeugd, Preventie en Sport) sturen de Tweede Kamer de kabinetsreactie op het rapport 'Sociale en culturele ontwikkelingen 2025' van het Sociaal en Cultureel Planbureau (SCP). In het rapport komen het tegengaan van ongelijkheden en het vergroten van sociale samenhang en weerbaarheid naar voren.  Kamerbrief kabinetsreactie op rapport 'Sociale en Culturele Ontwikkelingen 2025'",2025-07-30 14:23:05,"bcf3eb0e-2e35-4649-a3a5-3d46abf1a350"
"Kamerbrief verslag informele EU Gezondheidsraad 24-25 maart 2025","https://www.rijksoverheid.nl/documenten/kamerstukken/2025/05/26/kamerbrief-over-verslag-informele-eu-gezondheidsraad-24-25-maart-2025","Staatssecretaris Karremans (Jeugd, Preventie en Sport) doet de Tweede Kamer verslag van de informele EU Gezondheidsraad van 24 en 25 maart 2025. De Raad sprak over mentale gezondheid van kinderen en adolescenten in het digitale tijdperk, leveringszekerheid van geneesmiddelen, en gezondheidsbevordering en ziektepreventie. De Eerste Kamer heeft eenzelfde brief gekregen.Kamerbrief verslag informele EU Gezondheidsraad 24-25 maart 2025",2025-07-30 14:09:23,"58f1c528-633a-406e-bd20-d7690ab749dd"
"Kamerbrief reactie op brief over NVWA","https://www.rijksoverheid.nl/documenten/kamerstukken/2025/05/26/kamerbrief-afschrift-reactie-op-uw-brief-d-d-19-februari-2025-met-verzoek-om-reactie-op-de-brief-van-vno-ncw-over-commissiedebat-nvwa-d-d-7-februari-2025","Staatssecretaris Rummenie (LVVN) deelt de reactie op een brief van VNO-NCW en MKB-Nederland met de Tweede Kamer. De brief gaat over de Nederlandse Voedsel- en Warenautoriteit (NVWA).Kamerbrief reactie op brief over NVWA",2025-07-30 12:47:47,"ba8902bd-376e-4433-ad94-e6573d1e7416"
"Kamerbrief over omzetting verbruiksbelasting alcoholvrije dranken en tegemoetkoming toezeggingen","https://www.rijksoverheid.nl/documenten/kamerstukken/2025/07/11/vervolg-omzetting-verbruiksbelasting-alcoholvrije-dranken-en-tegemoetkoming-toezeggingen","Staatssecretaris Van Oostenbruggen (Fiscaliteit, Belastingdienst en Douane) en staatssecretaris Tielen (Jeugd, Preventie en Sport) informeren de Tweede Kamer over de toegezegde scenario's voor de vormgeving van een gedifferentieerde verbruiksbelasting van alcoholvrije dranken op basis van suikergehalte. De Eerste Kamer heeft eenzelfde brief ontvangen.Kamerbrief over omzetting verbruiksbelasting alcoholvrije dranken en tegemoetkoming toezeggingen",2025-07-30 10:07:40,"7024e3e5-266f-42b6-a9f7-e3421fa32aeb"
"Kamerbrief over risico op schijnzelfstandigheid in pgb-situaties","https://www.rijksoverheid.nl/documenten/kamerstukken/2025/07/08/kamerbrief-uitleg-risico-op-schijnzelfstandigheid-in-pgb-situaties","Minister Van Hijum (SZW) informeert de Tweede Kamer over het risico op schijnzelfstandigheid bij particulieren die zorgverleners inhuren via een persoonsgebonden budget (pgb).Kamerbrief over risico op schijnzelfstandigheid in pgb-situaties",2025-07-30 09:33:57,"df14b8fe-31e8-4fd1-a843-6e61b95433be"
"Kamerbrief over Hoofdlijnenakkoord Ouderenzorg","https://www.rijksoverheid.nl/documenten/kamerstukken/2025/07/11/kamerbrief-over-hoofdlijnenakkoord-ouderenzorg","Staatssecretaris Pouw-Verweij (Langdurige en Maatschappelijke Zorg) stuurt de Tweede Kamer het Hoofdlijnenakkoord ouderenzorg. Het akkoord is een samenhangend pakket van afspraken die bijdragen aan de toekomstbestendigheid van de ouderenzorg. Kamerbrief over Hoofdlijnenakkoord Ouderenzorg",2025-07-29 16:29:25,"c20e48b3-0b88-4ec7-9098-67c6e787edcf"
"Uitstelbrief op Kamervragen over de casus van Ymere en Philadelphia en de Stimuleringsregeling Zorggeschikte Woningen","https://www.rijksoverheid.nl/documenten/kamerstukken/2025/07/29/uitstelbrief-op-kamervragen-over-de-casus-van-ymere-en-philadelphia-en-de-stimuleringsregeling-zorggeschikte-woningen","Uitstelbrief op Kamervragen over de casus van Ymere en Philadelphia en de Stimuleringsregeling Zorggeschikte Woningen",2025-07-29 10:55:39,"170ebd97-6de1-4b91-837d-eb7a787841cf"
"Kamerbrief over Verslag informele EU Gezondheidsraad","https://www.rijksoverheid.nl/documenten/kamerstukken/2024/11/15/kamerbrief-over-verslag-informele-eu-gezondheidsraad-24-25-juli-2024","Minister Agema (VWS) biedt de Tweede Kamer het verslag van de informele EU Gezondheidsraad van 24-25 juli 2024 aan. Een zelfde brief is ook aan de aan de Eerste Kamer gestuurd.Kamerbrief over Verslag informele EU Gezondheidsraad",2025-07-29 09:58:02,"662a019c-ba77-44d5-b288-f53ccce18272"
"Kamerbrief voortgang uitvoering Internationale Klimaatstrategie","https://www.rijksoverheid.nl/documenten/kamerstukken/2025/05/09/kamerbrief-inzake-voortgang-internationale-klimaatstrategie","Minister Klever (Buitenlandse Handel en Ontwikkelingshulp) en minister Hermans (KGG) informeren de Tweede Kamer over de voortgang van de uitvoering van de Internationale Klimaatstrategie in 2024.Kamerbrief voortgang uitvoering Internationale Klimaatstrategie",2025-07-29 09:00:01,"0d66f985-f91c-4528-9e7a-f18e12b8e710"
"Antwoorden op Kamervragen over voortgang kabinetsreactie Capaciteitsplan initiële opleidingen","https://www.rijksoverheid.nl/documenten/kamerstukken/2025/07/09/kamerbrief-over-schriftelijk-overleg-so-inzake-capaciteitsplan-initiele-opleidingen","Minister Jansen (VWS) geeft antwoord op vragen over de voortgang van de kabinetsreactie omtrent het Capaciteitsplan initiële opleidingen. De vaste Tweede Kamercommissie voor Volksgezondheid, Welzijn en Sport heeft de vragen gesteld in een verslag van een Schriftelijk Overleg (VSO) met de minister.Antwoorden op Kamervragen over voortgang kabinetsreactie Capaciteitsplan initiële opleidingen",2025-07-28 08:42:06,"ce4f2086-8dc5-4928-91d5-19f34ee8aaec"
