"item_title","item_link","item_description","item_pub_date","item_guid"
"Kamerbrief met reactie op motie over inzetten op labeling PFAS-houdende producten","https://www.rijksoverheid.nl/documenten/kamerstukken/2025/06/03/kamerbrief-over-appreciatie-motie-lid-bamenga-over-inzetten-op-labeling-van-pfas-houdende-producten","Staatssecretaris Karremans (Jeugd, Preventie en Sport) reageert op een motie waarin de regering wordt gevraagd zich in Europa in te zetten voor een labeling van PFAS-houdende producten. Het Tweede Kamerlid Bamenga (D66) heeft de motie ingediend.Kamerbrief met reactie op motie over inzetten op labeling PFAS-houdende producten",2025-08-08 15:17:21,"98681593-a307-410e-9e18-25eff67aab75"
"Kamerbrief over resultaten programma WOZO","https://www.rijksoverheid.nl/documenten/kamerstukken/2025/07/02/kamerbrief-over-programma-wonen-ondersteuning-en-zorg-voor-ouderen","Staatssecretaris Pouw-Verweij (Langdurige en Maatschappelijke Zorg) informeert de Tweede Kamer over de bereikte resultaten van het programma Wonen, Ondersteuning en Zorg voor Ouderen (WOZO) sinds 2022 en het vervolg. Vervolgens bespreekt zij de stand van zaken van de Medisch generalistische zorg (MGZ). Tot slot gaat zij in op de domeinoverstijgende activiteiten van de langdurige zorg en de gesprekken met Zorgbuurthuis ’t Hageltje.Kamerbrief over resultaten programma WOZO",2025-08-08 13:31:49,"0ce86af8-4f79-4f39-9276-e2a91e41e753"
"Kamerbrief over aanbieding Standen van de Uitvoering VWS 2025","https://www.rijksoverheid.nl/documenten/kamerstukken/2025/06/03/kamerbrief-over-aanbieding-standen-van-de-uitvoering-vws-2025","Minister Agema (VWS) informeert de Tweede Kamer over de 4e serie van de Standen van de Uitvoering op het VWS-domein. Eenzelfde brief is naar de Eerste Kamer verstuurd.Kamerbrief over aanbieding Standen van de Uitvoering VWS 2025",2025-08-08 13:05:45,"f87abaf0-905d-4103-95d8-5e4573b54c92"
"Kamerbrief over systeem herindicaties Wlz ","https://www.rijksoverheid.nl/documenten/kamerstukken/2025/06/03/kamerbrief-over-herindicaties-wlz","Staatssecretaris Maeijer (Langdurige en Maatschappelijke Zorg) informeert de Tweede Kamer over het voornemen uit het regeerprogramma om de administratieve lasten voor zorgprofessionals en zorgaanbieders te verminderen door het systeem van herindicaties voor mensen met een Wlz-indicatie in het verpleeghuis te beëindigen.Kamerbrief over systeem herindicaties Wlz",2025-08-08 12:48:50,"4534ac77-dcf0-4b9d-8ef6-a6e34171dd2e"
"Kamerbrief over onderzoek naar oorzaken van onderschrijding van budgettair kader wijkverpleging ","https://www.rijksoverheid.nl/documenten/kamerstukken/2025/07/02/onderzoek-oorzaken-van-de-onderschrijding-van-het-budgettair-kader-wijkverpleging","Staatssecretaris Pouw-Verweij (Langdurige en Maatschappelijke Zorg) informeert de Tweede Kamer over een onderzoek naar de oorzaken van de onderschrijding van het budgettair kader wijkverpleging dat in opdracht van partijen uit deze sector is uitgevoerd. Kamerbrief over onderzoek naar oorzaken van onderschrijding van budgettair kader wijkverpleging",2025-08-08 11:48:18,"6562e048-ff68-469b-a2df-b4724ad19e49"
"Kamerbrief over houdbaarheidsonderzoek Wmo 2015 en aanbieden analyses","https://www.rijksoverheid.nl/documenten/kamerstukken/2025/07/01/houdbaarheidsonderzoek-wmo-2015-aanbieden-analyses","Staatssecretaris Pouw-Verweij (Langdurige en Maatschappelijke Zorg) stuurt de Tweede Kamer de laatste rapporten over het Houdbaarheidsonderzoek Wmo 2015. Het onderzoek kijkt samen met gemeenten (VNG) naar de personele, financiële en maatschappelijke houdbaarheid van de Wet maatschappelijke ondersteuning (Wmo) 2015. De staatssecretaris gaat in op de bevindingen uit de rapporten.Kamerbrief over houdbaarheidsonderzoek Wmo 2015 en aanbieden analyses",2025-08-07 11:17:16,"4b767e9d-90ce-4f8c-a751-5422cdf25905"
"Kamerbrief over stand van zaken medische kindzorg","https://www.rijksoverheid.nl/documenten/kamerstukken/2025/07/01/kamerbrief-over-stand-van-zaken-medische-kindzorg","Staatssecretaris Pouw-Verweij (Langdurige en Maatschappelijke Zorg) informeert de Tweede Kamer over verbetering van de zorg voor kinderen met een intensieve zorg- of hulpvraag en laatste ontwikkelingen op het terrein van medische kindzorg.Kamerbrief over stand van zaken medische kindzorg",2025-08-07 08:24:28,"ae5ae73b-e77f-4ace-971b-8c0dbf31cd44"
"Antwoorden Kamervragen over wachttijden Wmo en ggz","https://www.rijksoverheid.nl/documenten/kamerstukken/2025/07/01/kamervragen-over-wachttijden-binnen-de-wet-maatschappelijke-ondersteuning-2015-wmo-en-de-geestelijke-gezondheidszorg-ggz","Staatssecretaris Pouw-Verweij ( Langdurige en Maatschappelijke Zorg) geeft antwoord op Kamervragen over wachttijden binnen de Wet maatschappelijke ondersteuning 2015 (Wmo) en de geestelijke gezondheidszorg (ggz). Het Tweede Kamerlid Van Houwelingen (FVD) had de vragen gesteld.Antwoorden Kamervragen over wachttijden Wmo en ggz",2025-08-07 08:10:44,"a84c983e-cb25-4a53-8612-fb57a46d60ac"
"Antwoorden op Kamervragen over bericht ‘Meer seksueel grensoverschrijdend gedrag door zorgverleners dan gedacht’","https://www.rijksoverheid.nl/documenten/kamerstukken/2025/06/02/antwoorden-op-kamervragen-over-het-bericht-meer-seksueel-grensoverschrijdend-gedrag-door-zorgverleners-dan-gedacht","Staatssecretaris Maeijer (Langdurige en Maatschappelijke Zorg) en staatssecretaris Karremans (Jeugd, Preventie en Sport) beantwoorden vragen over het bericht ‘Meer seksueel grensoverschrijdend gedrag door zorgverleners dan gedacht’. Het Tweede Kamerlid Tielen (VVD) heeft deze vragen gesteld. Antwoorden op Kamervragen over bericht ‘Meer seksueel grensoverschrijdend gedrag door zorgverleners dan gedacht’",2025-08-07 07:14:38,"762ffce6-7414-44f5-a6e2-9c8b555a851d"
"Kamerbrief over voortgang nieuwe regeling zorgkosten onverzekerden en aanpak onverzekerdheid","https://www.rijksoverheid.nl/documenten/kamerstukken/2025/07/03/voortgang-nieuwe-regeling-zorgkosten-onverzekerden-en-aanpak-onverzekerdheid","Minister Jansen (VWS) informeert de Tweede Kamer over de uitwerking van 2 ambities: een wetsvoorstel voor kosten van zorg aan onverzekerden en onverzekerbare vreemdelingen en het voorkomen en oplossen van onverzekerdheid en betere toegang tot de zorg voor onverzekerden.   Kamerbrief over voortgang nieuwe regeling zorgkosten onverzekerden en aanpak onverzekerdheid",2025-08-07 06:55:43,"bf817d75-89af-44a7-8a1e-7e0db3ab394b"
"Kamerbrief bij inspectierapport over Jeugdbescherming Noord","https://www.rijksoverheid.nl/documenten/kamerstukken/2025/08/06/tk-aanbieding-inspectierapport-over-jeugdbescherming-noord","Staatssecretaris Struycken (Rechtsbescherming) stuurt de Tweede Kamer het rapport 'Jeugdbescherming Noord -Toezicht jeugdbescherming en jeugdreclassering' van de Inspectie Gezondheidszorg en Jeugd en de Inspectie Justitie en Veiligheid. Hij geeft zijn reactie op het rapport.Kamerbrief bij inspectierapport over Jeugdbescherming Noord",2025-08-07 05:53:00,"d209937f-2ded-4ece-a1d2-4f68e1ca3d4c"
"Antwoorden op Kamervragen over ondersteuning organisaties voor mensen met een beperking","https://www.rijksoverheid.nl/documenten/kamerstukken/2025/05/30/antwoorden-op-kamervragen-over-de-ondersteuning-van-organisaties-die-zich-inzetten-voor-mensen-met-een-beperking","Staatssecretaris Maeijer (Langdurige en Maatschappelijke Zorg) geeft antwoord op vragen over de ondersteuning van organisaties die zich inzetten voor mensen met een beperking. Het Tweede Kamerlid Westerveld (GroenLinks-PvdA) heeft de vragen gesteld.Antwoorden op Kamervragen over ondersteuning organisaties voor mensen met een beperking",2025-08-06 15:48:44,"5df356b2-6a03-4d95-8778-b372c840c3d0"
"Kamerbrief over stand van zaken moties en toezeggingen (VWS) - zomer 2025","https://www.rijksoverheid.nl/documenten/kamerstukken/2025/07/10/kamerbrief-over-stand-van-zakenbrief-moties-en-toezeggingen-zomer-editie-2025","Minister Jansen (VWS), staatssecretaris Pouw-Verweij (Langdurige en Maatschappelijke Zorg) en Staatssecretaris Tielen (Jeugd, Preventie en Sport) bieden de Tweede Kamer de stand van zaken aan van verschillende moties en toezeggingen. Kamerbrief over stand van zaken moties en toezeggingen (VWS) - zomer 2025",2025-08-06 07:20:10,"21c13167-0a1e-42f1-a4a1-8b30734e7dea"
"Kamerbrief over petitie over censuur op gebied van sekse, gender en diversiteit in wetenschap, wetenschappelijk onderwijs, en gevolgen voor de gezondheidszorg","https://www.rijksoverheid.nl/documenten/kamerstukken/2025/06/02/kamerbrief-over-reactie-op-aangeboden-petitie-betreft-bescherming-wetenschap-en-zorg-tegen-censuur-van-aandacht-voor-sekse-gender-en-diversiteit","Minister Agema (VWS) informeert de Tweede Kamer over de reactie die mede namens haar is verstuurd als reactie op de petitie waarin aandacht wordt gevraagd voor de censuur op het gebied van sekse, gender en diversiteit in wetenschap, wetenschappelijk onderwijs, en voor de gevolgen daarvoor voor de gezondheidszorg. De vaste commissie voor VWS heeft verzocht op de petitie te reageren op de aangeboden De petitie is van het Landelijk Netwerk Vrouwelijke Hoogleraren. Kamerbrief over petitie over censuur op gebied van sekse, gender en diversiteit in wetenschap, wetenschappelijk onderwijs, en gevolgen voor de gezondheidszorg",2025-08-05 15:38:04,"bedb5e6a-caef-4dbf-942a-e65c334bc588"
"Kamerbrief over zwemmen in Nederland ","https://www.rijksoverheid.nl/documenten/kamerstukken/2025/06/26/kamerbrief-over-schriftelijk-overleg-so-zwemmen-in-nederland-en-overige-beleidsontwikkelingen","Staatssecretaris Tielen (Jeugd, Preventie en Sport) beantwoordt vragen over zwemmen in Nederland. De vragen en opmerkingen zijn van PVV, GroenLinks-PvdA, VVD, NSC, D66, CDA, SP en BBB.Kamerbrief over zwemmen in Nederland",2025-08-05 14:01:02,"de20be99-0dc6-4a03-b1b5-8e289b594d98"
"Kamerbrief over PALLAS-nieuwbouwprogramma","https://www.rijksoverheid.nl/documenten/kamerstukken/2025/07/01/kamerbrief-met-betrekking-tot-besluit-start-uitvoeringsfase-pallas-reactor","Minister Jansen (VWS) informeert de Tweede Kamer over het PALLAS-nieuwbouwprogramma en over de start van de  uitvoeringsfase van de bouw van de PALLAS-reactor.Kamerbrief over PALLAS-nieuwbouwprogramma",2025-08-05 13:49:05,"b2de230a-4a5e-4186-9fde-1d16c63cd475"
"Antwoorden op Kamervragen over gedwongen opnames in verpleeghuizen","https://www.rijksoverheid.nl/documenten/kamerstukken/2025/05/28/antwoorden-op-kamervragen-over-het-bericht-recordaantal-gedwongen-opnames-gevraagd-voor-verpleeghuis-vooral-alleenstaande-demente-ouderen-vormen-een-groot-gevaar","Minister Agema (VWS) geeft antwoord op vragen over het bericht “Recordaantal gedwongen opnames gevraagd voor verpleeghuis: ‘Vooral alleenstaande demente ouderen vormen een groot gevaar’”. Het Tweede Kamerlid Thiadens (PVV) heeft de vragen gesteld.Antwoorden op Kamervragen over gedwongen opnames in verpleeghuizen",2025-08-05 13:36:22,"49d283a4-b986-413c-80c4-8a2d908f4dd8"
"Antwoord op Kamervragen (VSO) over wijziging Besluit publieke gezondheid betreffende regels integraal suïcidepreventiebeleid","https://www.rijksoverheid.nl/documenten/kamerstukken/2025/07/10/schriftelijk-overleg-so-inzake-inbreng-25424-ontwerpbesluit-wijziging-van-het-besluit-publieke-gezondheid-in-verband-met-het-stellen-van-regels-omtrent-integraal-suicidepreventiebeleid","Staatssecretaris Tielen (Jeugd, Preventie en Sport) geeft antwoord op vragen over het ontwerpbesluit houdende wijziging van het Besluit publieke gezondheid in verband met het stellen van regels rond integraal suïcidepreventiebeleid. De vaste  commissie voor Volksgezondheid, Welzijn en Sport heeft de vragen gesteld in een verslag van een schriftelijk overleg (VSO) met de staatssecretaris. Eenzelfde brief is naar de Eerste Kamer verstuurd.Antwoord op Kamervragen (VSO) over wijziging Besluit publieke gezondheid betreffende regels integraal suïcidepreventiebeleid",2025-08-05 12:58:27,"dddad4c9-8183-45d6-99fa-f9750a572bc3"
"Kamerbrief over verzoek om toezending nota over Wet aanpak meervoudige problematiek sociaal domein","https://www.rijksoverheid.nl/documenten/kamerstukken/2025/07/01/verzoek-om-toezending-nota-naar-aanleiding-van-het-van-het-verslag-van-de-wet-aanpak-meervoudige-problematiek-sociaal-domein-kamerstuk-36295","Staatssecretaris Pouw-Verweij (Langdurige en Maatschappelijke Zorg) informeert de Tweede Kamer over de stand van zaken over het wetsvoorstel Aanpak meervoudige problematiek sociaal domein. En de inzet van ervaringsdeskundigen bij de voorlichting en ondersteuning van slachtoffers van seksueel geweld.Kamerbrief over verzoek om toezending nota over Wet aanpak meervoudige problematiek sociaal domein",2025-08-05 12:05:37,"6754615e-5e34-452b-a3d2-4c326b292ab5"
"Aanbiedingsbrief bij voorlopige kaderbrief Wlz 2026-2030","https://www.rijksoverheid.nl/documenten/kamerstukken/2025/07/10/voorlopige-kaderbrief-wlz-2026-2030","Staatssecretaris Pouw-Verweij (Langdurige en Maatschappelijke Zorg) stuurt een afschrift van de voorlopige kaderbrief Wlz 2026-2030 naar de Tweede Kamer. Eenzelfde brief is naar de Eerste Kamer verstuurd.Aanbiedingsbrief bij voorlopige kaderbrief Wlz 2026-2030",2025-08-05 07:27:56,"8bf23f1e-d668-465a-b6fd-e488e276fd3c"
