"item_title","item_link","item_description","item_pub_date","item_guid"
"Kamerbrief over Structurele aanpak Kansrijke Start en actieagenda 2026-2030","https://www.rijksoverheid.nl/documenten/kamerstukken/2025/11/20/kamerbrief-inzake-structurele-aanpak-kansrijke-start-en-actieagenda-2026-2030","Staatssecretaris Tielen (Jeugd, Preventie en Sport) stuurt de Tweede Kamer het rapport 'Samen zorgen we voor de eerste 1000 dagen' over de structurele aanpak Kansrijke Start voor de 1e 1000 levensdagen. Zij gaat in op de aanpak, het belang, de financiering en de actieagenda 2026-2030.Kamerbrief over Structurele aanpak Kansrijke Start en actieagenda 2026-2030",2025-12-08 09:13:37,"dc40972d-6418-45e8-9b95-1a2d4bd4c7f7"
"Kamerbrief over Periodieke rapportage Arbeidsmarkt en opleidingen zorg en welzijn","https://www.rijksoverheid.nl/documenten/kamerstukken/2025/12/05/kamerbrief-over-periodieke-rapportage-arbeidsmarkt-en-opleidingen-zorg-en-welzijn","Kamerbrief over Periodieke rapportage Arbeidsmarkt en opleidingen zorg en welzijn",2025-12-05 14:06:12,"f222a32c-aaeb-4c66-b415-c6469a58beec"
"Kamerbrief over Verzekerdenmonitor 2025","https://www.rijksoverheid.nl/documenten/kamerstukken/2025/12/05/kamerbrief-over-verzekerdenmonitor-2025","Kamerbrief over Verzekerdenmonitor 2025",2025-12-05 13:59:45,"9130cb69-1d85-4286-8582-19f63d233431"
"Kamerbrief over aanbiedingsbrief evaluatie Wet ambulancezorgvoorzieningen","https://www.rijksoverheid.nl/documenten/kamerstukken/2025/12/05/kamerbrief-over-aanbiedingsbrief-evaluatie-wet-ambulancezorgvoorzieningen","De Eerste Kamer heeft eenzelfde brief gekregen.Kamerbrief over aanbiedingsbrief evaluatie Wet ambulancezorgvoorzieningen",2025-12-05 13:34:16,"bd0ac993-bc9f-473c-b46b-3ae6c86af6c2"
"Kamerbrief Raadsmandaat Verordening kritieke geneesmiddelen (Critical Medicines Act)","https://www.rijksoverheid.nl/documenten/kamerstukken/2025/12/05/kamerbrief-raadsmandaat-verordening-kritieke-geneesmiddelen-critical-medicines-act","Kamerbrief Raadsmandaat Verordening kritieke geneesmiddelen (Critical Medicines Act)",2025-12-05 13:22:17,"9aec91af-1f39-47fe-8ad5-9f9ba8a4bc08"
"Beantwoording Kamervragen over het niet opdagen van zeker 800.000 mensen voor afspraak in ziekenhuis en dat kost tientallen miljoenen euro’s","https://www.rijksoverheid.nl/documenten/kamerstukken/2025/12/05/beantwoording-kamervragen-over-het-niet-opdagen-van-zeker-800-000-mensen-voor-afspraak-in-ziekenhuis-en-dat-kost-tientallen-miljoenen-euro-s","Beantwoording Kamervragen over het niet opdagen van zeker 800.000 mensen voor afspraak in ziekenhuis en dat kost tientallen miljoenen euro’s",2025-12-05 13:00:38,"2a75c731-bc08-46ad-ade9-d1182f583097"
"Antwoorden op Kamervragen over het Grevio rapport 'Building trust by delivering support, protection and justice Netherlands First thematic evaluation report'","https://www.rijksoverheid.nl/documenten/kamerstukken/2025/12/05/antwoorden-op-kamervragen-over-het-grevio-rapport-building-trust-by-delivering-support-protection-and-justice-netherlands-first-thematic-evaluation-report","Antwoorden op Kamervragen over het Grevio rapport 'Building trust by delivering support, protection and justice Netherlands First thematic evaluation report'",2025-12-05 12:58:10,"e671a988-974f-409a-9dfe-eec968e6d596"
"Uitstelbrief antwoorden Kamervragen over het rapport ‘De stand van de Jeugdzorg 2025’ van de Jeugdautoriteit","https://www.rijksoverheid.nl/documenten/kamerstukken/2025/12/05/uitstelbrief-antwoorden-kamervragen-over-het-rapport-de-stand-van-de-jeugdzorg-2025-van-de-jeugdautoriteit","Uitstelbrief antwoorden Kamervragen over het rapport ‘De stand van de Jeugdzorg 2025’ van de Jeugdautoriteit",2025-12-05 09:01:51,"96197666-3d4b-4c51-92d8-ff5c0e513e33"
"Kamerbrief over Gezondheidsraadadvies Richtlijnen goede voeding voor voedingsbronnen van eiwit","https://www.rijksoverheid.nl/documenten/kamerstukken/2025/12/04/kamerbrief-over-gezondheidsraadadvies-richtlijnen-goede-voeding-voor-voedingsbronnen-van-eiwit","Kamerbrief over Gezondheidsraadadvies Richtlijnen goede voeding voor voedingsbronnen van eiwit",2025-12-04 16:18:25,"8427f2bc-2b84-4585-987b-37a9ed7d8fe3"
"Kamerbrief over Informatieveiligheid in de zorg","https://www.rijksoverheid.nl/documenten/kamerstukken/2025/12/04/kamerbrief-over-informatieveiligheid-in-de-zorg","Kamerbrief over Informatieveiligheid in de zorg",2025-12-04 14:51:45,"a95a53ac-4027-477c-9348-c7e108365cb5"
"Kamerbrief over Aanbieding ontwerpregeling maximumprijzen geneesmiddelen per 1 april 2026","https://www.rijksoverheid.nl/documenten/kamerstukken/2025/12/04/kamerbrief-over-aanbieding-ontwerpregeling-maximumprijzen-geneesmiddelen-per-1-april-2026","Kamerbrief over Aanbieding ontwerpregeling maximumprijzen geneesmiddelen per 1 april 2026",2025-12-04 14:47:30,"6a89deff-6013-41b0-8ce7-1d1efb08b9ff"
"Kamerbrief over aanbieden drie adviezen t.b.v. toekomstige aanpak tijgermug","https://www.rijksoverheid.nl/documenten/kamerstukken/2025/12/04/kamerbrief-over-aanbieden-drie-adviezen-t-b-v-toekomstige-aanpak-tijgermug","Kamerbrief over aanbieden drie adviezen t.b.v. toekomstige aanpak tijgermug",2025-12-04 13:17:08,"1b70761d-372b-4c61-8306-d46704f342f2"
"Antwoorden op Kamervragen over de uitzending van Radar over de problemen met bekkenbodemmatjes","https://www.rijksoverheid.nl/documenten/kamerstukken/2025/12/04/antwoorden-op-kamervragen-over-de-uitzending-van-radar-over-de-problemen-met-bekkenbodemmatjes","Antwoorden op Kamervragen over de uitzending van Radar over de problemen met bekkenbodemmatjes",2025-12-04 13:10:20,"2d17bc63-64c2-4cbf-8e3f-45c1969fcae7"
"Kamerbrief naar aanleiding van de rapporten van de IGJ en IJenV over kwetsbare kinderen","https://www.rijksoverheid.nl/documenten/kamerstukken/2025/12/02/tk-kamerbrief-naar-aanleiding-van-de-rapporten-van-de-igj-en-ijenv","Staatssecretaris Tielen (Jeugd, Preventie en Sport) en staatssecretaris Rutte (JenV) bespreken de rapporten 'Kwetsbare kinderen, kwetsbaar stelsel' en 'Als zelfs overheidsingrijpen kinderen geen bescherming biedt' van de Inspectie Gezondheidszorg en Jeugd (IGJ) en de Inspectie Justitie en Veiligheid (IJenV). Zij doen dit als voorbereiding op het Kamerdebat van 4 december 2025. De Tweede Kamer had de rapportne op 25 september 2025 ontvangen.Kamerbrief naar aanleiding van de rapporten van de IGJ en IJenV over kwetsbare kinderen",2025-12-04 07:03:42,"e95307ac-6c29-4c51-af2b-b1b39acdc906"
"Uitstelbrief antwoorden op Kamervragen over risico resistente schimmels door gebruik landbouwgif","https://www.rijksoverheid.nl/documenten/kamerstukken/2025/12/03/uitstelbrief-op-kamervragen-over-het-risico-van-resistente-schimmels-door-het-gebruik-van-landbouwgif","Minister Bruijn (VWS) meldt dat de antwoorden op de Kamervragen over het risico van resistente schimmels door het gebruik van landbouwgif later komen dan gebruikelijk. Het Tweede Kamerlid Kostić (PvdD) heeft de vragen gesteld.Uitstelbrief antwoorden op Kamervragen over risico resistente schimmels door gebruik landbouwgif",2025-12-03 14:53:45,"bf61c441-4f1a-4ec8-a54f-7a576eadcf96"
"Antwoorden op Kamervragen van de leden Bushoff en Vliegenhart over het bericht dat kraamzorg niet meer overal in Nederland gegarandeerd kan worden","https://www.rijksoverheid.nl/documenten/kamerstukken/2025/12/03/antwoorden-op-kamervragen-van-de-leden-bushoff-en-vliegenhart-over-het-bericht-dat-kraamzorg-niet-meer-overal-in-nederland-gegarandeerd-kan-worden","Antwoorden op Kamervragen van de leden Bushoff en Vliegenhart over het bericht dat kraamzorg niet meer overal in Nederland gegarandeerd kan worden",2025-12-03 14:02:44,"c7cb9327-86ce-4330-be58-bd516c687774"
"Antwoorden op Kamervragen van het lid Dobbe over het bericht dat kraamzorg niet meer overal in Nederland gegarandeerd kan worden","https://www.rijksoverheid.nl/documenten/kamerstukken/2025/12/03/antwoorden-op-kamervragen-van-het-lid-dobbe-over-het-bericht-dat-kraamzorg-niet-meer-overal-in-nederland-gegarandeerd-kan-worden","Antwoorden op Kamervragen van het lid Dobbe over het bericht dat kraamzorg niet meer overal in Nederland gegarandeerd kan worden",2025-12-03 14:01:38,"4de8eb39-6e86-4dbb-b9b5-d7097ebcea7b"
"Antwoorden Kamervragen over het artikel over mishandeling pleegkinderen ","https://www.rijksoverheid.nl/documenten/kamerstukken/2025/12/02/antwoorden-kamervragen-over-het-artikel-pleegkinderen-geslagen-aan-oren-getrokken-en-door-hond-gebeten","Staatssecretaris Rutte (JenV) geeft antwoord op Kamervragen naar aanleiding van het artikel 'Pleegkinderen geslagen, aan oren getrokken en door hond gebeten'. Het Tweede Kamerlid Ceder (ChristenUnie) had de vragen gesteld.Antwoorden Kamervragen over het artikel over mishandeling pleegkinderen",2025-12-02 16:13:02,"4c289f53-3eee-4ed2-8e7a-0bde60c9e76e"
"Kamerbrief uitkomsten onderzoek naar impact kwantumkorting","https://www.rijksoverheid.nl/documenten/kamerstukken/2025/11/18/kamerbrief-over-uitkomsten-onderzoek-naar-impact-kwantumkorting","Staatssecretaris Tielen (Jeugd, Preventie en Sport) stuurt de Tweede Kamer een rapport over de inzet van kwantumkorting door supermarkten en de impact die dit heeft op uitgaven aan eten en drinken. De staatssecretaris gaat kort in op de uitkomsten in het rapport.Kamerbrief uitkomsten onderzoek naar impact kwantumkorting",2025-12-02 16:09:24,"31810f37-e593-41ff-ba9a-426b9bdc10e5"
"Antwoorden Kamervragen over het bericht over mishandeling uit huis geplaatste kinderen uit Noord Nederland ","https://www.rijksoverheid.nl/documenten/kamerstukken/2025/12/02/antwoorden-kamervragen-over-het-bericht-uit-huis-geplaatste-kinderen-uit-noord-nederland-jarenlang-ernstig-mishandeld","Staatssecretaris Rutte (JenV) geeft antwoord op Kamervragen naar aanleiding van het bericht 'Uit huis geplaatste kinderen uit Noord-Nederland jarenlang ernstig mishandeld'. De Tweede Kamerleden Schilder en Van Meetelen (beiden PVV) hadden de vragen gesteld.Antwoorden Kamervragen over het bericht over mishandeling uit huis geplaatste kinderen uit Noord Nederland",2025-12-02 15:19:45,"8a3e52a2-192c-4d41-8163-7cdb891f1fe1"
