"item_title","item_link","item_description","item_pub_date","item_guid"
"Aanbiedingsbrief bij afschrift brief medeoverheden capaciteitsbesluit asielopvang en taakstelling huisvesting vergunninghouders","https://www.rijksoverheid.nl/documenten/kamerstukken/2023/05/24/tk-afschrift-brief-medeoverheden-capaciteitsbesluit-asielopvang-en-taakstelling-huisvesting-vergunninghouders","Staatssecretaris Van der Burg (JenV) stuurt de Tweede Kamer een afschrift van de brief van 16 mei 2023 aan commissarissen van de Koning, gedeputeerden, burgemeesters en wethouders en corporatiebestuurders. De brief ging over het capaciteitsbesluit van het Centraal Orgaan opvang asielzoekers (COA), de verdeling van de asielopvangopgave over de provincies en de taakstelling huisvesting 2023-II.",2023-05-24 18:42:00,"bb5b2b07-cb03-4f1c-8eff-d03a6ae51b8c"
"Antwoorden Kamervragen over het bericht over onderzoek OM schokkend Hamas filmpje bij De Kuip","https://www.rijksoverheid.nl/documenten/kamerstukken/2023/05/24/antwoorden-kamervragen-over-het-bericht-om-gaat-schokkend-hamas-filmpje-bij-de-kuip-onderzoeken-cidi","Minister Yeşilgöz-Zegerius (JenV) geeft antwoorden op Kamervragen naar aanleiding van het bericht 'OM gaat 'schokkend' Hamas-filmpje bij De Kuip onderzoeken, CIDI doet aangifte'. De Tweede Kamerleden Ellian (VVD) en Bikker (ChristenUnie) hadden de vragen gesteld.",2023-05-24 13:56:00,"740122d4-d252-4508-9562-66dafbfe70bc"
"Kamerbrief over uitvoering moties over de emancipatie van mensen met een beperking","https://www.rijksoverheid.nl/documenten/kamerstukken/2023/05/24/kamerbrief-naar-aanleiding-van-de-moties-betreffende-de-emancipatie-van-mensen-met-een-beperking","Minister Dijkgraaf (OCW) en minister Helder (Langdurige Zorg en Sport) informeren de Tweede Kamer over de uitvoering van 2  aangenomen moties uit het wetgevingsoverleg Emancipatiebeleid van 5 december 2022. De moties gaan over het monitoren van de emancipatie van mensen met een beperking en het instellen van een burgerberaad.",2023-05-24 13:29:00,"15337974-5a35-4bf4-90d5-58d3eb81415d"
"Uitstelbrief op Kamervragen over sluiting afdelingen Gelre Ziekenhuis Zutphen ","https://www.rijksoverheid.nl/documenten/kamerstukken/2023/05/24/uitstelbrief-antwoorden-kamervragen-over-de-sluiting-van-afdelingen-van-het-gelre-ziekenhuis-zutphen","Minister Kuipers (VWS) meldt dat de antwoorden op vragen over de sluiting van afdelingen van het Gelre Ziekenhuis Zutphen later komen dan gebruikelijk. Het Tweede Kamerlid Dijk (SP) heeft de vragen gesteld.Uitstelbrief op Kamervragen over sluiting afdelingen Gelre Ziekenhuis Zutphen",2023-05-24 12:58:00,"75812a25-c9f9-4ede-92a5-0e76ec61a9b4"
"Antwoorden op Kamervragen (VSO) over Kamerbrief prijsonderhandelingen Trodelvy","https://www.rijksoverheid.nl/documenten/kamerstukken/2023/05/24/kamerbrief-verslag-schriftelijk-overleg-vso-n-a-v-kamerbrief-prijsonderhandelingen-trodelvy","Minister Kuipers (VWS) geeft antwoord op vragen over de Kamerbrief betreffende de prijsonderhandelingen van Trodelvy. De vaste commissie voor Volksgezondheid, Welzijn en Sport heeft de vragen gesteld in een verslag van een Schriftelijk Overleg (VSO) met de minister.Antwoorden op Kamervragen (VSO) over Kamerbrief prijsonderhandelingen Trodelvy",2023-05-24 11:57:35,"fd02deeb-6690-4817-9721-bc7ef1c8370e"
"Antwoorden op Kamervragen over bericht ‘Binnenlopen met bejaarden’","https://www.rijksoverheid.nl/documenten/kamerstukken/2023/05/24/antwoorden-op-kamervragen-over-het-bericht-binnenlopen-met-bejaarden","Minister Kuipers (VWS) geeft antwoord op vragen over het bericht ‘Binnenlopen met bejaarden’. Het Tweede Kamerlid Hijink (SP) heeft deze vragen gesteld.Antwoorden op Kamervragen over bericht ‘Binnenlopen met bejaarden’",2023-05-24 10:00:34,"7545582a-fa2d-43d9-a874-9e3930871810"
"Kamerbrief over stand van zaken European Health Data Space (EHDS)","https://www.rijksoverheid.nl/documenten/kamerstukken/2023/05/23/kamerbrief-over-stand-van-zaken-european-health-data-space","Minister Kuipers (VWS) informeert de Tweede Kamer over de voortgang van de onderhandelingen op het voorstel omtrent European Health Data Space (EHDS). Eenzelfde brief is naar de Eerste Kamer verstuurd.Kamerbrief over stand van zaken European Health Data Space (EHDS)",2023-05-24 06:06:21,"fa324f63-daa7-41de-aa0f-6fba1af58013"
"Kamerbrief over Schriftelijk Overleg inzake hoofdlijnen van het verbeteren en verbreden van de toets op het basispakket","https://www.rijksoverheid.nl/documenten/kamerstukken/2023/05/23/kamerbrief-over-schriftelijk-overleg-inzake-hoofdlijnen-van-het-verbeteren-en-verbreden-van-de-toets-op-het-basispakket","Minister Kuipers (VWS) en minister Helder (Langdurige Zorg en Sport) de Tweede Kamer reactie op SO inzake hoofdlijnen van het verbeteren en verbreden van de toets op het basispakketKamerbrief over Schriftelijk Overleg inzake hoofdlijnen van het verbeteren en verbreden van de toets op het basispakket",2023-05-23 14:51:43,"9ef06155-4cb1-4516-b649-1a5857d8370f"
"Kamerbrief over Wijzigingsregeling subsidiëring VIPP Babyconnect","https://www.rijksoverheid.nl/documenten/kamerstukken/2023/05/23/kamerbrief-over-wijzigingsregeling-subsidiering-vipp-babyconnect","Minister Kuipers (VWS) biedt de Tweede Kamer de concept Beleidsregel aan over subsidiëring Versnellingsprogramma Informatie-uitwisseling Patiënt en Professional Babyconnect in verband met de verlenging van de looptijd en aanpassing van de subsidiesystematiek.Kamerbrief over Wijzigingsregeling subsidiëring VIPP Babyconnect",2023-05-23 14:33:40,"35d7be0b-37c6-4113-a2de-67d50f0aa8ce"
"Antwoorden op Kamervragen over een mogelijk verband tussen vaccinaties en de hoge sterfte ","https://www.rijksoverheid.nl/documenten/kamerstukken/2023/05/23/antwoorden-op-kamervragen-over-een-mogelijk-verband-tussen-vaccinaties-en-de-hoge-sterfte","Minister Kuipers (VWS) geeft antwoord op vragen over een mogelijk verband tussen vaccinaties en de hoge sterfte. Het Tweede Kamerlid Van Houwelingen (FVD) heeft de vragen gesteld.Antwoorden op Kamervragen over een mogelijk verband tussen vaccinaties en de hoge sterfte",2023-05-23 14:17:51,"5fe7088b-9c83-4e7d-b80d-240fff1352c9"
"Uitstelbrief op Kamervragen over btw-nultarief groente en fruit","https://www.rijksoverheid.nl/documenten/kamerstukken/2023/05/23/uitstelbrief-kamervragen-btw-nultarief-groente-en-fruit","Staatssecretaris Van Ooijen (VWS) en staatssecretaris Van Rij (Fiscaliteit en Belastingdienst)       melden dat de antwoorden op vragen over de effectiviteit van het afschaffen van de btw op groente en fruit in landen waar dit al is toegepast later komen dan gebruikelijk. Het Tweede Kamerlid Van Esch (PvdD) heeft de vragen gesteld.Uitstelbrief op Kamervragen over btw-nultarief groente en fruit",2023-05-23 13:49:17,"3b76f920-3bb9-4bb4-8fbb-1a32c7c2f18f"
"Kamerbrief over geannoteerde agenda formele EU Gezondheidsraad 13 juni 2023","https://www.rijksoverheid.nl/documenten/kamerstukken/2023/05/23/kamerbrief-over-geannoteerde-agenda-formele-eu-gezondheidsraad-13-juni-2023","Minister Kuipers (VWS) biedt de Tweede Kamer de geannoteerde agenda aan voor de formele EU Gezondheidsraad op 13 juni 2023 in Luxemburg. Eenzelfde brief is naar de Eerste Kamer verstuurd.",2023-05-23 13:27:00,"53c5a74d-b29f-4a77-942c-26f0a0c0ce87"
"Kamerbrief bij advies over Programma Rationalisatie ICT-landschap CAK","https://www.rijksoverheid.nl/documenten/kamerstukken/2023/05/23/kamerbrief-over-het-bit-advies-programma-rationalisatie-ict-landschap-cak","Minister Kuipers (VWS) deelt het advies van het Adviescollege ICT-toetsing over het Programma Rationalisatie ICT-landschap CAK met de Tweede Kamer. Ook reageert de minister op het advies. De Eerste Kamer heeft een afschrift van deze brief gekregen.Kamerbrief bij advies over Programma Rationalisatie ICT-landschap CAK",2023-05-23 12:39:40,"f63c659c-5367-4051-b44f-aab910b5d0db"
"Kamerbrief over bestuurlijke afspraken langdurige ggz in de Wlz en Wmo","https://www.rijksoverheid.nl/documenten/kamerstukken/2023/05/23/kamerbrief-over-bestuurlijke-afspraken-langdurige-ggz-in-de-wlz-en-wmo","Minister Helder (Langdurige Zorg en Sport) en staatssecretaris Van Ooijen (VWS) sturen de brief over bestuurlijke afspraken langdurige ggz in de Wlz en WmoKamerbrief over bestuurlijke afspraken langdurige ggz in de Wlz en Wmo",2023-05-23 11:24:37,"7e290f32-ed25-4636-b111-10f62db17f34"
"Kamerbrief reactie op petitie over extra kosten glutenvrij dieet","https://www.rijksoverheid.nl/documenten/kamerstukken/2023/05/23/kamerbrief-over-reactie-op-petitie-nederlandse-coeliakie-vereniging-extra-kosten-glutenvrij-dieet","Minister Kuipers (VWS) reageert op de petitie van de Nederlandse Coeliakie Vereniging over de extra kosten van een glutenvrij dieet. De vaste commissie voor Volksgezondheid, Welzijn en Sport in de Tweede Kamer had om een reactie gevraagd.Kamerbrief reactie op petitie over extra kosten glutenvrij dieet",2023-05-23 10:39:59,"40a98654-c6f6-418e-9033-60f2af05dec0"
"Kamerbrief over versterking van de positie van patiënten en cliënten binnen het zorgsysteem en voorhang regeling tot verstrekking van instellingssubsidie aan patiënten- en gehandicaptenorganisatie","https://www.rijksoverheid.nl/documenten/kamerstukken/2023/05/22/kamerbrief-versterking-van-de-positie-van-patienten-en-clienten-binnen-het-zorgsysteem-en-voorhang-regeling-tot-verstrekking-van-instellingssubsidie-aan-patienten-en-gehandicaptenorganisatie","Minister Helder (Langdurige Zorg en Sport) informeert de Tweede Kamer over de bredere ontwikkelingen op het gebied van de patiënten- en gehandicaptenbeweging en de ondersteuning van patiënten- en gehandicaptenorganisaties. De minister informeert de Kamer ook over de nieuwe subsidieregeling voor patiënten- en gehandicaptenorganisaties (subsidieregeling PGO).Kamerbrief over versterking van de positie van patiënten en cliënten binnen het zorgsysteem en voorhang regeling tot verstrekking van instellingssubsidie aan patiënten- en gehandicaptenorganisatie",2023-05-23 09:17:03,"5de7cd7f-cc0e-4f94-b7d9-91a2e1e07b04"
"Kamerbrief met reactie op verzoek om informatie over advies RvS over ontwerp-AMvB regels veiligheid attractie- en speeltoestellen","https://www.rijksoverheid.nl/documenten/kamerstukken/2023/05/23/kamerbrief-over-reactie-op-verzoek-om-informatie-over-het-advies-raad-van-state-inzake-het-ontwerp-van-een-algemene-maatregel-van-bestuur-houdende-vaststelling-van-regels-met-betrekking-tot-de-veiligheid-van-attractie-en-speeltoestellen","Minister Kuipers (VWS) stuurt de Tweede Kamer zijn reactie op een verzoek om informatie over het advies van de Raad van State (RvS) over de ontwerp-Algemene Maatregel van Bestuur (AMvB) met regels over de veiligheid van attractie- en speeltoestellen.",2023-05-23 09:06:00,"38b0a8c5-bc92-48a1-abe3-26577df0ecd8"
"Kamerbrief over advies van de Raad voor Volksgezondheid en Samenleving  ‘Op onze gezondheid’","https://www.rijksoverheid.nl/documenten/kamerstukken/2023/05/23/kamerbrief-over-aanbieding-rvs-advies-op-onze-gezondheid","Minister Kuipers (VWS) en staatssecretaris Van Ooijen (VWS) sturen de Tweede Kamer het advies ‘Op onze gezondheid’ van de Raad voor Volksgezondheid en Samenleving (RVS) over de publieke gezondheid. De RVS geeft tips om de publieke gezondheidszorg te versterken.",2023-05-23 09:03:00,"9054b58d-8849-4492-b1af-f397edc023a1"
"Antwoorden op Kamervragen over prijsonderhandelingen voor Libmeldy","https://www.rijksoverheid.nl/documenten/kamerstukken/2023/05/23/kamerbrief-over-vso-inzake-de-informele-eu-gezondheidsraad-op-4-en-5-mei-2023-libmeldy","Minister Kuipers (VWS) geeft antwoord op vragen over de prijsonderhandelingen voor het geneesmiddel Libmeldy. De Tweede Kamerfracties van VVD en PVV hebben deze vragen gesteld.",2023-05-23 09:01:00,"7db0f0ef-5a0a-4122-b538-2f6fc965e772"
"Aanbiedingsbrief antwoorden Kamervragen over aanwijzing aan NZa over Wlz-maatregelen coalitieakkoord","https://www.rijksoverheid.nl/documenten/kamerstukken/2023/05/22/lz-1047522a","Minister Helder (Langdurige Zorg en Sport) stuurt de antwoorden op vragen over de voorhang van de aanwijzing aan de Nederlandse Zorgautoriteit (NZa) over Wet langdurige zorg (Wlz)-maatregelen uit het coalitieakkoord naar de Tweede Kamer.Aanbiedingsbrief antwoorden Kamervragen over aanwijzing aan NZa over Wlz-maatregelen coalitieakkoord",2023-05-22 16:05:22,"72de130a-8e28-4a56-87ac-53ef7cb07102"
