"item_title","item_link","item_description","item_pub_date","item_guid"
"Uitstelbrief antwoorden Kamervragen over ‘het antwoord dat oud-minister Martin van Rijn verantwoordelijk is voor de mondkapjesdeal waar 100,8 miljoen euro mee verloren ging’","https://www.rijksoverheid.nl/documenten/kamerstukken/2023/03/23/uitstelbrief-antwoorden-kamervragen-over-het-antwoord-dat-oudminister-martin-van-rijn-verantwoordelijk-is-voor-de-mondkapjesdeal-waar-1008-miljoen-euro-mee-verloren-ging","Minister Helder (Langdurige Zorg en Sport) meldt dat de antwoorden op vragen van het lid Agema (PVV), over ‘het antwoord dat oudminister Martin van Rijn verantwoordelijk is voor de mondkapjesdeal waar 100,8 miljoen euro mee verloren ging’, later komen dan gebruikelijk.",2023-03-23 16:14:00,"5a3f919c-1a36-4f9f-836c-68ce3b0f143c"
"Uitstelbrief op Kamervragen over toezicht op PGB wooninitiatieven","https://www.rijksoverheid.nl/documenten/kamerstukken/2023/03/23/uitstelbrief-antwoorden-kamervragen-over-het-toezicht-op-pgb-wooninitiatieven","Minister Helder (Langdurige Zorg en Sport) meldt dat de antwoorden op vragen over het toezicht op PGB wooninitiatieven later komen dan gebruikelijk. Het Tweede Kamerlid Westerveld (GroenLinks) heeft de vragen gesteld.",2023-03-23 16:13:00,"b18121a5-93b3-495d-a914-a6c5976d56ef"
"Antwoorden Kamervragen over de koppeling van persoonsgegevens van uithuisgeplaatste kinderen","https://www.rijksoverheid.nl/documenten/kamerstukken/2023/03/23/antwoorden-kamervragen-over-de-koppeling-van-persoonsgegevens-van-uithuisgeplaatste-kinderen-en-onafhankelijk-onderzoek-naar-uithuisplaatsingen-en-het-kinderopvangtoeslagschandaal","Minister Weerwind (Rechtsbescherming) geeft antwoord op Kamervragen over de koppeling van persoonsgegevens van uithuisgeplaatste kinderen en onafhankelijk onderzoek naar uithuisplaatsingen en het kinderopvangtoeslagschandaal. Het Tweede Kamerlid Omtzigt (Omtzigt) had de vragen gesteld.",2023-03-23 13:28:00,"609cdfc5-edb0-4931-ac4b-90a19806c13e"
"Kamerbrief met beleidsreactie op Prevalentiemonitor huiselijk geweld en seksueel grensoverschrijdend gedrag 2022","https://www.rijksoverheid.nl/documenten/kamerstukken/2023/03/23/tk-beleidsreactie-op-prevalentiemonitor-huiselijk-geweld-en-seksueel-grensoverschrijdend-gedrag-2022","De ministers Weerwind (Rechtsbescherming) en Yeşilgöz-Zegerius (JenV) en staatssecretaris Van OOijen (VWS) geven hun beleidsreactie op e Prevalentiemonitor huiselijk geweld en seksueel grensoverschrijdend gedrag 2022. Het is een rapport van het Wetenschappelijk Onderzoek- en Documentatiecentrum (WODC) en het Centraal Bureau voor de Statistiek (CBS). De Tweede Kamer had het rapport op 13 januari 2023 ontvangen.",2023-03-23 12:20:00,"29e59b63-d6e3-4761-82d8-beaf250d6c5f"
"Beantwoording Kamervragen over besluitvorming kabinet epidemiologische situatie China","https://www.rijksoverheid.nl/documenten/kamerstukken/2023/03/23/kamerbrief-over-beantwoording-brief-inzake-nadere-vragen-besluitvorming-kabinet-epidemiologische-situatie-china","Minister Kuipers (VWS) beantwoordt nadere vragen over de maatregelen inzake de COVID-19-situatie in China van de afgelopen periode. De vragen zijn van de leden van de vaste Eerste Kamercommissies voor Justitie en Veiligheid, voor Volksgezondheid, Welzijn en Sport, voor Binnenlandse Zaken en de Hoge Colleges van Staat / Algemene Zaken en Huis van de Koning.",2023-03-23 10:16:00,"331c516d-b627-41c8-93cd-c1b3c954d43a"
"Uitstelbrief op Kamervragen over oproep KNMG om langetermijn gezondheidsdoelen wettelijk te verankeren","https://www.rijksoverheid.nl/documenten/kamerstukken/2023/03/23/uitstelbrief-antwoorden-kamervragen-over-de-oproep-van-de-knmg-om-lange-termijn-gezondheidsdoelen-wettelijk-te-verankeren","Staatssecretaris Van Ooijen (VWS) meldt dat de antwoorden op vragen over de oproep van de KNMG om langetermijn gezondheidsdoelen wettelijk te verankeren later komen dan gebruikelijk. Het Tweede Kamerlid Van Esch (PvdD) heeft de vragen gesteld.",2023-03-23 09:58:00,"2b18cb68-9bcb-4cd9-b9ce-5ce7daba6601"
"Uitstelbrief antwoorden op Kamervragen bericht groeiende kritiek 'Dutch approach'","https://www.rijksoverheid.nl/documenten/kamerstukken/2023/03/22/uitstelbrief-antwoorden-kamervragen-over-het-bericht-dat-de-kritiek-op-the-dutch-approach-groeit","Minister Kuipers (VWS) meldt dat hij vragen niet op tijd kan beantwoorden. De vragen gaan over het bericht dat de kritiek op 'the Dutch approach' groeit. Deze vragen gaan over de behandeling van transgenderjongeren. Het Tweede Kamerlid Van der Staaij (SGP) heeft de vragen gesteld. ",2023-03-22 16:34:00,"72756520-0850-4522-90c1-12e93dd473be"
"Uitstelbrief antwoorden op Kamervragen over berichtgeving van the Wall Street Journal over natuurlijke immuniteit tegen het SARS-COV-2 virus","https://www.rijksoverheid.nl/documenten/kamerstukken/2023/03/22/uitstelbrief-antwoorden-kamervragen-over-de-berichtgeving-van-the-wall-street-journal-over-natuurlijke-immuniteit-tegen-het-sars-cov-2-virus","Minister Kuipers (VWS) meldt dat de antwoorden op vragen over de berichtgeving van the Wall Street Journal over natuurlijke immuniteit tegen het SARS-COV-2 virus, later komen dan gebruikelijk. Het Tweede Kamerlid Van Haga (Groep Van Haga) heeft de vragen gesteld.",2023-03-22 16:33:00,"2e60c008-5404-4c4c-9a67-2add456c8d2a"
"Uitstelbrief antwoorden op Kamervragen over onderzoek 'Pharma's pandemic profits'","https://www.rijksoverheid.nl/documenten/kamerstukken/2023/03/22/uitstelbrief-antwoorden-kamervragen-over-het-onderzoek-van-somo-pharmas-pandemic-profits","Minister Kuipers (VWS) meldt dat hij vragen niet op tijd kan beantwoorden. De vragen gaan over het onderzoek van de Stichting Onderzoek Multinationale Ondernemingen (SOMO), getiteld 'Pharma's pandemic profits'. De vragen zijn gesteld door het Tweede Kamerlid Marijnissen (SP). ",2023-03-22 16:31:00,"0c189587-38aa-4948-8670-3fb85f45cc8b"
"Kamerbrief over voorhangbrief beschikbaarheidbijdrage (medische) vervolgopleidingen (gezondheidszorgpsycholoog en psychotherapeut)","https://www.rijksoverheid.nl/documenten/kamerstukken/2023/03/22/kamerbrief-over-voorhangbrief-beschikbaarheidbijdrage-medische-vervolgopleidingen-gezondheidszorgpsycholoog-en-psychotherapeut","Minister Kuipers (VWS) stuurt de Tweede Kamer de voorhangbrief beschikbaarheidbijdrage (medische) vervolgopleidingen (gezondheidszorgpsycholoog en psychotherapeut). Eenzelfde brief is aan de Eerste Kamer verstuurd.",2023-03-22 16:08:00,"39710b35-42c5-46e5-894f-ccc8c3fc1599"
"Antwoorden op Kamervragen over het uitstel van antwoorden over coronawobs","https://www.rijksoverheid.nl/documenten/kamerstukken/2023/03/22/antwoorden-op-kamervragen-over-het-uitstel-van-antwoorden-over-coronawobs","Minister Kuipers (VWS) geeft antwoord op vragen over het uitstel van antwoorden over coronawobs. Het Tweede Kamerlid Agema (PVV) heeft de vragen gesteld. ",2023-03-22 15:39:00,"c5a808bc-346e-4e00-af91-28936b8ba12c"
"Antwoorden op Kamervragen over coronawobs","https://www.rijksoverheid.nl/documenten/kamerstukken/2023/03/22/antwoorden-op-kamervragen-over-coronawobs","Minister Kuipers (VWS) geeft antwoord op de vragen van het lid Agema (PVV) over Coronawobs.",2023-03-22 15:38:01,"f1215c8f-9b13-4d04-9b97-b227f208ea59"
"Kamerbrief over nieuw arbeidsmarktprognose zorg en welzijn","https://www.rijksoverheid.nl/documenten/kamerstukken/2023/03/22/kamerbrief-over-nieuw-arbeidsmarktprognose-zorg-en-welzijn","Minister Helder (Langdurige Zorg en Sport) informeert de Tweede Kamer over de uitkomsten van de nieuwe prognose van het verwachte personeelstekort in de verschillende branches van zorg en welzijn.",2023-03-22 15:19:00,"4d34c735-f3f6-4dc9-9fec-c64fe01c4261"
"Uitstelbrief op Kamervragen over het sluiten van zorglocaties voor mensen die intensieve zorg nodig hebben","https://www.rijksoverheid.nl/documenten/kamerstukken/2023/03/22/uitstelbrief-antwoorden-kamervragen-over-het-sluiten-van-zorglocaties-voor-mensen-die-intensieve-zorg-nodig-hebben","Minister Helder (Langdurige Zorg en Sport) meldt dat de antwoorden op vragen over het sluiten van zorglocaties voor mensen die intensieve zorg nodig hebben, later komen dan gebruikelijk. Het Tweede Kamerlid Westerveld (GroenLinks) heeft de vragen gesteld.",2023-03-22 13:27:00,"66cff992-3d77-4a53-b3ce-3e7312623a6f"
"Kamerbrief over Februaribrief NZa Wlz-kader 2023","https://www.rijksoverheid.nl/documenten/kamerstukken/2023/03/22/kamerbrief-over-februaribrief-nza-wlz-kader-2023","Minister Helder (Langdurige Zorg en Sport) stuurt de Tweede Kamer de februaribrief van de Nederlandse Zorgautoriteit (NZa) over de benutting van het budgettaire kader Wlz voor 2023.",2023-03-22 12:36:01,"03087294-cc6f-4c68-886c-9036818785f7"
"Uitstelbrief op Kamervragen over het verdwijnen van specialistische ggz behandelplekken","https://www.rijksoverheid.nl/documenten/kamerstukken/2023/03/21/uitstelbrief-antwoorden-kamervragen-over-het-verdwijnen-van-specialistische-ggz-behandelplekken","Minister Helder (Langdurige Zorg en Sport) meldt dat de antwoorden op vragen over het verdwijnen van specialistische ggz behandelplekken, later komen dan gebruikelijk. Het Tweede Kamerlid Westerveld (GroenLinks) heeft de vragen gesteld. ",2023-03-21 16:12:00,"5eb139ce-8f3c-4dc1-ae32-a85d0f6a1bad"
"Kamerbrief met reactie VWS op vraag herregistratie van jeugd- en gezinsprofessional","https://www.rijksoverheid.nl/documenten/kamerstukken/2023/03/21/kamerbrief-over-reactie-vws-op-vraag-inzake-herregistratie-van-jeugd-en-gezinsprofessional","Staatssecretaris Van Ooijen (VWS) reageert op een brief die de vaste Tweede Kamercommissie voor Volksgezondheid, Welzijn en Sport van een jeugdzorgprofessional heeft ontvangen. De brief gaat over de herregistratie van jeugd- en gezinsprofessional.  ",2023-03-21 14:29:00,"8db80c7c-8ab9-4793-a962-dbc4e4e00d39"
"Kamerbrief over voortgang aanpak drugspreventie","https://www.rijksoverheid.nl/documenten/kamerstukken/2023/03/21/kamerbrief-over-voortgang-aanpak-drugspreventie","Staatssecretaris Van Ooijen (VWS) stuurt de Tweede Kamer een brief over de voortgang aanpak drugspreventie. De staatssecretaris heeft eerder toegezd om zich in zijn aanpak drugspreventie te richten op een actieve en effectieve preventieaanpak, met een focus op de bescherming van kwetsbare jongeren.",2023-03-21 14:14:00,"33bd0e1d-5b39-4eac-87d9-7f32d85cdac5"
"Antwoorden op Kamervragen over het recent verschenen rapport van Movisie over discriminatie in de sociale basis","https://www.rijksoverheid.nl/documenten/kamerstukken/2023/03/21/antwoorden-op-kamervragen-over-het-recent-verschenen-rapport-van-movisie-met-betrekking-tot-discriminatie-in-de-sociale-basis","Staatssecretaris Van Ooijen (VWS) geeft antwoord op vragen over het recent verschenen rapport van Movisie met betrekking tot discriminatie in de sociale basis. Het Tweede Kamerlid Simons (BIJ1) heeft de vragen gesteld.",2023-03-21 14:01:00,"2caaa3f3-ff86-4e50-a778-fac5e5465a73"
"Kamerbrief over Landelijke rapportage Cliëntervaringsonderzoek Wmo – Verantwoordingsjaar 2022","https://www.rijksoverheid.nl/documenten/kamerstukken/2023/03/21/kamerbrief-over-landelijke-rapportage-clientervaringsonderzoek-wmo-verantwoordingsjaar-2022","Staatssecretaris Van Ooijen (VWS) stuurt de Tweede Kamer de Landelijke rapportage Cliëntervaringsonderzoek Wmo – Verantwoordingsjaar 2022.",2023-03-21 13:26:00,"990acd6b-5226-4826-9c00-4c1a1f83aafb"
