"item_title","item_link","item_description","item_pub_date","item_guid"
"Antwoord op Kamervragen over bericht ‘Nieuwe behandeling? Alleen nog vergoeden als die klimaat en zorgpersoneel spaart’","https://www.rijksoverheid.nl/documenten/kamerstukken/2025/06/17/antwoorden-op-kamervragen-over-het-bericht-nieuwe-behandeling-alleen-nog-vergoeden-als-die-klimaat-en-zorgpersoneel-spaart","Minister Van Hijum (VWS) beantwoordt vragen over het bericht ‘Nieuwe behandeling? Alleen nog vergoeden als die klimaat en zorgpersoneel spaart’. Het Tweede Kamerlid Claassen (PVV) heeft de vragen gesteld.Antwoord op Kamervragen over bericht ‘Nieuwe behandeling? Alleen nog vergoeden als die klimaat en zorgpersoneel spaart’",2025-08-12 07:10:57,"1ac9be2f-d92a-4217-964e-26c8d1ddd11e"
"Antwoord op Kamervragen over bericht dat ongediplomeerd personeel in dienst is bij zorgverleners","https://www.rijksoverheid.nl/documenten/kamerstukken/2025/06/19/antwoorden-op-de-vragen-van-de-leden-dijk-en-dobbe-beiden-sp-over-het-bericht-dat-ongediplomeerd-personeel-in-dienst-is-bij-zorgverleners","Minister van Hijum (VWS) beantwoordt vragen over het bericht dat ongediplomeerd personeel in dienst is bij zorgverleners. De vragen zijn gesteld door Tweede Kamerleden Jimmy Dijk en Dobbe (beiden SP).Antwoord op Kamervragen over bericht dat ongediplomeerd personeel in dienst is bij zorgverleners",2025-08-12 07:02:30,"20066cb4-8d14-4386-9b57-7c7891df2e48"
"Antwoord op Kamervragen over bericht 'Noodkreet GGZ-instelling de Waag: wachtlijsten plotseling nog langer door aanpassing van beleid'","https://www.rijksoverheid.nl/documenten/kamerstukken/2025/06/18/antwoorden-op-kamervragen-over-het-bericht-noodkreet-ggz-instelling-de-waag-wachtlijsten-plotseling-nog-langer-door-aanpassing-van-beleid","Minister Van Hijum (VWS) geeft antwoord op vragen over het bericht 'Noodkreet GGZ-instelling de Waag: wachtlijsten plotseling nog langer door aanpassing van beleid'. Tweede Kamerlid Westerveld (GroenLinks-PvdA) heeft de vragen gesteld.Antwoord op Kamervragen over bericht 'Noodkreet GGZ-instelling de Waag: wachtlijsten plotseling nog langer door aanpassing van beleid'",2025-08-12 06:34:52,"4e6bc153-4119-4b01-8b6a-14a44cb99ffd"
"Kamerbrief met reactie op aangehouden motie Van Dijck over etikettering levensmiddelen","https://www.rijksoverheid.nl/documenten/kamerstukken/2025/07/03/kamerbrief-over-reactie-op-aangehouden-motie-van-het-lid-van-dijck-36-725-nr-8","Staatssecretaris Tielen (Jeugd, Preventie en Sport) reageert op de aangehouden motie van het Tweede Kamerlid Van Dijck (PVV). De motie verzoekt om de verplichting om de informatie op etiketten voor levensmiddelen in het Nederlands te vermelden, te schrappen.Kamerbrief met reactie op aangehouden motie Van Dijck over etikettering levensmiddelen",2025-08-12 06:15:12,"6f89f9a1-7dc4-4cb1-901d-a49bfb8249cc"
"Kamerbrief over Bereikbaarheidsanalyse SEH en acute verloskunde 2025","https://www.rijksoverheid.nl/documenten/kamerstukken/2025/07/03/bereikbaarheidsanalyse-seh-s-en-acute-verloskunde-2025","Minister Jansen (VWS) stuurt de Tweede Kamer de 'Kennisnotitie Bereikbaarheidsanalyse SEH’s en acute verloskunde 2025'. De notitie bevat het jaarlijkse rapport van het Rijksinstituut voor Volksgezondheid en Milieu (RIVM) over de 'gevoelige ziekenhuizen analyse' van de bereikbaarheid van de spoedeisende hulpafdelingen (SEH's) en locaties met acute verloskunde (AV). De minister gaat in op de bevindingen uit de analyse. Kamerbrief over Bereikbaarheidsanalyse SEH en acute verloskunde 2025",2025-08-12 05:41:48,"4469c15b-9234-4465-81d2-3d6d76891f2e"
"Antwoorden op Kamervragen over schijnveiligheid jongeren op sociale media","https://www.rijksoverheid.nl/documenten/kamerstukken/2025/08/11/antwoorden-op-kamervragen-over-de-schijnveiligheid-van-jongeren-op-sociale-media","Staatssecretaris Van Marum (BZK) geeft antwoord op vragen over de schijnveiligheid van jongeren op sociale media. Het Tweede Kamerlid Kathmann (GroenLinks-PvdA) heeft de vragen gesteld.Antwoorden op Kamervragen over schijnveiligheid jongeren op sociale media",2025-08-11 14:21:59,"200f3851-0999-4a91-9701-2df6eefb164c"
"Kamerbrief over datalek bij laboratorium bevolkingsonderzoek baarmoederhalskanker","https://www.rijksoverheid.nl/documenten/kamerstukken/2025/08/11/kamerbrief-over-datalek-bij-laboratorium-bvo-baarmoederhalskanker","Minister Jansen (VWS) informeert de Tweede Kamer over een hack (computerinbraak) bij een laboratorium dat is betrokken bij het bevolkingsonderzoek naar baarmoederhalskanker. Kamerbrief over datalek bij laboratorium bevolkingsonderzoek baarmoederhalskanker",2025-08-11 12:08:20,"c5196f31-42a2-49b6-82c2-cb123858767f"
"Kamerbrief Beleidsreactie Nibud onderzoek Meerkosten van het leven met een beperking  ","https://www.rijksoverheid.nl/documenten/kamerstukken/2025/07/11/kamerbrief-over-beleidsreactie-nibud-onderzoek-meerkosten-van-het-leven-met-een-beperking","Staatssecretaris Pouw-Verweij (Langdurige en Maatschappelijke Zorg) stuurt de Tweede Kamer de beleidsreactie op het onderzoek naar meerkosten waar mensen met een beperking mee te maken hebben. Dit rapport van het Nationaal Instituut voor Budgetvoorlichting (Nibud) is in juni 2024 aan de Tweede Kamer aangeboden.Kamerbrief Beleidsreactie Nibud onderzoek Meerkosten van het leven met een beperking",2025-08-11 09:10:20,"608393bb-a9d4-44c7-bc5f-c5c030e909b2"
"Aanbiedingsbrief bij wijziging Besluit afbreking zwangerschap","https://www.rijksoverheid.nl/documenten/kamerstukken/2025/06/03/kamerbrief-inzake-nahangprocedure-inzake-wijziging-van-het-besluit-afbreking-zwangerschap","Minister Agema (VWS) biedt de Tweede Kamer een wijziging aan van het Besluit afbreking zwangerschap. De wijziging betreft de invoering van een vergunningplicht en een meldplicht voor het verrichten van handelingen met het poliovirus. Eenzelfde brief is naar de Eerste Kamer verstuurd.Aanbiedingsbrief bij wijziging Besluit afbreking zwangerschap",2025-08-11 08:43:47,"f44aa0b2-b1f1-4fe8-acae-13c3384590de"
"Kamerbrief over stand van zaken complexe zorg gehandicaptenzorg - juni 2025","https://www.rijksoverheid.nl/documenten/kamerstukken/2025/06/03/kamerbrief-over-vervolg-complexe-zorg-gehandicaptenzorg-juni-2025","Staatssecretaris Maeijer (Langdurige en Maatschappelijke Zorg) informeert de Tweede Kamer over de stand van zaken rondom de complexe zorg voor mensen met een beperking. Ook informeert de staatssecretaris de Kamer over de stappen die zij daarin zet. Ze bouwt hierbij voort op onder meer de voortgangsrapportage van de ‘Toekomstagenda zorg en ondersteuning voor mensen met een beperking’.Kamerbrief over stand van zaken complexe zorg gehandicaptenzorg - juni 2025",2025-08-11 07:57:13,"0489f8ea-723f-4ab1-a778-c23fe1f125f8"
"Antwoorden op Kamervragen over het bericht  over toename huidkanker ","https://www.rijksoverheid.nl/documenten/kamerstukken/2025/07/02/antwoorden-op-kamervragen-over-het-bericht-huidkanker-is-snelst-toenemende-vorm-van-kanker-in-nederland","Staatssecretaris Tielen (Jeugd, Preventie en Sport) geeft antwoorden op Kamervragen naar aanleiding van het bericht 'Huidkanker is snelst toenemende vorm van kanker in Nederland'. Het voormalig Tweede Kamerlid Danielle Jansen (Nieuw Sociaal Contract) had de vragen gesteld.Antwoorden op Kamervragen over het bericht  over toename huidkanker",2025-08-11 07:43:06,"a4650b1f-d1b8-4499-95f6-ad488eb850e9"
"Kamerbrief met reactie op petitie over eenzame opsluiting in de ggz","https://www.rijksoverheid.nl/documenten/kamerstukken/2025/07/02/kamerbrief-over-verzoek-om-reactie-op-petitie-stop-eenzame-opsluiting-in-de-ggz","Staatssecretaris Tielen (Jeugd, Preventie en Sport) reageert op de petitie 'Stop eenzame opsluiting in de ggz' van MIND. De vaste Tweede Kamercommissie voor Volksgezondheid, Welzijn en Sport (VWS) had om een reactie verzocht.Kamerbrief met reactie op petitie over eenzame opsluiting in de ggz",2025-08-11 06:11:35,"d9602403-b0cd-4bc0-a1a4-5ed3a5a4a556"
"Kamerbrief met reactie op motie over inzetten op labeling PFAS-houdende producten","https://www.rijksoverheid.nl/documenten/kamerstukken/2025/06/03/kamerbrief-over-appreciatie-motie-lid-bamenga-over-inzetten-op-labeling-van-pfas-houdende-producten","Staatssecretaris Karremans (Jeugd, Preventie en Sport) reageert op een motie waarin de regering wordt gevraagd zich in Europa in te zetten voor een labeling van PFAS-houdende producten. Het Tweede Kamerlid Bamenga (D66) heeft de motie ingediend.Kamerbrief met reactie op motie over inzetten op labeling PFAS-houdende producten",2025-08-08 15:17:21,"98681593-a307-410e-9e18-25eff67aab75"
"Kamerbrief over resultaten programma WOZO","https://www.rijksoverheid.nl/documenten/kamerstukken/2025/07/02/kamerbrief-over-programma-wonen-ondersteuning-en-zorg-voor-ouderen","Staatssecretaris Pouw-Verweij (Langdurige en Maatschappelijke Zorg) informeert de Tweede Kamer over de bereikte resultaten van het programma Wonen, Ondersteuning en Zorg voor Ouderen (WOZO) sinds 2022 en het vervolg. Vervolgens bespreekt zij de stand van zaken van de Medisch generalistische zorg (MGZ). Tot slot gaat zij in op de domeinoverstijgende activiteiten van de langdurige zorg en de gesprekken met Zorgbuurthuis ’t Hageltje.Kamerbrief over resultaten programma WOZO",2025-08-08 13:31:49,"0ce86af8-4f79-4f39-9276-e2a91e41e753"
"Kamerbrief over aanbieding Standen van de Uitvoering VWS 2025","https://www.rijksoverheid.nl/documenten/kamerstukken/2025/06/03/kamerbrief-over-aanbieding-standen-van-de-uitvoering-vws-2025","Minister Agema (VWS) informeert de Tweede Kamer over de 4e serie van de Standen van de Uitvoering op het VWS-domein. Eenzelfde brief is naar de Eerste Kamer verstuurd.Kamerbrief over aanbieding Standen van de Uitvoering VWS 2025",2025-08-08 13:05:45,"f87abaf0-905d-4103-95d8-5e4573b54c92"
"Kamerbrief over systeem herindicaties Wlz ","https://www.rijksoverheid.nl/documenten/kamerstukken/2025/06/03/kamerbrief-over-herindicaties-wlz","Staatssecretaris Maeijer (Langdurige en Maatschappelijke Zorg) informeert de Tweede Kamer over het voornemen uit het regeerprogramma om de administratieve lasten voor zorgprofessionals en zorgaanbieders te verminderen door het systeem van herindicaties voor mensen met een Wlz-indicatie in het verpleeghuis te beëindigen.Kamerbrief over systeem herindicaties Wlz",2025-08-08 12:48:50,"4534ac77-dcf0-4b9d-8ef6-a6e34171dd2e"
"Kamerbrief over onderzoek naar oorzaken van onderschrijding van budgettair kader wijkverpleging ","https://www.rijksoverheid.nl/documenten/kamerstukken/2025/07/02/onderzoek-oorzaken-van-de-onderschrijding-van-het-budgettair-kader-wijkverpleging","Staatssecretaris Pouw-Verweij (Langdurige en Maatschappelijke Zorg) informeert de Tweede Kamer over een onderzoek naar de oorzaken van de onderschrijding van het budgettair kader wijkverpleging dat in opdracht van partijen uit deze sector is uitgevoerd. Kamerbrief over onderzoek naar oorzaken van onderschrijding van budgettair kader wijkverpleging",2025-08-08 11:48:18,"6562e048-ff68-469b-a2df-b4724ad19e49"
"Kamerbrief over houdbaarheidsonderzoek Wmo 2015 en aanbieden analyses","https://www.rijksoverheid.nl/documenten/kamerstukken/2025/07/01/houdbaarheidsonderzoek-wmo-2015-aanbieden-analyses","Staatssecretaris Pouw-Verweij (Langdurige en Maatschappelijke Zorg) stuurt de Tweede Kamer de laatste rapporten over het Houdbaarheidsonderzoek Wmo 2015. Het onderzoek kijkt samen met gemeenten (VNG) naar de personele, financiële en maatschappelijke houdbaarheid van de Wet maatschappelijke ondersteuning (Wmo) 2015. De staatssecretaris gaat in op de bevindingen uit de rapporten.Kamerbrief over houdbaarheidsonderzoek Wmo 2015 en aanbieden analyses",2025-08-07 11:17:16,"4b767e9d-90ce-4f8c-a751-5422cdf25905"
"Kamerbrief over stand van zaken medische kindzorg","https://www.rijksoverheid.nl/documenten/kamerstukken/2025/07/01/kamerbrief-over-stand-van-zaken-medische-kindzorg","Staatssecretaris Pouw-Verweij (Langdurige en Maatschappelijke Zorg) informeert de Tweede Kamer over verbetering van de zorg voor kinderen met een intensieve zorg- of hulpvraag en laatste ontwikkelingen op het terrein van medische kindzorg.Kamerbrief over stand van zaken medische kindzorg",2025-08-07 08:24:28,"ae5ae73b-e77f-4ace-971b-8c0dbf31cd44"
"Antwoorden Kamervragen over wachttijden Wmo en ggz","https://www.rijksoverheid.nl/documenten/kamerstukken/2025/07/01/kamervragen-over-wachttijden-binnen-de-wet-maatschappelijke-ondersteuning-2015-wmo-en-de-geestelijke-gezondheidszorg-ggz","Staatssecretaris Pouw-Verweij ( Langdurige en Maatschappelijke Zorg) geeft antwoord op Kamervragen over wachttijden binnen de Wet maatschappelijke ondersteuning 2015 (Wmo) en de geestelijke gezondheidszorg (ggz). Het Tweede Kamerlid Van Houwelingen (FVD) had de vragen gesteld.Antwoorden Kamervragen over wachttijden Wmo en ggz",2025-08-07 08:10:44,"a84c983e-cb25-4a53-8612-fb57a46d60ac"
