"item_title","item_link","item_description","item_pub_date","item_guid"
"Kamerbrief over reactie brieven CSZ en NZa over wetsvoorstel Wibz","https://www.rijksoverheid.nl/documenten/kamerstukken/2025/02/13/kamerbrief-over-afschrift-reactie-brieven-csz-en-nza-over-wetsvoorstel-wibz","Minister Agema (VWS) stuurt de Tweede Kamer haar reactie op brieven van de Nederlandse Zorgautoriteit (NZa) en het Collega Sanering Zorginstellingen (CSZ). De brieven gaan over het wetsvoorstel voor de Wet integere bedrijfsvoering zorg- en jeugdhulpaanbieders (Wibz).Kamerbrief over reactie brieven CSZ en NZa over wetsvoorstel Wibz",2025-02-14 09:36:32,"9e11336d-c18e-4d4c-be2e-069e42379576"
"Kamerbrief over voortgang uitvoering agenda tegen kanker","https://www.rijksoverheid.nl/documenten/kamerstukken/2025/02/13/kamerbrief-over-voortgang-nederlandse-kanker-agenda","Minister Agema (VWS) en staatssecretaris Karremans (Jeugd, Preventie en Sport) informeren de Tweede Kamer over de voortgang bij de uitvoering van de agenda tegen de bestrijding van de ziekte kanker (Nederlandse Kanker-Agenda; NKA). Hoofdpunten van de NKA zijn voorkomen van kanker (preventie), vroege opsporing van de ziekte, diagnostiek, behandeling, na- of palliatieve zorg, en verbeteren van de kwaliteit van leven met kanker.Kamerbrief over voortgang uitvoering agenda tegen kanker",2025-02-14 08:14:07,"946cf782-e4be-4c8d-8bfc-be11a3a3542c"
"Uitstelbrief op Kamervragen over het bericht dat de helft van de jongvolwassenen hun mentale gezondheid niet goed noemt","https://www.rijksoverheid.nl/documenten/kamerstukken/2025/02/13/uitstelbrief-op-kamervragen-over-het-bericht-dat-de-helft-van-de-jongvolwassenen-hun-mentale-gezondheid-niet-goed-noemt","Staatssecretaris Karremans (Jeugd, Preventie en Sport) informeert de Tweede Kamer over uitstel van de beantwoording van Kamervragen over het bericht dat de helft van de jongvolwassenen hun mentale gezondheid niet goed noemt'. De vragen zijn van het Kamerlid Dobbe (SP) .Uitstelbrief op Kamervragen over het bericht dat de helft van de jongvolwassenen hun mentale gezondheid niet goed noemt",2025-02-13 17:05:29,"ecf490e6-30d2-49ab-9718-c147c15096b0"
"Kamerbrief over voortgang modernisering staatsnoodrecht","https://www.rijksoverheid.nl/documenten/kamerstukken/2025/02/13/tk-voortgang-modernisering-staatsnoodrecht","Staatssecretaris Coenradie (JenV) informeert de Tweede Kamer over de nadere stand van zaken van de modernisering van het staatsnoodrecht. Zij geeft een overzicht van de plannen per betrokken ministerie.Kamerbrief over voortgang modernisering staatsnoodrecht",2025-02-13 14:37:31,"8f1def1f-4878-4e76-b68e-dc1745dff757"
"Antwoorden op Kamervragen (VVD) over berichten geen geld voor opvang mensen met verstandelijke beperking en onbegrepen gedrag","https://www.rijksoverheid.nl/documenten/kamerstukken/2025/02/12/antwoorden-op-kamervragen-vvd-over-berichten-geen-geld-voor-opvang-mensen-met-verstandelijke-beperking-en-onbegrepen-gedrag","Staatssecretaris Maeijer (Langdurige en Maatschappelijke Zorg) stuurt de Tweede Kamer haar antwoorden op vragen over berichten dat geen geld beschikbaar is voor de opvang van mensen met een verstandelijke beperking die onbegrepen gedrag vertonen. De Tweede Kamerleden Bevers (VVD), Bikker (CU) en Dobbe (SP) hebben afzonderlijk vragen gesteld over dit onderwerp. Deze beantwoording betreft de vragen van het Tweede Kamerlid Bevers (VVD).Antwoorden op Kamervragen (VVD) over berichten geen geld voor opvang mensen met verstandelijke beperking en onbegrepen gedrag",2025-02-13 10:44:47,"07928dfb-ae17-44d5-ac34-64b21dc930ee"
"Antwoorden op Kamervragen (CU) over berichten geen geld voor opvang mensen met verstandelijke beperking en onbegrepen gedrag","https://www.rijksoverheid.nl/documenten/kamerstukken/2025/02/12/antwoorden-op-kamervragen-cu-over-berichten-geen-geld-voor-opvang-mensen-met-verstandelijke-beperking-en-onbegrepen-gedrag","Staatssecretaris Maeijer (Langdurige en Maatschappelijke Zorg) stuurt de Tweede Kamer haar antwoorden op vragen over berichten dat geen geld beschikbaar is voor de opvang van mensen met een verstandelijke beperking die onbegrepen gedrag vertonen. De Tweede Kamerleden Bevers (VVD), Bikker (CU) en Dobbe (SP) hebben afzonderlijk vragen gesteld over dit onderwerp. Deze beantwoording betreft de vragen van het Tweede Kamerlid Bikker (CU).Antwoorden op Kamervragen (CU) over berichten geen geld voor opvang mensen met verstandelijke beperking en onbegrepen gedrag",2025-02-13 10:44:30,"b2804d75-5dca-4ee1-b278-c2576cbdc772"
"Antwoorden op Kamervragen over het bericht dat voor patiënten met gedragsproblemen en verstandelijke handicap geen geld is in de opvang","https://www.rijksoverheid.nl/documenten/kamerstukken/2025/02/13/antwoorden-op-kamervragen-over-het-bericht-dat-voor-patienten-met-gedragsproblemen-en-verstandelijke-handicap-geen-geld-is-in-de-opvang","Antwoorden op Kamervragen over het bericht dat voor patiënten met gedragsproblemen en verstandelijke handicap geen geld is in de opvang",2025-02-13 08:39:52,"97f139f3-8156-4d04-8514-1ef0fc846280"
"Kamerbrief bij onderzoeksrapport WODC over terugplaatsing na gedwongen uithuisplaatsing","https://www.rijksoverheid.nl/documenten/kamerstukken/2025/02/11/tk-aanbieding-onderzoeksrapport","Staatssecretaris Struycken (Rechtsbescherming) stuurt de Tweede Kamer het onderzoeksrapport 'Terugplaatsen na een gedwongen uithuisplaatsing'. Het rapport gaat over onderzoek van de Universiteit Leiden in opdracht van het Wetenschappelijk Onderzoek- en Documentatiecentrum (WODC). De staatssecretaris gaat in op de bevindingen  uit het onderzoek en bespreekt kort de vervolgstappen die hij wil nemen.Kamerbrief bij onderzoeksrapport WODC over terugplaatsing na gedwongen uithuisplaatsing",2025-02-13 07:18:40,"9d047047-68f9-46b4-8014-629ec73b5d23"
"Antwoorden op Kamervragen over het bericht over de aanhouding van de 27-jarige verdachte voor de moord op een 76-jarige vrouw in Den Dolder","https://www.rijksoverheid.nl/documenten/kamerstukken/2025/02/12/antwoorden-op-kamervragen-over-het-bericht-inzake-de-aanhouding-van-de-27-jarige-verdachte-voor-de-moord-op-een-76-jarige-vrouw-in-den-dolder","Staatssecretaris Karremans (Jeugd, Preventie en Sport) en staatssecretaris Coenradie (JenV) geven antwoord op vragen over het bericht over de aanhouding van de 27-jarige verdachte voor de moord op een 76-jarige vrouw in Den Dolder. De Tweede Kamerleden Thiadens en Emiel van Dijk (beiden PVV) hebben de vragen gesteld.Antwoorden op Kamervragen over het bericht over de aanhouding van de 27-jarige verdachte voor de moord op een 76-jarige vrouw in Den Dolder",2025-02-12 15:43:34,"6f133a71-156b-44ab-bd8a-77fd3d5b79c7"
"Kamerbrief met reactie op petitie Landelijke Werkgroep Misstanden Stichting Fokus","https://www.rijksoverheid.nl/documenten/kamerstukken/2025/02/12/reactie-op-petitie-landelijke-werkgroep-misstanden-stichting-fokus","Staatssecretaris Maeijer (Langdurige en Maatschappelijke Zorg) reageert op de petitie van de Landelijke Werkgroep Misstanden Stichting Fokus over de situatie bij Fokus. De vaste commissie voor Volksgezondheid, Welzijn en Sport had hierom verzocht.Kamerbrief met reactie op petitie Landelijke Werkgroep Misstanden Stichting Fokus",2025-02-12 14:19:56,"22c1ff2e-da13-4206-9f82-be4f949dfc9a"
"Kamerbrief reactie op motie handhaven zorgplicht zorgverzekeraars","https://www.rijksoverheid.nl/documenten/kamerstukken/2025/02/12/kamerbrief-over-motie-handhaven-zorgplicht-36357-19","Minister Agema (VWS) deelt haar reactie op de motie-Tielen-Jansen-Claassen met de Tweede Kamer. Deze motie vraagt om een onderzoek naar de wenselijkheid en mogelijkheid van een bestuurlijke boete voor het onvoldoende invullen van de zorgplicht door zorgverzekeraars.Kamerbrief reactie op motie handhaven zorgplicht zorgverzekeraars",2025-02-12 14:19:39,"07d75bd7-1108-4235-9bad-80875f66ad29"
"Antwoorden op Kamervragen over miljardenwinst Pfizer","https://www.rijksoverheid.nl/documenten/kamerstukken/2025/02/11/antwoorden-op-kamervragen-over-het-bericht-ook-na-de-pandemie-boekt-pfizer-nog-een-miljardenwinst","Minister Agema (VWS) geeft antwoord op vragen over het bericht ‘Ook na de pandemie boekt Pfizer nog een miljardenwinst’. Het Tweede Kamerlid Dijk (SP) heeft deze vragen gesteld.Antwoorden op Kamervragen over miljardenwinst Pfizer",2025-02-11 12:07:04,"518c7b46-909a-451e-ac77-e6fafcba0dd7"
"Uitstelbrief op Kamervragen over de onrust na het dodelijke steekincident in Den Dolder","https://www.rijksoverheid.nl/documenten/kamerstukken/2025/02/10/uitstelbrief-antwoorden-kamervragen-over-de-onrust-na-het-dodelijke-steekincident-in-den-dolder","Staatssecretaris Karremans (Jeugd, Preventie en Sport) meldt dat de antwoorden op vragen over de onrust na het dodelijke steekincident in Den Dolder later komen dan gebruikelijk. Het Tweede Kamerlid Lahlah (GroenLinks-PvdA) heeft de vragen gesteld.Uitstelbrief op Kamervragen over de onrust na het dodelijke steekincident in Den Dolder",2025-02-10 14:53:15,"71db9f37-b720-477c-b29a-7b5c9586058f"
"Aanbiedingsbrief bij advies Gezondheidsraad vernieuwde griepvaccins","https://www.rijksoverheid.nl/documenten/kamerstukken/2025/02/10/kamerbrief-inzake-aanbieden-gezondheidsraad-advies-vernieuwde-griepvaccins","Staatssecretaris Karremans (Jeugd, Preventie en Sport) stuurt de Tweede Kamer het advies van de Gezondheidsraad over de inzet van vernieuwde typen griepvaccins in het Nationaal Programma Grieppreventie.Aanbiedingsbrief bij advies Gezondheidsraad vernieuwde griepvaccins",2025-02-10 13:38:08,"58a0b9a6-7294-401e-a8a5-fe28a34dc8a1"
"Kamerbrief met reactie op verzoek kabinetsreactie op initiatiefnota over een kritische reflectie op euthanasie bij psychisch lijden van jonge mensen","https://www.rijksoverheid.nl/documenten/kamerstukken/2025/02/10/kamerbrief-over-verzoek-kabinetsreactie-op-initiatiefnota-van-het-lid-hertzberger-over-een-kritische-reflectie-op-euthanasie-bij-psychisch-lijden-van-jonge-mensen","Staatssecretaris Karremans (Jeugd, Preventie en Sport) stuurt de Tweede Kamer de kabinetsreactie op de initiatiefnota van het voormalig lid Hertzberger (NSC) over een kritische reflectie op euthanasie bij psychisch lijden van jonge mensen. De vaste Tweede Kamercommissie voor Volksgezondheid, Welzijn en Sport (VWS) had om de reactie verzocht.Kamerbrief met reactie op verzoek kabinetsreactie op initiatiefnota over een kritische reflectie op euthanasie bij psychisch lijden van jonge mensen",2025-02-10 13:27:27,"bfbeb194-07e7-4cd1-ad1e-54eb1ddce270"
"Antwoorden op Kamervragen over twee onderzoeken van de Patiëntenfederatie en de FNV naar de problematiek rondom tekorten in de geboortezorg","https://www.rijksoverheid.nl/documenten/kamerstukken/2025/02/10/antwoorden-op-kamervragen-over-twee-onderzoeken-van-de-patientenfederatie-en-de-fnv-naar-de-problematiek-rondom-tekorten-in-de-geboortezorg","Minister Agema (VWS) geeft antwoord op vragen over twee onderzoeken van de Patiëntenfederatie en de FNV naar de problematiek rondom tekorten in de geboortezorg. Het Tweede Kamerlid Dobbe (SP) heeft de vragen gesteld.Antwoorden op Kamervragen over twee onderzoeken van de Patiëntenfederatie en de FNV naar de problematiek rondom tekorten in de geboortezorg",2025-02-10 11:39:23,"cd76d58c-27fe-4e3e-be14-b2ada608bcd1"
"Uitstelbrief op Kamervragen over het bericht 'Studenten boos om uitblijven loon bij stages in zorg'","https://www.rijksoverheid.nl/documenten/kamerstukken/2025/02/10/uitstelbrief-antwoorden-kamervragen-over-het-bericht-studenten-boos-om-uitblijven-loon-bij-stages-in-zorg","Minister Agema (VWS) meldt dat de antwoorden op vragen over het bericht 'Studenten boos om uitblijven loon bij stages in zorg' later komen dan gebruikelijk. De Tweede Kamerleden Dobbe en Dijk (beiden SP) hebben de vragen gesteld.Uitstelbrief op Kamervragen over het bericht 'Studenten boos om uitblijven loon bij stages in zorg'",2025-02-10 10:12:22,"8775e2c8-d7cc-4aff-a320-4e86bf4e1a52"
"Kamerbrief reactie op speciaal verslag Europese rekenkamer over voedseletiketten","https://www.rijksoverheid.nl/documenten/kamerstukken/2025/02/07/kamerbrief-over-verzoek-om-reactie-speciaal-verslag-erk-voedseletikettering-in-de-eu-consumenten","Staatssecretaris Karremans (Jeugd, Preventie en Sport) reageert op het speciaal verslag van de Europese rekenkamer ‘Voedseletikettering in de EU - Consumenten kunnen verdwalen in het labyrint van etiketten’. De Tweede Kamer had om een reactie gevraagd.Kamerbrief reactie op speciaal verslag Europese rekenkamer over voedseletiketten",2025-02-07 15:22:01,"3bd851c5-2cf8-4f39-9840-9385ef7a584d"
"Antwoorden op Kamervragen naar aanleiding van Kamerbrieven over geneesmiddelen","https://www.rijksoverheid.nl/documenten/kamerstukken/2025/02/07/kamerbrief-over-schriftelijk-overleg-so-inzake-continuering-van-de-sluis-voor-zes-geneesmiddelen-kamerstuk-29-477-nr-911-en-sluiskandidaten-eerste-helft-2025-kamerstuk-29-477-nr-912","Minister Agema (VWS) stuurt de Tweede Kamer antwoorden op vragen naar aanleiding van de Kamerbrieven 'Continuering van de sluis voor zes geneesmiddelen' en 'Sluiskandidaten eerste helft 2025'.Antwoorden op Kamervragen naar aanleiding van Kamerbrieven over geneesmiddelen",2025-02-07 15:09:26,"cb64578f-073f-47e1-8f60-720a786ac96e"
"Kamerbrief over behandeling in Eerste Kamer van begroting ministerie VWS 2025","https://www.rijksoverheid.nl/documenten/kamerstukken/2025/02/07/kamerbrief-over-commissiebrief-eerste-kamer-inzake-behandeling-vws-begroting-2025-36600-xvi","Minister Agema (VWS) stuurt de Eerste Kamer een brief over de behandeling van de begroting van het ministerie van VWS voor 2025 (36600 XVI). De minister voldoet daarmee aan een verzoek vanuit de vaste Eerste Kamercommissie voor VWS, over de manier waarop invulling wordt gegeven aan de zogenoemde ombuiging bij de subsidie voor bij- en nascholing in de medisch-specialistische zorg. Kamerbrief over behandeling in Eerste Kamer van begroting ministerie VWS 2025",2025-02-07 14:45:49,"8a4d6135-2264-4470-8be2-6dc34b088968"
