"item_title","item_link","item_description","item_pub_date","item_guid"
"Kamerbrief over Reactie op rapport MIND onderzoek wachttijden ggz","https://www.rijksoverheid.nl/documenten/kamerstukken/2023/12/21/kamerbrief-over-reactie-op-rapport-mind-onderzoek-wachttijden-ggz","Kamerbrief over Reactie op rapport MIND onderzoek wachttijden ggz",2023-12-21 11:05:31,"20e0dc59-baa6-4e67-ba3b-e0e7c8645ed1"
"Kamerbrief over Stand van zaken tolkenvoorzieningen in de Zvw","https://www.rijksoverheid.nl/documenten/kamerstukken/2023/12/21/kamerbrief-over-stand-van-zaken-tolkenvoorzieningen-in-de-zvw","Kamerbrief over Stand van zaken tolkenvoorzieningen in de Zvw",2023-12-21 11:04:37,"b3ddd6c2-1272-4a74-9981-8c569eb203f8"
"Kamerbrief over inrichting financiële functie ministerie van VWS","https://www.rijksoverheid.nl/documenten/kamerstukken/2023/12/19/kamerbrief-over-inrichting-financiele-functie-ministerie-van-vws","Minister Kuipers (VWS) informeert de Tweede Kamer over de voortgang en het vervolg van de herinrichting van de financiële functie bij het ministerie van VWS.Kamerbrief over inrichting financiële functie ministerie van VWS",2023-12-21 10:55:27,"c192ab04-85d5-400c-b200-647115cfbdd7"
"Kamerbrief over Stand van zaken beleidsagenda toekomstbestendige acute zorg","https://www.rijksoverheid.nl/documenten/kamerstukken/2023/12/21/kamerbrief-over-stand-van-zaken-beleidsagenda-toekomstbestendige-acute-zorg","Kamerbrief over Stand van zaken beleidsagenda toekomstbestendige acute zorg",2023-12-21 10:49:19,"dce4a000-cc34-4247-90f6-7136aed4dc5a"
"Kamerbrief over arbeidsmarktprognose zorg en welzijn 2023","https://www.rijksoverheid.nl/documenten/kamerstukken/2023/12/21/kamerbrief-over-arbeidsmarktprognose-zorg-en-welzijn-2023","Minister Helder (Langdurige Zorg en Sport) informeert de Tweede Kamer over de uitkomsten van de nieuwe prognose van het verwachte personeelstekort in de verschillende branches van zorg en welzijn.Kamerbrief over arbeidsmarktprognose zorg en welzijn 2023",2023-12-21 10:34:26,"1524a733-740f-425f-91f9-e87b1a95d4a1"
"Kamerbrief over Gezondheidsverkenning windturbines Nivel","https://www.rijksoverheid.nl/documenten/kamerstukken/2023/12/21/kamerbrief-over-gezondheidsverkenning-windturbines-nivel","Kamerbrief over Gezondheidsverkenning windturbines Nivel",2023-12-21 10:19:49,"bd1c840a-ed59-48ca-9720-dd248c958c6a"
"Aanbiedingsbrief bij rapporten over uitvoering Wet langdurige zorg (Wlz)","https://www.rijksoverheid.nl/documenten/kamerstukken/2023/12/18/kamerbrief-over-aanbieding-samenvattend-rapport-uitvoering-wlz-2022-2023","Minister Helder (Langdurige Zorg en Sport) biedt de Tweede Kamer 2 rapporten van de Nederlandse Zorgautoriteit (NZa) aan over de uitvoering van de Wet langdurige zorg (Wlz). Eenzelfde brief is naar de Eerste Kamer verstuurd.Aanbiedingsbrief bij rapporten over uitvoering Wet langdurige zorg (Wlz)",2023-12-21 07:54:10,"ebdb6e3c-cdd5-4536-9d5f-790523651f22"
"Kamerbrief over Nederlandse Kanker Agenda","https://www.rijksoverheid.nl/documenten/kamerstukken/2023/12/18/kamerbrief-over-reactie-op-de-nederlandse-kanker-agenda","Minister Kuipers (VWS) informeert de Tweede kamer over de Nederlandse Kanker Agenda met haar 20 doelen. De minister neemt de Kamer mee in de rol van het ministerie van VWS betreffende de nadere uitwerking van de doelen uit deze agenda.  Kamerbrief over Nederlandse Kanker Agenda",2023-12-21 07:52:23,"cc8e4350-e15c-4816-92b4-98159f22b8d3"
"Kamerbrief over uitvoering akkoord 'Gezond en actief leven'","https://www.rijksoverheid.nl/documenten/kamerstukken/2023/12/20/kamerbrief-over-uitvoering-gezond-en-actief-leven-akkoord","Staatssecretaris Van Ooijen (VWS) en de ministers Kuipers (VWS) en Helder (Langdurige zorg en Sport) informeren de Tweede Kamer over de uitvoering van het 'Gezond en actief leven'-akkoord (GALA). Het akkoord is in februari 2023 gesloten met de Vereniging Nederlandse Gemeenten (VNG), GGD-GHOR Nederland, Zorgverzekeraars Nederland en het ministerie van VWS. Kamerbrief over uitvoering akkoord 'Gezond en actief leven'",2023-12-21 07:22:36,"89aa692a-919c-48e0-bd17-31221fbc793f"
"Antwoorden Kamervragen over de rechtspositie van slachtoffers van relationeel geweld","https://www.rijksoverheid.nl/documenten/kamerstukken/2023/12/19/antwoorden-kamervragen-over-de-rechtspositie-van-slachtoffers-van-relationeel-geweld","Minister Weerwind (Rechtsbescherming) en staatssecretraris Van ooijen (VWS) geven antwoorden op Kamervragen over de rechtspositie van slachtoffers van (relationeel) geweld en de overheidsbemoeienis met slachtoffers van Intieme Terreur bij omgangsregelingen. Het Tweede Kamerlid Eerdmans (JA21) had de vragen gesteld.Antwoorden Kamervragen over de rechtspositie van slachtoffers van relationeel geweld",2023-12-21 06:47:23,"1ef877ee-a6b9-4943-9356-95bd67e7581b"
"Antwoorden op Kamervragen over Witboek zwembaden voor gemeenten","https://www.rijksoverheid.nl/documenten/kamerstukken/2023/12/19/antwoorden-op-kamervragen-over-het-witboek-zwembaden-voor-gemeenten-van-de-fnv","Minister Helder (Langdurige Zorg en Sport) geeft antwoord op vragen over het Witboek zwembaden voor gemeenten van de FNV. Het Tweede Kamerlid Van Nispen (SP) heeft deze vragen gesteld.Antwoorden op Kamervragen over Witboek zwembaden voor gemeenten",2023-12-20 17:07:49,"066463d2-ea92-4fa6-a5f7-6117628bfa3e"
"Antwoorden op Kamervragen over problemen bij commerciële GGZ-instelling Mindler in Zweden","https://www.rijksoverheid.nl/documenten/kamerstukken/2023/12/20/antwoorden-op-kamervragen-over-de-problemen-bij-de-commerciele-ggz-instelling-mindler-in-zweden","Minister Helder (Langdurige Zorg en Sport) geeft antwoord op vragen over de problemen bij de commerciële GGZ-instelling Mindler in Zweden. Het Tweede Kamerlid Dijk (SP) heeft de vragen gesteld. Antwoorden op Kamervragen over problemen bij commerciële GGZ-instelling Mindler in Zweden",2023-12-20 14:57:20,"578bcadb-6be8-4c8f-aac1-53d2c0639284"
"Kamerbrief over voortgang verbetering jeugdhulp, jeugdbescherming en jeugdreclassering","https://www.rijksoverheid.nl/documenten/kamerstukken/2023/12/18/kamerbrief-over-voortgangsbrief-jeugd","Staatssecretaris Van Ooijen (VWS) en minister Weerwind (Rechtsbescherming) informeren de Tweede Kamer over de voortgang van hun aanpak voor de verbetering van de jeugdhulp, jeugdbescherming en jeugdreclassering. Eenzelfde brief is naar de Eerste Kamer verstuurd. Kamerbrief over voortgang verbetering jeugdhulp, jeugdbescherming en jeugdreclassering",2023-12-20 14:54:15,"a01e233c-d2d1-4491-9f0c-1c1acb12beb9"
"Kamerbrief over aanbieding eerste voortgangsrapportage aanpak ""Mentale Gezondheid: van ons allemaal""","https://www.rijksoverheid.nl/documenten/kamerstukken/2023/12/20/kamerbrief-over-aanbieding-eerste-voortgangsrapportage-aanpak-mentale-gezondheid-van-ons-allemaal","Kamerbrief over aanbieding eerste voortgangsrapportage aanpak ""Mentale Gezondheid: van ons allemaal""",2023-12-20 13:43:38,"40d13ee7-ceab-420a-a5f9-5ace57c7d8a6"
"Uitstelbrief antwoorden Kamervragen over coronavaccinatie, vaccinatieschade en aanverwante zaken","https://www.rijksoverheid.nl/documenten/kamerstukken/2023/12/20/uitstelbrief-antwoorden-kamervragen-over-coronavaccinatie-vaccinatieschade-en-aanverwante-zaken","Minister Kuipers (VWS) meldt dat de antwoorden op vragen over coronavaccinatie, vaccinatieschade en aanverwante zaken later komen dan gebruikelijk.Uitstelbrief antwoorden Kamervragen over coronavaccinatie, vaccinatieschade en aanverwante zaken",2023-12-20 12:18:59,"a165388e-5204-453d-9c1d-cb0cd17e4fdf"
"Antwoorden op Kamervragen over reactie op uitvoering Wlz 2021-2022","https://www.rijksoverheid.nl/documenten/kamerstukken/2023/12/20/kamerbrief-over-reactie-so-inzake-inbreng-schriftelijk-overleg-beleidsreactie-op-het-samenvattend-magazine-uitvoering-wlz-2021-2022","Minister Helder (Langdurige Zorg en Sport) geeft antwoord op vragen over de beleidsreactie op het samenvattend magazine uitvoering Wlz 2021-2022. De Tweede Kamerfracties van VVD, D66, PVV, CDA, SP en BBB hebben deze vragen gesteld.Antwoorden op Kamervragen over reactie op uitvoering Wlz 2021-2022",2023-12-20 11:46:51,"c1029988-e90c-4981-b8d8-a1715e11a48e"
"Antwoorden op Kamervragen over het bericht 'Steeds meer kinderen zonder zwemdiploma vooral bij lage inkomens' ","https://www.rijksoverheid.nl/documenten/kamerstukken/2023/12/19/antwoorden-op-kamervragen-over-het-bericht-steeds-meer-kinderen-zonder-zwemdiploma-vooral-bij-lage-inkomens","Antwoorden op Kamervragen over het bericht 'Steeds meer kinderen zonder zwemdiploma vooral bij lage inkomens'",2023-12-20 11:28:07,"b4e5939a-87bf-4b62-9095-0cb00edce826"
"Aanbiedingsbrief bij tweede voortgangsrapportage Aanpak geldzorgen, armoede en schulden","https://www.rijksoverheid.nl/documenten/kamerstukken/2023/12/19/aanbiedingsbrief-over-tweede-voortgangsrapportage-aanpak-geldzorgen-armoede-en-schulden","Minister Schouten (Armoedebeleid, Participatie en Pensioenen) biedt de Tweede Kamer de tweede voortgangsrapportage van de aanpak geldzorgen, armoede en schulden aan. De Eerste Kamer heeft eenzelfde brief gekregen.Aanbiedingsbrief bij tweede voortgangsrapportage Aanpak geldzorgen, armoede en schulden",2023-12-20 10:22:36,"95b3d74a-a074-42fd-85c4-9e402c6f439d"
"Aanbiedingsbrief bij rapport Monitor acute zorg 2023","https://www.rijksoverheid.nl/documenten/kamerstukken/2023/12/19/kamerbrief-over-aanbieding-monitor-acute-zorg-2023","Minister  Kuipers (VWS) stuurt de Tweede Kamer de Monitor acute zorg 2023 van de Nederlandse Zorgautoriteit (NZa). Deze monitor laat zien hoe het gebruik van acute zorg zich heeft ontwikkeld over de periode 2017-2021 en meer specifiek vanaf 2020.Aanbiedingsbrief bij rapport Monitor acute zorg 2023",2023-12-20 08:17:26,"76b2c5c0-e2f0-48e2-b615-36e116379650"
"Kamerbrief over stand van zaken versterking huisartsenzorg","https://www.rijksoverheid.nl/documenten/kamerstukken/2023/12/19/kamerbrief-over-stand-van-zaken-versterking-huisartsenzorg","Minister Kuipers (VWS) informeert de Tweede Kamer over de voortgang van enkele afspraken uit het Integraal Zorgakkoord (IZA) over de versterking van de huisartsenzorg.Kamerbrief over stand van zaken versterking huisartsenzorg",2023-12-20 07:56:03,"9f4a8d71-dd27-4c8b-8b5e-dd93b6d991cf"
