"item_title","item_link","item_description","item_pub_date","item_guid"
"Kamerbrief over gewijzigde Voorhangprocedure vervolg tariefmaatregel meerjarig contracteren sector gehandicaptenzorg en langdurige ggz","https://www.rijksoverheid.nl/documenten/kamerstukken/2025/06/26/kamerbrief-over-gewijzigde-voorhangprocedure-vervolg-tariefmaatregel-meerjarig-contracteren-sector-gehandicaptenzorg-en-langdurige-ggz","Staatssecretaris Pouw-Verweij (Langdurige en Maatschappelijke Zorg) stuurt de Tweede Kamer de gewijzigde voorhangbrief meerjarig contracteren voor de sectoren gehandicaptenzorg en langdurige geestelijke gezondheidszorg (ggz).Kamerbrief over gewijzigde Voorhangprocedure vervolg tariefmaatregel meerjarig contracteren sector gehandicaptenzorg en langdurige ggz",2025-06-26 16:12:26,"5d297979-a4b1-48de-88f5-78808a25aebd"
"Kamerbrief over gewijzigde voorhangprocedure tariefmaatregel samenhangend met hoofdlijnenakkoord ouderenzorg","https://www.rijksoverheid.nl/documenten/kamerstukken/2025/06/26/kamerbrief-over-gewijzigde-voorhangprocedure-tariefmaatregel-samenhangend-met-hoofdlijnenakkoord-ouderenzorg","Staatssecretaris Pouw-Verweij (Langdurige en Maatschappelijke Zorg) stuurt de Tweede Kamer de gewijzigde voorhangbrief samenhangend met het hoofdlijnenakkoord ouderenzorg (HLO).Kamerbrief over gewijzigde voorhangprocedure tariefmaatregel samenhangend met hoofdlijnenakkoord ouderenzorg",2025-06-26 15:59:19,"7cc24183-cf87-4e06-a391-9c38746be1c0"
"Kamerbrief over gewijzigde voorhangbrieven samenhangend met HLO en meerjarig contracteren voor sectoren gehandicaptenzorg en langdurige ggz","https://www.rijksoverheid.nl/documenten/kamerstukken/2025/06/26/kamerbrief-over-afschrift-van-gewijzigde-voorhangbrief-samenhangend-met-het-hoofdlijnenakkoord-ouderenzorg-hlo-en-meerjarig-contracteren-voor-de-sectoren-gehandicaptenzorg-en-langdurige-ggz","Staatssecretaris Pouw-Verweij (Langdurige en Maatschappelijke Zorg) stuurt de Eerste Kamer een afschrift van gewijzigde voorhangbrieven aan de Tweede Kamer, samenhangend met het hoofdlijnenakkoord ouderenzorg (HLO) en meerjarig contracteren voor de sectoren gehandicaptenzorg en langdurige ggz.Kamerbrief over gewijzigde voorhangbrieven samenhangend met HLO en meerjarig contracteren voor sectoren gehandicaptenzorg en langdurige ggz",2025-06-26 15:41:34,"4f20a5e7-5d00-4d4a-a295-7c810dcfafd9"
"Kamerbrief over Schriftelijk Overleg (SO) - Zwemmen in Nederland en overige beleidsontwikkelingen","https://www.rijksoverheid.nl/documenten/kamerstukken/2025/06/26/kamerbrief-over-schriftelijk-overleg-so-zwemmen-in-nederland-en-overige-beleidsontwikkelingen","Kamerbrief over Schriftelijk Overleg (SO) - Zwemmen in Nederland en overige beleidsontwikkelingen",2025-06-26 15:08:43,"de20be99-0dc6-4a03-b1b5-8e289b594d98"
"Kamerbrief over ontwikkelingen op het gebied van lichaamsmateriaal ","https://www.rijksoverheid.nl/documenten/kamerstukken/2025/06/26/kamerbrief-over-ontwikkelingen-op-het-gebied-van-lichaamsmateriaal","Minister Jansen (VWS) informeert de Tweede Kamer over de stand van zaken rondom de ontwikkelingen op het gebied van lichaamsmateriaal. Kamerbrief over ontwikkelingen op het gebied van lichaamsmateriaal",2025-06-26 14:14:27,"80934a2d-1f4b-4498-88a7-4126ee49d380"
"Kamerbrief Voortgangsbrief aanpak beschikbaarheid en leveringszekerheid geneesmiddelen","https://www.rijksoverheid.nl/documenten/kamerstukken/2025/06/26/kamerbrief-over-voortgangsbrief-beschikbaarheid-en-leveringszekerheid","Minister Jansen (VWS) informeert de Tweede Kamer over de voortgang op de activiteiten die ondernomen worden om tekorten van geneesmiddelen op te lossen en de beschikbaarheid en leveringszekerheid te verbeteren.Kamerbrief Voortgangsbrief aanpak beschikbaarheid en leveringszekerheid geneesmiddelen",2025-06-26 14:02:51,"e080f218-7909-4258-abbb-805ab783101e"
"Aanbiedingsbrief bij antwoorden op vragen so over Kamerbrief over verdeling (medische) vervolgopleidingen ","https://www.rijksoverheid.nl/documenten/kamerstukken/2025/06/26/kamerbrief-over-schriftelijk-overleg-so-inzake-voorhangbrief-verstrekking-beschikbaarheidbijdrage-medische-vervolgopleidingen-2026-en-verder-29282-605","Minister Jansen (VWS) stuurt de Tweede Kamer de antwoorden op de vragen uit het Schriftelijk Overleg (SO) over de Kamerbrief over verdeling (medische) vervolgopleidingen van 27 mei 2025.Aanbiedingsbrief bij antwoorden op vragen so over Kamerbrief over verdeling (medische) vervolgopleidingen",2025-06-26 13:37:01,"f41d3cbc-c023-4ec0-8e94-3b82c853b678"
"Kamerbrief over Wijziging van de Wet veiligheid en kwaliteit lichaamsmateriaal, de Wet op de orgaandonatie en enkele andere wetten in verband met ontwikkelingen in de lichaamsmateriaaldonatiepraktijk (Wet actualisering lichaamsmateriaalwetgeving)","https://www.rijksoverheid.nl/documenten/kamerstukken/2025/06/26/kamerbrief-over-wijziging-van-de-wet-veiligheid-en-kwaliteit-lichaamsmateriaal-de-wet-op-de-orgaandonatie-en-enkele-andere-wetten-in-verband-met-ontwikkelingen-in-de-lichaamsmateriaaldonatiepraktijk-wet-actualisering-lichaamsmateriaalwetgeving","Kamerbrief over Wijziging van de Wet veiligheid en kwaliteit lichaamsmateriaal, de Wet op de orgaandonatie en enkele andere wetten in verband met ontwikkelingen in de lichaamsmateriaaldonatiepraktijk (Wet actualisering lichaamsmateriaalwetgeving)",2025-06-26 10:35:57,"ec5a0e2f-e84a-43b2-9713-e7f8ac563144"
"NOTA NAAR AANLEIDING VAN HET VERSLAG","https://www.rijksoverheid.nl/documenten/kamerstukken/2025/06/26/nota-naar-aanleiding-van-het-verslag","NOTA NAAR AANLEIDING VAN HET VERSLAG",2025-06-26 10:35:56,"6ff3f2d9-7180-43e5-bc9d-34219b556795"
"Kamerbrief over Ontwikkelingen in het geneesmiddelenvergoedingssysteem (GVS) en de Wet geneesmiddelenprijzen (Wgp)","https://www.rijksoverheid.nl/documenten/kamerstukken/2025/06/26/kamerbrief-over-ontwikkelingen-in-het-geneesmiddelenvergoedingssysteem-gvs-en-de-wet-geneesmiddelenprijzen-wgp","Kamerbrief over Ontwikkelingen in het geneesmiddelenvergoedingssysteem (GVS) en de Wet geneesmiddelenprijzen (Wgp)",2025-06-26 10:16:08,"d148077a-683e-475a-af9c-c8c43a327201"
"Kamerbrief over reactie op petitie met betrekking tot behoud van Geneesmiddelenbulletin","https://www.rijksoverheid.nl/documenten/kamerstukken/2025/06/26/kamerbrief-over-reactie-op-petitie-met-betrekking-tot-behoud-van-geneesmiddelenbulletin","Kamerbrief over reactie op petitie met betrekking tot behoud van Geneesmiddelenbulletin",2025-06-26 10:00:55,"2cf310fb-ce96-4dde-bb6e-4bb4c2202e82"
"Uitstelbrief op Kamervragen over het belang van verslavingsartsen en de resultaten van een enquête hierover","https://www.rijksoverheid.nl/documenten/kamerstukken/2025/06/24/uitstelbrief-antwoorden-kamervragen-over-het-belang-van-verslavingsartsen-en-de-resultaten-van-een-enquete-hierover","Minister Jansen (VWS) meldt dat de antwoorden op vragen over het belang van verslavingsartsen en de resultaten van een enquête hierover later komen dan gebruikelijk. De Tweede Kamerleden Dobbe en Van Nispen (beiden SP) hebben de vragen gesteld.Uitstelbrief op Kamervragen over het belang van verslavingsartsen en de resultaten van een enquête hierover",2025-06-25 07:24:53,"81e925f7-bc6b-49d4-8683-a6de4e0f5086"
"Kamerbrief over Commissiedebat Sport en Bewegen 2025","https://www.rijksoverheid.nl/documenten/kamerstukken/2025/06/18/kamerbrief-over-commissiedebat-sport-en-bewegen-2025","Staatssecretaris Karremans (Jeugd, Preventie en Sport) informeert de Tweede Kamer over de stand van zaken van de volgende onderwerpen: jeugd, mensen met een handicap en mensen in armoede meer laten sporten, en een sociaal veilige en eerlijke sport. In een van de bijlagen komen moties en toezeggingen aan de orde.Kamerbrief over Commissiedebat Sport en Bewegen 2025",2025-06-24 14:49:51,"ccccbf69-9feb-4062-874d-7e0ddf66e907"
"Antwoorden op Kamervragen over de NAVO-verplichtingen","https://www.rijksoverheid.nl/documenten/kamerstukken/2025/06/02/antwoorden-op-kamervragen-over-de-navo-verplichtingen","Minister Agema (VWS) beantwoordt vragen over de NAVO-verplichtingen. Het Tweede Kamerlid Dekker (FvD) heeft de vragen gesteld. Antwoorden op Kamervragen over de NAVO-verplichtingen",2025-06-24 14:24:14,"869710f1-64ff-4955-8460-eee2bac1296d"
"Aanbiedingsbrief bij vaccinatiegraadrapport verslagjaar 2025 en voortgang aanpak 'Vol vertrouwen in vaccinaties'","https://www.rijksoverheid.nl/documenten/kamerstukken/2025/06/19/kamerbrief-over-vaccinatiegraadrapport-verslagjaar-2025-en-voortgang-aanpak-vol-vertrouwen-in-vaccinaties","Staatssecretaris Karremans (Jeugd, Preventie en Sport) biedt de Tweede Kamer het vaccinatiegraadrapport verslagjaar 2025 aan en informeert over de voortgang van de aanpak 'Vol vertrouwen in vaccinaties'.Aanbiedingsbrief bij vaccinatiegraadrapport verslagjaar 2025 en voortgang aanpak 'Vol vertrouwen in vaccinaties'",2025-06-23 14:21:55,"1ccfd3d9-bdad-4dd7-a1bc-731c67972fa5"
"Uitstelbrief antwoorden Kamervragen over het dreigende verlies van zorgaanbod in Zeeuws-Vlaanderen","https://www.rijksoverheid.nl/documenten/kamerstukken/2025/06/20/uitstelbrief-antwoorden-kamervragen-over-het-dreigende-verlies-van-zorgaanbod-in-zeeuws-vlaanderen","Uitstelbrief antwoorden Kamervragen over het dreigende verlies van zorgaanbod in Zeeuws-Vlaanderen",2025-06-20 14:58:51,"930e11a0-df3e-4a73-a8e1-14a419d11d6b"
"Antwoorden Kamervragen over het bericht dat bestuurders van sportclubs afhaken","https://www.rijksoverheid.nl/documenten/kamerstukken/2025/06/18/antwoorden-kamervragen-over-het-bericht-dat-bestuurders-van-sportclubs-afhaken","Staatssecretaris Struycken (Rechtsbescherming) geeft antwoord op Kamervragen naar aanleiding van de berichtgeving op NOS: 'Bestuurders sportclubs haken af: financiële risico's te groot''. De Tweede Kamerleden Inge van Dijk (CDA), Mohandis (PvdA-GroenLinks) en Van Nispen (SP) hadden de vragen gesteld.Antwoorden Kamervragen over het bericht dat bestuurders van sportclubs afhaken",2025-06-20 10:54:52,"15705111-1d39-4b44-8bcd-4aa84b1e3337"
"Kamerbrief aanbieding onderzoek naar topsportcultuur in Nederland","https://www.rijksoverheid.nl/documenten/kamerstukken/2025/06/18/kamerbrief-over-aanbieding-onderzoek-naar-de-topsportcultuur-in-nederland","Staatssecretaris Karremans (Jeugd, Preventie en Sport) biedt de Tweede Kamer het rapport over de topsportcultuur in Nederland ‘Vlammende ambitie’ aan. Het rapport laat zien welke factoren bijdragen aan een gezonde, veilige en optimale topsportcultuur in Nederland.Kamerbrief aanbieding onderzoek naar topsportcultuur in Nederland",2025-06-19 16:48:19,"8d6002b3-48cc-45f7-b192-4eba5070a413"
"Kamerbrief over richtlijn gezond en verantwoord scherm- en sociale mediagebruik","https://www.rijksoverheid.nl/documenten/kamerstukken/2025/06/17/kamerbrief-over-richtlijn-gezond-en-verantwoord-scherm-en-sociale-mediagebruik","Staatssecretaris Karremans (Jeugd, Preventie en Sport) informeert de Tweede Kamer over het onderzoek om te komen tot een een richtlijn voor gezond en verantwoord gebruik van scherm en sociale media, door kinderen. Kamerbrief over richtlijn gezond en verantwoord scherm- en sociale mediagebruik",2025-06-19 11:52:43,"59070392-a78d-49b7-a3ad-0f053a6b6395"
"Antwoorden op Kamervragen over het bericht ‘Nieuwe behandeling? Alleen nog vergoeden als die klimaat en zorgpersoneel spaart’","https://www.rijksoverheid.nl/documenten/kamerstukken/2025/06/17/antwoorden-op-kamervragen-over-het-bericht-nieuwe-behandeling-alleen-nog-vergoeden-als-die-klimaat-en-zorgpersoneel-spaart","Antwoorden op Kamervragen over het bericht ‘Nieuwe behandeling? Alleen nog vergoeden als die klimaat en zorgpersoneel spaart’",2025-06-19 10:59:58,"1ac9be2f-d92a-4217-964e-26c8d1ddd11e"
