"item_title","item_link","item_description","item_pub_date","item_guid"
"[Ingetrokken] Kamerbrief over aanpak dakloosheid","https://www.rijksoverheid.nl/documenten/kamerstukken/2024/12/16/kamerbrief-over-aanpak-dakloosheid","[INGETROKKEN]",2024-12-16 23:19:42,"5115e18e-18cc-4f29-9af5-40aec97d13a8"
"Kamerbrief stand van zaken mpox","https://www.rijksoverheid.nl/documenten/kamerstukken/2024/12/16/kamerbrief-over-stand-van-zaken-mpox","Minister Agema (VWS) informeert de Tweede Kamer over recente ontwikkelingen rond mpox.Kamerbrief stand van zaken mpox",2024-12-16 19:53:15,"974a0038-e185-4c55-98d1-adb867ea0a87"
"Kamerbrief over aanpak dakloosheid","https://www.rijksoverheid.nl/documenten/kamerstukken/2024/12/16/kamerbrief-over-aanpak-dakloosheid%5B2%5D","Kamerbrief over aanpak dakloosheid",2024-12-16 17:06:50,"a6bd39ce-3148-4bac-b9a7-4319742a82a1"
"Kamerbrief over Arbeidsmarktprognose zorg en welzijn 2024","https://www.rijksoverheid.nl/documenten/kamerstukken/2024/12/16/kamerbrief-over-arbeidsmarktprognose-zorg-en-welzijn-2024","Kamerbrief over Arbeidsmarktprognose zorg en welzijn 2024",2024-12-16 16:37:21,"f9b4cba3-8c0e-4ba3-8a20-82f23c95e25e"
"Kamerbrief kenmerken van mensen die afzien van zorg om financiële redenen","https://www.rijksoverheid.nl/documenten/kamerstukken/2024/12/16/kamerbrief-over-nivel-kennisvraag-kenmerken-van-mensen-die-afzien-van-zorg-om-financiele-redenen","Minister Agema (VWS) informeert de Tweede Kamer over de uitkomsten van een onderzoek naar de kenmerken van mensen die aangeven af te zien van zorg om financiële redenen.Kamerbrief kenmerken van mensen die afzien van zorg om financiële redenen",2024-12-16 16:30:09,"90ce8726-6e81-493c-839a-610837d017a3"
"Kamerbrief over Beantwoording van feitelijke vragen Verzamelbrief Wet BIG 2024 ","https://www.rijksoverheid.nl/documenten/kamerstukken/2024/12/16/kamerbrief-over-beantwoording-van-feitelijke-vragen-verzamelbrief-wet-big-2024","Kamerbrief over Beantwoording van feitelijke vragen Verzamelbrief Wet BIG 2024",2024-12-16 16:23:20,"bebdb3f7-6414-49dc-b987-5308882be651"
"Kamerbrief met beleidsreactie op onderzoeksrapport 'Druk op de Keten'","https://www.rijksoverheid.nl/documenten/kamerstukken/2024/12/16/kamerbrief-over-beleidsreactie-onderzoeksrapport-druk-op-de-keten","Staatssecretaris Karremans (Jeugd, Preventie en Sport) stuurt de Tweede Kamer zijn reactie op het rapport 'Druk op de Keten'. Het gaat over de keten van kinderopvang, onderwijs en zorg bij kinderen in de leeftijdsgroep 0-13 jaar die hulp nodig hebben op het gebied van gedrag, sociaal-emotionele ontwikkeling, leren of lichamelijke of geestelijke gezondheid.Kamerbrief met beleidsreactie op onderzoeksrapport 'Druk op de Keten'",2024-12-16 16:12:46,"6fdd89b9-25f3-4b3d-9f12-9248bac5ff8a"
"Kamerbrief over gedwongen opsluiting in de GGZ","https://www.rijksoverheid.nl/documenten/kamerstukken/2024/12/16/kamerbrief-over-gedwongen-opsluiting-in-de-ggz","Staatssecretaris Karremans (Jeugd, Preventie en Sport) stuurt de Tweede Kamer zijn reactie op het verzoek van het lid Westerveld (GroenLinks-PvdA) over gedwongen opsluiting in de geestelijke gezondheidszorg.Kamerbrief over gedwongen opsluiting in de GGZ",2024-12-16 16:06:50,"636693b7-00c5-4066-a5ac-17ff97b3021c"
"Aanbiedingsbrief overzicht begrotingswijzigingen na 2e suppletoire begroting 2024 VWS","https://www.rijksoverheid.nl/documenten/kamerstukken/2024/12/16/kamerbrief-over-veegbrief-2024","Minister Agema (VWS) stuurt de Tweede Kamer het overzicht van de voorziene begrotingswijzigingen ten opzichte van de 2e suppletoire begroting 2024 van het ministerie van Volksgezondheid, Welzijn en Sport (VWS). De Eerste Kamer heeft eenzelfde brief gekregen.Aanbiedingsbrief overzicht begrotingswijzigingen na 2e suppletoire begroting 2024 VWS",2024-12-16 15:37:00,"c68b9e47-0fab-4edd-acea-d7bbff623ca5"
"Kamerbrief over stand van zaken prenatale screening en preconceptionele dragerschapsscreening","https://www.rijksoverheid.nl/documenten/kamerstukken/2024/12/16/kamerbrief-over-stand-van-zaken-prenatale-screening-en-preconceptionele-dragerschapsscreening","Staatssecretaris Karremans (Jeugd, Preventie en Sport) informeert de Tweede Kamer over de stand van zaken bij diverse prenatale screeningsmethoden. Het gaat om de niet-invasieve prenatale test (NIPT), het 1e trimester structureel echoscopisch onderzoek (ETSEO), de preconceptionele dragerschapsscreening (PCDS), en over de prenatale screening infectieziekten enerytrocytenimmunisatie (PSIE).  Kamerbrief over stand van zaken prenatale screening en preconceptionele dragerschapsscreening",2024-12-16 15:25:00,"3d99bd90-4d3d-44ac-973c-d8af2ef23e96"
"Antwoorden op Kamervragen (VSO) over pokkenvaccins en -virus","https://www.rijksoverheid.nl/documenten/kamerstukken/2024/12/16/kamerbrief-over-schriftelijk-overleg-so-inzake-pokkenvaccins-en-virus","Minister Agema (VWS) stuurt de Tweede Kamer haar antwoorden op vragen over pokkenvaccins en het pokkenvirus. De vragen zijn gesteld vanuit de vaste Tweede Kamercommissie voor VWS in een verslag van een schriftelijk overleg (VSO) met de minister. Antwoorden op Kamervragen (VSO) over pokkenvaccins en -virus",2024-12-16 14:54:39,"5845adf0-e9b0-4960-a915-8a600037a753"
"Kamerbrief over verzoek reactie op manifest Seksuele gezondheid","https://www.rijksoverheid.nl/documenten/kamerstukken/2024/12/16/kamerbrief-over-verzoek-reactie-op-manifest-seksuele-gezondheid","Staatssecretaris Karremans (Jeugd, Preventie en Sport) stuurt de Tweede Kamer zijn reactie op het manifest ‘Seksuele gezondheid’. Verschillende jongerenorganisaties hebben dit manifest op 5 november 2024 aan de Tweede Kamer aangeboden. De vaste commissie voor Volksgezondheid, Welzijn en Sport in de Tweede Kamer had om een reactie gevraagd.Kamerbrief over verzoek reactie op manifest Seksuele gezondheid",2024-12-16 14:09:02,"7781dd7e-9e5a-47f2-a755-aa2a5889bd68"
"Aanbiedingsbrief rapport ‘Gezond in de bonus’","https://www.rijksoverheid.nl/documenten/kamerstukken/2024/12/16/kamerbrief-over-aanbieding-rapport-gezond-in-de-bonus-raad-voor-volksgezondheid-samenleving","Staatssecretaris Karremans (Jeugd, Preventie en Sport) stuurt de Tweede Kamer het rapport ‘Gezond in de bonus; via supermarkten betere voeding stimuleren’ van de Raad voor Volksgezondheid & Samenleving.Aanbiedingsbrief rapport ‘Gezond in de bonus’",2024-12-16 12:59:01,"907f6ca8-215d-4a82-844c-a898fa765429"
"Kamerbrief planning en voortgang Algoritmeregister 2024","https://www.rijksoverheid.nl/documenten/kamerstukken/2024/12/16/planning-en-voortgang-algoritmeregister-2024","Minister Agema (VWS) informeert de Tweede Kamer over het gebruik van algoritmen door het ministerie van VWS. Voor VWS en organisaties die daaronder vallen zijn 7 algoritmen opgenomen in het Algoritmeregister. Het gaat om een jaarlijkse rapportage.Kamerbrief planning en voortgang Algoritmeregister 2024",2024-12-16 12:44:05,"09a30a95-75a4-49f7-902d-6b8167e5cae4"
"Kamerbrief met reactie op verzoek om reactie op petitie over risico's en gevolgen van antibiotica- en antimycoticagebruik","https://www.rijksoverheid.nl/documenten/kamerstukken/2024/12/16/commissiebrief-inzake-verzoek-reactie-petitie-m-b-t-risico-s-en-gevolgen-van-antibiotica-en-antimycoticagebruik","Minister Agema (VWS) stuurt de Tweede Kamer haar reactie op de petitie van Samenwerking Infectieziekten over de risico’s en  gevolgen van antibiotica- en antimycoticagebruik. De vaste commissie voor Volksgezondheid, Welzijn en Sport heeft hierom verzocht.Kamerbrief met reactie op verzoek om reactie op petitie over risico's en gevolgen van antibiotica- en antimycoticagebruik",2024-12-16 12:41:25,"3b1931e9-b5e7-46bd-9fa0-35305d6baea1"
"Kamerbrief advies NZa over bekostiging tolken huisartsenzorg","https://www.rijksoverheid.nl/documenten/kamerstukken/2024/12/16/kamerbrief-over-advies-van-de-nza-over-de-bekostiging-van-tolken-in-de-huisartsenzorg","Minister Agema (VWS) informeert de Tweede Kamer over het advies van de Nederlandse Zorgautoriteit (NZa) over de bekostiging van de inzet van tolken binnen de huisartsenzorg.Kamerbrief advies NZa over bekostiging tolken huisartsenzorg",2024-12-16 12:36:21,"2530ae52-e4da-4813-8817-b1591192bfaf"
"Kamerbrief over SER-briefadvies sociaaleconomische gezondheidsverschillen","https://www.rijksoverheid.nl/documenten/kamerstukken/2024/12/13/kamerbrief-over-kabinetsreactie-ser-briefadvies-sociaaleconomische-gezondheidsverschillen-beleidsagenda-gezondheid-in-alle-beleidsdomeinen","Staatssecretaris Karremans (Jeugd, Preventie en Sport), minister Van Hijum (SZW) en staatssecretaris Nobel (Participatie en Integratie) sturen de Tweede Kamer de eerste hoofdlijnen van een beleidsagenda ‘Gezondheid in alle beleidsdomeinen’. Dit in reactie op het briefadvies van de Sociaal-Economische Raad  (SER) ‘Gezond opgroeien, wonen en werken’. Kamerbrief over SER-briefadvies sociaaleconomische gezondheidsverschillen",2024-12-13 16:38:57,"e5423f23-0f02-4bf8-9e0a-58cfdaa14f08"
"Kamerbrief over uitwerking plannen arbeidsmarktkrapte en brede arbeidsmarktagenda","https://www.rijksoverheid.nl/documenten/kamerstukken/2024/12/13/kamerbrief-uitwerking-plannen-arbeidsmarktkrapte-en-brede-arbeidsmarktagenda","Minister Van Hijum (SZW), minister Beljaarts (EZ), minister Bruins (OCW), minister Agema (VWS) en staatssecretaris Paul (Funderend Onderwijs en Emancipatie) informeren de Tweede Kamer over hoe het kabinet de arbeidsmarktkrapte wil verminderen.Kamerbrief over uitwerking plannen arbeidsmarktkrapte en brede arbeidsmarktagenda",2024-12-13 16:27:15,"2962504f-229e-455a-8646-6dd23b8e895f"
"Uitstelbrief antwoorden Kamervragen over weren campagne Platform Zorg voor Leven","https://www.rijksoverheid.nl/documenten/kamerstukken/2024/12/13/uitstelbrief-antwoorden-kamervragen-over-het-bericht-dat-de-campagne-van-platform-zorg-voor-leven-geweerd-is-vanwege-te-veel-negatief-commentaar","Minister Karremans (Jeugd, Preventie en Sport) meldt de Tweede Kamer dat de antwoorden op vragen over het bericht dat de Campagne van Platform Zorg voor Leven geweerd is vanwege “te veel negatief commentaar” later komen dan gebruikelijk.Uitstelbrief antwoorden Kamervragen over weren campagne Platform Zorg voor Leven",2024-12-13 16:25:22,"09acaf47-f43d-4a8b-8c0d-84e615db8965"
"Kamerbrief over vindbaarheid van patient access programma’s","https://www.rijksoverheid.nl/documenten/kamerstukken/2024/12/13/kamerbrief-over-vindbaarheid-van-patient-access-programma-s","Minister Agema (VWS) informeert de Tweede Kamer over ‘een programma waarbij een geneesmiddel dat nog niet is geregistreerd, of nog niet is opgenomen in het basispakket gedurende een bepaalde periode door de betreffende firma gratis worden verstrekt’.Kamerbrief over vindbaarheid van patient access programma’s",2024-12-13 16:18:53,"7f05fbbd-5753-4236-8b29-0f86fa02db4b"
