"item_title","item_link","item_description","item_pub_date","item_guid"
"Antwoorden op Kamervragen over het bericht 'Radioloog.nu bindt strijd aan met wervingsbureaus vanwege ‘absurd’ hoge marges'","https://www.rijksoverheid.nl/documenten/kamerstukken/2023/02/16/antwoorden-op-kamervragen-over-het-bericht-radioloognu-bindt-strijd-aan-met-wervingsbureaus-vanwege-absurd-hoge-marges","Minister Helder (Langdurige Zorg en Sport) geeft antwoord op vragen over het bericht 'Radioloog.nu bindt strijd aan met wervingsbureaus vanwege ‘absurd’ hoge marges'. Het Tweede Kamerlid Agema (PVV) heeft de vragen gesteld.",2023-02-16 16:05:00,"41477ad3-f9f2-4210-94cd-941d785bce09"
"Antwoorden op Kamervragen over rapport Gecoördineerde aanpak nodig om rechtsbescherming van mensen met een beperking te garanderen (College voor de Rechten van de Mens)","https://www.rijksoverheid.nl/documenten/kamerstukken/2023/02/16/antwoorden-op-kamervragen-over-het-bericht-en-het-rapport-van-het-college-voor-de-rechten-van-de-mens-gecoordineerde-aanpak-nodig-om-rechtsbescherming-van-mensen-met-een-beperking-te-garanderen","Minister Helder (Langdurige Zorg en Sport) geeft antwoord op vragen over het bericht en het rapport van het College voor de Rechten van de Mens 'Gecoördineerde aanpak nodig om rechtsbescherming van mensen met een beperking te garanderen'. Het Tweede Kamerlid Werner (CDA) heeft de vragen gesteld.",2023-02-16 15:45:00,"dab204fd-27d1-413b-8978-26f364fc728e"
"Kamerbrief over stand van zaken gebruik Corona Opt-in","https://www.rijksoverheid.nl/documenten/kamerstukken/2023/02/16/kamerbrief-over-stand-van-zaken-gebruik-corona-opt-in","Minister Kuipers (VWS) informeert de Tweede Kamer over de stand van zaken gebruik Corona Opt-in. Eenzelfde brief is naar de Eerste Kamer verstuurd.",2023-02-16 14:23:00,"13ac788e-bc3e-4a19-a3ca-7528f1386552"
"Antwoorden op Kamervragen over oprichting Stichting Kennis- en Innovatiecentrum WOII","https://www.rijksoverheid.nl/documenten/kamerstukken/2023/02/16/commissiebrief-inzake-oprichting-stichting-kennis-en-innovatiecentrum-woii","Staatssecretaris Van Ooijen (VWS) geeft antwoord op vragen over het voornemen tot het doen oprichten van de stichting Kennis- en innovatiecentrum WOII. Eerste Kamerleden van de fractie-Nanninga en de PVV hebben de vragen gesteld.",2023-02-16 14:12:00,"b2eaf32b-05b6-4d3b-a324-da01743ebee8"
"Kamerbrief over beleidsreactie Slachtoffermonitor Seksueel Geweld tegen Kinderen 2017-2021","https://www.rijksoverheid.nl/documenten/kamerstukken/2023/02/15/kamerbrief-over-beleidsreactie-slachtoffermonitor-seksueel-geweld-tegen-kinderen-2017-2021","Staatssecretaris Van Ooijen (VWS) informeert de Tweede Kamer over de Slachtoffermonitor Seksueel Geweld tegen Kinderen 2017-2021. Hij reageert op 3 afzonderlijke aanbevelingen uit het rapport.",2023-02-15 15:51:00,"09947774-6450-481e-a4d4-63808e9991db"
"Antwoorden op Kamervragen over berichtgeving huisartsenpraktijken in commerciële handen","https://www.rijksoverheid.nl/documenten/kamerstukken/2023/02/15/antwoorden-op-kamervragen-over-de-berichtgeving-over-het-nieuws-dat-steeds-meer-huisartsenpraktijken-in-commerciele-handen-komen","Minister Kuipers (VWS) geeft antwoord op vragen over het nieuws dat steeds meer huisartsenpraktijken in commerciële handen komen. Het Tweede Kamerlid Bushoff (PvdA) heeft de vragen gesteld.",2023-02-15 15:48:00,"99735bd5-23fd-4aa5-8569-a0e884536762"
"Antwoorden op Kamervragen over commerciële huisartsenpraktijken","https://www.rijksoverheid.nl/documenten/kamerstukken/2023/02/15/antwoorden-op-kamervragen-over-commerciele-huisartsenpraktijken","Minister Kuipers (VWS) geeft antwoord op vragen over commerciële huisartsenpraktijken. Het Tweede Kamerlid Van den Berg (CDA) heeft de vragen gesteld.",2023-02-15 15:32:00,"b0970b2a-dc43-44dc-bff4-8db5286ca849"
"Antwoorden op Kamervragen over berichtgeving commerciële overname huisartsenpraktijken","https://www.rijksoverheid.nl/documenten/kamerstukken/2023/02/15/antwoorden-op-kamervragen-over-de-berichtgeving-over-de-commerciele-overname-van-huisartsenpraktijken","Minister Kuipers (VWS) geeft antwoord op vragen over de berichtgeving van de commerciële overname van huisartsenpraktijken. Het Tweede Kamerlid Van Haga (Groep-Van Haga) heeft de vragen gesteld.",2023-02-15 15:31:00,"cc304195-ef52-4abf-914c-c75a832161b7"
"Uitstelbrief op Kamervragen over de berichten 'Groen licht voor euthanasie, maar Nathalie wil verkrachter eerst nog een keer in de ogen kijken' en 'Na loodzwaar traject kreeg ik 'groen licht' voor euthanasie'","https://www.rijksoverheid.nl/documenten/kamerstukken/2023/02/15/uitstelbrief-op-kamervragen-over-uitstelbrief-op-kamervragen-over-de-berichten-groen-licht-voor-euthanasie-maar-nathalie-wil-verkrachter-eerst-nog-een-keer-in-de-ogen-kijken-en-na-loodzwaar-traject-kreeg-ik-groen-licht-voor-euthanasie","Minister Kuipers (VWS) meldt dat de antwoorden op vragen over de berichten 'Groen licht voor euthanasie, maar Nathalie wil verkrachter eerst nog een keer in de ogen kijken' en 'Na loodzwaar traject kreeg ik 'groen licht' voor euthanasie', later komen dan gebruikelijk. De Tweede Kamerleden Palland, Van den Berg en Kuik (allen van CDA) hebben de vragen gesteld.",2023-02-15 12:25:00,"33de4865-dbd3-410b-947c-996704ce3266"
"Antwoorden op Kamervragen over de Groene GGZ","https://www.rijksoverheid.nl/documenten/kamerstukken/2023/02/15/antwoorden-op-kamervragen-over-de-groene-ggz","Minister Helder (Langdurige Zorg en Sport) geeft antwoord op vragen over de Groene GGZ. Het Tweede Kamerlid Westerveld (GroenLinks) heeft de vragen gesteld.",2023-02-15 11:54:00,"d92251a3-d35b-441b-af6b-141a063f98c5"
"Antwoorden op Kamervragen over studenten met post covid-klachten","https://www.rijksoverheid.nl/documenten/kamerstukken/2023/02/15/antwoorden-op-kamervragen-over-studenten-met-long-covid","Minister Kuipers (VWS) geeft antwoord op vragen over studenten met post covid-klachten. Het Tweede Kamerlid Westerveld (GroenLinks) heeft de vragen gesteld.",2023-02-15 11:38:00,"9e1d156d-4b9a-4417-9c10-04ed794923ad"
"Kamerbrief met appreciatie op de IKA-visketen","https://www.rijksoverheid.nl/documenten/kamerstukken/2023/02/14/appreciatie-op-de-ika-visketen","Minister Adema (LNV) stuurt de Tweede Kamer een appreciatie op het document ‘De visketen in beeld’, een integrale keten- en risicoanalyse van de visketen.",2023-02-14 16:01:00,"c7337bfe-ffde-4846-8016-fd4d0ca53f39"
"Antwoorden op Kamervragen over signalen met betrekking tot geneesmiddelentekorten in Nederland","https://www.rijksoverheid.nl/documenten/kamerstukken/2023/02/14/antwoorden-op-kamervragen-over-signalen-met-betrekking-tot-geneesmiddelentekorten-in-nederland","Minister Kuipers (VWS) geeft antwoord op vragen over signalen met betrekking tot geneesmiddelentekorten in Nederland, onder andere via het NOS-bericht ‘Medicijnschaarste opgelopen tot recordhoogte, vorig jaar ruim 1500 tekorten’. De vragen zijn van het Kamerlid Tielen (VVD).",2023-02-14 16:00:00,"ccd31012-a834-4f40-9abf-15e59beec511"
"Kamerbrief over nazending naar aanleiding van beantwoording Kamervragen over de acute zorg","https://www.rijksoverheid.nl/documenten/kamerstukken/2023/02/14/antwoorden-op-kamervragen-over-nazending-naar-aanleiding-van-beantwoording-kamervragen-over-de-acute-zorg","Minister Kuipers (VWS) stuurt de Tweede Kamer het overzicht van de ontvangen meldingen bij de ProQA-Ambulancemeldkamer.",2023-02-14 15:40:00,"1099be87-1ab2-4c61-a043-be992b269ce8"
"Kamerbrief over geneesmiddelenontwikkeling","https://www.rijksoverheid.nl/documenten/kamerstukken/2023/02/14/kamerbrief-over-kwantitatief-overzicht-farmaceutische-ontwikkeling","Minister Kuipers (VWS) informeert de Tweede Kamer over het rapport ‘Opbrengsten huidige R&D-ecosysteem: analyse aantal marktintroducties geneesmiddelen vanaf 1995’.",2023-02-14 15:09:00,"57ba5e9e-1d6a-4e78-95e0-bb1420dc5ab5"
"Kamerbrief over bekrachtiging Wetswijziging Wet afbreking zwangerschap","https://www.rijksoverheid.nl/documenten/kamerstukken/2023/02/14/kamerbrief-over-bekrachtiging-van-de-wet-houdende-wijziging-van-de-wet-afbreking-zwangerschap","Minister Kuipers (VWS) informeert de Tweede Kamer over de bekrachtiging van de Wetswijziging van de Wet afbreking zwangerschap evenals enkele andere wetten in verband met de legale medicamenteuze afbreking van de zwangerschap via de huisarts.",2023-02-14 13:47:00,"cb732d13-9351-495a-adaf-2b7158ddf1c8"
"Kamerbrief over beleid seksuele gezondheid","https://www.rijksoverheid.nl/documenten/kamerstukken/2023/02/13/kamerbrief-over-voortgang-beleidsvisie-seksuele-gezondheid","Minister Kuipers (VWS) stuurt de Tweede Kamer een brief over verschillende onderwerpen in het beleid rondom seksuele gezondheid.",2023-02-13 17:05:00,"62dc3f1b-c0f1-48ff-883b-0e9bbaf7bb80"
"Kamerbrief over voortgangsrapportage onderhandelingen over de EHDS","https://www.rijksoverheid.nl/documenten/kamerstukken/2023/02/13/kamerbrief-over-voortgangsrapportage-onderhandelingen-over-de-ehds","Minister Kuipers (VWS) informeert de Tweede Kamer over de  voortgangsrapportage onderhandelingen over de Europese ruimte voor gezondheidsgegevens, ook wel European Health Data Space (EHDS) genoemd. Daarnaast informeert de minister de Tweede Kamer over de daarbij behorende krachtenveldanalyse en hoe dat invloed kan hebben op de vervolgstappen. ",2023-02-13 16:02:00,"0061b892-29f0-40d2-96dc-1fa74a9ce115"
"Uitstelbrief op Kamervragen over het bericht ‘Vaak dakloos na verlaten jeugdzorg’","https://www.rijksoverheid.nl/documenten/kamerstukken/2023/02/13/uitstelbrief-antwoorden-kamervragen-over-het-bericht-vaak-dakloos-na-verlaten-jeugdzorg","Staatssecretaris Van Ooijen (VWS) meldt dat de antwoorden op vragen over het bericht ‘Vaak dakloos na verlaten jeugdzorg’ later komen dan gebruikelijk. De Tweede Kamerleden Van den Hil en Verkuijlen (beiden VVD) hebben de vragen gesteld.",2023-02-13 15:45:00,"92835fa1-2e01-4a8f-b211-9cdd2e3c7bf0"
"Kamerbrief over aanbieding e-healthmonitor 2022","https://www.rijksoverheid.nl/documenten/kamerstukken/2023/02/13/kamerbrief-over-aanbieding-e-healthmonitor-2022","Minister Kuipers (VWS) deelt de uitkomsten van de e-healthmonitor 2022 met de Tweede Kamer. Ook meldt de minister wat hij gaat doen met de aanbevelingen uit de monitor.",2023-02-13 14:37:00,"54d7949e-28a1-46ba-9dd8-61f8a69caf79"
